23:34:32.073095 IP 10.0.0.1.52228 > 10.0.0.2.5001: UDP, length 1470

23:34:32.079105 IP 10.0.0.1.52228 > 10.0.0.2.5001: UDP, length 1470

23:34:32.084815 IP 10.0.0.1.52228 > 10.0.0.2.5001: UDP, length 1470

23:34:32.096714 IP 10.0.0.1.52228 > 10.0.0.2.5001: UDP, length 1470

23:34:32.108822 IP 10.0.0.1.52228 > 10.0.0.2.5001: UDP, length 1470

23:34:32.120828 IP 10.0.0.1.52228 > 10.0.0.2.5001: UDP, length 1470

23:34:32.132964 IP 10.0.0.1.52228 > 10.0.0.2.5001: UDP, length 1470

23:34:32.145102 IP 10.0.0.1.52228 > 10.0.0.2.5001: UDP, length 1470

23:34:32.157275 IP 10.0.0.1.52228 > 10.0.0.2.5001: UDP, length 1470

23:34:32.169463 IP 10.0.0.1.52228 > 10.0.0.2.5001: UDP, length 1470

23:34:32.181523 IP 10.0.0.1.52228 > 10.0.0.2.5001: UDP, length 1470

23:34:32.193491 IP 10.0.0.1.52228 > 10.0.0.2.5001: UDP, length 1470

23:34:32.205712 IP 10.0.0.1.52228 > 10.0.0.2.5001: UDP, length 1470

23:34:32.217709 IP 10.0.0.1.52228 > 10.0.0.2.5001: UDP, length 1470

23:34:32.229832 IP 10.0.0.1.52228 > 10.0.0.2.5001: UDP, length 1470

23:34:32.241945 IP 10.0.0.1.52228 > 10.0.0.2.5001: UDP, length 1470

23:34:32.254067 IP 10.0.0.1.52228 > 10.0.0.2.5001: UDP, length 1470

23:34:32.266204 IP 10.0.0.1.52228 > 10.0.0.2.5001: UDP, length 1470

23:34:32.278156 IP 10.0.0.1.52228 > 10.0.0.2.5001: UDP, length 1470

23:34:32.290316 IP 10.0.0.1.52228 > 10.0.0.2.5001: UDP, length 1470

23:34:32.302327 IP 10.0.0.1.52228 > 10.0.0.2.5001: UDP, length 1470

23:34:32.314442 IP 10.0.0.1.52228 > 10.0.0.2.5001: UDP, length 1470

23:34:32.326565 IP 10.0.0.1.52228 > 10.0.0.2.5001: UDP, length 1470

23:34:32.338684 IP 10.0.0.1.52228 > 10.0.0.2.5001: UDP, length 1470

23:34:32.350755 IP 10.0.0.1.52228 > 10.0.0.2.5001: UDP, length 1470

23:34:32.362919 IP 10.0.0.1.52228 > 10.0.0.2.5001: UDP, length 1470

23:34:32.375040 IP 10.0.0.1.52228 > 10.0.0.2.5001: UDP, length 1470

23:34:32.387180 IP 10.0.0.1.52228 > 10.0.0.2.5001: UDP, length 1470

23:34:32.399202 IP 10.0.0.1.52228 > 10.0.0.2.5001: UDP, length 1470

23:34:32.411147 IP 10.0.0.1.52228 > 10.0.0.2.5001: UDP, length 1470

23:34:32.423300 IP 10.0.0.1.52228 > 10.0.0.2.5001: UDP, length 1470

23:34:32.435425 IP 10.0.0.1.52228 > 10.0.0.2.5001: UDP, length 1470

23:34:32.447484 IP 10.0.0.1.52228 > 10.0.0.2.5001: UDP, length 1470

23:34:32.459642 IP 10.0.0.1.52228 > 10.0.0.2.5001: UDP, length 1470

23:34:32.471692 IP 10.0.0.1.52228 > 10.0.0.2.5001: UDP, length 1470

23:34:32.483878 IP 10.0.0.1.52228 > 10.0.0.2.5001: UDP, length 1470

23:34:32.495789 IP 10.0.0.1.52228 > 10.0.0.2.5001: UDP, length 1470

23:34:32.507922 IP 10.0.0.1.52228 > 10.0.0.2.5001: UDP, length 1470

23:34:32.520253 IP 10.0.0.1.52228 > 10.0.0.2.5001: UDP, length 1470

23:34:32.532130 IP 10.0.0.1.52228 > 10.0.0.2.5001: UDP, length 1470

23:34:32.544281 IP 10.0.0.1.52228 > 10.0.0.2.5001: UDP, length 1470

23:34:32.556393 IP 10.0.0.1.52228 > 10.0.0.2.5001: UDP, length 1470

23:34:32.568508 IP 10.0.0.1.52228 > 10.0.0.2.5001: UDP, length 1470

23:34:32.580626 IP 10.0.0.1.52228 > 10.0.0.2.5001: UDP, length 1470

23:34:32.592749 IP 10.0.0.1.52228 > 10.0.0.2.5001: UDP, length 1470

23:34:32.604881 IP 10.0.0.1.52228 > 10.0.0.2.5001: UDP, length 1470

23:34:32.616861 IP 10.0.0.1.52228 > 10.0.0.2.5001: UDP, length 1470

23:34:32.629021 IP 10.0.0.1.52228 > 10.0.0.2.5001: UDP, length 1470

23:34:32.640965 IP 10.0.0.1.52228 > 10.0.0.2.5001: UDP, length 1470

23:34:32.653125 IP 10.0.0.1.52228 > 10.0.0.2.5001: UDP, length 1470

23:34:32.665239 IP 10.0.0.1.52228 > 10.0.0.2.5001: UDP, length 1470

23:34:32.677321 IP 10.0.0.1.52228 > 10.0.0.2.5001: UDP, length 1470

23:34:32.689568 IP 10.0.0.1.52228 > 10.0.0.2.5001: UDP, length 1470

23:34:32.701608 IP 10.0.0.1.52228 > 10.0.0.2.5001: UDP, length 1470

23:34:32.713696 IP 10.0.0.1.52228 > 10.0.0.2.5001: UDP, length 1470

23:34:32.725859 IP 10.0.0.1.52228 > 10.0.0.2.5001: UDP, length 1470

23:34:32.738000 IP 10.0.0.1.52228 > 10.0.0.2.5001: UDP, length 1470

23:34:32.749808 IP 10.0.0.1.52228 > 10.0.0.2.5001: UDP, length 1470

23:34:32.761992 IP 10.0.0.1.52228 > 10.0.0.2.5001: UDP, length 1470

23:34:32.774112 IP 10.0.0.1.52228 > 10.0.0.2.5001: UDP, length 1470

23:34:32.786193 IP 10.0.0.1.52228 > 10.0.0.2.5001: UDP, length 1470

23:34:32.798342 IP 10.0.0.1.52228 > 10.0.0.2.5001: UDP, length 1470

23:34:32.810380 IP 10.0.0.1.52228 > 10.0.0.2.5001: UDP, length 1470

23:34:32.822514 IP 10.0.0.1.52228 > 10.0.0.2.5001: UDP, length 1470

23:34:32.834576 IP 10.0.0.1.52228 > 10.0.0.2.5001: UDP, length 1470

23:34:32.846666 IP 10.0.0.1.52228 > 10.0.0.2.5001: UDP, length 1470

23:34:32.858781 IP 10.0.0.1.52228 > 10.0.0.2.5001: UDP, length 1470

23:34:32.870753 IP 10.0.0.1.52228 > 10.0.0.2.5001: UDP, length 1470

23:34:32.882915 IP 10.0.0.1.52228 > 10.0.0.2.5001: UDP, length 1470

23:34:32.895024 IP 10.0.0.1.52228 > 10.0.0.2.5001: UDP, length 1470

23:34:32.907128 IP 10.0.0.1.52228 > 10.0.0.2.5001: UDP, length 1470

23:34:32.919238 IP 10.0.0.1.52228 > 10.0.0.2.5001: UDP, length 1470

23:34:32.931354 IP 10.0.0.1.52228 > 10.0.0.2.5001: UDP, length 1470

23:34:32.943405 IP 10.0.0.1.52228 > 10.0.0.2.5001: UDP, length 1470

23:34:32.955544 IP 10.0.0.1.52228 > 10.0.0.2.5001: UDP, length 1470

23:34:32.967753 IP 10.0.0.1.52228 > 10.0.0.2.5001: UDP, length 1470

23:34:32.979619 IP 10.0.0.1.52228 > 10.0.0.2.5001: UDP, length 1470

23:34:32.991800 IP 10.0.0.1.52228 > 10.0.0.2.5001: UDP, length 1470

23:34:33.003917 IP 10.0.0.1.52228 > 10.0.0.2.5001: UDP, length 1470

23:34:33.016044 IP 10.0.0.1.52228 > 10.0.0.2.5001: UDP, length 1470

23:34:33.028171 IP 10.0.0.1.52228 > 10.0.0.2.5001: UDP, length 1470

23:34:33.040280 IP 10.0.0.1.52228 > 10.0.0.2.5001: UDP, length 1470

23:34:33.052396 IP 10.0.0.1.52228 > 10.0.0.2.5001: UDP, length 1470

23:34:33.064503 IP 10.0.0.1.52228 > 10.0.0.2.5001: UDP, length 1470

23:34:33.076522 IP 10.0.0.1.52228 > 10.0.0.2.5001: UDP, length 1470

23:34:33.088704 IP 10.0.0.1.52228 > 10.0.0.2.5001: UDP, length 1470

23:34:33.100640 IP 10.0.0.1.52228 > 10.0.0.2.5001: UDP, length 1470

23:34:33.112785 IP 10.0.0.1.52228 > 10.0.0.2.5001: UDP, length 1470

23:34:33.124909 IP 10.0.0.1.52228 > 10.0.0.2.5001: UDP, length 1470

23:34:33.136974 IP 10.0.0.1.52228 > 10.0.0.2.5001: UDP, length 1470

23:34:33.149135 IP 10.0.0.1.52228 > 10.0.0.2.5001: UDP, length 1470

23:34:33.161263 IP 10.0.0.1.52228 > 10.0.0.2.5001: UDP, length 1470

23:34:33.173320 IP 10.0.0.1.52228 > 10.0.0.2.5001: UDP, length 1470

23:34:33.185569 IP 10.0.0.1.52228 > 10.0.0.2.5001: UDP, length 1470

23:34:33.197585 IP 10.0.0.1.52228 > 10.0.0.2.5001: UDP, length 1470

23:34:33.209508 IP 10.0.0.1.52228 > 10.0.0.2.5001: UDP, length 1470

23:34:33.221632 IP 10.0.0.1.52228 > 10.0.0.2.5001: UDP, length 1470

23:34:33.233754 IP 10.0.0.1.52228 > 10.0.0.2.5001: UDP, length 1470

23:34:33.245738 IP 10.0.0.1.52228 > 10.0.0.2.5001: UDP, length 1470

23:34:33.257959 IP 10.0.0.1.52228 > 10.0.0.2.5001: UDP, length 1470

23:34:33.270033 IP 10.0.0.1.52228 > 10.0.0.2.5001: UDP, length 1470

23:34:33.282182 IP 10.0.0.1.52228 > 10.0.0.2.5001: UDP, length 1470

23:34:33.294350 IP 10.0.0.1.52228 > 10.0.0.2.5001: UDP, length 1470

23:34:33.306486 IP 10.0.0.1.52228 > 10.0.0.2.5001: UDP, length 1470

23:34:33.318424 IP 10.0.0.1.52228 > 10.0.0.2.5001: UDP, length 1470

23:34:33.330497 IP 10.0.0.1.52228 > 10.0.0.2.5001: UDP, length 1470

23:34:33.342629 IP 10.0.0.1.52228 > 10.0.0.2.5001: UDP, length 1470

23:34:33.354759 IP 10.0.0.1.52228 > 10.0.0.2.5001: UDP, length 1470

23:34:33.366857 IP 10.0.0.1.52228 > 10.0.0.2.5001: UDP, length 1470

23:34:33.378974 IP 10.0.0.1.52228 > 10.0.0.2.5001: UDP, length 1470

23:34:33.391095 IP 10.0.0.1.52228 > 10.0.0.2.5001: UDP, length 1470

23:34:33.403076 IP 10.0.0.1.52228 > 10.0.0.2.5001: UDP, length 1470

23:34:33.415236 IP 10.0.0.1.52228 > 10.0.0.2.5001: UDP, length 1470

23:34:33.427408 IP 10.0.0.1.52228 > 10.0.0.2.5001: UDP, length 1470

23:34:33.439302 IP 10.0.0.1.52228 > 10.0.0.2.5001: UDP, length 1470

23:34:33.451473 IP 10.0.0.1.52228 > 10.0.0.2.5001: UDP, length 1470

23:34:33.463615 IP 10.0.0.1.52228 > 10.0.0.2.5001: UDP, length 1470

23:34:33.475773 IP 10.0.0.1.52228 > 10.0.0.2.5001: UDP, length 1470

23:34:33.487910 IP 10.0.0.1.52228 > 10.0.0.2.5001: UDP, length 1470

23:34:33.500020 IP 10.0.0.1.52228 > 10.0.0.2.5001: UDP, length 1470

23:34:33.512142 IP 10.0.0.1.52228 > 10.0.0.2.5001: UDP, length 1470

23:34:33.524243 IP 10.0.0.1.52228 > 10.0.0.2.5001: UDP, length 1470

23:34:33.536197 IP 10.0.0.1.52228 > 10.0.0.2.5001: UDP, length 1470

23:34:33.548113 IP 10.0.0.1.52228 > 10.0.0.2.5001: UDP, length 1470

23:34:33.560402 IP 10.0.0.1.52228 > 10.0.0.2.5001: UDP, length 1470

23:34:33.572473 IP 10.0.0.1.52228 > 10.0.0.2.5001: UDP, length 1470

23:34:33.584587 IP 10.0.0.1.52228 > 10.0.0.2.5001: UDP, length 1470

23:34:33.596692 IP 10.0.0.1.52228 > 10.0.0.2.5001: UDP, length 1470

23:34:33.608693 IP 10.0.0.1.52228 > 10.0.0.2.5001: UDP, length 1470

23:34:33.620858 IP 10.0.0.1.52228 > 10.0.0.2.5001: UDP, length 1470

23:34:33.632856 IP 10.0.0.1.52228 > 10.0.0.2.5001: UDP, length 1470

23:34:33.645207 IP 10.0.0.1.52228 > 10.0.0.2.5001: UDP, length 1470

23:34:33.657306 IP 10.0.0.1.52228 > 10.0.0.2.5001: UDP, length 1470

23:34:33.669152 IP 10.0.0.1.52228 > 10.0.0.2.5001: UDP, length 1470

23:34:33.681279 IP 10.0.0.1.52228 > 10.0.0.2.5001: UDP, length 1470

23:34:33.693471 IP 10.0.0.1.52228 > 10.0.0.2.5001: UDP, length 1470

23:34:33.705537 IP 10.0.0.1.52228 > 10.0.0.2.5001: UDP, length 1470

23:34:33.717659 IP 10.0.0.1.52228 > 10.0.0.2.5001: UDP, length 1470

23:34:33.729769 IP 10.0.0.1.52228 > 10.0.0.2.5001: UDP, length 1470

23:34:33.741889 IP 10.0.0.1.52228 > 10.0.0.2.5001: UDP, length 1470

23:34:33.753891 IP 10.0.0.1.52228 > 10.0.0.2.5001: UDP, length 1470

23:34:33.766067 IP 10.0.0.1.52228 > 10.0.0.2.5001: UDP, length 1470

23:34:33.778001 IP 10.0.0.1.52228 > 10.0.0.2.5001: UDP, length 1470

23:34:33.790162 IP 10.0.0.1.52228 > 10.0.0.2.5001: UDP, length 1470

23:34:33.802278 IP 10.0.0.1.52228 > 10.0.0.2.5001: UDP, length 1470

23:34:33.814333 IP 10.0.0.1.52228 > 10.0.0.2.5001: UDP, length 1470

23:34:33.826508 IP 10.0.0.1.52228 > 10.0.0.2.5001: UDP, length 1470

23:34:33.838633 IP 10.0.0.1.52228 > 10.0.0.2.5001: UDP, length 1470

23:34:33.850759 IP 10.0.0.1.52228 > 10.0.0.2.5001: UDP, length 1470

23:34:33.862914 IP 10.0.0.1.52228 > 10.0.0.2.5001: UDP, length 1470

23:34:33.874859 IP 10.0.0.1.52228 > 10.0.0.2.5001: UDP, length 1470

23:34:33.886800 IP 10.0.0.1.52228 > 10.0.0.2.5001: UDP, length 1470

23:34:33.899013 IP 10.0.0.1.52228 > 10.0.0.2.5001: UDP, length 1470

23:34:33.911152 IP 10.0.0.1.52228 > 10.0.0.2.5001: UDP, length 1470

23:34:33.923258 IP 10.0.0.1.52228 > 10.0.0.2.5001: UDP, length 1470

23:34:33.935370 IP 10.0.0.1.52228 > 10.0.0.2.5001: UDP, length 1470

23:34:33.947423 IP 10.0.0.1.52228 > 10.0.0.2.5001: UDP, length 1470

23:34:33.959550 IP 10.0.0.1.52228 > 10.0.0.2.5001: UDP, length 1470

23:34:33.971551 IP 10.0.0.1.52228 > 10.0.0.2.5001: UDP, length 1470

23:34:33.983718 IP 10.0.0.1.52228 > 10.0.0.2.5001: UDP, length 1470

23:34:33.995875 IP 10.0.0.1.52228 > 10.0.0.2.5001: UDP, length 1470

23:34:34.007822 IP 10.0.0.1.52228 > 10.0.0.2.5001: UDP, length 1470

23:34:34.020002 IP 10.0.0.1.52228 > 10.0.0.2.5001: UDP, length 1470

23:34:34.032104 IP 10.0.0.1.52228 > 10.0.0.2.5001: UDP, length 1470

23:34:34.044258 IP 10.0.0.1.52228 > 10.0.0.2.5001: UDP, length 1470

23:34:34.056336 IP 10.0.0.1.52228 > 10.0.0.2.5001: UDP, length 1470

23:34:34.068493 IP 10.0.0.1.52228 > 10.0.0.2.5001: UDP, length 1470

23:34:34.080409 IP 10.0.0.1.52228 > 10.0.0.2.5001: UDP, length 1470

23:34:34.092602 IP 10.0.0.1.52228 > 10.0.0.2.5001: UDP, length 1470

23:34:34.104788 IP 10.0.0.1.52228 > 10.0.0.2.5001: UDP, length 1470

23:34:34.116676 IP 10.0.0.1.52228 > 10.0.0.2.5001: UDP, length 1470

23:34:34.128838 IP 10.0.0.1.52228 > 10.0.0.2.5001: UDP, length 1470

23:34:34.140956 IP 10.0.0.1.52228 > 10.0.0.2.5001: UDP, length 1470

23:34:34.153056 IP 10.0.0.1.52228 > 10.0.0.2.5001: UDP, length 1470

23:34:34.165206 IP 10.0.0.1.52228 > 10.0.0.2.5001: UDP, length 1470

23:34:34.177320 IP 10.0.0.1.52228 > 10.0.0.2.5001: UDP, length 1470

23:34:34.189443 IP 10.0.0.1.52228 > 10.0.0.2.5001: UDP, length 1470

23:34:34.201561 IP 10.0.0.1.52228 > 10.0.0.2.5001: UDP, length 1470

23:34:34.213470 IP 10.0.0.1.52228 > 10.0.0.2.5001: UDP, length 1470

23:34:34.225520 IP 10.0.0.1.52228 > 10.0.0.2.5001: UDP, length 1470

23:34:34.237715 IP 10.0.0.1.52228 > 10.0.0.2.5001: UDP, length 1470

23:34:34.249818 IP 10.0.0.1.52228 > 10.0.0.2.5001: UDP, length 1470

23:34:34.261936 IP 10.0.0.1.52228 > 10.0.0.2.5001: UDP, length 1470

23:34:34.273970 IP 10.0.0.1.52228 > 10.0.0.2.5001: UDP, length 1470

23:34:34.286101 IP 10.0.0.1.52228 > 10.0.0.2.5001: UDP, length 1470

23:34:34.298326 IP 10.0.0.1.52228 > 10.0.0.2.5001: UDP, length 1470

23:34:34.310430 IP 10.0.0.1.52228 > 10.0.0.2.5001: UDP, length 1470

23:34:34.322488 IP 10.0.0.1.52228 > 10.0.0.2.5001: UDP, length 1470

23:34:34.334559 IP 10.0.0.1.52228 > 10.0.0.2.5001: UDP, length 1470

23:34:34.346561 IP 10.0.0.1.52228 > 10.0.0.2.5001: UDP, length 1470

23:34:34.358745 IP 10.0.0.1.52228 > 10.0.0.2.5001: UDP, length 1470

23:34:34.370815 IP 10.0.0.1.52228 > 10.0.0.2.5001: UDP, length 1470

23:34:34.382849 IP 10.0.0.1.52228 > 10.0.0.2.5001: UDP, length 1470

23:34:34.395018 IP 10.0.0.1.52228 > 10.0.0.2.5001: UDP, length 1470

23:34:34.407214 IP 10.0.0.1.52228 > 10.0.0.2.5001: UDP, length 1470

23:34:34.419357 IP 10.0.0.1.52228 > 10.0.0.2.5001: UDP, length 1470

23:34:34.431332 IP 10.0.0.1.52228 > 10.0.0.2.5001: UDP, length 1470

23:34:34.443429 IP 10.0.0.1.52228 > 10.0.0.2.5001: UDP, length 1470

23:34:34.455333 IP 10.0.0.1.52228 > 10.0.0.2.5001: UDP, length 1470

23:34:34.467526 IP 10.0.0.1.52228 > 10.0.0.2.5001: UDP, length 1470

23:34:34.479637 IP 10.0.0.1.52228 > 10.0.0.2.5001: UDP, length 1470

23:34:34.491757 IP 10.0.0.1.52228 > 10.0.0.2.5001: UDP, length 1470

23:34:34.503864 IP 10.0.0.1.52228 > 10.0.0.2.5001: UDP, length 1470

23:34:34.516000 IP 10.0.0.1.52228 > 10.0.0.2.5001: UDP, length 1470

23:34:34.528114 IP 10.0.0.1.52228 > 10.0.0.2.5001: UDP, length 1470

23:34:34.540234 IP 10.0.0.1.52228 > 10.0.0.2.5001: UDP, length 1470

23:34:34.552369 IP 10.0.0.1.52228 > 10.0.0.2.5001: UDP, length 1470

23:34:34.564272 IP 10.0.0.1.52228 > 10.0.0.2.5001: UDP, length 1470

23:34:34.576385 IP 10.0.0.1.52228 > 10.0.0.2.5001: UDP, length 1470

23:34:34.588500 IP 10.0.0.1.52228 > 10.0.0.2.5001: UDP, length 1470

23:34:34.600618 IP 10.0.0.1.52228 > 10.0.0.2.5001: UDP, length 1470

23:34:34.612736 IP 10.0.0.1.52228 > 10.0.0.2.5001: UDP, length 1470

23:34:34.624873 IP 10.0.0.1.52228 > 10.0.0.2.5001: UDP, length 1470

23:34:34.636921 IP 10.0.0.1.52228 > 10.0.0.2.5001: UDP, length 1470

23:34:34.649055 IP 10.0.0.1.52228 > 10.0.0.2.5001: UDP, length 1470

23:34:34.661165 IP 10.0.0.1.52228 > 10.0.0.2.5001: UDP, length 1470

23:34:34.673220 IP 10.0.0.1.52228 > 10.0.0.2.5001: UDP, length 1470

23:34:34.685147 IP 10.0.0.1.52228 > 10.0.0.2.5001: UDP, length 1470

23:34:34.697307 IP 10.0.0.1.52228 > 10.0.0.2.5001: UDP, length 1470

23:34:34.709502 IP 10.0.0.1.52228 > 10.0.0.2.5001: UDP, length 1470

23:34:34.721525 IP 10.0.0.1.52228 > 10.0.0.2.5001: UDP, length 1470

23:34:34.733535 IP 10.0.0.1.52228 > 10.0.0.2.5001: UDP, length 1470

23:34:34.745799 IP 10.0.0.1.52228 > 10.0.0.2.5001: UDP, length 1470

23:34:34.757727 IP 10.0.0.1.52228 > 10.0.0.2.5001: UDP, length 1470

23:34:34.769966 IP 10.0.0.1.52228 > 10.0.0.2.5001: UDP, length 1470

23:34:34.782131 IP 10.0.0.1.52228 > 10.0.0.2.5001: UDP, length 1470

23:34:34.794076 IP 10.0.0.1.52228 > 10.0.0.2.5001: UDP, length 1470

23:34:34.806188 IP 10.0.0.1.52228 > 10.0.0.2.5001: UDP, length 1470

23:34:34.818336 IP 10.0.0.1.52228 > 10.0.0.2.5001: UDP, length 1470

23:34:34.830385 IP 10.0.0.1.52228 > 10.0.0.2.5001: UDP, length 1470

23:34:34.842585 IP 10.0.0.1.52228 > 10.0.0.2.5001: UDP, length 1470

23:34:34.854714 IP 10.0.0.1.52228 > 10.0.0.2.5001: UDP, length 1470

23:34:34.866814 IP 10.0.0.1.52228 > 10.0.0.2.5001: UDP, length 1470

23:34:34.878928 IP 10.0.0.1.52228 > 10.0.0.2.5001: UDP, length 1470

23:34:34.891039 IP 10.0.0.1.52228 > 10.0.0.2.5001: UDP, length 1470

23:34:34.903030 IP 10.0.0.1.52228 > 10.0.0.2.5001: UDP, length 1470

23:34:34.915003 IP 10.0.0.1.52228 > 10.0.0.2.5001: UDP, length 1470

23:34:34.927134 IP 10.0.0.1.52228 > 10.0.0.2.5001: UDP, length 1470

23:34:34.939256 IP 10.0.0.1.52228 > 10.0.0.2.5001: UDP, length 1470

23:34:34.951356 IP 10.0.0.1.52228 > 10.0.0.2.5001: UDP, length 1470

23:34:34.963430 IP 10.0.0.1.52228 > 10.0.0.2.5001: UDP, length 1470

23:34:34.975637 IP 10.0.0.1.52228 > 10.0.0.2.5001: UDP, length 1470

23:34:34.987779 IP 10.0.0.1.52228 > 10.0.0.2.5001: UDP, length 1470

23:34:34.999861 IP 10.0.0.1.52228 > 10.0.0.2.5001: UDP, length 1470

23:34:35.011984 IP 10.0.0.1.52228 > 10.0.0.2.5001: UDP, length 1470

23:34:35.023848 IP 10.0.0.1.52228 > 10.0.0.2.5001: UDP, length 1470

23:34:35.036049 IP 10.0.0.1.52228 > 10.0.0.2.5001: UDP, length 1470

23:34:35.048167 IP 10.0.0.1.52228 > 10.0.0.2.5001: UDP, length 1470

23:34:35.060306 IP 10.0.0.1.52228 > 10.0.0.2.5001: UDP, length 1470

23:34:35.072326 IP 10.0.0.1.52228 > 10.0.0.2.5001: UDP, length 1470

23:34:35.084464 IP 10.0.0.1.52228 > 10.0.0.2.5001: UDP, length 1470

23:34:35.096519 IP 10.0.0.1.52228 > 10.0.0.2.5001: UDP, length 1470

23:34:35.108626 IP 10.0.0.1.52228 > 10.0.0.2.5001: UDP, length 1470

23:34:35.120849 IP 10.0.0.1.52228 > 10.0.0.2.5001: UDP, length 1470

23:34:35.132695 IP 10.0.0.1.52228 > 10.0.0.2.5001: UDP, length 1470

23:34:35.144890 IP 10.0.0.1.52228 > 10.0.0.2.5001: UDP, length 1470

23:34:35.157033 IP 10.0.0.1.52228 > 10.0.0.2.5001: UDP, length 1470

23:34:35.169137 IP 10.0.0.1.52228 > 10.0.0.2.5001: UDP, length 1470

23:34:35.181252 IP 10.0.0.1.52228 > 10.0.0.2.5001: UDP, length 1470

23:34:35.193439 IP 10.0.0.1.52228 > 10.0.0.2.5001: UDP, length 1470

23:34:35.205515 IP 10.0.0.1.52228 > 10.0.0.2.5001: UDP, length 1470

23:34:35.217595 IP 10.0.0.1.52228 > 10.0.0.2.5001: UDP, length 1470

23:34:35.229585 IP 10.0.0.1.52228 > 10.0.0.2.5001: UDP, length 1470

23:34:35.241718 IP 10.0.0.1.52228 > 10.0.0.2.5001: UDP, length 1470

23:34:35.253687 IP 10.0.0.1.52228 > 10.0.0.2.5001: UDP, length 1470

23:34:35.265900 IP 10.0.0.1.52228 > 10.0.0.2.5001: UDP, length 1470

23:34:35.277999 IP 10.0.0.1.52228 > 10.0.0.2.5001: UDP, length 1470

23:34:35.290000 IP 10.0.0.1.52228 > 10.0.0.2.5001: UDP, length 1470

23:34:35.302204 IP 10.0.0.1.52228 > 10.0.0.2.5001: UDP, length 1470

23:34:35.314337 IP 10.0.0.1.52228 > 10.0.0.2.5001: UDP, length 1470

23:34:35.326490 IP 10.0.0.1.52228 > 10.0.0.2.5001: UDP, length 1470

23:34:35.338584 IP 10.0.0.1.52228 > 10.0.0.2.5001: UDP, length 1470

23:34:35.350681 IP 10.0.0.1.52228 > 10.0.0.2.5001: UDP, length 1470

23:34:35.362525 IP 10.0.0.1.52228 > 10.0.0.2.5001: UDP, length 1470

23:34:35.374733 IP 10.0.0.1.52228 > 10.0.0.2.5001: UDP, length 1470

23:34:35.386847 IP 10.0.0.1.52228 > 10.0.0.2.5001: UDP, length 1470

23:34:35.398971 IP 10.0.0.1.52228 > 10.0.0.2.5001: UDP, length 1470

23:34:35.411086 IP 10.0.0.1.52228 > 10.0.0.2.5001: UDP, length 1470

23:34:35.423013 IP 10.0.0.1.52228 > 10.0.0.2.5001: UDP, length 1470

23:34:35.435256 IP 10.0.0.1.52228 > 10.0.0.2.5001: UDP, length 1470

23:34:35.447603 IP 10.0.0.1.52228 > 10.0.0.2.5001: UDP, length 1470

23:34:35.459453 IP 10.0.0.1.52228 > 10.0.0.2.5001: UDP, length 1470

23:34:35.471497 IP 10.0.0.1.52228 > 10.0.0.2.5001: UDP, length 1470

23:34:35.483644 IP 10.0.0.1.52228 > 10.0.0.2.5001: UDP, length 1470

23:34:35.495705 IP 10.0.0.1.52228 > 10.0.0.2.5001: UDP, length 1470

23:34:35.507731 IP 10.0.0.1.52228 > 10.0.0.2.5001: UDP, length 1470

23:34:35.519938 IP 10.0.0.1.52228 > 10.0.0.2.5001: UDP, length 1470

23:34:35.532032 IP 10.0.0.1.52228 > 10.0.0.2.5001: UDP, length 1470

23:34:35.544194 IP 10.0.0.1.52228 > 10.0.0.2.5001: UDP, length 1470

23:34:35.556179 IP 10.0.0.1.52228 > 10.0.0.2.5001: UDP, length 1470

23:34:35.568307 IP 10.0.0.1.52228 > 10.0.0.2.5001: UDP, length 1470

23:34:35.580466 IP 10.0.0.1.52228 > 10.0.0.2.5001: UDP, length 1470

23:34:35.592357 IP 10.0.0.1.52228 > 10.0.0.2.5001: UDP, length 1470

23:34:35.604557 IP 10.0.0.1.52228 > 10.0.0.2.5001: UDP, length 1470

23:34:35.616679 IP 10.0.0.1.52228 > 10.0.0.2.5001: UDP, length 1470

23:34:35.628749 IP 10.0.0.1.52228 > 10.0.0.2.5001: UDP, length 1470

23:34:35.640908 IP 10.0.0.1.52228 > 10.0.0.2.5001: UDP, length 1470

23:34:35.653031 IP 10.0.0.1.52228 > 10.0.0.2.5001: UDP, length 1470

23:34:35.665204 IP 10.0.0.1.52228 > 10.0.0.2.5001: UDP, length 1470

23:34:35.677227 IP 10.0.0.1.52228 > 10.0.0.2.5001: UDP, length 1470

23:34:35.689511 IP 10.0.0.1.52228 > 10.0.0.2.5001: UDP, length 1470

23:34:35.701204 IP 10.0.0.1.52228 > 10.0.0.2.5001: UDP, length 1470

23:34:35.713432 IP 10.0.0.1.52228 > 10.0.0.2.5001: UDP, length 1470

23:34:35.725521 IP 10.0.0.1.52228 > 10.0.0.2.5001: UDP, length 1470

23:34:35.737651 IP 10.0.0.1.52228 > 10.0.0.2.5001: UDP, length 1470

23:34:35.749798 IP 10.0.0.1.52228 > 10.0.0.2.5001: UDP, length 1470

23:34:35.761768 IP 10.0.0.1.52228 > 10.0.0.2.5001: UDP, length 1470

23:34:35.773957 IP 10.0.0.1.52228 > 10.0.0.2.5001: UDP, length 1470

23:34:35.786104 IP 10.0.0.1.52228 > 10.0.0.2.5001: UDP, length 1470

23:34:35.798140 IP 10.0.0.1.52228 > 10.0.0.2.5001: UDP, length 1470

23:34:35.810259 IP 10.0.0.1.52228 > 10.0.0.2.5001: UDP, length 1470

23:34:35.822238 IP 10.0.0.1.52228 > 10.0.0.2.5001: UDP, length 1470

23:34:35.834382 IP 10.0.0.1.52228 > 10.0.0.2.5001: UDP, length 1470

23:34:35.846468 IP 10.0.0.1.52228 > 10.0.0.2.5001: UDP, length 1470

23:34:35.858642 IP 10.0.0.1.52228 > 10.0.0.2.5001: UDP, length 1470

23:34:35.870874 IP 10.0.0.1.52228 > 10.0.0.2.5001: UDP, length 1470

23:34:35.882801 IP 10.0.0.1.52228 > 10.0.0.2.5001: UDP, length 1470

23:34:35.894757 IP 10.0.0.1.52228 > 10.0.0.2.5001: UDP, length 1470

23:34:35.907001 IP 10.0.0.1.52228 > 10.0.0.2.5001: UDP, length 1470

23:34:35.919160 IP 10.0.0.1.52228 > 10.0.0.2.5001: UDP, length 1470

23:34:35.931154 IP 10.0.0.1.52228 > 10.0.0.2.5001: UDP, length 1470

23:34:35.943219 IP 10.0.0.1.52228 > 10.0.0.2.5001: UDP, length 1470

23:34:35.955351 IP 10.0.0.1.52228 > 10.0.0.2.5001: UDP, length 1470

23:34:35.967520 IP 10.0.0.1.52228 > 10.0.0.2.5001: UDP, length 1470

23:34:35.979700 IP 10.0.0.1.52228 > 10.0.0.2.5001: UDP, length 1470

23:34:35.991837 IP 10.0.0.1.52228 > 10.0.0.2.5001: UDP, length 1470

23:34:36.003909 IP 10.0.0.1.52228 > 10.0.0.2.5001: UDP, length 1470

23:34:36.016027 IP 10.0.0.1.52228 > 10.0.0.2.5001: UDP, length 1470

23:34:36.028187 IP 10.0.0.1.52228 > 10.0.0.2.5001: UDP, length 1470

23:34:36.040124 IP 10.0.0.1.52228 > 10.0.0.2.5001: UDP, length 1470

23:34:36.052160 IP 10.0.0.1.52228 > 10.0.0.2.5001: UDP, length 1470

23:34:36.064208 IP 10.0.0.1.52228 > 10.0.0.2.5001: UDP, length 1470

23:34:36.076300 IP 10.0.0.1.52228 > 10.0.0.2.5001: UDP, length 1470

23:34:36.088446 IP 10.0.0.1.52228 > 10.0.0.2.5001: UDP, length 1470

23:34:36.100439 IP 10.0.0.1.52228 > 10.0.0.2.5001: UDP, length 1470

23:34:36.112625 IP 10.0.0.1.52228 > 10.0.0.2.5001: UDP, length 1470

23:34:36.124787 IP 10.0.0.1.52228 > 10.0.0.2.5001: UDP, length 1470

23:34:36.136900 IP 10.0.0.1.52228 > 10.0.0.2.5001: UDP, length 1470

23:34:36.148954 IP 10.0.0.1.52228 > 10.0.0.2.5001: UDP, length 1470

23:34:36.160907 IP 10.0.0.1.52228 > 10.0.0.2.5001: UDP, length 1470

23:34:36.173078 IP 10.0.0.1.52228 > 10.0.0.2.5001: UDP, length 1470

23:34:36.185193 IP 10.0.0.1.52228 > 10.0.0.2.5001: UDP, length 1470

23:34:36.197295 IP 10.0.0.1.52228 > 10.0.0.2.5001: UDP, length 1470

23:34:36.209378 IP 10.0.0.1.52228 > 10.0.0.2.5001: UDP, length 1470

23:34:36.221491 IP 10.0.0.1.52228 > 10.0.0.2.5001: UDP, length 1470

23:34:36.233497 IP 10.0.0.1.52228 > 10.0.0.2.5001: UDP, length 1470

23:34:36.245693 IP 10.0.0.1.52228 > 10.0.0.2.5001: UDP, length 1470

23:34:36.257696 IP 10.0.0.1.52228 > 10.0.0.2.5001: UDP, length 1470

23:34:36.269814 IP 10.0.0.1.52228 > 10.0.0.2.5001: UDP, length 1470

23:34:36.281864 IP 10.0.0.1.52228 > 10.0.0.2.5001: UDP, length 1470

23:34:36.294113 IP 10.0.0.1.52228 > 10.0.0.2.5001: UDP, length 1470

23:34:36.306147 IP 10.0.0.1.52228 > 10.0.0.2.5001: UDP, length 1470

23:34:36.318294 IP 10.0.0.1.52228 > 10.0.0.2.5001: UDP, length 1470

23:34:36.330411 IP 10.0.0.1.52228 > 10.0.0.2.5001: UDP, length 1470

23:34:36.342516 IP 10.0.0.1.52228 > 10.0.0.2.5001: UDP, length 1470

23:34:36.354596 IP 10.0.0.1.52228 > 10.0.0.2.5001: UDP, length 1470

23:34:36.366513 IP 10.0.0.1.52228 > 10.0.0.2.5001: UDP, length 1470

23:34:36.378747 IP 10.0.0.1.52228 > 10.0.0.2.5001: UDP, length 1470

23:34:36.390744 IP 10.0.0.1.52228 > 10.0.0.2.5001: UDP, length 1470

23:34:36.402892 IP 10.0.0.1.52228 > 10.0.0.2.5001: UDP, length 1470

23:34:36.414971 IP 10.0.0.1.52228 > 10.0.0.2.5001: UDP, length 1470

23:34:36.427142 IP 10.0.0.1.52228 > 10.0.0.2.5001: UDP, length 1470

23:34:36.439181 IP 10.0.0.1.52228 > 10.0.0.2.5001: UDP, length 1470

23:34:36.451356 IP 10.0.0.1.52228 > 10.0.0.2.5001: UDP, length 1470

23:34:36.463489 IP 10.0.0.1.52228 > 10.0.0.2.5001: UDP, length 1470

23:34:36.475506 IP 10.0.0.1.52228 > 10.0.0.2.5001: UDP, length 1470

23:34:36.487713 IP 10.0.0.1.52228 > 10.0.0.2.5001: UDP, length 1470

23:34:36.499553 IP 10.0.0.1.52228 > 10.0.0.2.5001: UDP, length 1470

23:34:36.511757 IP 10.0.0.1.52228 > 10.0.0.2.5001: UDP, length 1470

23:34:36.523870 IP 10.0.0.1.52228 > 10.0.0.2.5001: UDP, length 1470

23:34:36.535989 IP 10.0.0.1.52228 > 10.0.0.2.5001: UDP, length 1470

23:34:36.548086 IP 10.0.0.1.52228 > 10.0.0.2.5001: UDP, length 1470

23:34:36.560201 IP 10.0.0.1.52228 > 10.0.0.2.5001: UDP, length 1470

23:34:36.572234 IP 10.0.0.1.52228 > 10.0.0.2.5001: UDP, length 1470

23:34:36.584363 IP 10.0.0.1.52228 > 10.0.0.2.5001: UDP, length 1470

23:34:36.596415 IP 10.0.0.1.52228 > 10.0.0.2.5001: UDP, length 1470

23:34:36.608406 IP 10.0.0.1.52228 > 10.0.0.2.5001: UDP, length 1470

23:34:36.620610 IP 10.0.0.1.52228 > 10.0.0.2.5001: UDP, length 1470

23:34:36.632615 IP 10.0.0.1.52228 > 10.0.0.2.5001: UDP, length 1470

23:34:36.644859 IP 10.0.0.1.52228 > 10.0.0.2.5001: UDP, length 1470

23:34:36.656955 IP 10.0.0.1.52228 > 10.0.0.2.5001: UDP, length 1470

23:34:36.669073 IP 10.0.0.1.52228 > 10.0.0.2.5001: UDP, length 1470

23:34:36.681252 IP 10.0.0.1.52228 > 10.0.0.2.5001: UDP, length 1470

23:34:36.693484 IP 10.0.0.1.52228 > 10.0.0.2.5001: UDP, length 1470

23:34:36.705250 IP 10.0.0.1.52228 > 10.0.0.2.5001: UDP, length 1470

23:34:36.717528 IP 10.0.0.1.52228 > 10.0.0.2.5001: UDP, length 1470

23:34:36.729441 IP 10.0.0.1.52228 > 10.0.0.2.5001: UDP, length 1470

23:34:36.741642 IP 10.0.0.1.52228 > 10.0.0.2.5001: UDP, length 1470

23:34:36.753740 IP 10.0.0.1.52228 > 10.0.0.2.5001: UDP, length 1470

23:34:36.765872 IP 10.0.0.1.52228 > 10.0.0.2.5001: UDP, length 1470

23:34:36.777956 IP 10.0.0.1.52228 > 10.0.0.2.5001: UDP, length 1470

23:34:36.789933 IP 10.0.0.1.52228 > 10.0.0.2.5001: UDP, length 1470

23:34:36.802254 IP 10.0.0.1.52228 > 10.0.0.2.5001: UDP, length 1470

23:34:36.814379 IP 10.0.0.1.52228 > 10.0.0.2.5001: UDP, length 1470

23:34:36.826517 IP 10.0.0.1.52228 > 10.0.0.2.5001: UDP, length 1470

23:34:36.838299 IP 10.0.0.1.52228 > 10.0.0.2.5001: UDP, length 1470

23:34:36.850524 IP 10.0.0.1.52228 > 10.0.0.2.5001: UDP, length 1470

23:34:36.862644 IP 10.0.0.1.52228 > 10.0.0.2.5001: UDP, length 1470

23:34:36.874645 IP 10.0.0.1.52228 > 10.0.0.2.5001: UDP, length 1470

23:34:36.886784 IP 10.0.0.1.52228 > 10.0.0.2.5001: UDP, length 1470

23:34:36.898913 IP 10.0.0.1.52228 > 10.0.0.2.5001: UDP, length 1470

23:34:36.910928 IP 10.0.0.1.52228 > 10.0.0.2.5001: UDP, length 1470

23:34:36.923017 IP 10.0.0.1.52228 > 10.0.0.2.5001: UDP, length 1470

23:34:36.935155 IP 10.0.0.1.52228 > 10.0.0.2.5001: UDP, length 1470

23:34:36.947203 IP 10.0.0.1.52228 > 10.0.0.2.5001: UDP, length 1470

23:34:36.960326 IP 10.0.0.1.52228 > 10.0.0.2.5001: UDP, length 1470

23:34:36.971362 IP 10.0.0.1.52228 > 10.0.0.2.5001: UDP, length 1470

23:34:36.983492 IP 10.0.0.1.52228 > 10.0.0.2.5001: UDP, length 1470

23:34:36.995655 IP 10.0.0.1.52228 > 10.0.0.2.5001: UDP, length 1470

23:34:37.007618 IP 10.0.0.1.52228 > 10.0.0.2.5001: UDP, length 1470

23:34:37.019914 IP 10.0.0.1.52228 > 10.0.0.2.5001: UDP, length 1470

23:34:37.032022 IP 10.0.0.1.52228 > 10.0.0.2.5001: UDP, length 1470

23:34:37.043964 IP 10.0.0.1.52228 > 10.0.0.2.5001: UDP, length 1470

23:34:37.056098 IP 10.0.0.1.52228 > 10.0.0.2.5001: UDP, length 1470

23:34:37.068093 IP 10.0.0.1.52228 > 10.0.0.2.5001: UDP, length 1470

23:34:37.080273 IP 10.0.0.1.52228 > 10.0.0.2.5001: UDP, length 1470

23:34:37.092444 IP 10.0.0.1.52228 > 10.0.0.2.5001: UDP, length 1470

23:34:37.104742 IP 10.0.0.1.52228 > 10.0.0.2.5001: UDP, length 1470

23:34:37.116540 IP 10.0.0.1.52228 > 10.0.0.2.5001: UDP, length 1470

23:34:37.128732 IP 10.0.0.1.52228 > 10.0.0.2.5001: UDP, length 1470

23:34:37.140900 IP 10.0.0.1.52228 > 10.0.0.2.5001: UDP, length 1470

23:34:37.153063 IP 10.0.0.1.52228 > 10.0.0.2.5001: UDP, length 1470

23:34:37.165169 IP 10.0.0.1.52228 > 10.0.0.2.5001: UDP, length 1470

23:34:37.176924 IP 10.0.0.1.52228 > 10.0.0.2.5001: UDP, length 1470

23:34:37.189174 IP 10.0.0.1.52228 > 10.0.0.2.5001: UDP, length 1470

23:34:37.201302 IP 10.0.0.1.52228 > 10.0.0.2.5001: UDP, length 1470

23:34:37.213531 IP 10.0.0.1.52228 > 10.0.0.2.5001: UDP, length 1470

23:34:37.225543 IP 10.0.0.1.52228 > 10.0.0.2.5001: UDP, length 1470

23:34:37.237656 IP 10.0.0.1.52228 > 10.0.0.2.5001: UDP, length 1470

23:34:37.249620 IP 10.0.0.1.52228 > 10.0.0.2.5001: UDP, length 1470

23:34:37.261773 IP 10.0.0.1.52228 > 10.0.0.2.5001: UDP, length 1470

23:34:37.273734 IP 10.0.0.1.52228 > 10.0.0.2.5001: UDP, length 1470

23:34:37.285991 IP 10.0.0.1.52228 > 10.0.0.2.5001: UDP, length 1470

23:34:37.298193 IP 10.0.0.1.52228 > 10.0.0.2.5001: UDP, length 1470

23:34:37.310154 IP 10.0.0.1.52228 > 10.0.0.2.5001: UDP, length 1470

23:34:37.322227 IP 10.0.0.1.52228 > 10.0.0.2.5001: UDP, length 1470

23:34:37.334304 IP 10.0.0.1.52228 > 10.0.0.2.5001: UDP, length 1470

23:34:37.346342 IP 10.0.0.1.52228 > 10.0.0.2.5001: UDP, length 1470

23:34:37.358494 IP 10.0.0.1.52228 > 10.0.0.2.5001: UDP, length 1470

23:34:37.370851 IP 10.0.0.1.52228 > 10.0.0.2.5001: UDP, length 1470

23:34:37.382798 IP 10.0.0.1.52228 > 10.0.0.2.5001: UDP, length 1470

23:34:37.394781 IP 10.0.0.1.52228 > 10.0.0.2.5001: UDP, length 1470

23:34:37.406949 IP 10.0.0.1.52228 > 10.0.0.2.5001: UDP, length 1470

23:34:37.419093 IP 10.0.0.1.52228 > 10.0.0.2.5001: UDP, length 1470

23:34:37.431256 IP 10.0.0.1.52228 > 10.0.0.2.5001: UDP, length 1470

23:34:37.443411 IP 10.0.0.1.52228 > 10.0.0.2.5001: UDP, length 1470

23:34:37.455608 IP 10.0.0.1.52228 > 10.0.0.2.5001: UDP, length 1470

23:34:37.467354 IP 10.0.0.1.52228 > 10.0.0.2.5001: UDP, length 1470

23:34:37.479504 IP 10.0.0.1.52228 > 10.0.0.2.5001: UDP, length 1470

23:34:37.491662 IP 10.0.0.1.52228 > 10.0.0.2.5001: UDP, length 1470

23:34:37.503678 IP 10.0.0.1.52228 > 10.0.0.2.5001: UDP, length 1470

23:34:37.516011 IP 10.0.0.1.52228 > 10.0.0.2.5001: UDP, length 1470

23:34:37.527994 IP 10.0.0.1.52228 > 10.0.0.2.5001: UDP, length 1470

23:34:37.539935 IP 10.0.0.1.52228 > 10.0.0.2.5001: UDP, length 1470

23:34:37.552094 IP 10.0.0.1.52228 > 10.0.0.2.5001: UDP, length 1470

23:34:37.564277 IP 10.0.0.1.52228 > 10.0.0.2.5001: UDP, length 1470

23:34:37.576374 IP 10.0.0.1.52228 > 10.0.0.2.5001: UDP, length 1470

23:34:37.588474 IP 10.0.0.1.52228 > 10.0.0.2.5001: UDP, length 1470

23:34:37.600336 IP 10.0.0.1.52228 > 10.0.0.2.5001: UDP, length 1470

23:34:37.612536 IP 10.0.0.1.52228 > 10.0.0.2.5001: UDP, length 1470

23:34:37.624690 IP 10.0.0.1.52228 > 10.0.0.2.5001: UDP, length 1470

23:34:37.636823 IP 10.0.0.1.52228 > 10.0.0.2.5001: UDP, length 1470

23:34:37.648854 IP 10.0.0.1.52228 > 10.0.0.2.5001: UDP, length 1470

23:34:37.660964 IP 10.0.0.1.52228 > 10.0.0.2.5001: UDP, length 1470

23:34:37.672971 IP 10.0.0.1.52228 > 10.0.0.2.5001: UDP, length 1470

23:34:37.685132 IP 10.0.0.1.52228 > 10.0.0.2.5001: UDP, length 1470

23:34:37.697189 IP 10.0.0.1.52228 > 10.0.0.2.5001: UDP, length 1470

23:34:37.709276 IP 10.0.0.1.52228 > 10.0.0.2.5001: UDP, length 1470

23:34:37.721321 IP 10.0.0.1.52228 > 10.0.0.2.5001: UDP, length 1470

23:34:37.733501 IP 10.0.0.1.52228 > 10.0.0.2.5001: UDP, length 1470

23:34:37.745562 IP 10.0.0.1.52228 > 10.0.0.2.5001: UDP, length 1470

23:34:37.757546 IP 10.0.0.1.52228 > 10.0.0.2.5001: UDP, length 1470

23:34:37.769859 IP 10.0.0.1.52228 > 10.0.0.2.5001: UDP, length 1470

23:34:37.782015 IP 10.0.0.1.52228 > 10.0.0.2.5001: UDP, length 1470

23:34:37.794079 IP 10.0.0.1.52228 > 10.0.0.2.5001: UDP, length 1470

23:34:37.806340 IP 10.0.0.1.52228 > 10.0.0.2.5001: UDP, length 1470

23:34:37.818131 IP 10.0.0.1.52228 > 10.0.0.2.5001: UDP, length 1470

23:34:37.830278 IP 10.0.0.1.52228 > 10.0.0.2.5001: UDP, length 1470

23:34:37.842444 IP 10.0.0.1.52228 > 10.0.0.2.5001: UDP, length 1470

23:34:37.854563 IP 10.0.0.1.52228 > 10.0.0.2.5001: UDP, length 1470

23:34:37.866766 IP 10.0.0.1.52228 > 10.0.0.2.5001: UDP, length 1470

23:34:37.878824 IP 10.0.0.1.52228 > 10.0.0.2.5001: UDP, length 1470

23:34:37.890681 IP 10.0.0.1.52228 > 10.0.0.2.5001: UDP, length 1470

23:34:37.902924 IP 10.0.0.1.52228 > 10.0.0.2.5001: UDP, length 1470

23:34:37.914983 IP 10.0.0.1.52228 > 10.0.0.2.5001: UDP, length 1470

23:34:37.927185 IP 10.0.0.1.52228 > 10.0.0.2.5001: UDP, length 1470

23:34:37.942878 IP 10.0.0.1.52228 > 10.0.0.2.5001: UDP, length 1470

23:34:37.951361 IP 10.0.0.1.52228 > 10.0.0.2.5001: UDP, length 1470

23:34:37.963461 IP 10.0.0.1.52228 > 10.0.0.2.5001: UDP, length 1470

23:34:37.975401 IP 10.0.0.1.52228 > 10.0.0.2.5001: UDP, length 1470

23:34:37.987565 IP 10.0.0.1.52228 > 10.0.0.2.5001: UDP, length 1470

23:34:37.999602 IP 10.0.0.1.52228 > 10.0.0.2.5001: UDP, length 1470

23:34:38.011771 IP 10.0.0.1.52228 > 10.0.0.2.5001: UDP, length 1470

23:34:38.023828 IP 10.0.0.1.52228 > 10.0.0.2.5001: UDP, length 1470

23:34:38.035808 IP 10.0.0.1.52228 > 10.0.0.2.5001: UDP, length 1470

23:34:38.047975 IP 10.0.0.1.52228 > 10.0.0.2.5001: UDP, length 1470

23:34:38.060136 IP 10.0.0.1.52228 > 10.0.0.2.5001: UDP, length 1470

23:34:38.072158 IP 10.0.0.1.52228 > 10.0.0.2.5001: UDP, length 1470

23:34:38.084254 IP 10.0.0.1.52228 > 10.0.0.2.5001: UDP, length 1470

23:34:38.096292 IP 10.0.0.1.52228 > 10.0.0.2.5001: UDP, length 1470

23:34:38.108388 IP 10.0.0.1.52228 > 10.0.0.2.5001: UDP, length 1470

23:34:38.120566 IP 10.0.0.1.52228 > 10.0.0.2.5001: UDP, length 1470

23:34:38.132573 IP 10.0.0.1.52228 > 10.0.0.2.5001: UDP, length 1470

23:34:38.144884 IP 10.0.0.1.52228 > 10.0.0.2.5001: UDP, length 1470

23:34:38.157015 IP 10.0.0.1.52228 > 10.0.0.2.5001: UDP, length 1470

23:34:38.169204 IP 10.0.0.1.52228 > 10.0.0.2.5001: UDP, length 1470

23:34:38.181014 IP 10.0.0.1.52228 > 10.0.0.2.5001: UDP, length 1470

23:34:38.193164 IP 10.0.0.1.52228 > 10.0.0.2.5001: UDP, length 1470

23:34:38.205280 IP 10.0.0.1.52228 > 10.0.0.2.5001: UDP, length 1470

23:34:38.217440 IP 10.0.0.1.52228 > 10.0.0.2.5001: UDP, length 1470

23:34:38.229624 IP 10.0.0.1.52228 > 10.0.0.2.5001: UDP, length 1470

23:34:38.241787 IP 10.0.0.1.52228 > 10.0.0.2.5001: UDP, length 1470

23:34:38.253610 IP 10.0.0.1.52228 > 10.0.0.2.5001: UDP, length 1470

23:34:38.265754 IP 10.0.0.1.52228 > 10.0.0.2.5001: UDP, length 1470

23:34:38.277961 IP 10.0.0.1.52228 > 10.0.0.2.5001: UDP, length 1470

23:34:38.290159 IP 10.0.0.1.52228 > 10.0.0.2.5001: UDP, length 1470

23:34:38.302209 IP 10.0.0.1.52228 > 10.0.0.2.5001: UDP, length 1470

23:34:38.314098 IP 10.0.0.1.52228 > 10.0.0.2.5001: UDP, length 1470

23:34:38.326266 IP 10.0.0.1.52228 > 10.0.0.2.5001: UDP, length 1470

23:34:38.338410 IP 10.0.0.1.52228 > 10.0.0.2.5001: UDP, length 1470

23:34:38.350557 IP 10.0.0.1.52228 > 10.0.0.2.5001: UDP, length 1470

23:34:38.362683 IP 10.0.0.1.52228 > 10.0.0.2.5001: UDP, length 1470

23:34:38.374687 IP 10.0.0.1.52228 > 10.0.0.2.5001: UDP, length 1470

23:34:38.386825 IP 10.0.0.1.52228 > 10.0.0.2.5001: UDP, length 1470

23:34:38.398838 IP 10.0.0.1.52228 > 10.0.0.2.5001: UDP, length 1470

23:34:38.410968 IP 10.0.0.1.52228 > 10.0.0.2.5001: UDP, length 1470

23:34:38.423050 IP 10.0.0.1.52228 > 10.0.0.2.5001: UDP, length 1470

23:34:38.435149 IP 10.0.0.1.52228 > 10.0.0.2.5001: UDP, length 1470

23:34:38.447145 IP 10.0.0.1.52228 > 10.0.0.2.5001: UDP, length 1470

23:34:38.459225 IP 10.0.0.1.52228 > 10.0.0.2.5001: UDP, length 1470

23:34:38.471247 IP 10.0.0.1.52228 > 10.0.0.2.5001: UDP, length 1470

23:34:38.483469 IP 10.0.0.1.52228 > 10.0.0.2.5001: UDP, length 1470

23:34:38.495682 IP 10.0.0.1.52228 > 10.0.0.2.5001: UDP, length 1470

23:34:38.507646 IP 10.0.0.1.52228 > 10.0.0.2.5001: UDP, length 1470

23:34:38.519892 IP 10.0.0.1.52228 > 10.0.0.2.5001: UDP, length 1470

23:34:38.532123 IP 10.0.0.1.52228 > 10.0.0.2.5001: UDP, length 1470

23:34:38.543899 IP 10.0.0.1.52228 > 10.0.0.2.5001: UDP, length 1470

23:34:38.556057 IP 10.0.0.1.52228 > 10.0.0.2.5001: UDP, length 1470

23:34:38.568220 IP 10.0.0.1.52228 > 10.0.0.2.5001: UDP, length 1470

23:34:38.580368 IP 10.0.0.1.52228 > 10.0.0.2.5001: UDP, length 1470

23:34:38.592532 IP 10.0.0.1.52228 > 10.0.0.2.5001: UDP, length 1470

23:34:38.604647 IP 10.0.0.1.52228 > 10.0.0.2.5001: UDP, length 1470

23:34:38.616499 IP 10.0.0.1.52228 > 10.0.0.2.5001: UDP, length 1470

23:34:38.628633 IP 10.0.0.1.52228 > 10.0.0.2.5001: UDP, length 1470

23:34:38.640796 IP 10.0.0.1.52228 > 10.0.0.2.5001: UDP, length 1470

23:34:38.652968 IP 10.0.0.1.52228 > 10.0.0.2.5001: UDP, length 1470

23:34:38.665080 IP 10.0.0.1.52228 > 10.0.0.2.5001: UDP, length 1470

23:34:38.677045 IP 10.0.0.1.52228 > 10.0.0.2.5001: UDP, length 1470

23:34:38.689068 IP 10.0.0.1.52228 > 10.0.0.2.5001: UDP, length 1470

23:34:38.701275 IP 10.0.0.1.52228 > 10.0.0.2.5001: UDP, length 1470

23:34:38.713336 IP 10.0.0.1.52228 > 10.0.0.2.5001: UDP, length 1470

23:34:38.725435 IP 10.0.0.1.52228 > 10.0.0.2.5001: UDP, length 1470

23:34:38.737587 IP 10.0.0.1.52228 > 10.0.0.2.5001: UDP, length 1470

23:34:38.749485 IP 10.0.0.1.52228 > 10.0.0.2.5001: UDP, length 1470

23:34:38.761662 IP 10.0.0.1.52228 > 10.0.0.2.5001: UDP, length 1470

23:34:38.773765 IP 10.0.0.1.52228 > 10.0.0.2.5001: UDP, length 1470

23:34:38.785892 IP 10.0.0.1.52228 > 10.0.0.2.5001: UDP, length 1470

23:34:38.797969 IP 10.0.0.1.52228 > 10.0.0.2.5001: UDP, length 1470

23:34:38.810036 IP 10.0.0.1.52228 > 10.0.0.2.5001: UDP, length 1470

23:34:38.822093 IP 10.0.0.1.52228 > 10.0.0.2.5001: UDP, length 1470

23:34:38.834193 IP 10.0.0.1.52228 > 10.0.0.2.5001: UDP, length 1470

23:34:38.846247 IP 10.0.0.1.52228 > 10.0.0.2.5001: UDP, length 1470

23:34:38.858376 IP 10.0.0.1.52228 > 10.0.0.2.5001: UDP, length 1470

23:34:38.870729 IP 10.0.0.1.52228 > 10.0.0.2.5001: UDP, length 1470

23:34:38.882895 IP 10.0.0.1.52228 > 10.0.0.2.5001: UDP, length 1470

23:34:38.894698 IP 10.0.0.1.52228 > 10.0.0.2.5001: UDP, length 1470

23:34:38.906886 IP 10.0.0.1.52228 > 10.0.0.2.5001: UDP, length 1470

23:34:38.918988 IP 10.0.0.1.52228 > 10.0.0.2.5001: UDP, length 1470

23:34:38.931146 IP 10.0.0.1.52228 > 10.0.0.2.5001: UDP, length 1470

23:34:38.943346 IP 10.0.0.1.52228 > 10.0.0.2.5001: UDP, length 1470

23:34:38.955503 IP 10.0.0.1.52228 > 10.0.0.2.5001: UDP, length 1470

23:34:38.967254 IP 10.0.0.1.52228 > 10.0.0.2.5001: UDP, length 1470

23:34:38.979411 IP 10.0.0.1.52228 > 10.0.0.2.5001: UDP, length 1470

23:34:38.991569 IP 10.0.0.1.52228 > 10.0.0.2.5001: UDP, length 1470

23:34:39.003748 IP 10.0.0.1.52228 > 10.0.0.2.5001: UDP, length 1470

23:34:39.015892 IP 10.0.0.1.52228 > 10.0.0.2.5001: UDP, length 1470

23:34:39.027900 IP 10.0.0.1.52228 > 10.0.0.2.5001: UDP, length 1470

23:34:39.039843 IP 10.0.0.1.52228 > 10.0.0.2.5001: UDP, length 1470

23:34:39.052098 IP 10.0.0.1.52228 > 10.0.0.2.5001: UDP, length 1470

23:34:39.064260 IP 10.0.0.1.52228 > 10.0.0.2.5001: UDP, length 1470

23:34:39.076147 IP 10.0.0.1.52228 > 10.0.0.2.5001: UDP, length 1470

23:34:39.088377 IP 10.0.0.1.52228 > 10.0.0.2.5001: UDP, length 1470

23:34:39.100252 IP 10.0.0.1.52228 > 10.0.0.2.5001: UDP, length 1470

23:34:39.112437 IP 10.0.0.1.52228 > 10.0.0.2.5001: UDP, length 1470

23:34:39.124567 IP 10.0.0.1.52228 > 10.0.0.2.5001: UDP, length 1470

23:34:39.136708 IP 10.0.0.1.52228 > 10.0.0.2.5001: UDP, length 1470

23:34:39.148758 IP 10.0.0.1.52228 > 10.0.0.2.5001: UDP, length 1470

23:34:39.160866 IP 10.0.0.1.52228 > 10.0.0.2.5001: UDP, length 1470

23:34:39.172885 IP 10.0.0.1.52228 > 10.0.0.2.5001: UDP, length 1470

23:34:39.185043 IP 10.0.0.1.52228 > 10.0.0.2.5001: UDP, length 1470

23:34:39.197122 IP 10.0.0.1.52228 > 10.0.0.2.5001: UDP, length 1470

23:34:39.209178 IP 10.0.0.1.52228 > 10.0.0.2.5001: UDP, length 1470

23:34:39.221204 IP 10.0.0.1.52228 > 10.0.0.2.5001: UDP, length 1470

23:34:39.233322 IP 10.0.0.1.52228 > 10.0.0.2.5001: UDP, length 1470

23:34:39.245471 IP 10.0.0.1.52228 > 10.0.0.2.5001: UDP, length 1470

23:34:39.257539 IP 10.0.0.1.52228 > 10.0.0.2.5001: UDP, length 1470

23:34:39.269818 IP 10.0.0.1.52228 > 10.0.0.2.5001: UDP, length 1470

23:34:39.281916 IP 10.0.0.1.52228 > 10.0.0.2.5001: UDP, length 1470

23:34:39.294122 IP 10.0.0.1.52228 > 10.0.0.2.5001: UDP, length 1470

23:34:39.306450 IP 10.0.0.1.52228 > 10.0.0.2.5001: UDP, length 1470

23:34:39.318033 IP 10.0.0.1.52228 > 10.0.0.2.5001: UDP, length 1470

23:34:39.330187 IP 10.0.0.1.52228 > 10.0.0.2.5001: UDP, length 1470

23:34:39.342315 IP 10.0.0.1.52228 > 10.0.0.2.5001: UDP, length 1470

23:34:39.354509 IP 10.0.0.1.52228 > 10.0.0.2.5001: UDP, length 1470

23:34:39.366694 IP 10.0.0.1.52228 > 10.0.0.2.5001: UDP, length 1470

23:34:39.378766 IP 10.0.0.1.52228 > 10.0.0.2.5001: UDP, length 1470

23:34:39.390718 IP 10.0.0.1.52228 > 10.0.0.2.5001: UDP, length 1470

23:34:39.404368 IP 10.0.0.1.52228 > 10.0.0.2.5001: UDP, length 1470

23:34:39.419066 IP 10.0.0.1.52228 > 10.0.0.2.5001: UDP, length 1470

23:34:39.429704 IP 10.0.0.1.52228 > 10.0.0.2.5001: UDP, length 1470

23:34:39.439096 IP 10.0.0.1.52228 > 10.0.0.2.5001: UDP, length 1470

23:34:39.451266 IP 10.0.0.1.52228 > 10.0.0.2.5001: UDP, length 1470

23:34:39.463337 IP 10.0.0.1.52228 > 10.0.0.2.5001: UDP, length 1470

23:34:39.475298 IP 10.0.0.1.52228 > 10.0.0.2.5001: UDP, length 1470

23:34:39.487441 IP 10.0.0.1.52228 > 10.0.0.2.5001: UDP, length 1470

23:34:39.499529 IP 10.0.0.1.52228 > 10.0.0.2.5001: UDP, length 1470

23:34:39.511681 IP 10.0.0.1.52228 > 10.0.0.2.5001: UDP, length 1470

23:34:39.523747 IP 10.0.0.1.52228 > 10.0.0.2.5001: UDP, length 1470

23:34:39.535837 IP 10.0.0.1.52228 > 10.0.0.2.5001: UDP, length 1470

23:34:39.547895 IP 10.0.0.1.52228 > 10.0.0.2.5001: UDP, length 1470

23:34:39.559981 IP 10.0.0.1.52228 > 10.0.0.2.5001: UDP, length 1470

23:34:39.572057 IP 10.0.0.1.52228 > 10.0.0.2.5001: UDP, length 1470

23:34:39.584198 IP 10.0.0.1.52228 > 10.0.0.2.5001: UDP, length 1470

23:34:39.596178 IP 10.0.0.1.52228 > 10.0.0.2.5001: UDP, length 1470

23:34:39.608341 IP 10.0.0.1.52228 > 10.0.0.2.5001: UDP, length 1470

23:34:39.620429 IP 10.0.0.1.52228 > 10.0.0.2.5001: UDP, length 1470

23:34:39.632493 IP 10.0.0.1.52228 > 10.0.0.2.5001: UDP, length 1470

23:34:39.644654 IP 10.0.0.1.52228 > 10.0.0.2.5001: UDP, length 1470

23:34:39.656852 IP 10.0.0.1.52228 > 10.0.0.2.5001: UDP, length 1470

23:34:39.669035 IP 10.0.0.1.52228 > 10.0.0.2.5001: UDP, length 1470

23:34:39.681106 IP 10.0.0.1.52228 > 10.0.0.2.5001: UDP, length 1470

23:34:39.692909 IP 10.0.0.1.52228 > 10.0.0.2.5001: UDP, length 1470

23:34:39.705108 IP 10.0.0.1.52228 > 10.0.0.2.5001: UDP, length 1470

23:34:39.717280 IP 10.0.0.1.52228 > 10.0.0.2.5001: UDP, length 1470

23:34:39.729441 IP 10.0.0.1.52228 > 10.0.0.2.5001: UDP, length 1470

23:34:39.741615 IP 10.0.0.1.52228 > 10.0.0.2.5001: UDP, length 1470

23:34:39.753730 IP 10.0.0.1.52228 > 10.0.0.2.5001: UDP, length 1470

23:34:39.765548 IP 10.0.0.1.52228 > 10.0.0.2.5001: UDP, length 1470

23:34:39.777704 IP 10.0.0.1.52228 > 10.0.0.2.5001: UDP, length 1470

23:34:39.789899 IP 10.0.0.1.52228 > 10.0.0.2.5001: UDP, length 1470

23:34:39.802008 IP 10.0.0.1.52228 > 10.0.0.2.5001: UDP, length 1470

23:34:39.814202 IP 10.0.0.1.52228 > 10.0.0.2.5001: UDP, length 1470

23:34:39.826177 IP 10.0.0.1.52228 > 10.0.0.2.5001: UDP, length 1470

23:34:39.838169 IP 10.0.0.1.52228 > 10.0.0.2.5001: UDP, length 1470

23:34:39.850311 IP 10.0.0.1.52228 > 10.0.0.2.5001: UDP, length 1470

23:34:39.862455 IP 10.0.0.1.52228 > 10.0.0.2.5001: UDP, length 1470

23:34:39.874388 IP 10.0.0.1.52228 > 10.0.0.2.5001: UDP, length 1470

23:34:39.886836 IP 10.0.0.1.52228 > 10.0.0.2.5001: UDP, length 1470

23:34:39.898762 IP 10.0.0.1.52228 > 10.0.0.2.5001: UDP, length 1470

23:34:39.910726 IP 10.0.0.1.52228 > 10.0.0.2.5001: UDP, length 1470

23:34:39.922833 IP 10.0.0.1.52228 > 10.0.0.2.5001: UDP, length 1470

23:34:39.934947 IP 10.0.0.1.52228 > 10.0.0.2.5001: UDP, length 1470

23:34:39.946993 IP 10.0.0.1.52228 > 10.0.0.2.5001: UDP, length 1470

23:34:39.959102 IP 10.0.0.1.52228 > 10.0.0.2.5001: UDP, length 1470

23:34:39.971133 IP 10.0.0.1.52228 > 10.0.0.2.5001: UDP, length 1470

23:34:39.983311 IP 10.0.0.1.52228 > 10.0.0.2.5001: UDP, length 1470

23:34:39.995477 IP 10.0.0.1.52228 > 10.0.0.2.5001: UDP, length 1470

23:34:40.007621 IP 10.0.0.1.52228 > 10.0.0.2.5001: UDP, length 1470

23:34:40.019826 IP 10.0.0.1.52228 > 10.0.0.2.5001: UDP, length 1470

23:34:40.031974 IP 10.0.0.1.52228 > 10.0.0.2.5001: UDP, length 1470

23:34:40.043681 IP 10.0.0.1.52228 > 10.0.0.2.5001: UDP, length 1470

23:34:40.055882 IP 10.0.0.1.52228 > 10.0.0.2.5001: UDP, length 1470

23:34:40.068049 IP 10.0.0.1.52228 > 10.0.0.2.5001: UDP, length 1470

23:34:40.080216 IP 10.0.0.1.52228 > 10.0.0.2.5001: UDP, length 1470

23:34:40.092399 IP 10.0.0.1.52228 > 10.0.0.2.5001: UDP, length 1470

23:34:40.104321 IP 10.0.0.1.52228 > 10.0.0.2.5001: UDP, length 1470

23:34:40.116309 IP 10.0.0.1.52228 > 10.0.0.2.5001: UDP, length 1470

23:34:40.128484 IP 10.0.0.1.52228 > 10.0.0.2.5001: UDP, length 1470

23:34:40.140680 IP 10.0.0.1.52228 > 10.0.0.2.5001: UDP, length 1470

23:34:40.152814 IP 10.0.0.1.52228 > 10.0.0.2.5001: UDP, length 1470

23:34:40.164980 IP 10.0.0.1.52228 > 10.0.0.2.5001: UDP, length 1470

23:34:40.177007 IP 10.0.0.1.52228 > 10.0.0.2.5001: UDP, length 1470

23:34:40.188946 IP 10.0.0.1.52228 > 10.0.0.2.5001: UDP, length 1470

23:34:40.201101 IP 10.0.0.1.52228 > 10.0.0.2.5001: UDP, length 1470

23:34:40.213283 IP 10.0.0.1.52228 > 10.0.0.2.5001: UDP, length 1470

23:34:40.225327 IP 10.0.0.1.52228 > 10.0.0.2.5001: UDP, length 1470

23:34:40.237471 IP 10.0.0.1.52228 > 10.0.0.2.5001: UDP, length 1470

23:34:40.249312 IP 10.0.0.1.52228 > 10.0.0.2.5001: UDP, length 1470

23:34:40.261560 IP 10.0.0.1.52228 > 10.0.0.2.5001: UDP, length 1470

23:34:40.273541 IP 10.0.0.1.52228 > 10.0.0.2.5001: UDP, length 1470

23:34:40.285791 IP 10.0.0.1.52228 > 10.0.0.2.5001: UDP, length 1470

23:34:40.297838 IP 10.0.0.1.52228 > 10.0.0.2.5001: UDP, length 1470

23:34:40.309941 IP 10.0.0.1.52228 > 10.0.0.2.5001: UDP, length 1470

23:34:40.321991 IP 10.0.0.1.52228 > 10.0.0.2.5001: UDP, length 1470

23:34:40.334074 IP 10.0.0.1.52228 > 10.0.0.2.5001: UDP, length 1470

23:34:40.346135 IP 10.0.0.1.52228 > 10.0.0.2.5001: UDP, length 1470

23:34:40.358267 IP 10.0.0.1.52228 > 10.0.0.2.5001: UDP, length 1470

23:34:40.370629 IP 10.0.0.1.52228 > 10.0.0.2.5001: UDP, length 1470

23:34:40.382812 IP 10.0.0.1.52228 > 10.0.0.2.5001: UDP, length 1470

23:34:40.394632 IP 10.0.0.1.52228 > 10.0.0.2.5001: UDP, length 1470

23:34:40.406732 IP 10.0.0.1.52228 > 10.0.0.2.5001: UDP, length 1470

23:34:40.418893 IP 10.0.0.1.52228 > 10.0.0.2.5001: UDP, length 1470

23:34:40.431063 IP 10.0.0.1.52228 > 10.0.0.2.5001: UDP, length 1470

23:34:40.443224 IP 10.0.0.1.52228 > 10.0.0.2.5001: UDP, length 1470

23:34:40.455381 IP 10.0.0.1.52228 > 10.0.0.2.5001: UDP, length 1470

23:34:40.467172 IP 10.0.0.1.52228 > 10.0.0.2.5001: UDP, length 1470

23:34:40.479331 IP 10.0.0.1.52228 > 10.0.0.2.5001: UDP, length 1470

23:34:40.491500 IP 10.0.0.1.52228 > 10.0.0.2.5001: UDP, length 1470

23:34:40.503471 IP 10.0.0.1.52228 > 10.0.0.2.5001: UDP, length 1470

23:34:40.515784 IP 10.0.0.1.52228 > 10.0.0.2.5001: UDP, length 1470

23:34:40.527514 IP 10.0.0.1.52228 > 10.0.0.2.5001: UDP, length 1470

23:34:40.539758 IP 10.0.0.1.52228 > 10.0.0.2.5001: UDP, length 1470

23:34:40.551911 IP 10.0.0.1.52228 > 10.0.0.2.5001: UDP, length 1470

23:34:40.564093 IP 10.0.0.1.52228 > 10.0.0.2.5001: UDP, length 1470

23:34:40.576161 IP 10.0.0.1.52228 > 10.0.0.2.5001: UDP, length 1470

23:34:40.588283 IP 10.0.0.1.52228 > 10.0.0.2.5001: UDP, length 1470

23:34:40.600204 IP 10.0.0.1.52228 > 10.0.0.2.5001: UDP, length 1470

23:34:40.612364 IP 10.0.0.1.52228 > 10.0.0.2.5001: UDP, length 1470

23:34:40.624500 IP 10.0.0.1.52228 > 10.0.0.2.5001: UDP, length 1470

23:34:40.636616 IP 10.0.0.1.52228 > 10.0.0.2.5001: UDP, length 1470

23:34:40.648655 IP 10.0.0.1.52228 > 10.0.0.2.5001: UDP, length 1470

23:34:40.660758 IP 10.0.0.1.52228 > 10.0.0.2.5001: UDP, length 1470

23:34:40.672803 IP 10.0.0.1.52228 > 10.0.0.2.5001: UDP, length 1470

23:34:40.685041 IP 10.0.0.1.52228 > 10.0.0.2.5001: UDP, length 1470

23:34:40.696993 IP 10.0.0.1.52228 > 10.0.0.2.5001: UDP, length 1470

23:34:40.709087 IP 10.0.0.1.52228 > 10.0.0.2.5001: UDP, length 1470

23:34:40.721101 IP 10.0.0.1.52228 > 10.0.0.2.5001: UDP, length 1470

23:34:40.733223 IP 10.0.0.1.52228 > 10.0.0.2.5001: UDP, length 1470

23:34:40.745478 IP 10.0.0.1.52228 > 10.0.0.2.5001: UDP, length 1470

23:34:40.757700 IP 10.0.0.1.52228 > 10.0.0.2.5001: UDP, length 1470

23:34:40.769773 IP 10.0.0.1.52228 > 10.0.0.2.5001: UDP, length 1470

23:34:40.781900 IP 10.0.0.1.52228 > 10.0.0.2.5001: UDP, length 1470

23:34:40.793744 IP 10.0.0.1.52228 > 10.0.0.2.5001: UDP, length 1470

23:34:40.806272 IP 10.0.0.1.52228 > 10.0.0.2.5001: UDP, length 1470

23:34:40.817985 IP 10.0.0.1.52228 > 10.0.0.2.5001: UDP, length 1470

23:34:40.830159 IP 10.0.0.1.52228 > 10.0.0.2.5001: UDP, length 1470

23:34:40.842322 IP 10.0.0.1.52228 > 10.0.0.2.5001: UDP, length 1470

23:34:40.854487 IP 10.0.0.1.52228 > 10.0.0.2.5001: UDP, length 1470

23:34:40.866658 IP 10.0.0.1.52228 > 10.0.0.2.5001: UDP, length 1470

23:34:40.878631 IP 10.0.0.1.52228 > 10.0.0.2.5001: UDP, length 1470

23:34:40.890517 IP 10.0.0.1.52228 > 10.0.0.2.5001: UDP, length 1470

23:34:40.902662 IP 10.0.0.1.52228 > 10.0.0.2.5001: UDP, length 1470

23:34:40.914833 IP 10.0.0.1.52228 > 10.0.0.2.5001: UDP, length 1470

23:34:40.926992 IP 10.0.0.1.52228 > 10.0.0.2.5001: UDP, length 1470

23:34:40.939086 IP 10.0.0.1.52228 > 10.0.0.2.5001: UDP, length 1470

23:34:40.951155 IP 10.0.0.1.52228 > 10.0.0.2.5001: UDP, length 1470

23:34:40.963105 IP 10.0.0.1.52228 > 10.0.0.2.5001: UDP, length 1470

23:34:40.975274 IP 10.0.0.1.52228 > 10.0.0.2.5001: UDP, length 1470

23:34:40.991247 IP 10.0.0.1.52228 > 10.0.0.2.5001: UDP, length 1470

23:34:40.999473 IP 10.0.0.1.52228 > 10.0.0.2.5001: UDP, length 1470

23:34:41.011573 IP 10.0.0.1.52228 > 10.0.0.2.5001: UDP, length 1470

23:34:41.023538 IP 10.0.0.1.52228 > 10.0.0.2.5001: UDP, length 1470

23:34:41.035716 IP 10.0.0.1.52228 > 10.0.0.2.5001: UDP, length 1470

23:34:41.047790 IP 10.0.0.1.52228 > 10.0.0.2.5001: UDP, length 1470

23:34:41.059905 IP 10.0.0.1.52228 > 10.0.0.2.5001: UDP, length 1470

23:34:41.071945 IP 10.0.0.1.52228 > 10.0.0.2.5001: UDP, length 1470

23:34:41.084151 IP 10.0.0.1.52228 > 10.0.0.2.5001: UDP, length 1470

23:34:41.096087 IP 10.0.0.1.52228 > 10.0.0.2.5001: UDP, length 1470

23:34:41.108242 IP 10.0.0.1.52228 > 10.0.0.2.5001: UDP, length 1470

23:34:41.120449 IP 10.0.0.1.52228 > 10.0.0.2.5001: UDP, length 1470

23:34:41.132625 IP 10.0.0.1.52228 > 10.0.0.2.5001: UDP, length 1470

23:34:41.144760 IP 10.0.0.1.52228 > 10.0.0.2.5001: UDP, length 1470

23:34:41.156954 IP 10.0.0.1.52228 > 10.0.0.2.5001: UDP, length 1470

23:34:41.168729 IP 10.0.0.1.52228 > 10.0.0.2.5001: UDP, length 1470

23:34:41.180888 IP 10.0.0.1.52228 > 10.0.0.2.5001: UDP, length 1470

23:34:41.193046 IP 10.0.0.1.52228 > 10.0.0.2.5001: UDP, length 1470

23:34:41.205185 IP 10.0.0.1.52228 > 10.0.0.2.5001: UDP, length 1470

23:34:41.217353 IP 10.0.0.1.52228 > 10.0.0.2.5001: UDP, length 1470

23:34:41.229494 IP 10.0.0.1.52228 > 10.0.0.2.5001: UDP, length 1470

23:34:41.241277 IP 10.0.0.1.52228 > 10.0.0.2.5001: UDP, length 1470

23:34:41.253512 IP 10.0.0.1.52228 > 10.0.0.2.5001: UDP, length 1470

23:34:41.265610 IP 10.0.0.1.52228 > 10.0.0.2.5001: UDP, length 1470

23:34:41.277692 IP 10.0.0.1.52228 > 10.0.0.2.5001: UDP, length 1470

23:34:41.289961 IP 10.0.0.1.52228 > 10.0.0.2.5001: UDP, length 1470

23:34:41.301678 IP 10.0.0.1.52228 > 10.0.0.2.5001: UDP, length 1470

23:34:41.313909 IP 10.0.0.1.52228 > 10.0.0.2.5001: UDP, length 1470

23:34:41.326071 IP 10.0.0.1.52228 > 10.0.0.2.5001: UDP, length 1470

23:34:41.338176 IP 10.0.0.1.52228 > 10.0.0.2.5001: UDP, length 1470

23:34:41.350281 IP 10.0.0.1.52228 > 10.0.0.2.5001: UDP, length 1470

23:34:41.362378 IP 10.0.0.1.52228 > 10.0.0.2.5001: UDP, length 1470

23:34:41.374338 IP 10.0.0.1.52228 > 10.0.0.2.5001: UDP, length 1470

23:34:41.386509 IP 10.0.0.1.52228 > 10.0.0.2.5001: UDP, length 1470

23:34:41.398605 IP 10.0.0.1.52228 > 10.0.0.2.5001: UDP, length 1470

23:34:41.410717 IP 10.0.0.1.52228 > 10.0.0.2.5001: UDP, length 1470

23:34:41.422769 IP 10.0.0.1.52228 > 10.0.0.2.5001: UDP, length 1470

23:34:41.434872 IP 10.0.0.1.52228 > 10.0.0.2.5001: UDP, length 1470

23:34:41.446947 IP 10.0.0.1.52228 > 10.0.0.2.5001: UDP, length 1470

23:34:41.459059 IP 10.0.0.1.52228 > 10.0.0.2.5001: UDP, length 1470

23:34:41.471021 IP 10.0.0.1.52228 > 10.0.0.2.5001: UDP, length 1470

23:34:41.483204 IP 10.0.0.1.52228 > 10.0.0.2.5001: UDP, length 1470

23:34:41.495677 IP 10.0.0.1.52228 > 10.0.0.2.5001: UDP, length 1470

23:34:41.507669 IP 10.0.0.1.52228 > 10.0.0.2.5001: UDP, length 1470

23:34:41.519577 IP 10.0.0.1.52228 > 10.0.0.2.5001: UDP, length 1470

23:34:41.531742 IP 10.0.0.1.52228 > 10.0.0.2.5001: UDP, length 1470

23:34:41.543916 IP 10.0.0.1.52228 > 10.0.0.2.5001: UDP, length 1470

23:34:41.556142 IP 10.0.0.1.52228 > 10.0.0.2.5001: UDP, length 1470

23:34:41.568184 IP 10.0.0.1.52228 > 10.0.0.2.5001: UDP, length 1470

23:34:41.580353 IP 10.0.0.1.52228 > 10.0.0.2.5001: UDP, length 1470

23:34:41.592160 IP 10.0.0.1.52228 > 10.0.0.2.5001: UDP, length 1470

23:34:41.604363 IP 10.0.0.1.52228 > 10.0.0.2.5001: UDP, length 1470

23:34:41.616461 IP 10.0.0.1.52228 > 10.0.0.2.5001: UDP, length 1470

23:34:41.628631 IP 10.0.0.1.52228 > 10.0.0.2.5001: UDP, length 1470

23:34:41.640797 IP 10.0.0.1.52228 > 10.0.0.2.5001: UDP, length 1470

23:34:41.652856 IP 10.0.0.1.52228 > 10.0.0.2.5001: UDP, length 1470

23:34:41.664641 IP 10.0.0.1.52228 > 10.0.0.2.5001: UDP, length 1470

23:34:41.676784 IP 10.0.0.1.52228 > 10.0.0.2.5001: UDP, length 1470

23:34:41.688996 IP 10.0.0.1.52228 > 10.0.0.2.5001: UDP, length 1470

23:34:41.701134 IP 10.0.0.1.52228 > 10.0.0.2.5001: UDP, length 1470

23:34:41.713028 IP 10.0.0.1.52228 > 10.0.0.2.5001: UDP, length 1470

23:34:41.725270 IP 10.0.0.1.52228 > 10.0.0.2.5001: UDP, length 1470

23:34:41.737199 IP 10.0.0.1.52228 > 10.0.0.2.5001: UDP, length 1470

23:34:41.749365 IP 10.0.0.1.52228 > 10.0.0.2.5001: UDP, length 1470

23:34:41.761616 IP 10.0.0.1.52228 > 10.0.0.2.5001: UDP, length 1470

23:34:41.773582 IP 10.0.0.1.52228 > 10.0.0.2.5001: UDP, length 1470

23:34:41.785685 IP 10.0.0.1.52228 > 10.0.0.2.5001: UDP, length 1470

23:34:41.797757 IP 10.0.0.1.52228 > 10.0.0.2.5001: UDP, length 1470

23:34:41.809825 IP 10.0.0.1.52228 > 10.0.0.2.5001: UDP, length 1470

23:34:41.821913 IP 10.0.0.1.52228 > 10.0.0.2.5001: UDP, length 1470

23:34:41.833953 IP 10.0.0.1.52228 > 10.0.0.2.5001: UDP, length 1470

23:34:41.846003 IP 10.0.0.1.52228 > 10.0.0.2.5001: UDP, length 1470

23:34:41.858189 IP 10.0.0.1.52228 > 10.0.0.2.5001: UDP, length 1470

23:34:41.870576 IP 10.0.0.1.52228 > 10.0.0.2.5001: UDP, length 1470

23:34:41.882392 IP 10.0.0.1.52228 > 10.0.0.2.5001: UDP, length 1470

23:34:41.894610 IP 10.0.0.1.52228 > 10.0.0.2.5001: UDP, length 1470

23:34:41.906595 IP 10.0.0.1.52228 > 10.0.0.2.5001: UDP, length 1470

23:34:41.918795 IP 10.0.0.1.52228 > 10.0.0.2.5001: UDP, length 1470

23:34:41.930996 IP 10.0.0.1.52228 > 10.0.0.2.5001: UDP, length 1470

23:34:41.942887 IP 10.0.0.1.52228 > 10.0.0.2.5001: UDP, length 1470

23:34:41.955268 IP 10.0.0.1.52228 > 10.0.0.2.5001: UDP, length 1470

23:34:41.967069 IP 10.0.0.1.52228 > 10.0.0.2.5001: UDP, length 1470

23:34:41.979225 IP 10.0.0.1.52228 > 10.0.0.2.5001: UDP, length 1470

23:34:41.991382 IP 10.0.0.1.52228 > 10.0.0.2.5001: UDP, length 1470

23:34:42.003347 IP 10.0.0.1.52228 > 10.0.0.2.5001: UDP, length 1470

23:34:42.015679 IP 10.0.0.1.52228 > 10.0.0.2.5001: UDP, length 1470

23:34:42.027469 IP 10.0.0.1.52228 > 10.0.0.2.5001: UDP, length 1470

23:34:42.039668 IP 10.0.0.1.52228 > 10.0.0.2.5001: UDP, length 1470

23:34:42.051829 IP 10.0.0.1.52228 > 10.0.0.2.5001: UDP, length 1470

23:34:42.064053 IP 10.0.0.1.52228 > 10.0.0.2.5001: UDP, length 1470

23:34:42.075995 IP 10.0.0.1.52228 > 10.0.0.2.5001: UDP, length 1470

23:34:42.088247 IP 10.0.0.1.52228 > 10.0.0.2.5001: UDP, length 1470

23:34:42.100088 IP 10.0.0.1.52228 > 10.0.0.2.5001: UDP, length 1470

23:34:42.112271 IP 10.0.0.1.52228 > 10.0.0.2.5001: UDP, length 1470

23:34:42.124329 IP 10.0.0.1.52228 > 10.0.0.2.5001: UDP, length 1470

23:34:42.136507 IP 10.0.0.1.52228 > 10.0.0.2.5001: UDP, length 1470

23:34:42.148553 IP 10.0.0.1.52228 > 10.0.0.2.5001: UDP, length 1470

23:34:42.160670 IP 10.0.0.1.52228 > 10.0.0.2.5001: UDP, length 1470

23:34:42.172747 IP 10.0.0.1.52228 > 10.0.0.2.5001: UDP, length 1470

23:34:42.184837 IP 10.0.0.1.52228 > 10.0.0.2.5001: UDP, length 1470

23:34:42.196899 IP 10.0.0.1.52228 > 10.0.0.2.5001: UDP, length 1470

23:34:42.208998 IP 10.0.0.1.52228 > 10.0.0.2.5001: UDP, length 1470

23:34:42.220959 IP 10.0.0.1.52228 > 10.0.0.2.5001: UDP, length 1470

23:34:42.233112 IP 10.0.0.1.52228 > 10.0.0.2.5001: UDP, length 1470

23:34:42.245309 IP 10.0.0.1.52228 > 10.0.0.2.5001: UDP, length 1470

23:34:42.257500 IP 10.0.0.1.52228 > 10.0.0.2.5001: UDP, length 1470

23:34:42.269528 IP 10.0.0.1.52228 > 10.0.0.2.5001: UDP, length 1470

23:34:42.281767 IP 10.0.0.1.52228 > 10.0.0.2.5001: UDP, length 1470

23:34:42.293958 IP 10.0.0.1.52228 > 10.0.0.2.5001: UDP, length 1470

23:34:42.305698 IP 10.0.0.1.52228 > 10.0.0.2.5001: UDP, length 1470

23:34:42.317872 IP 10.0.0.1.52228 > 10.0.0.2.5001: UDP, length 1470

23:34:42.330029 IP 10.0.0.1.52228 > 10.0.0.2.5001: UDP, length 1470

23:34:42.342191 IP 10.0.0.1.52228 > 10.0.0.2.5001: UDP, length 1470

23:34:42.354349 IP 10.0.0.1.52228 > 10.0.0.2.5001: UDP, length 1470

23:34:42.366534 IP 10.0.0.1.52228 > 10.0.0.2.5001: UDP, length 1470

23:34:42.378268 IP 10.0.0.1.52228 > 10.0.0.2.5001: UDP, length 1470

23:34:42.390473 IP 10.0.0.1.52228 > 10.0.0.2.5001: UDP, length 1470

23:34:42.402622 IP 10.0.0.1.52228 > 10.0.0.2.5001: UDP, length 1470

23:34:42.414796 IP 10.0.0.1.52228 > 10.0.0.2.5001: UDP, length 1470

23:34:42.426891 IP 10.0.0.1.52228 > 10.0.0.2.5001: UDP, length 1470

23:34:42.438995 IP 10.0.0.1.52228 > 10.0.0.2.5001: UDP, length 1470

23:34:42.450866 IP 10.0.0.1.52228 > 10.0.0.2.5001: UDP, length 1470

23:34:42.463076 IP 10.0.0.1.52228 > 10.0.0.2.5001: UDP, length 1470

23:34:42.475094 IP 10.0.0.1.52228 > 10.0.0.2.5001: UDP, length 1470

23:34:42.487540 IP 10.0.0.1.52228 > 10.0.0.2.5001: UDP, length 1470

23:34:42.499359 IP 10.0.0.1.52228 > 10.0.0.2.5001: UDP, length 1470

23:34:42.511333 IP 10.0.0.1.52228 > 10.0.0.2.5001: UDP, length 1470

23:34:42.523541 IP 10.0.0.1.52228 > 10.0.0.2.5001: UDP, length 1470

23:34:42.535502 IP 10.0.0.1.52228 > 10.0.0.2.5001: UDP, length 1470

23:34:42.535648 IP 10.0.0.2.5001 > 10.0.0.1.52228: UDP, length 1470

23:34:42.539045 IP 10.0.0.2.5001 > 10.0.0.1.52228: UDP, length 1470

23:34:42.547686 IP 10.0.0.1.52228 > 10.0.0.2.5001: UDP, length 1470

23:34:42.551185 IP 10.0.0.2.5001 > 10.0.0.1.52228: UDP, length 1470

23:34:42.559774 IP 10.0.0.1.52228 > 10.0.0.2.5001: UDP, length 1470

23:34:42.563194 IP 10.0.0.2.5001 > 10.0.0.1.52228: UDP, length 1470

23:34:42.571881 IP 10.0.0.1.52228 > 10.0.0.2.5001: UDP, length 1470

23:34:42.575389 IP 10.0.0.2.5001 > 10.0.0.1.52228: UDP, length 1470

23:34:42.584247 IP 10.0.0.1.52228 > 10.0.0.2.5001: UDP, length 1470

23:34:42.587852 IP 10.0.0.2.5001 > 10.0.0.1.52228: UDP, length 1470

23:34:42.596356 IP 10.0.0.1.52228 > 10.0.0.2.5001: UDP, length 1470

23:34:42.599873 IP 10.0.0.2.5001 > 10.0.0.1.52228: UDP, length 1470

23:34:42.608464 IP 10.0.0.1.52228 > 10.0.0.2.5001: UDP, length 1470

23:34:42.611973 IP 10.0.0.2.5001 > 10.0.0.1.52228: UDP, length 1470

23:34:42.620764 IP 10.0.0.1.52228 > 10.0.0.2.5001: UDP, length 1470

23:34:42.624243 IP 10.0.0.2.5001 > 10.0.0.1.52228: UDP, length 1470

23:34:42.632901 IP 10.0.0.1.52228 > 10.0.0.2.5001: UDP, length 1470

23:34:42.636415 IP 10.0.0.2.5001 > 10.0.0.1.52228: UDP, length 1470

23:34:42.647049 IP 10.0.0.1 > 10.0.0.2: ICMP 10.0.0.1 udp port 52228 unreachable, length 556

23:34:42.650410 IP 10.0.0.1 > 10.0.0.2: ICMP 10.0.0.1 udp port 52228 unreachable, length 556

23:34:42.655144 IP 10.0.0.1 > 10.0.0.2: ICMP 10.0.0.1 udp port 52228 unreachable, length 556

23:34:42.659986 IP 10.0.0.1 > 10.0.0.2: ICMP 10.0.0.1 udp port 52228 unreachable, length 556

23:34:42.664710 IP 10.0.0.1 > 10.0.0.2: ICMP 10.0.0.1 udp port 52228 unreachable, length 556

23:34:42.669256 IP 10.0.0.1 > 10.0.0.2: ICMP 10.0.0.1 udp port 52228 unreachable, length 556



cnt=
892
