23:29:05.112002 IP 10.0.0.1.33303 > 10.0.0.2.5001: UDP, length 1470

23:29:05.158147 IP 10.0.0.1.33303 > 10.0.0.2.5001: UDP, length 1470

23:29:05.204235 IP 10.0.0.1.33303 > 10.0.0.2.5001: UDP, length 1470

23:29:05.250067 IP 10.0.0.1.33303 > 10.0.0.2.5001: UDP, length 1470

23:29:05.296167 IP 10.0.0.1.33303 > 10.0.0.2.5001: UDP, length 1470

23:29:05.342080 IP 10.0.0.1.33303 > 10.0.0.2.5001: UDP, length 1470

23:29:05.387940 IP 10.0.0.1.33303 > 10.0.0.2.5001: UDP, length 1470

23:29:05.433902 IP 10.0.0.1.33303 > 10.0.0.2.5001: UDP, length 1470

23:29:05.479806 IP 10.0.0.1.33303 > 10.0.0.2.5001: UDP, length 1470

23:29:05.525694 IP 10.0.0.1.33303 > 10.0.0.2.5001: UDP, length 1470

23:29:05.571627 IP 10.0.0.1.33303 > 10.0.0.2.5001: UDP, length 1470

23:29:05.617485 IP 10.0.0.1.33303 > 10.0.0.2.5001: UDP, length 1470

23:29:05.663497 IP 10.0.0.1.33303 > 10.0.0.2.5001: UDP, length 1470

23:29:05.709303 IP 10.0.0.1.33303 > 10.0.0.2.5001: UDP, length 1470

23:29:05.755264 IP 10.0.0.1.33303 > 10.0.0.2.5001: UDP, length 1470

23:29:05.801553 IP 10.0.0.1.33303 > 10.0.0.2.5001: UDP, length 1470

23:29:05.847116 IP 10.0.0.1.33303 > 10.0.0.2.5001: UDP, length 1470

23:29:05.893144 IP 10.0.0.1.33303 > 10.0.0.2.5001: UDP, length 1470

23:29:05.939078 IP 10.0.0.1.33303 > 10.0.0.2.5001: UDP, length 1470

23:29:05.984992 IP 10.0.0.1.33303 > 10.0.0.2.5001: UDP, length 1470

23:29:06.031141 IP 10.0.0.1.33303 > 10.0.0.2.5001: UDP, length 1470

23:29:06.076865 IP 10.0.0.1.33303 > 10.0.0.2.5001: UDP, length 1470

23:29:06.122808 IP 10.0.0.1.33303 > 10.0.0.2.5001: UDP, length 1470

23:29:06.168955 IP 10.0.0.1.33303 > 10.0.0.2.5001: UDP, length 1470

23:29:06.214756 IP 10.0.0.1.33303 > 10.0.0.2.5001: UDP, length 1470

23:29:06.260658 IP 10.0.0.1.33303 > 10.0.0.2.5001: UDP, length 1470

23:29:06.306647 IP 10.0.0.1.33303 > 10.0.0.2.5001: UDP, length 1470

23:29:06.352642 IP 10.0.0.1.33303 > 10.0.0.2.5001: UDP, length 1470

23:29:06.398435 IP 10.0.0.1.33303 > 10.0.0.2.5001: UDP, length 1470

23:29:06.444536 IP 10.0.0.1.33303 > 10.0.0.2.5001: UDP, length 1470

23:29:06.490483 IP 10.0.0.1.33303 > 10.0.0.2.5001: UDP, length 1470

23:29:06.536406 IP 10.0.0.1.33303 > 10.0.0.2.5001: UDP, length 1470

23:29:06.582644 IP 10.0.0.1.33303 > 10.0.0.2.5001: UDP, length 1470

23:29:06.674104 IP 10.0.0.1.33303 > 10.0.0.2.5001: UDP, length 1470

23:29:06.720015 IP 10.0.0.1.33303 > 10.0.0.2.5001: UDP, length 1470

23:29:06.766160 IP 10.0.0.1.33303 > 10.0.0.2.5001: UDP, length 1470

23:29:06.811911 IP 10.0.0.1.33303 > 10.0.0.2.5001: UDP, length 1470

23:29:06.859027 IP 10.0.0.1.33303 > 10.0.0.2.5001: UDP, length 1470

23:29:06.904148 IP 10.0.0.1.33303 > 10.0.0.2.5001: UDP, length 1470

23:29:06.949629 IP 10.0.0.1.33303 > 10.0.0.2.5001: UDP, length 1470

23:29:06.995470 IP 10.0.0.1.33303 > 10.0.0.2.5001: UDP, length 1470

23:29:07.041746 IP 10.0.0.1.33303 > 10.0.0.2.5001: UDP, length 1470

23:29:07.087539 IP 10.0.0.1.33303 > 10.0.0.2.5001: UDP, length 1470

23:29:07.133525 IP 10.0.0.1.33303 > 10.0.0.2.5001: UDP, length 1470

23:29:07.179403 IP 10.0.0.1.33303 > 10.0.0.2.5001: UDP, length 1470

23:29:07.225354 IP 10.0.0.1.33303 > 10.0.0.2.5001: UDP, length 1470

23:29:07.271359 IP 10.0.0.1.33303 > 10.0.0.2.5001: UDP, length 1470

23:29:07.317436 IP 10.0.0.1.33303 > 10.0.0.2.5001: UDP, length 1470

23:29:07.363180 IP 10.0.0.1.33303 > 10.0.0.2.5001: UDP, length 1470

23:29:07.409129 IP 10.0.0.1.33303 > 10.0.0.2.5001: UDP, length 1470

23:29:07.455107 IP 10.0.0.1.33303 > 10.0.0.2.5001: UDP, length 1470

23:29:07.500942 IP 10.0.0.1.33303 > 10.0.0.2.5001: UDP, length 1470

23:29:07.547025 IP 10.0.0.1.33303 > 10.0.0.2.5001: UDP, length 1470

23:29:07.592850 IP 10.0.0.1.33303 > 10.0.0.2.5001: UDP, length 1470

23:29:07.638874 IP 10.0.0.1.33303 > 10.0.0.2.5001: UDP, length 1470

23:29:07.684745 IP 10.0.0.1.33303 > 10.0.0.2.5001: UDP, length 1470

23:29:07.730713 IP 10.0.0.1.33303 > 10.0.0.2.5001: UDP, length 1470

23:29:07.776578 IP 10.0.0.1.33303 > 10.0.0.2.5001: UDP, length 1470

23:29:07.822340 IP 10.0.0.1.33303 > 10.0.0.2.5001: UDP, length 1470

23:29:07.868291 IP 10.0.0.1.33303 > 10.0.0.2.5001: UDP, length 1470

23:29:07.914373 IP 10.0.0.1.33303 > 10.0.0.2.5001: UDP, length 1470

23:29:07.960134 IP 10.0.0.1.33303 > 10.0.0.2.5001: UDP, length 1470

23:29:08.006267 IP 10.0.0.1.33303 > 10.0.0.2.5001: UDP, length 1470

23:29:08.052366 IP 10.0.0.1.33303 > 10.0.0.2.5001: UDP, length 1470

23:29:08.098045 IP 10.0.0.1.33303 > 10.0.0.2.5001: UDP, length 1470

23:29:08.144212 IP 10.0.0.1.33303 > 10.0.0.2.5001: UDP, length 1470

23:29:08.190015 IP 10.0.0.1.33303 > 10.0.0.2.5001: UDP, length 1470

23:29:08.235975 IP 10.0.0.1.33303 > 10.0.0.2.5001: UDP, length 1470

23:29:08.281913 IP 10.0.0.1.33303 > 10.0.0.2.5001: UDP, length 1470

23:29:08.327803 IP 10.0.0.1.33303 > 10.0.0.2.5001: UDP, length 1470

23:29:08.373763 IP 10.0.0.1.33303 > 10.0.0.2.5001: UDP, length 1470

23:29:08.419734 IP 10.0.0.1.33303 > 10.0.0.2.5001: UDP, length 1470

23:29:08.465612 IP 10.0.0.1.33303 > 10.0.0.2.5001: UDP, length 1470

23:29:08.511567 IP 10.0.0.1.33303 > 10.0.0.2.5001: UDP, length 1470

23:29:08.557622 IP 10.0.0.1.33303 > 10.0.0.2.5001: UDP, length 1470

23:29:08.603511 IP 10.0.0.1.33303 > 10.0.0.2.5001: UDP, length 1470

23:29:08.649431 IP 10.0.0.1.33303 > 10.0.0.2.5001: UDP, length 1470

23:29:08.695419 IP 10.0.0.1.33303 > 10.0.0.2.5001: UDP, length 1470

23:29:08.741475 IP 10.0.0.1.33303 > 10.0.0.2.5001: UDP, length 1470

23:29:08.787209 IP 10.0.0.1.33303 > 10.0.0.2.5001: UDP, length 1470

23:29:08.833286 IP 10.0.0.1.33303 > 10.0.0.2.5001: UDP, length 1470

23:29:08.879058 IP 10.0.0.1.33303 > 10.0.0.2.5001: UDP, length 1470

23:29:08.924956 IP 10.0.0.1.33303 > 10.0.0.2.5001: UDP, length 1470

23:29:08.971020 IP 10.0.0.1.33303 > 10.0.0.2.5001: UDP, length 1470

23:29:09.016989 IP 10.0.0.1.33303 > 10.0.0.2.5001: UDP, length 1470

23:29:09.062951 IP 10.0.0.1.33303 > 10.0.0.2.5001: UDP, length 1470

23:29:09.108962 IP 10.0.0.1.33303 > 10.0.0.2.5001: UDP, length 1470

23:29:09.164269 IP 10.0.0.1.33303 > 10.0.0.2.5001: UDP, length 1470

23:29:09.200880 IP 10.0.0.1.33303 > 10.0.0.2.5001: UDP, length 1470

23:29:09.246915 IP 10.0.0.1.33303 > 10.0.0.2.5001: UDP, length 1470

23:29:09.292914 IP 10.0.0.1.33303 > 10.0.0.2.5001: UDP, length 1470

23:29:09.338514 IP 10.0.0.1.33303 > 10.0.0.2.5001: UDP, length 1470

23:29:09.384317 IP 10.0.0.1.33303 > 10.0.0.2.5001: UDP, length 1470

23:29:09.430377 IP 10.0.0.1.33303 > 10.0.0.2.5001: UDP, length 1470

23:29:09.476256 IP 10.0.0.1.33303 > 10.0.0.2.5001: UDP, length 1470

23:29:09.522117 IP 10.0.0.1.33303 > 10.0.0.2.5001: UDP, length 1470

23:29:09.568128 IP 10.0.0.1.33303 > 10.0.0.2.5001: UDP, length 1470

23:29:09.614161 IP 10.0.0.1.33303 > 10.0.0.2.5001: UDP, length 1470

23:29:09.659969 IP 10.0.0.1.33303 > 10.0.0.2.5001: UDP, length 1470

23:29:09.706110 IP 10.0.0.1.33303 > 10.0.0.2.5001: UDP, length 1470

23:29:09.752158 IP 10.0.0.1.33303 > 10.0.0.2.5001: UDP, length 1470

23:29:09.797698 IP 10.0.0.1.33303 > 10.0.0.2.5001: UDP, length 1470

23:29:09.844022 IP 10.0.0.1.33303 > 10.0.0.2.5001: UDP, length 1470

23:29:09.889713 IP 10.0.0.1.33303 > 10.0.0.2.5001: UDP, length 1470

23:29:09.935491 IP 10.0.0.1.33303 > 10.0.0.2.5001: UDP, length 1470

23:29:09.981658 IP 10.0.0.1.33303 > 10.0.0.2.5001: UDP, length 1470

23:29:10.027465 IP 10.0.0.1.33303 > 10.0.0.2.5001: UDP, length 1470

23:29:10.073358 IP 10.0.0.1.33303 > 10.0.0.2.5001: UDP, length 1470

23:29:10.119322 IP 10.0.0.1.33303 > 10.0.0.2.5001: UDP, length 1470

23:29:10.165458 IP 10.0.0.1.33303 > 10.0.0.2.5001: UDP, length 1470

23:29:10.178086 IP 10.0.0.2.5001 > 10.0.0.1.33303: UDP, length 1470



cnt=
112
