23:25:10.743568 IP 10.0.0.1.56845 > 10.0.0.2.5001: UDP, length 1470

23:25:10.927782 IP 10.0.0.1.56845 > 10.0.0.2.5001: UDP, length 1470

23:25:11.111693 IP 10.0.0.1.56845 > 10.0.0.2.5001: UDP, length 1470

23:25:11.479106 IP 10.0.0.1.56845 > 10.0.0.2.5001: UDP, length 1470

23:25:11.662834 IP 10.0.0.1.56845 > 10.0.0.2.5001: UDP, length 1470

23:25:11.846271 IP 10.0.0.1.56845 > 10.0.0.2.5001: UDP, length 1470

23:25:12.948999 IP 10.0.0.1.56845 > 10.0.0.2.5001: UDP, length 1470

23:25:13.132553 IP 10.0.0.1.56845 > 10.0.0.2.5001: UDP, length 1470

23:25:13.316661 IP 10.0.0.1.56845 > 10.0.0.2.5001: UDP, length 1470

23:25:13.500322 IP 10.0.0.1.56845 > 10.0.0.2.5001: UDP, length 1470

23:25:13.684109 IP 10.0.0.1.56845 > 10.0.0.2.5001: UDP, length 1470

23:25:13.867840 IP 10.0.0.1.56845 > 10.0.0.2.5001: UDP, length 1470

23:25:14.051498 IP 10.0.0.1.56845 > 10.0.0.2.5001: UDP, length 1470

23:25:14.235437 IP 10.0.0.1.56845 > 10.0.0.2.5001: UDP, length 1470

23:25:14.419218 IP 10.0.0.1.56845 > 10.0.0.2.5001: UDP, length 1470

23:25:14.602858 IP 10.0.0.1.56845 > 10.0.0.2.5001: UDP, length 1470

23:25:14.786499 IP 10.0.0.1.56845 > 10.0.0.2.5001: UDP, length 1470

23:25:14.970352 IP 10.0.0.1.56845 > 10.0.0.2.5001: UDP, length 1470

23:25:15.154008 IP 10.0.0.1.56845 > 10.0.0.2.5001: UDP, length 1470

23:25:15.337767 IP 10.0.0.1.56845 > 10.0.0.2.5001: UDP, length 1470

23:25:15.521688 IP 10.0.0.1.56845 > 10.0.0.2.5001: UDP, length 1470

23:25:15.705347 IP 10.0.0.1.56845 > 10.0.0.2.5001: UDP, length 1470

23:25:15.889043 IP 10.0.0.1.56845 > 10.0.0.2.5001: UDP, length 1470

23:25:16.072639 IP 10.0.0.1.56845 > 10.0.0.2.5001: UDP, length 1470

23:25:16.089481 IP 10.0.0.2.5001 > 10.0.0.1.56845: UDP, length 1470



cnt=
26
