23:29:57.419577 IP 10.0.0.1.58036 > 10.0.0.2.5001: UDP, length 1470

23:29:57.442888 IP 10.0.0.1.58036 > 10.0.0.2.5001: UDP, length 1470

23:29:57.466144 IP 10.0.0.1.58036 > 10.0.0.2.5001: UDP, length 1470

23:29:57.489076 IP 10.0.0.1.58036 > 10.0.0.2.5001: UDP, length 1470

23:29:57.511912 IP 10.0.0.1.58036 > 10.0.0.2.5001: UDP, length 1470

23:29:57.534819 IP 10.0.0.1.58036 > 10.0.0.2.5001: UDP, length 1470

23:29:57.557840 IP 10.0.0.1.58036 > 10.0.0.2.5001: UDP, length 1470

23:29:57.580912 IP 10.0.0.1.58036 > 10.0.0.2.5001: UDP, length 1470

23:29:57.603879 IP 10.0.0.1.58036 > 10.0.0.2.5001: UDP, length 1470

23:29:57.626658 IP 10.0.0.1.58036 > 10.0.0.2.5001: UDP, length 1470

23:29:57.649676 IP 10.0.0.1.58036 > 10.0.0.2.5001: UDP, length 1470

23:29:57.672524 IP 10.0.0.1.58036 > 10.0.0.2.5001: UDP, length 1470

23:29:57.695712 IP 10.0.0.1.58036 > 10.0.0.2.5001: UDP, length 1470

23:29:57.718878 IP 10.0.0.1.58036 > 10.0.0.2.5001: UDP, length 1470

23:29:57.741568 IP 10.0.0.1.58036 > 10.0.0.2.5001: UDP, length 1470

23:29:57.764602 IP 10.0.0.1.58036 > 10.0.0.2.5001: UDP, length 1470

23:29:57.787555 IP 10.0.0.1.58036 > 10.0.0.2.5001: UDP, length 1470

23:29:57.810449 IP 10.0.0.1.58036 > 10.0.0.2.5001: UDP, length 1470

23:29:57.833318 IP 10.0.0.1.58036 > 10.0.0.2.5001: UDP, length 1470

23:29:57.856417 IP 10.0.0.1.58036 > 10.0.0.2.5001: UDP, length 1470

23:29:57.879560 IP 10.0.0.1.58036 > 10.0.0.2.5001: UDP, length 1470

23:29:57.902534 IP 10.0.0.1.58036 > 10.0.0.2.5001: UDP, length 1470

23:29:57.925345 IP 10.0.0.1.58036 > 10.0.0.2.5001: UDP, length 1470

23:29:57.948224 IP 10.0.0.1.58036 > 10.0.0.2.5001: UDP, length 1470

23:29:57.971214 IP 10.0.0.1.58036 > 10.0.0.2.5001: UDP, length 1470

23:29:57.994311 IP 10.0.0.1.58036 > 10.0.0.2.5001: UDP, length 1470

23:29:58.017344 IP 10.0.0.1.58036 > 10.0.0.2.5001: UDP, length 1470

23:29:58.040178 IP 10.0.0.1.58036 > 10.0.0.2.5001: UDP, length 1470

23:29:58.063045 IP 10.0.0.1.58036 > 10.0.0.2.5001: UDP, length 1470

23:29:58.086116 IP 10.0.0.1.58036 > 10.0.0.2.5001: UDP, length 1470

23:29:58.108877 IP 10.0.0.1.58036 > 10.0.0.2.5001: UDP, length 1470

23:29:58.132218 IP 10.0.0.1.58036 > 10.0.0.2.5001: UDP, length 1470

23:29:58.154849 IP 10.0.0.1.58036 > 10.0.0.2.5001: UDP, length 1470

23:29:58.177998 IP 10.0.0.1.58036 > 10.0.0.2.5001: UDP, length 1470

23:29:58.200961 IP 10.0.0.1.58036 > 10.0.0.2.5001: UDP, length 1470

23:29:58.223863 IP 10.0.0.1.58036 > 10.0.0.2.5001: UDP, length 1470

23:29:58.247079 IP 10.0.0.1.58036 > 10.0.0.2.5001: UDP, length 1470

23:29:58.269821 IP 10.0.0.1.58036 > 10.0.0.2.5001: UDP, length 1470

23:29:58.293140 IP 10.0.0.1.58036 > 10.0.0.2.5001: UDP, length 1470

23:29:58.316060 IP 10.0.0.1.58036 > 10.0.0.2.5001: UDP, length 1470

23:29:58.339123 IP 10.0.0.1.58036 > 10.0.0.2.5001: UDP, length 1470

23:29:58.361882 IP 10.0.0.1.58036 > 10.0.0.2.5001: UDP, length 1470

23:29:58.384765 IP 10.0.0.1.58036 > 10.0.0.2.5001: UDP, length 1470

23:29:58.407730 IP 10.0.0.1.58036 > 10.0.0.2.5001: UDP, length 1470

23:29:58.430908 IP 10.0.0.1.58036 > 10.0.0.2.5001: UDP, length 1470

23:29:58.453878 IP 10.0.0.1.58036 > 10.0.0.2.5001: UDP, length 1470

23:29:58.476615 IP 10.0.0.1.58036 > 10.0.0.2.5001: UDP, length 1470

23:29:58.499785 IP 10.0.0.1.58036 > 10.0.0.2.5001: UDP, length 1470

23:29:58.522575 IP 10.0.0.1.58036 > 10.0.0.2.5001: UDP, length 1470

23:29:58.545663 IP 10.0.0.1.58036 > 10.0.0.2.5001: UDP, length 1470

23:29:58.568424 IP 10.0.0.1.58036 > 10.0.0.2.5001: UDP, length 1470

23:29:58.591323 IP 10.0.0.1.58036 > 10.0.0.2.5001: UDP, length 1470

23:29:58.614341 IP 10.0.0.1.58036 > 10.0.0.2.5001: UDP, length 1470

23:29:58.637367 IP 10.0.0.1.58036 > 10.0.0.2.5001: UDP, length 1470

23:29:58.660284 IP 10.0.0.1.58036 > 10.0.0.2.5001: UDP, length 1470

23:29:58.683056 IP 10.0.0.1.58036 > 10.0.0.2.5001: UDP, length 1470

23:29:58.706198 IP 10.0.0.1.58036 > 10.0.0.2.5001: UDP, length 1470

23:29:58.729276 IP 10.0.0.1.58036 > 10.0.0.2.5001: UDP, length 1470

23:29:58.752279 IP 10.0.0.1.58036 > 10.0.0.2.5001: UDP, length 1470

23:29:58.775084 IP 10.0.0.1.58036 > 10.0.0.2.5001: UDP, length 1470

23:29:58.798023 IP 10.0.0.1.58036 > 10.0.0.2.5001: UDP, length 1470

23:29:58.820992 IP 10.0.0.1.58036 > 10.0.0.2.5001: UDP, length 1470

23:29:58.844039 IP 10.0.0.1.58036 > 10.0.0.2.5001: UDP, length 1470

23:29:58.867177 IP 10.0.0.1.58036 > 10.0.0.2.5001: UDP, length 1470

23:29:58.890153 IP 10.0.0.1.58036 > 10.0.0.2.5001: UDP, length 1470

23:29:58.913020 IP 10.0.0.1.58036 > 10.0.0.2.5001: UDP, length 1470

23:29:58.935926 IP 10.0.0.1.58036 > 10.0.0.2.5001: UDP, length 1470

23:29:58.958866 IP 10.0.0.1.58036 > 10.0.0.2.5001: UDP, length 1470

23:29:58.981934 IP 10.0.0.1.58036 > 10.0.0.2.5001: UDP, length 1470

23:29:59.004733 IP 10.0.0.1.58036 > 10.0.0.2.5001: UDP, length 1470

23:29:59.050950 IP 10.0.0.1.58036 > 10.0.0.2.5001: UDP, length 1470

23:29:59.073698 IP 10.0.0.1.58036 > 10.0.0.2.5001: UDP, length 1470

23:29:59.096966 IP 10.0.0.1.58036 > 10.0.0.2.5001: UDP, length 1470

23:29:59.119593 IP 10.0.0.1.58036 > 10.0.0.2.5001: UDP, length 1470

23:29:59.142626 IP 10.0.0.1.58036 > 10.0.0.2.5001: UDP, length 1470

23:29:59.165725 IP 10.0.0.1.58036 > 10.0.0.2.5001: UDP, length 1470

23:29:59.188497 IP 10.0.0.1.58036 > 10.0.0.2.5001: UDP, length 1470

23:29:59.215431 IP 10.0.0.1.58036 > 10.0.0.2.5001: UDP, length 1470

23:29:59.234300 IP 10.0.0.1.58036 > 10.0.0.2.5001: UDP, length 1470

23:29:59.257620 IP 10.0.0.1.58036 > 10.0.0.2.5001: UDP, length 1470

23:29:59.280404 IP 10.0.0.1.58036 > 10.0.0.2.5001: UDP, length 1470

23:29:59.303512 IP 10.0.0.1.58036 > 10.0.0.2.5001: UDP, length 1470

23:29:59.326602 IP 10.0.0.1.58036 > 10.0.0.2.5001: UDP, length 1470

23:29:59.349377 IP 10.0.0.1.58036 > 10.0.0.2.5001: UDP, length 1470

23:29:59.372177 IP 10.0.0.1.58036 > 10.0.0.2.5001: UDP, length 1470

23:29:59.395145 IP 10.0.0.1.58036 > 10.0.0.2.5001: UDP, length 1470

23:29:59.418833 IP 10.0.0.1.58036 > 10.0.0.2.5001: UDP, length 1470

23:29:59.441370 IP 10.0.0.1.58036 > 10.0.0.2.5001: UDP, length 1470

23:29:59.464298 IP 10.0.0.1.58036 > 10.0.0.2.5001: UDP, length 1470

23:29:59.487120 IP 10.0.0.1.58036 > 10.0.0.2.5001: UDP, length 1470

23:29:59.510091 IP 10.0.0.1.58036 > 10.0.0.2.5001: UDP, length 1470

23:29:59.533205 IP 10.0.0.1.58036 > 10.0.0.2.5001: UDP, length 1470

23:29:59.556236 IP 10.0.0.1.58036 > 10.0.0.2.5001: UDP, length 1470

23:29:59.578930 IP 10.0.0.1.58036 > 10.0.0.2.5001: UDP, length 1470

23:29:59.602024 IP 10.0.0.1.58036 > 10.0.0.2.5001: UDP, length 1470

23:29:59.624950 IP 10.0.0.1.58036 > 10.0.0.2.5001: UDP, length 1470

23:29:59.647843 IP 10.0.0.1.58036 > 10.0.0.2.5001: UDP, length 1470

23:29:59.671041 IP 10.0.0.1.58036 > 10.0.0.2.5001: UDP, length 1470

23:29:59.693866 IP 10.0.0.1.58036 > 10.0.0.2.5001: UDP, length 1470

23:29:59.716895 IP 10.0.0.1.58036 > 10.0.0.2.5001: UDP, length 1470

23:29:59.739951 IP 10.0.0.1.58036 > 10.0.0.2.5001: UDP, length 1470

23:29:59.762810 IP 10.0.0.1.58036 > 10.0.0.2.5001: UDP, length 1470

23:29:59.785679 IP 10.0.0.1.58036 > 10.0.0.2.5001: UDP, length 1470

23:29:59.808709 IP 10.0.0.1.58036 > 10.0.0.2.5001: UDP, length 1470

23:29:59.831827 IP 10.0.0.1.58036 > 10.0.0.2.5001: UDP, length 1470

23:29:59.854832 IP 10.0.0.1.58036 > 10.0.0.2.5001: UDP, length 1470

23:29:59.877764 IP 10.0.0.1.58036 > 10.0.0.2.5001: UDP, length 1470

23:29:59.900554 IP 10.0.0.1.58036 > 10.0.0.2.5001: UDP, length 1470

23:29:59.923527 IP 10.0.0.1.58036 > 10.0.0.2.5001: UDP, length 1470

23:29:59.946678 IP 10.0.0.1.58036 > 10.0.0.2.5001: UDP, length 1470

23:29:59.969639 IP 10.0.0.1.58036 > 10.0.0.2.5001: UDP, length 1470

23:29:59.992386 IP 10.0.0.1.58036 > 10.0.0.2.5001: UDP, length 1470

23:30:00.015470 IP 10.0.0.1.58036 > 10.0.0.2.5001: UDP, length 1470

23:30:00.038492 IP 10.0.0.1.58036 > 10.0.0.2.5001: UDP, length 1470

23:30:00.061450 IP 10.0.0.1.58036 > 10.0.0.2.5001: UDP, length 1470

23:30:00.084180 IP 10.0.0.1.58036 > 10.0.0.2.5001: UDP, length 1470

23:30:00.107248 IP 10.0.0.1.58036 > 10.0.0.2.5001: UDP, length 1470

23:30:00.130314 IP 10.0.0.1.58036 > 10.0.0.2.5001: UDP, length 1470

23:30:00.153324 IP 10.0.0.1.58036 > 10.0.0.2.5001: UDP, length 1470

23:30:00.176126 IP 10.0.0.1.58036 > 10.0.0.2.5001: UDP, length 1470

23:30:00.199059 IP 10.0.0.1.58036 > 10.0.0.2.5001: UDP, length 1470

23:30:00.221964 IP 10.0.0.1.58036 > 10.0.0.2.5001: UDP, length 1470

23:30:00.245141 IP 10.0.0.1.58036 > 10.0.0.2.5001: UDP, length 1470

23:30:00.268205 IP 10.0.0.1.58036 > 10.0.0.2.5001: UDP, length 1470

23:30:00.290943 IP 10.0.0.1.58036 > 10.0.0.2.5001: UDP, length 1470

23:30:00.314002 IP 10.0.0.1.58036 > 10.0.0.2.5001: UDP, length 1470

23:30:00.336837 IP 10.0.0.1.58036 > 10.0.0.2.5001: UDP, length 1470

23:30:00.359845 IP 10.0.0.1.58036 > 10.0.0.2.5001: UDP, length 1470

23:30:00.382933 IP 10.0.0.1.58036 > 10.0.0.2.5001: UDP, length 1470

23:30:00.405826 IP 10.0.0.1.58036 > 10.0.0.2.5001: UDP, length 1470

23:30:00.428912 IP 10.0.0.1.58036 > 10.0.0.2.5001: UDP, length 1470

23:30:00.451876 IP 10.0.0.1.58036 > 10.0.0.2.5001: UDP, length 1470

23:30:00.474803 IP 10.0.0.1.58036 > 10.0.0.2.5001: UDP, length 1470

23:30:00.497821 IP 10.0.0.1.58036 > 10.0.0.2.5001: UDP, length 1470

23:30:00.520719 IP 10.0.0.1.58036 > 10.0.0.2.5001: UDP, length 1470

23:30:00.543784 IP 10.0.0.1.58036 > 10.0.0.2.5001: UDP, length 1470

23:30:00.567410 IP 10.0.0.1.58036 > 10.0.0.2.5001: UDP, length 1470

23:30:00.589724 IP 10.0.0.1.58036 > 10.0.0.2.5001: UDP, length 1470

23:30:00.612564 IP 10.0.0.1.58036 > 10.0.0.2.5001: UDP, length 1470

23:30:00.635496 IP 10.0.0.1.58036 > 10.0.0.2.5001: UDP, length 1470

23:30:00.658650 IP 10.0.0.1.58036 > 10.0.0.2.5001: UDP, length 1470

23:30:00.681616 IP 10.0.0.1.58036 > 10.0.0.2.5001: UDP, length 1470

23:30:00.704331 IP 10.0.0.1.58036 > 10.0.0.2.5001: UDP, length 1470

23:30:00.727618 IP 10.0.0.1.58036 > 10.0.0.2.5001: UDP, length 1470

23:30:00.750684 IP 10.0.0.1.58036 > 10.0.0.2.5001: UDP, length 1470

23:30:00.773431 IP 10.0.0.1.58036 > 10.0.0.2.5001: UDP, length 1470

23:30:00.796550 IP 10.0.0.1.58036 > 10.0.0.2.5001: UDP, length 1470

23:30:00.819171 IP 10.0.0.1.58036 > 10.0.0.2.5001: UDP, length 1470

23:30:00.842344 IP 10.0.0.1.58036 > 10.0.0.2.5001: UDP, length 1470

23:30:00.865398 IP 10.0.0.1.58036 > 10.0.0.2.5001: UDP, length 1470

23:30:00.888224 IP 10.0.0.1.58036 > 10.0.0.2.5001: UDP, length 1470

23:30:00.911110 IP 10.0.0.1.58036 > 10.0.0.2.5001: UDP, length 1470

23:30:00.934024 IP 10.0.0.1.58036 > 10.0.0.2.5001: UDP, length 1470

23:30:00.957089 IP 10.0.0.1.58036 > 10.0.0.2.5001: UDP, length 1470

23:30:00.980233 IP 10.0.0.1.58036 > 10.0.0.2.5001: UDP, length 1470

23:30:01.003179 IP 10.0.0.1.58036 > 10.0.0.2.5001: UDP, length 1470

23:30:01.025982 IP 10.0.0.1.58036 > 10.0.0.2.5001: UDP, length 1470

23:30:01.048928 IP 10.0.0.1.58036 > 10.0.0.2.5001: UDP, length 1470

23:30:01.072101 IP 10.0.0.1.58036 > 10.0.0.2.5001: UDP, length 1470

23:30:01.095091 IP 10.0.0.1.58036 > 10.0.0.2.5001: UDP, length 1470

23:30:01.117791 IP 10.0.0.1.58036 > 10.0.0.2.5001: UDP, length 1470

23:30:01.140832 IP 10.0.0.1.58036 > 10.0.0.2.5001: UDP, length 1470

23:30:01.163801 IP 10.0.0.1.58036 > 10.0.0.2.5001: UDP, length 1470

23:30:01.186733 IP 10.0.0.1.58036 > 10.0.0.2.5001: UDP, length 1470

23:30:01.209633 IP 10.0.0.1.58036 > 10.0.0.2.5001: UDP, length 1470

23:30:01.232542 IP 10.0.0.1.58036 > 10.0.0.2.5001: UDP, length 1470

23:30:01.255691 IP 10.0.0.1.58036 > 10.0.0.2.5001: UDP, length 1470

23:30:01.278705 IP 10.0.0.1.58036 > 10.0.0.2.5001: UDP, length 1470

23:30:01.301708 IP 10.0.0.1.58036 > 10.0.0.2.5001: UDP, length 1470

23:30:01.324556 IP 10.0.0.1.58036 > 10.0.0.2.5001: UDP, length 1470

23:30:01.347629 IP 10.0.0.1.58036 > 10.0.0.2.5001: UDP, length 1470

23:30:01.370705 IP 10.0.0.1.58036 > 10.0.0.2.5001: UDP, length 1470

23:30:01.393602 IP 10.0.0.1.58036 > 10.0.0.2.5001: UDP, length 1470

23:30:01.416408 IP 10.0.0.1.58036 > 10.0.0.2.5001: UDP, length 1470

23:30:01.439455 IP 10.0.0.1.58036 > 10.0.0.2.5001: UDP, length 1470

23:30:01.462422 IP 10.0.0.1.58036 > 10.0.0.2.5001: UDP, length 1470

23:30:01.485496 IP 10.0.0.1.58036 > 10.0.0.2.5001: UDP, length 1470

23:30:01.531440 IP 10.0.0.1.58036 > 10.0.0.2.5001: UDP, length 1470

23:30:01.554486 IP 10.0.0.1.58036 > 10.0.0.2.5001: UDP, length 1470

23:30:01.577441 IP 10.0.0.1.58036 > 10.0.0.2.5001: UDP, length 1470

23:30:01.600266 IP 10.0.0.1.58036 > 10.0.0.2.5001: UDP, length 1470

23:30:01.623151 IP 10.0.0.1.58036 > 10.0.0.2.5001: UDP, length 1470

23:30:01.646203 IP 10.0.0.1.58036 > 10.0.0.2.5001: UDP, length 1470

23:30:01.669286 IP 10.0.0.1.58036 > 10.0.0.2.5001: UDP, length 1470

23:30:01.692358 IP 10.0.0.1.58036 > 10.0.0.2.5001: UDP, length 1470

23:30:01.715195 IP 10.0.0.1.58036 > 10.0.0.2.5001: UDP, length 1470

23:30:01.737901 IP 10.0.0.1.58036 > 10.0.0.2.5001: UDP, length 1470

23:30:01.760971 IP 10.0.0.1.58036 > 10.0.0.2.5001: UDP, length 1470

23:30:01.783813 IP 10.0.0.1.58036 > 10.0.0.2.5001: UDP, length 1470

23:30:01.807081 IP 10.0.0.1.58036 > 10.0.0.2.5001: UDP, length 1470

23:30:01.830015 IP 10.0.0.1.58036 > 10.0.0.2.5001: UDP, length 1470

23:30:01.852818 IP 10.0.0.1.58036 > 10.0.0.2.5001: UDP, length 1470

23:30:01.875801 IP 10.0.0.1.58036 > 10.0.0.2.5001: UDP, length 1470

23:30:01.898769 IP 10.0.0.1.58036 > 10.0.0.2.5001: UDP, length 1470

23:30:01.923705 IP 10.0.0.1.58036 > 10.0.0.2.5001: UDP, length 1470

23:30:01.944579 IP 10.0.0.1.58036 > 10.0.0.2.5001: UDP, length 1470

23:30:01.967651 IP 10.0.0.1.58036 > 10.0.0.2.5001: UDP, length 1470

23:30:01.990690 IP 10.0.0.1.58036 > 10.0.0.2.5001: UDP, length 1470

23:30:02.013638 IP 10.0.0.1.58036 > 10.0.0.2.5001: UDP, length 1470

23:30:02.036457 IP 10.0.0.1.58036 > 10.0.0.2.5001: UDP, length 1470

23:30:02.059493 IP 10.0.0.1.58036 > 10.0.0.2.5001: UDP, length 1470

23:30:02.082535 IP 10.0.0.1.58036 > 10.0.0.2.5001: UDP, length 1470

23:30:02.105518 IP 10.0.0.1.58036 > 10.0.0.2.5001: UDP, length 1470

23:30:02.128592 IP 10.0.0.1.58036 > 10.0.0.2.5001: UDP, length 1470

23:30:02.151469 IP 10.0.0.1.58036 > 10.0.0.2.5001: UDP, length 1470

23:30:02.174294 IP 10.0.0.1.58036 > 10.0.0.2.5001: UDP, length 1470

23:30:02.197230 IP 10.0.0.1.58036 > 10.0.0.2.5001: UDP, length 1470

23:30:02.220478 IP 10.0.0.1.58036 > 10.0.0.2.5001: UDP, length 1470

23:30:02.243529 IP 10.0.0.1.58036 > 10.0.0.2.5001: UDP, length 1470

23:30:02.266217 IP 10.0.0.1.58036 > 10.0.0.2.5001: UDP, length 1470

23:30:02.289321 IP 10.0.0.1.58036 > 10.0.0.2.5001: UDP, length 1470

23:30:02.312255 IP 10.0.0.1.58036 > 10.0.0.2.5001: UDP, length 1470

23:30:02.334968 IP 10.0.0.1.58036 > 10.0.0.2.5001: UDP, length 1470

23:30:02.358065 IP 10.0.0.1.58036 > 10.0.0.2.5001: UDP, length 1470

23:30:02.381089 IP 10.0.0.1.58036 > 10.0.0.2.5001: UDP, length 1470

23:30:02.404204 IP 10.0.0.1.58036 > 10.0.0.2.5001: UDP, length 1470

23:30:02.427145 IP 10.0.0.1.58036 > 10.0.0.2.5001: UDP, length 1470

23:30:02.450038 IP 10.0.0.1.58036 > 10.0.0.2.5001: UDP, length 1470

23:30:02.467724 IP 10.0.0.2.5001 > 10.0.0.1.58036: UDP, length 1470



cnt=
220
