23:27:10.181786 IP 10.0.0.1.39710 > 10.0.0.2.5001: UDP, length 1470

23:27:10.273969 IP 10.0.0.1.39710 > 10.0.0.2.5001: UDP, length 1470

23:27:10.366123 IP 10.0.0.1.39710 > 10.0.0.2.5001: UDP, length 1470

23:27:10.457908 IP 10.0.0.1.39710 > 10.0.0.2.5001: UDP, length 1470

23:27:10.549762 IP 10.0.0.1.39710 > 10.0.0.2.5001: UDP, length 1470

23:27:10.641552 IP 10.0.0.1.39710 > 10.0.0.2.5001: UDP, length 1470

23:27:10.733623 IP 10.0.0.1.39710 > 10.0.0.2.5001: UDP, length 1470

23:27:10.825532 IP 10.0.0.1.39710 > 10.0.0.2.5001: UDP, length 1470

23:27:10.917459 IP 10.0.0.1.39710 > 10.0.0.2.5001: UDP, length 1470

23:27:11.008919 IP 10.0.0.1.39710 > 10.0.0.2.5001: UDP, length 1470

23:27:11.101010 IP 10.0.0.1.39710 > 10.0.0.2.5001: UDP, length 1470

23:27:11.192803 IP 10.0.0.1.39710 > 10.0.0.2.5001: UDP, length 1470

23:27:11.284523 IP 10.0.0.1.39710 > 10.0.0.2.5001: UDP, length 1470

23:27:11.376482 IP 10.0.0.1.39710 > 10.0.0.2.5001: UDP, length 1470

23:27:11.468707 IP 10.0.0.1.39710 > 10.0.0.2.5001: UDP, length 1470

23:27:11.560292 IP 10.0.0.1.39710 > 10.0.0.2.5001: UDP, length 1470

23:27:11.652309 IP 10.0.0.1.39710 > 10.0.0.2.5001: UDP, length 1470

23:27:11.744161 IP 10.0.0.1.39710 > 10.0.0.2.5001: UDP, length 1470

23:27:11.835894 IP 10.0.0.1.39710 > 10.0.0.2.5001: UDP, length 1470

23:27:11.927860 IP 10.0.0.1.39710 > 10.0.0.2.5001: UDP, length 1470

23:27:12.019640 IP 10.0.0.1.39710 > 10.0.0.2.5001: UDP, length 1470

23:27:12.111617 IP 10.0.0.1.39710 > 10.0.0.2.5001: UDP, length 1470

23:27:12.203549 IP 10.0.0.1.39710 > 10.0.0.2.5001: UDP, length 1470

23:27:12.295496 IP 10.0.0.1.39710 > 10.0.0.2.5001: UDP, length 1470

23:27:12.387156 IP 10.0.0.1.39710 > 10.0.0.2.5001: UDP, length 1470

23:27:12.479399 IP 10.0.0.1.39710 > 10.0.0.2.5001: UDP, length 1470

23:27:12.570891 IP 10.0.0.1.39710 > 10.0.0.2.5001: UDP, length 1470

23:27:12.662871 IP 10.0.0.1.39710 > 10.0.0.2.5001: UDP, length 1470

23:27:12.754924 IP 10.0.0.1.39710 > 10.0.0.2.5001: UDP, length 1470

23:27:12.846753 IP 10.0.0.1.39710 > 10.0.0.2.5001: UDP, length 1470

23:27:12.938567 IP 10.0.0.1.39710 > 10.0.0.2.5001: UDP, length 1470

23:27:13.030394 IP 10.0.0.1.39710 > 10.0.0.2.5001: UDP, length 1470

23:27:13.121994 IP 10.0.0.1.39710 > 10.0.0.2.5001: UDP, length 1470

23:27:13.214118 IP 10.0.0.1.39710 > 10.0.0.2.5001: UDP, length 1470

23:27:13.305901 IP 10.0.0.1.39710 > 10.0.0.2.5001: UDP, length 1470

23:27:13.397625 IP 10.0.0.1.39710 > 10.0.0.2.5001: UDP, length 1470

23:27:13.489550 IP 10.0.0.1.39710 > 10.0.0.2.5001: UDP, length 1470

23:27:13.581809 IP 10.0.0.1.39710 > 10.0.0.2.5001: UDP, length 1470

23:27:13.673482 IP 10.0.0.1.39710 > 10.0.0.2.5001: UDP, length 1470

23:27:13.765534 IP 10.0.0.1.39710 > 10.0.0.2.5001: UDP, length 1470

23:27:13.857220 IP 10.0.0.1.39710 > 10.0.0.2.5001: UDP, length 1470

23:27:13.949027 IP 10.0.0.1.39710 > 10.0.0.2.5001: UDP, length 1470

23:27:14.040855 IP 10.0.0.1.39710 > 10.0.0.2.5001: UDP, length 1470

23:27:14.133019 IP 10.0.0.1.39710 > 10.0.0.2.5001: UDP, length 1470

23:27:14.224571 IP 10.0.0.1.39710 > 10.0.0.2.5001: UDP, length 1470

23:27:14.316743 IP 10.0.0.1.39710 > 10.0.0.2.5001: UDP, length 1470

23:27:14.408603 IP 10.0.0.1.39710 > 10.0.0.2.5001: UDP, length 1470

23:27:14.500272 IP 10.0.0.1.39710 > 10.0.0.2.5001: UDP, length 1470

23:27:14.592103 IP 10.0.0.1.39710 > 10.0.0.2.5001: UDP, length 1470

23:27:14.684000 IP 10.0.0.1.39710 > 10.0.0.2.5001: UDP, length 1470

23:27:14.775838 IP 10.0.0.1.39710 > 10.0.0.2.5001: UDP, length 1470

23:27:14.868191 IP 10.0.0.1.39710 > 10.0.0.2.5001: UDP, length 1470

23:27:14.959703 IP 10.0.0.1.39710 > 10.0.0.2.5001: UDP, length 1470

23:27:15.051749 IP 10.0.0.1.39710 > 10.0.0.2.5001: UDP, length 1470

23:27:15.143515 IP 10.0.0.1.39710 > 10.0.0.2.5001: UDP, length 1470

23:27:15.235276 IP 10.0.0.1.39710 > 10.0.0.2.5001: UDP, length 1470

23:27:15.327109 IP 10.0.0.1.39710 > 10.0.0.2.5001: UDP, length 1470

23:27:15.345501 IP 10.0.0.2.5001 > 10.0.0.1.39710: UDP, length 1470



cnt=
59
