23:34:00.364104 IP 10.0.0.1.52832 > 10.0.0.2.5001: UDP, length 1470

23:34:00.376238 IP 10.0.0.1.52832 > 10.0.0.2.5001: UDP, length 1470

23:34:00.387654 IP 10.0.0.1.52832 > 10.0.0.2.5001: UDP, length 1470

23:34:00.399056 IP 10.0.0.1.52832 > 10.0.0.2.5001: UDP, length 1470

23:34:00.410627 IP 10.0.0.1.52832 > 10.0.0.2.5001: UDP, length 1470

23:34:00.422148 IP 10.0.0.1.52832 > 10.0.0.2.5001: UDP, length 1470

23:34:00.433366 IP 10.0.0.1.52832 > 10.0.0.2.5001: UDP, length 1470

23:34:00.445049 IP 10.0.0.1.52832 > 10.0.0.2.5001: UDP, length 1470

23:34:00.456481 IP 10.0.0.1.52832 > 10.0.0.2.5001: UDP, length 1470

23:34:00.467738 IP 10.0.0.1.52832 > 10.0.0.2.5001: UDP, length 1470

23:34:00.479174 IP 10.0.0.1.52832 > 10.0.0.2.5001: UDP, length 1470

23:34:00.490594 IP 10.0.0.1.52832 > 10.0.0.2.5001: UDP, length 1470

23:34:00.502235 IP 10.0.0.1.52832 > 10.0.0.2.5001: UDP, length 1470

23:34:00.513797 IP 10.0.0.1.52832 > 10.0.0.2.5001: UDP, length 1470

23:34:00.525225 IP 10.0.0.1.52832 > 10.0.0.2.5001: UDP, length 1470

23:34:00.536715 IP 10.0.0.1.52832 > 10.0.0.2.5001: UDP, length 1470

23:34:00.548167 IP 10.0.0.1.52832 > 10.0.0.2.5001: UDP, length 1470

23:34:00.559636 IP 10.0.0.1.52832 > 10.0.0.2.5001: UDP, length 1470

23:34:00.571025 IP 10.0.0.1.52832 > 10.0.0.2.5001: UDP, length 1470

23:34:00.582500 IP 10.0.0.1.52832 > 10.0.0.2.5001: UDP, length 1470

23:34:00.594147 IP 10.0.0.1.52832 > 10.0.0.2.5001: UDP, length 1470

23:34:00.605568 IP 10.0.0.1.52832 > 10.0.0.2.5001: UDP, length 1470

23:34:00.617585 IP 10.0.0.1.52832 > 10.0.0.2.5001: UDP, length 1470

23:34:00.629691 IP 10.0.0.1.52832 > 10.0.0.2.5001: UDP, length 1470

23:34:00.641684 IP 10.0.0.1.52832 > 10.0.0.2.5001: UDP, length 1470

23:34:00.653848 IP 10.0.0.1.52832 > 10.0.0.2.5001: UDP, length 1470

23:34:00.665879 IP 10.0.0.1.52832 > 10.0.0.2.5001: UDP, length 1470

23:34:00.678184 IP 10.0.0.1.52832 > 10.0.0.2.5001: UDP, length 1470

23:34:00.690257 IP 10.0.0.1.52832 > 10.0.0.2.5001: UDP, length 1470

23:34:00.702357 IP 10.0.0.1.52832 > 10.0.0.2.5001: UDP, length 1470

23:34:00.714321 IP 10.0.0.1.52832 > 10.0.0.2.5001: UDP, length 1470

23:34:00.726404 IP 10.0.0.1.52832 > 10.0.0.2.5001: UDP, length 1470

23:34:00.738591 IP 10.0.0.1.52832 > 10.0.0.2.5001: UDP, length 1470

23:34:00.750744 IP 10.0.0.1.52832 > 10.0.0.2.5001: UDP, length 1470

23:34:00.762860 IP 10.0.0.1.52832 > 10.0.0.2.5001: UDP, length 1470

23:34:00.774764 IP 10.0.0.1.52832 > 10.0.0.2.5001: UDP, length 1470

23:34:00.786935 IP 10.0.0.1.52832 > 10.0.0.2.5001: UDP, length 1470

23:34:00.799021 IP 10.0.0.1.52832 > 10.0.0.2.5001: UDP, length 1470

23:34:00.811188 IP 10.0.0.1.52832 > 10.0.0.2.5001: UDP, length 1470

23:34:00.823168 IP 10.0.0.1.52832 > 10.0.0.2.5001: UDP, length 1470

23:34:00.835289 IP 10.0.0.1.52832 > 10.0.0.2.5001: UDP, length 1470

23:34:00.847386 IP 10.0.0.1.52832 > 10.0.0.2.5001: UDP, length 1470

23:34:00.859463 IP 10.0.0.1.52832 > 10.0.0.2.5001: UDP, length 1470

23:34:00.871560 IP 10.0.0.1.52832 > 10.0.0.2.5001: UDP, length 1470

23:34:00.883676 IP 10.0.0.1.52832 > 10.0.0.2.5001: UDP, length 1470

23:34:00.895789 IP 10.0.0.1.52832 > 10.0.0.2.5001: UDP, length 1470

23:34:00.907758 IP 10.0.0.1.52832 > 10.0.0.2.5001: UDP, length 1470

23:34:00.919923 IP 10.0.0.1.52832 > 10.0.0.2.5001: UDP, length 1470

23:34:00.932065 IP 10.0.0.1.52832 > 10.0.0.2.5001: UDP, length 1470

23:34:00.944240 IP 10.0.0.1.52832 > 10.0.0.2.5001: UDP, length 1470

23:34:00.956373 IP 10.0.0.1.52832 > 10.0.0.2.5001: UDP, length 1470

23:34:00.968393 IP 10.0.0.1.52832 > 10.0.0.2.5001: UDP, length 1470

23:34:00.980418 IP 10.0.0.1.52832 > 10.0.0.2.5001: UDP, length 1470

23:34:00.992527 IP 10.0.0.1.52832 > 10.0.0.2.5001: UDP, length 1470

23:34:01.004689 IP 10.0.0.1.52832 > 10.0.0.2.5001: UDP, length 1470

23:34:01.016813 IP 10.0.0.1.52832 > 10.0.0.2.5001: UDP, length 1470

23:34:01.029004 IP 10.0.0.1.52832 > 10.0.0.2.5001: UDP, length 1470

23:34:01.041029 IP 10.0.0.1.52832 > 10.0.0.2.5001: UDP, length 1470

23:34:01.053038 IP 10.0.0.1.52832 > 10.0.0.2.5001: UDP, length 1470

23:34:01.065010 IP 10.0.0.1.52832 > 10.0.0.2.5001: UDP, length 1470

23:34:01.077228 IP 10.0.0.1.52832 > 10.0.0.2.5001: UDP, length 1470

23:34:01.089345 IP 10.0.0.1.52832 > 10.0.0.2.5001: UDP, length 1470

23:34:01.101500 IP 10.0.0.1.52832 > 10.0.0.2.5001: UDP, length 1470

23:34:01.113429 IP 10.0.0.1.52832 > 10.0.0.2.5001: UDP, length 1470

23:34:01.125683 IP 10.0.0.1.52832 > 10.0.0.2.5001: UDP, length 1470

23:34:01.137827 IP 10.0.0.1.52832 > 10.0.0.2.5001: UDP, length 1470

23:34:01.149885 IP 10.0.0.1.52832 > 10.0.0.2.5001: UDP, length 1470

23:34:01.161978 IP 10.0.0.1.52832 > 10.0.0.2.5001: UDP, length 1470

23:34:01.173931 IP 10.0.0.1.52832 > 10.0.0.2.5001: UDP, length 1470

23:34:01.186071 IP 10.0.0.1.52832 > 10.0.0.2.5001: UDP, length 1470

23:34:01.198168 IP 10.0.0.1.52832 > 10.0.0.2.5001: UDP, length 1470

23:34:01.210322 IP 10.0.0.1.52832 > 10.0.0.2.5001: UDP, length 1470

23:34:01.222259 IP 10.0.0.1.52832 > 10.0.0.2.5001: UDP, length 1470

23:34:01.234464 IP 10.0.0.1.52832 > 10.0.0.2.5001: UDP, length 1470

23:34:01.246532 IP 10.0.0.1.52832 > 10.0.0.2.5001: UDP, length 1470

23:34:01.258625 IP 10.0.0.1.52832 > 10.0.0.2.5001: UDP, length 1470

23:34:01.270643 IP 10.0.0.1.52832 > 10.0.0.2.5001: UDP, length 1470

23:34:01.282764 IP 10.0.0.1.52832 > 10.0.0.2.5001: UDP, length 1470

23:34:01.294937 IP 10.0.0.1.52832 > 10.0.0.2.5001: UDP, length 1470

23:34:01.307052 IP 10.0.0.1.52832 > 10.0.0.2.5001: UDP, length 1470

23:34:01.319022 IP 10.0.0.1.52832 > 10.0.0.2.5001: UDP, length 1470

23:34:01.331257 IP 10.0.0.1.52832 > 10.0.0.2.5001: UDP, length 1470

23:34:01.343417 IP 10.0.0.1.52832 > 10.0.0.2.5001: UDP, length 1470

23:34:01.355534 IP 10.0.0.1.52832 > 10.0.0.2.5001: UDP, length 1470

23:34:01.367543 IP 10.0.0.1.52832 > 10.0.0.2.5001: UDP, length 1470

23:34:01.379769 IP 10.0.0.1.52832 > 10.0.0.2.5001: UDP, length 1470

23:34:01.391692 IP 10.0.0.1.52832 > 10.0.0.2.5001: UDP, length 1470

23:34:01.403837 IP 10.0.0.1.52832 > 10.0.0.2.5001: UDP, length 1470

23:34:01.416004 IP 10.0.0.1.52832 > 10.0.0.2.5001: UDP, length 1470

23:34:01.428164 IP 10.0.0.1.52832 > 10.0.0.2.5001: UDP, length 1470

23:34:01.440257 IP 10.0.0.1.52832 > 10.0.0.2.5001: UDP, length 1470

23:34:01.452353 IP 10.0.0.1.52832 > 10.0.0.2.5001: UDP, length 1470

23:34:01.464280 IP 10.0.0.1.52832 > 10.0.0.2.5001: UDP, length 1470

23:34:01.476632 IP 10.0.0.1.52832 > 10.0.0.2.5001: UDP, length 1470

23:34:01.488611 IP 10.0.0.1.52832 > 10.0.0.2.5001: UDP, length 1470

23:34:01.500498 IP 10.0.0.1.52832 > 10.0.0.2.5001: UDP, length 1470

23:34:01.512641 IP 10.0.0.1.52832 > 10.0.0.2.5001: UDP, length 1470

23:34:01.524739 IP 10.0.0.1.52832 > 10.0.0.2.5001: UDP, length 1470

23:34:01.536883 IP 10.0.0.1.52832 > 10.0.0.2.5001: UDP, length 1470

23:34:01.548977 IP 10.0.0.1.52832 > 10.0.0.2.5001: UDP, length 1470

23:34:01.561118 IP 10.0.0.1.52832 > 10.0.0.2.5001: UDP, length 1470

23:34:01.573177 IP 10.0.0.1.52832 > 10.0.0.2.5001: UDP, length 1470

23:34:01.585170 IP 10.0.0.1.52832 > 10.0.0.2.5001: UDP, length 1470

23:34:01.597348 IP 10.0.0.1.52832 > 10.0.0.2.5001: UDP, length 1470

23:34:01.609487 IP 10.0.0.1.52832 > 10.0.0.2.5001: UDP, length 1470

23:34:01.621521 IP 10.0.0.1.52832 > 10.0.0.2.5001: UDP, length 1470

23:34:01.633663 IP 10.0.0.1.52832 > 10.0.0.2.5001: UDP, length 1470

23:34:01.645821 IP 10.0.0.1.52832 > 10.0.0.2.5001: UDP, length 1470

23:34:01.657705 IP 10.0.0.1.52832 > 10.0.0.2.5001: UDP, length 1470

23:34:01.669792 IP 10.0.0.1.52832 > 10.0.0.2.5001: UDP, length 1470

23:34:01.682130 IP 10.0.0.1.52832 > 10.0.0.2.5001: UDP, length 1470

23:34:01.694310 IP 10.0.0.1.52832 > 10.0.0.2.5001: UDP, length 1470

23:34:01.706332 IP 10.0.0.1.52832 > 10.0.0.2.5001: UDP, length 1470

23:34:01.718420 IP 10.0.0.1.52832 > 10.0.0.2.5001: UDP, length 1470

23:34:01.730326 IP 10.0.0.1.52832 > 10.0.0.2.5001: UDP, length 1470

23:34:01.742478 IP 10.0.0.1.52832 > 10.0.0.2.5001: UDP, length 1470

23:34:01.754599 IP 10.0.0.1.52832 > 10.0.0.2.5001: UDP, length 1470

23:34:01.766646 IP 10.0.0.1.52832 > 10.0.0.2.5001: UDP, length 1470

23:34:01.778841 IP 10.0.0.1.52832 > 10.0.0.2.5001: UDP, length 1470

23:34:01.790952 IP 10.0.0.1.52832 > 10.0.0.2.5001: UDP, length 1470

23:34:01.802979 IP 10.0.0.1.52832 > 10.0.0.2.5001: UDP, length 1470

23:34:01.815145 IP 10.0.0.1.52832 > 10.0.0.2.5001: UDP, length 1470

23:34:01.827306 IP 10.0.0.1.52832 > 10.0.0.2.5001: UDP, length 1470

23:34:01.839413 IP 10.0.0.1.52832 > 10.0.0.2.5001: UDP, length 1470

23:34:01.851507 IP 10.0.0.1.52832 > 10.0.0.2.5001: UDP, length 1470

23:34:01.863384 IP 10.0.0.1.52832 > 10.0.0.2.5001: UDP, length 1470

23:34:01.875682 IP 10.0.0.1.52832 > 10.0.0.2.5001: UDP, length 1470

23:34:01.887844 IP 10.0.0.1.52832 > 10.0.0.2.5001: UDP, length 1470

23:34:01.899901 IP 10.0.0.1.52832 > 10.0.0.2.5001: UDP, length 1470

23:34:01.912010 IP 10.0.0.1.52832 > 10.0.0.2.5001: UDP, length 1470

23:34:01.923946 IP 10.0.0.1.52832 > 10.0.0.2.5001: UDP, length 1470

23:34:01.936020 IP 10.0.0.1.52832 > 10.0.0.2.5001: UDP, length 1470

23:34:01.948128 IP 10.0.0.1.52832 > 10.0.0.2.5001: UDP, length 1470

23:34:01.960131 IP 10.0.0.1.52832 > 10.0.0.2.5001: UDP, length 1470

23:34:01.972363 IP 10.0.0.1.52832 > 10.0.0.2.5001: UDP, length 1470

23:34:01.984457 IP 10.0.0.1.52832 > 10.0.0.2.5001: UDP, length 1470

23:34:01.996452 IP 10.0.0.1.52832 > 10.0.0.2.5001: UDP, length 1470

23:34:02.008642 IP 10.0.0.1.52832 > 10.0.0.2.5001: UDP, length 1470

23:34:02.020847 IP 10.0.0.1.52832 > 10.0.0.2.5001: UDP, length 1470

23:34:02.032744 IP 10.0.0.1.52832 > 10.0.0.2.5001: UDP, length 1470

23:34:02.045050 IP 10.0.0.1.52832 > 10.0.0.2.5001: UDP, length 1470

23:34:02.058037 IP 10.0.0.1.52832 > 10.0.0.2.5001: UDP, length 1470

23:34:02.069036 IP 10.0.0.1.52832 > 10.0.0.2.5001: UDP, length 1470

23:34:02.081214 IP 10.0.0.1.52832 > 10.0.0.2.5001: UDP, length 1470

23:34:02.093365 IP 10.0.0.1.52832 > 10.0.0.2.5001: UDP, length 1470

23:34:02.105470 IP 10.0.0.1.52832 > 10.0.0.2.5001: UDP, length 1470

23:34:02.117540 IP 10.0.0.1.52832 > 10.0.0.2.5001: UDP, length 1470

23:34:02.129646 IP 10.0.0.1.52832 > 10.0.0.2.5001: UDP, length 1470

23:34:02.142225 IP 10.0.0.1.52832 > 10.0.0.2.5001: UDP, length 1470

23:34:02.153837 IP 10.0.0.1.52832 > 10.0.0.2.5001: UDP, length 1470

23:34:02.165954 IP 10.0.0.1.52832 > 10.0.0.2.5001: UDP, length 1470

23:34:02.177844 IP 10.0.0.1.52832 > 10.0.0.2.5001: UDP, length 1470

23:34:02.189999 IP 10.0.0.1.52832 > 10.0.0.2.5001: UDP, length 1470

23:34:02.202043 IP 10.0.0.1.52832 > 10.0.0.2.5001: UDP, length 1470

23:34:02.214263 IP 10.0.0.1.52832 > 10.0.0.2.5001: UDP, length 1470

23:34:02.226370 IP 10.0.0.1.52832 > 10.0.0.2.5001: UDP, length 1470

23:34:02.238490 IP 10.0.0.1.52832 > 10.0.0.2.5001: UDP, length 1470

23:34:02.250399 IP 10.0.0.1.52832 > 10.0.0.2.5001: UDP, length 1470

23:34:02.262742 IP 10.0.0.1.52832 > 10.0.0.2.5001: UDP, length 1470

23:34:02.274704 IP 10.0.0.1.52832 > 10.0.0.2.5001: UDP, length 1470

23:34:02.286851 IP 10.0.0.1.52832 > 10.0.0.2.5001: UDP, length 1470

23:34:02.298979 IP 10.0.0.1.52832 > 10.0.0.2.5001: UDP, length 1470

23:34:02.311077 IP 10.0.0.1.52832 > 10.0.0.2.5001: UDP, length 1470

23:34:02.323081 IP 10.0.0.1.52832 > 10.0.0.2.5001: UDP, length 1470

23:34:02.335157 IP 10.0.0.1.52832 > 10.0.0.2.5001: UDP, length 1470

23:34:02.347293 IP 10.0.0.1.52832 > 10.0.0.2.5001: UDP, length 1470

23:34:02.359451 IP 10.0.0.1.52832 > 10.0.0.2.5001: UDP, length 1470

23:34:02.371441 IP 10.0.0.1.52832 > 10.0.0.2.5001: UDP, length 1470

23:34:02.383720 IP 10.0.0.1.52832 > 10.0.0.2.5001: UDP, length 1470

23:34:02.395698 IP 10.0.0.1.52832 > 10.0.0.2.5001: UDP, length 1470

23:34:02.407684 IP 10.0.0.1.52832 > 10.0.0.2.5001: UDP, length 1470

23:34:02.419827 IP 10.0.0.1.52832 > 10.0.0.2.5001: UDP, length 1470

23:34:02.431952 IP 10.0.0.1.52832 > 10.0.0.2.5001: UDP, length 1470

23:34:02.444063 IP 10.0.0.1.52832 > 10.0.0.2.5001: UDP, length 1470

23:34:02.456217 IP 10.0.0.1.52832 > 10.0.0.2.5001: UDP, length 1470

23:34:02.468300 IP 10.0.0.1.52832 > 10.0.0.2.5001: UDP, length 1470

23:34:02.480349 IP 10.0.0.1.52832 > 10.0.0.2.5001: UDP, length 1470

23:34:02.492517 IP 10.0.0.1.52832 > 10.0.0.2.5001: UDP, length 1470

23:34:02.504591 IP 10.0.0.1.52832 > 10.0.0.2.5001: UDP, length 1470

23:34:02.516748 IP 10.0.0.1.52832 > 10.0.0.2.5001: UDP, length 1470

23:34:02.528904 IP 10.0.0.1.52832 > 10.0.0.2.5001: UDP, length 1470

23:34:02.540799 IP 10.0.0.1.52832 > 10.0.0.2.5001: UDP, length 1470

23:34:02.552963 IP 10.0.0.1.52832 > 10.0.0.2.5001: UDP, length 1470

23:34:02.565119 IP 10.0.0.1.52832 > 10.0.0.2.5001: UDP, length 1470

23:34:02.577246 IP 10.0.0.1.52832 > 10.0.0.2.5001: UDP, length 1470

23:34:02.589285 IP 10.0.0.1.52832 > 10.0.0.2.5001: UDP, length 1470

23:34:02.601389 IP 10.0.0.1.52832 > 10.0.0.2.5001: UDP, length 1470

23:34:02.613448 IP 10.0.0.1.52832 > 10.0.0.2.5001: UDP, length 1470

23:34:02.625573 IP 10.0.0.1.52832 > 10.0.0.2.5001: UDP, length 1470

23:34:02.637540 IP 10.0.0.1.52832 > 10.0.0.2.5001: UDP, length 1470

23:34:02.649678 IP 10.0.0.1.52832 > 10.0.0.2.5001: UDP, length 1470

23:34:02.661797 IP 10.0.0.1.52832 > 10.0.0.2.5001: UDP, length 1470

23:34:02.673825 IP 10.0.0.1.52832 > 10.0.0.2.5001: UDP, length 1470

23:34:02.686015 IP 10.0.0.1.52832 > 10.0.0.2.5001: UDP, length 1470

23:34:02.698108 IP 10.0.0.1.52832 > 10.0.0.2.5001: UDP, length 1470

23:34:02.710306 IP 10.0.0.1.52832 > 10.0.0.2.5001: UDP, length 1470

23:34:02.722278 IP 10.0.0.1.52832 > 10.0.0.2.5001: UDP, length 1470

23:34:02.734393 IP 10.0.0.1.52832 > 10.0.0.2.5001: UDP, length 1470

23:34:02.746431 IP 10.0.0.1.52832 > 10.0.0.2.5001: UDP, length 1470

23:34:02.758609 IP 10.0.0.1.52832 > 10.0.0.2.5001: UDP, length 1470

23:34:02.770710 IP 10.0.0.1.52832 > 10.0.0.2.5001: UDP, length 1470

23:34:02.782682 IP 10.0.0.1.52832 > 10.0.0.2.5001: UDP, length 1470

23:34:02.795059 IP 10.0.0.1.52832 > 10.0.0.2.5001: UDP, length 1470

23:34:02.806916 IP 10.0.0.1.52832 > 10.0.0.2.5001: UDP, length 1470

23:34:02.819143 IP 10.0.0.1.52832 > 10.0.0.2.5001: UDP, length 1470

23:34:02.831270 IP 10.0.0.1.52832 > 10.0.0.2.5001: UDP, length 1470

23:34:02.843449 IP 10.0.0.1.52832 > 10.0.0.2.5001: UDP, length 1470

23:34:02.855513 IP 10.0.0.1.52832 > 10.0.0.2.5001: UDP, length 1470

23:34:02.867384 IP 10.0.0.1.52832 > 10.0.0.2.5001: UDP, length 1470

23:34:02.879463 IP 10.0.0.1.52832 > 10.0.0.2.5001: UDP, length 1470

23:34:02.891625 IP 10.0.0.1.52832 > 10.0.0.2.5001: UDP, length 1470

23:34:02.903781 IP 10.0.0.1.52832 > 10.0.0.2.5001: UDP, length 1470

23:34:02.915876 IP 10.0.0.1.52832 > 10.0.0.2.5001: UDP, length 1470

23:34:02.927994 IP 10.0.0.1.52832 > 10.0.0.2.5001: UDP, length 1470

23:34:02.940048 IP 10.0.0.1.52832 > 10.0.0.2.5001: UDP, length 1470

23:34:02.952095 IP 10.0.0.1.52832 > 10.0.0.2.5001: UDP, length 1470

23:34:02.964252 IP 10.0.0.1.52832 > 10.0.0.2.5001: UDP, length 1470

23:34:02.976323 IP 10.0.0.1.52832 > 10.0.0.2.5001: UDP, length 1470

23:34:02.988538 IP 10.0.0.1.52832 > 10.0.0.2.5001: UDP, length 1470

23:34:03.000525 IP 10.0.0.1.52832 > 10.0.0.2.5001: UDP, length 1470

23:34:03.012551 IP 10.0.0.1.52832 > 10.0.0.2.5001: UDP, length 1470

23:34:03.024702 IP 10.0.0.1.52832 > 10.0.0.2.5001: UDP, length 1470

23:34:03.036861 IP 10.0.0.1.52832 > 10.0.0.2.5001: UDP, length 1470

23:34:03.048911 IP 10.0.0.1.52832 > 10.0.0.2.5001: UDP, length 1470

23:34:03.061053 IP 10.0.0.1.52832 > 10.0.0.2.5001: UDP, length 1470

23:34:03.072932 IP 10.0.0.1.52832 > 10.0.0.2.5001: UDP, length 1470

23:34:03.085014 IP 10.0.0.1.52832 > 10.0.0.2.5001: UDP, length 1470

23:34:03.097217 IP 10.0.0.1.52832 > 10.0.0.2.5001: UDP, length 1470

23:34:03.109343 IP 10.0.0.1.52832 > 10.0.0.2.5001: UDP, length 1470

23:34:03.121457 IP 10.0.0.1.52832 > 10.0.0.2.5001: UDP, length 1470

23:34:03.133563 IP 10.0.0.1.52832 > 10.0.0.2.5001: UDP, length 1470

23:34:03.145637 IP 10.0.0.1.52832 > 10.0.0.2.5001: UDP, length 1470

23:34:03.157625 IP 10.0.0.1.52832 > 10.0.0.2.5001: UDP, length 1470

23:34:03.169684 IP 10.0.0.1.52832 > 10.0.0.2.5001: UDP, length 1470

23:34:03.182051 IP 10.0.0.1.52832 > 10.0.0.2.5001: UDP, length 1470

23:34:03.194151 IP 10.0.0.1.52832 > 10.0.0.2.5001: UDP, length 1470

23:34:03.206058 IP 10.0.0.1.52832 > 10.0.0.2.5001: UDP, length 1470

23:34:03.218221 IP 10.0.0.1.52832 > 10.0.0.2.5001: UDP, length 1470

23:34:03.230411 IP 10.0.0.1.52832 > 10.0.0.2.5001: UDP, length 1470

23:34:03.242381 IP 10.0.0.1.52832 > 10.0.0.2.5001: UDP, length 1470

23:34:03.254642 IP 10.0.0.1.52832 > 10.0.0.2.5001: UDP, length 1470

23:34:03.266564 IP 10.0.0.1.52832 > 10.0.0.2.5001: UDP, length 1470

23:34:03.278669 IP 10.0.0.1.52832 > 10.0.0.2.5001: UDP, length 1470

23:34:03.290832 IP 10.0.0.1.52832 > 10.0.0.2.5001: UDP, length 1470

23:34:03.303010 IP 10.0.0.1.52832 > 10.0.0.2.5001: UDP, length 1470

23:34:03.314837 IP 10.0.0.1.52832 > 10.0.0.2.5001: UDP, length 1470

23:34:03.327048 IP 10.0.0.1.52832 > 10.0.0.2.5001: UDP, length 1470

23:34:03.339072 IP 10.0.0.1.52832 > 10.0.0.2.5001: UDP, length 1470

23:34:03.351294 IP 10.0.0.1.52832 > 10.0.0.2.5001: UDP, length 1470

23:34:03.363440 IP 10.0.0.1.52832 > 10.0.0.2.5001: UDP, length 1470

23:34:03.375473 IP 10.0.0.1.52832 > 10.0.0.2.5001: UDP, length 1470

23:34:03.387643 IP 10.0.0.1.52832 > 10.0.0.2.5001: UDP, length 1470

23:34:03.399731 IP 10.0.0.1.52832 > 10.0.0.2.5001: UDP, length 1470

23:34:03.411726 IP 10.0.0.1.52832 > 10.0.0.2.5001: UDP, length 1470

23:34:03.423862 IP 10.0.0.1.52832 > 10.0.0.2.5001: UDP, length 1470

23:34:03.435985 IP 10.0.0.1.52832 > 10.0.0.2.5001: UDP, length 1470

23:34:03.448056 IP 10.0.0.1.52832 > 10.0.0.2.5001: UDP, length 1470

23:34:03.460165 IP 10.0.0.1.52832 > 10.0.0.2.5001: UDP, length 1470

23:34:03.472099 IP 10.0.0.1.52832 > 10.0.0.2.5001: UDP, length 1470

23:34:03.484335 IP 10.0.0.1.52832 > 10.0.0.2.5001: UDP, length 1470

23:34:03.496395 IP 10.0.0.1.52832 > 10.0.0.2.5001: UDP, length 1470

23:34:03.508514 IP 10.0.0.1.52832 > 10.0.0.2.5001: UDP, length 1470

23:34:03.520821 IP 10.0.0.1.52832 > 10.0.0.2.5001: UDP, length 1470

23:34:03.532704 IP 10.0.0.1.52832 > 10.0.0.2.5001: UDP, length 1470

23:34:03.544742 IP 10.0.0.1.52832 > 10.0.0.2.5001: UDP, length 1470

23:34:03.556881 IP 10.0.0.1.52832 > 10.0.0.2.5001: UDP, length 1470

23:34:03.569005 IP 10.0.0.1.52832 > 10.0.0.2.5001: UDP, length 1470

23:34:03.581113 IP 10.0.0.1.52832 > 10.0.0.2.5001: UDP, length 1470

23:34:03.593230 IP 10.0.0.1.52832 > 10.0.0.2.5001: UDP, length 1470

23:34:03.605351 IP 10.0.0.1.52832 > 10.0.0.2.5001: UDP, length 1470

23:34:03.617352 IP 10.0.0.1.52832 > 10.0.0.2.5001: UDP, length 1470

23:34:03.629516 IP 10.0.0.1.52832 > 10.0.0.2.5001: UDP, length 1470

23:34:03.641661 IP 10.0.0.1.52832 > 10.0.0.2.5001: UDP, length 1470

23:34:03.653781 IP 10.0.0.1.52832 > 10.0.0.2.5001: UDP, length 1470

23:34:03.665861 IP 10.0.0.1.52832 > 10.0.0.2.5001: UDP, length 1470

23:34:03.678018 IP 10.0.0.1.52832 > 10.0.0.2.5001: UDP, length 1470

23:34:03.689888 IP 10.0.0.1.52832 > 10.0.0.2.5001: UDP, length 1470

23:34:03.702092 IP 10.0.0.1.52832 > 10.0.0.2.5001: UDP, length 1470

23:34:03.714272 IP 10.0.0.1.52832 > 10.0.0.2.5001: UDP, length 1470

23:34:03.726326 IP 10.0.0.1.52832 > 10.0.0.2.5001: UDP, length 1470

23:34:03.738448 IP 10.0.0.1.52832 > 10.0.0.2.5001: UDP, length 1470

23:34:03.750393 IP 10.0.0.1.52832 > 10.0.0.2.5001: UDP, length 1470

23:34:03.762551 IP 10.0.0.1.52832 > 10.0.0.2.5001: UDP, length 1470

23:34:03.774585 IP 10.0.0.1.52832 > 10.0.0.2.5001: UDP, length 1470

23:34:03.786703 IP 10.0.0.1.52832 > 10.0.0.2.5001: UDP, length 1470

23:34:03.798831 IP 10.0.0.1.52832 > 10.0.0.2.5001: UDP, length 1470

23:34:03.810952 IP 10.0.0.1.52832 > 10.0.0.2.5001: UDP, length 1470

23:34:03.822991 IP 10.0.0.1.52832 > 10.0.0.2.5001: UDP, length 1470

23:34:03.835111 IP 10.0.0.1.52832 > 10.0.0.2.5001: UDP, length 1470

23:34:03.847201 IP 10.0.0.1.52832 > 10.0.0.2.5001: UDP, length 1470

23:34:03.859307 IP 10.0.0.1.52832 > 10.0.0.2.5001: UDP, length 1470

23:34:03.871369 IP 10.0.0.1.52832 > 10.0.0.2.5001: UDP, length 1470

23:34:03.883398 IP 10.0.0.1.52832 > 10.0.0.2.5001: UDP, length 1470

23:34:03.895557 IP 10.0.0.1.52832 > 10.0.0.2.5001: UDP, length 1470

23:34:03.907559 IP 10.0.0.1.52832 > 10.0.0.2.5001: UDP, length 1470

23:34:03.919884 IP 10.0.0.1.52832 > 10.0.0.2.5001: UDP, length 1470

23:34:03.932028 IP 10.0.0.1.52832 > 10.0.0.2.5001: UDP, length 1470

23:34:03.944099 IP 10.0.0.1.52832 > 10.0.0.2.5001: UDP, length 1470

23:34:03.956033 IP 10.0.0.1.52832 > 10.0.0.2.5001: UDP, length 1470

23:34:03.968141 IP 10.0.0.1.52832 > 10.0.0.2.5001: UDP, length 1470

23:34:03.980323 IP 10.0.0.1.52832 > 10.0.0.2.5001: UDP, length 1470

23:34:03.992369 IP 10.0.0.1.52832 > 10.0.0.2.5001: UDP, length 1470

23:34:04.004371 IP 10.0.0.1.52832 > 10.0.0.2.5001: UDP, length 1470

23:34:04.016488 IP 10.0.0.1.52832 > 10.0.0.2.5001: UDP, length 1470

23:34:04.028663 IP 10.0.0.1.52832 > 10.0.0.2.5001: UDP, length 1470

23:34:04.040777 IP 10.0.0.1.52832 > 10.0.0.2.5001: UDP, length 1470

23:34:04.052895 IP 10.0.0.1.52832 > 10.0.0.2.5001: UDP, length 1470

23:34:04.065032 IP 10.0.0.1.52832 > 10.0.0.2.5001: UDP, length 1470

23:34:04.077091 IP 10.0.0.1.52832 > 10.0.0.2.5001: UDP, length 1470

23:34:04.089090 IP 10.0.0.1.52832 > 10.0.0.2.5001: UDP, length 1470

23:34:04.101259 IP 10.0.0.1.52832 > 10.0.0.2.5001: UDP, length 1470

23:34:04.113482 IP 10.0.0.1.52832 > 10.0.0.2.5001: UDP, length 1470

23:34:04.125506 IP 10.0.0.1.52832 > 10.0.0.2.5001: UDP, length 1470

23:34:04.137587 IP 10.0.0.1.52832 > 10.0.0.2.5001: UDP, length 1470

23:34:04.149692 IP 10.0.0.1.52832 > 10.0.0.2.5001: UDP, length 1470

23:34:04.161726 IP 10.0.0.1.52832 > 10.0.0.2.5001: UDP, length 1470

23:34:04.173681 IP 10.0.0.1.52832 > 10.0.0.2.5001: UDP, length 1470

23:34:04.185928 IP 10.0.0.1.52832 > 10.0.0.2.5001: UDP, length 1470

23:34:04.197984 IP 10.0.0.1.52832 > 10.0.0.2.5001: UDP, length 1470

23:34:04.210121 IP 10.0.0.1.52832 > 10.0.0.2.5001: UDP, length 1470

23:34:04.222104 IP 10.0.0.1.52832 > 10.0.0.2.5001: UDP, length 1470

23:34:04.234247 IP 10.0.0.1.52832 > 10.0.0.2.5001: UDP, length 1470

23:34:04.246333 IP 10.0.0.1.52832 > 10.0.0.2.5001: UDP, length 1470

23:34:04.258444 IP 10.0.0.1.52832 > 10.0.0.2.5001: UDP, length 1470

23:34:04.270543 IP 10.0.0.1.52832 > 10.0.0.2.5001: UDP, length 1470

23:34:04.282547 IP 10.0.0.1.52832 > 10.0.0.2.5001: UDP, length 1470

23:34:04.294888 IP 10.0.0.1.52832 > 10.0.0.2.5001: UDP, length 1470

23:34:04.306992 IP 10.0.0.1.52832 > 10.0.0.2.5001: UDP, length 1470

23:34:04.319131 IP 10.0.0.1.52832 > 10.0.0.2.5001: UDP, length 1470

23:34:04.331251 IP 10.0.0.1.52832 > 10.0.0.2.5001: UDP, length 1470

23:34:04.343349 IP 10.0.0.1.52832 > 10.0.0.2.5001: UDP, length 1470

23:34:04.355228 IP 10.0.0.1.52832 > 10.0.0.2.5001: UDP, length 1470

23:34:04.367436 IP 10.0.0.1.52832 > 10.0.0.2.5001: UDP, length 1470

23:34:04.379553 IP 10.0.0.1.52832 > 10.0.0.2.5001: UDP, length 1470

23:34:04.391723 IP 10.0.0.1.52832 > 10.0.0.2.5001: UDP, length 1470

23:34:04.403850 IP 10.0.0.1.52832 > 10.0.0.2.5001: UDP, length 1470

23:34:04.415953 IP 10.0.0.1.52832 > 10.0.0.2.5001: UDP, length 1470

23:34:04.427771 IP 10.0.0.1.52832 > 10.0.0.2.5001: UDP, length 1470

23:34:04.439912 IP 10.0.0.1.52832 > 10.0.0.2.5001: UDP, length 1470

23:34:04.451874 IP 10.0.0.1.52832 > 10.0.0.2.5001: UDP, length 1470

23:34:04.464120 IP 10.0.0.1.52832 > 10.0.0.2.5001: UDP, length 1470

23:34:04.476248 IP 10.0.0.1.52832 > 10.0.0.2.5001: UDP, length 1470

23:34:04.488350 IP 10.0.0.1.52832 > 10.0.0.2.5001: UDP, length 1470

23:34:04.500285 IP 10.0.0.1.52832 > 10.0.0.2.5001: UDP, length 1470

23:34:04.512504 IP 10.0.0.1.52832 > 10.0.0.2.5001: UDP, length 1470

23:34:04.524606 IP 10.0.0.1.52832 > 10.0.0.2.5001: UDP, length 1470

23:34:04.536777 IP 10.0.0.1.52832 > 10.0.0.2.5001: UDP, length 1470

23:34:04.548817 IP 10.0.0.1.52832 > 10.0.0.2.5001: UDP, length 1470

23:34:04.560932 IP 10.0.0.1.52832 > 10.0.0.2.5001: UDP, length 1470

23:34:04.572931 IP 10.0.0.1.52832 > 10.0.0.2.5001: UDP, length 1470

23:34:04.585088 IP 10.0.0.1.52832 > 10.0.0.2.5001: UDP, length 1470

23:34:04.597142 IP 10.0.0.1.52832 > 10.0.0.2.5001: UDP, length 1470

23:34:04.609248 IP 10.0.0.1.52832 > 10.0.0.2.5001: UDP, length 1470

23:34:04.621284 IP 10.0.0.1.52832 > 10.0.0.2.5001: UDP, length 1470

23:34:04.633365 IP 10.0.0.1.52832 > 10.0.0.2.5001: UDP, length 1470

23:34:04.645541 IP 10.0.0.1.52832 > 10.0.0.2.5001: UDP, length 1470

23:34:04.657567 IP 10.0.0.1.52832 > 10.0.0.2.5001: UDP, length 1470

23:34:04.669595 IP 10.0.0.1.52832 > 10.0.0.2.5001: UDP, length 1470

23:34:04.681770 IP 10.0.0.1.52832 > 10.0.0.2.5001: UDP, length 1470

23:34:04.693955 IP 10.0.0.1.52832 > 10.0.0.2.5001: UDP, length 1470

23:34:04.705992 IP 10.0.0.1.52832 > 10.0.0.2.5001: UDP, length 1470

23:34:04.718144 IP 10.0.0.1.52832 > 10.0.0.2.5001: UDP, length 1470

23:34:04.730270 IP 10.0.0.1.52832 > 10.0.0.2.5001: UDP, length 1470

23:34:04.742326 IP 10.0.0.1.52832 > 10.0.0.2.5001: UDP, length 1470

23:34:04.754493 IP 10.0.0.1.52832 > 10.0.0.2.5001: UDP, length 1470

23:34:04.766393 IP 10.0.0.1.52832 > 10.0.0.2.5001: UDP, length 1470

23:34:04.778574 IP 10.0.0.1.52832 > 10.0.0.2.5001: UDP, length 1470

23:34:04.790763 IP 10.0.0.1.52832 > 10.0.0.2.5001: UDP, length 1470

23:34:04.802924 IP 10.0.0.1.52832 > 10.0.0.2.5001: UDP, length 1470

23:34:04.815038 IP 10.0.0.1.52832 > 10.0.0.2.5001: UDP, length 1470

23:34:04.827078 IP 10.0.0.1.52832 > 10.0.0.2.5001: UDP, length 1470

23:34:04.839043 IP 10.0.0.1.52832 > 10.0.0.2.5001: UDP, length 1470

23:34:04.851207 IP 10.0.0.1.52832 > 10.0.0.2.5001: UDP, length 1470

23:34:04.863367 IP 10.0.0.1.52832 > 10.0.0.2.5001: UDP, length 1470

23:34:04.875388 IP 10.0.0.1.52832 > 10.0.0.2.5001: UDP, length 1470

23:34:04.887586 IP 10.0.0.1.52832 > 10.0.0.2.5001: UDP, length 1470

23:34:04.899520 IP 10.0.0.1.52832 > 10.0.0.2.5001: UDP, length 1470

23:34:04.911606 IP 10.0.0.1.52832 > 10.0.0.2.5001: UDP, length 1470

23:34:04.923739 IP 10.0.0.1.52832 > 10.0.0.2.5001: UDP, length 1470

23:34:04.935828 IP 10.0.0.1.52832 > 10.0.0.2.5001: UDP, length 1470

23:34:04.947948 IP 10.0.0.1.52832 > 10.0.0.2.5001: UDP, length 1470

23:34:04.960061 IP 10.0.0.1.52832 > 10.0.0.2.5001: UDP, length 1470

23:34:04.972051 IP 10.0.0.1.52832 > 10.0.0.2.5001: UDP, length 1470

23:34:04.984236 IP 10.0.0.1.52832 > 10.0.0.2.5001: UDP, length 1470

23:34:04.996262 IP 10.0.0.1.52832 > 10.0.0.2.5001: UDP, length 1470

23:34:05.008388 IP 10.0.0.1.52832 > 10.0.0.2.5001: UDP, length 1470

23:34:05.020688 IP 10.0.0.1.52832 > 10.0.0.2.5001: UDP, length 1470

23:34:05.032673 IP 10.0.0.1.52832 > 10.0.0.2.5001: UDP, length 1470

23:34:05.044675 IP 10.0.0.1.52832 > 10.0.0.2.5001: UDP, length 1470

23:34:05.056805 IP 10.0.0.1.52832 > 10.0.0.2.5001: UDP, length 1470

23:34:05.068993 IP 10.0.0.1.52832 > 10.0.0.2.5001: UDP, length 1470

23:34:05.081055 IP 10.0.0.1.52832 > 10.0.0.2.5001: UDP, length 1470

23:34:05.093297 IP 10.0.0.1.52832 > 10.0.0.2.5001: UDP, length 1470

23:34:05.105387 IP 10.0.0.1.52832 > 10.0.0.2.5001: UDP, length 1470

23:34:05.117274 IP 10.0.0.1.52832 > 10.0.0.2.5001: UDP, length 1470

23:34:05.129242 IP 10.0.0.1.52832 > 10.0.0.2.5001: UDP, length 1470

23:34:05.141447 IP 10.0.0.1.52832 > 10.0.0.2.5001: UDP, length 1470

23:34:05.153585 IP 10.0.0.1.52832 > 10.0.0.2.5001: UDP, length 1470

23:34:05.165705 IP 10.0.0.1.52832 > 10.0.0.2.5001: UDP, length 1470

23:34:05.177645 IP 10.0.0.1.52832 > 10.0.0.2.5001: UDP, length 1470

23:34:05.189860 IP 10.0.0.1.52832 > 10.0.0.2.5001: UDP, length 1470

23:34:05.201979 IP 10.0.0.1.52832 > 10.0.0.2.5001: UDP, length 1470

23:34:05.214169 IP 10.0.0.1.52832 > 10.0.0.2.5001: UDP, length 1470

23:34:05.226048 IP 10.0.0.1.52832 > 10.0.0.2.5001: UDP, length 1470

23:34:05.238126 IP 10.0.0.1.52832 > 10.0.0.2.5001: UDP, length 1470

23:34:05.250349 IP 10.0.0.1.52832 > 10.0.0.2.5001: UDP, length 1470

23:34:05.262512 IP 10.0.0.1.52832 > 10.0.0.2.5001: UDP, length 1470

23:34:05.274505 IP 10.0.0.1.52832 > 10.0.0.2.5001: UDP, length 1470

23:34:05.286709 IP 10.0.0.1.52832 > 10.0.0.2.5001: UDP, length 1470

23:34:05.298774 IP 10.0.0.1.52832 > 10.0.0.2.5001: UDP, length 1470

23:34:05.310792 IP 10.0.0.1.52832 > 10.0.0.2.5001: UDP, length 1470

23:34:05.322880 IP 10.0.0.1.52832 > 10.0.0.2.5001: UDP, length 1470

23:34:05.335003 IP 10.0.0.1.52832 > 10.0.0.2.5001: UDP, length 1470

23:34:05.347094 IP 10.0.0.1.52832 > 10.0.0.2.5001: UDP, length 1470

23:34:05.359134 IP 10.0.0.1.52832 > 10.0.0.2.5001: UDP, length 1470

23:34:05.371179 IP 10.0.0.1.52832 > 10.0.0.2.5001: UDP, length 1470

23:34:05.383368 IP 10.0.0.1.52832 > 10.0.0.2.5001: UDP, length 1470

23:34:05.395500 IP 10.0.0.1.52832 > 10.0.0.2.5001: UDP, length 1470

23:34:05.407644 IP 10.0.0.1.52832 > 10.0.0.2.5001: UDP, length 1470

23:34:05.419838 IP 10.0.0.1.52832 > 10.0.0.2.5001: UDP, length 1470

23:34:05.431988 IP 10.0.0.1.52832 > 10.0.0.2.5001: UDP, length 1470

23:34:05.443796 IP 10.0.0.1.52832 > 10.0.0.2.5001: UDP, length 1470

23:34:05.455997 IP 10.0.0.1.52832 > 10.0.0.2.5001: UDP, length 1470

23:34:05.468151 IP 10.0.0.1.52832 > 10.0.0.2.5001: UDP, length 1470

23:34:05.480210 IP 10.0.0.1.52832 > 10.0.0.2.5001: UDP, length 1470

23:34:05.492446 IP 10.0.0.1.52832 > 10.0.0.2.5001: UDP, length 1470

23:34:05.504404 IP 10.0.0.1.52832 > 10.0.0.2.5001: UDP, length 1470

23:34:05.516372 IP 10.0.0.1.52832 > 10.0.0.2.5001: UDP, length 1470

23:34:05.528576 IP 10.0.0.1.52832 > 10.0.0.2.5001: UDP, length 1470

23:34:05.540737 IP 10.0.0.1.52832 > 10.0.0.2.5001: UDP, length 1470

23:34:05.553440 IP 10.0.0.1.52832 > 10.0.0.2.5001: UDP, length 1470

23:34:05.564899 IP 10.0.0.1.52832 > 10.0.0.2.5001: UDP, length 1470

23:34:05.576998 IP 10.0.0.1.52832 > 10.0.0.2.5001: UDP, length 1470

23:34:05.589898 IP 10.0.0.1.52832 > 10.0.0.2.5001: UDP, length 1470

23:34:05.608527 IP 10.0.0.2.5001 > 10.0.0.1.52832: UDP, length 1470



cnt=
436
