23:12:05.588969 ARP, Request who-has 10.0.0.2 tell 10.0.0.1, length 28

23:12:05.594935 ARP, Reply 10.0.0.2 is-at e6:14:f1:bd:ca:16, length 28

23:12:05.602819 IP 10.0.0.1.56477 > 10.0.0.2.5001: Flags [P.], seq 1:25, ack 1, win 58, options [nop,nop,TS val 722425 ecr 722424], length 24

23:12:05.602822 IP 10.0.0.1.56477 > 10.0.0.2.5001: Flags [.], seq 25:2921, ack 1, win 58, options [nop,nop,TS val 722425 ecr 722424], length 2896

23:12:05.615515 IP 10.0.0.1.56477 > 10.0.0.2.5001: Flags [.], seq 2921:5817, ack 1, win 58, options [nop,nop,TS val 722425 ecr 722424], length 2896

23:12:05.639892 IP 10.0.0.1.56477 > 10.0.0.2.5001: Flags [.], seq 5817:8713, ack 1, win 58, options [nop,nop,TS val 722425 ecr 722424], length 2896

23:12:05.664146 IP 10.0.0.1.56477 > 10.0.0.2.5001: Flags [.], seq 8713:11609, ack 1, win 58, options [nop,nop,TS val 722425 ecr 722424], length 2896

23:12:05.688470 IP 10.0.0.1.56477 > 10.0.0.2.5001: Flags [.], seq 11609:13057, ack 1, win 58, options [nop,nop,TS val 722425 ecr 722424], length 1448

23:12:05.700529 IP 10.0.0.1.56477 > 10.0.0.2.5001: Flags [P.], seq 13057:15953, ack 1, win 58, options [nop,nop,TS val 722426 ecr 722425], length 2896

23:12:05.724647 IP 10.0.0.1.56477 > 10.0.0.2.5001: Flags [.], seq 15953:18849, ack 1, win 58, options [nop,nop,TS val 722426 ecr 722425], length 2896

23:12:05.748923 IP 10.0.0.1.56477 > 10.0.0.2.5001: Flags [.], seq 18849:21745, ack 1, win 58, options [nop,nop,TS val 722426 ecr 722425], length 2896

23:12:05.773122 IP 10.0.0.1.56477 > 10.0.0.2.5001: Flags [.], seq 21745:24641, ack 1, win 58, options [nop,nop,TS val 722429 ecr 722428], length 2896

23:12:05.797315 IP 10.0.0.1.56477 > 10.0.0.2.5001: Flags [.], seq 24641:27537, ack 1, win 58, options [nop,nop,TS val 722429 ecr 722428], length 2896

23:12:05.821513 IP 10.0.0.1.56477 > 10.0.0.2.5001: Flags [.], seq 27537:28985, ack 1, win 58, options [nop,nop,TS val 722435 ecr 722428], length 1448

23:12:05.833662 IP 10.0.0.1.56477 > 10.0.0.2.5001: Flags [.], seq 5817:7265, ack 1, win 58, options [nop,nop,TS val 722441 ecr 722441], length 1448

23:12:05.846037 IP 10.0.0.1.56477 > 10.0.0.2.5001: Flags [.], seq 28985:30433, ack 1, win 58, options [nop,nop,TS val 722441 ecr 722441], length 1448

23:12:05.857808 IP 10.0.0.1.56477 > 10.0.0.2.5001: Flags [.], seq 7265:8713, ack 1, win 58, options [nop,nop,TS val 722450 ecr 722450], length 1448

23:12:05.870025 IP 10.0.0.1.56477 > 10.0.0.2.5001: Flags [.], seq 30433:31881, ack 1, win 58, options [nop,nop,TS val 722450 ecr 722450], length 1448

23:12:05.882196 IP 10.0.0.1.56477 > 10.0.0.2.5001: Flags [P.], seq 31881:33329, ack 1, win 58, options [nop,nop,TS val 722456 ecr 722456], length 1448

23:12:05.894377 IP 10.0.0.1.56477 > 10.0.0.2.5001: Flags [.], seq 33329:36225, ack 1, win 58, options [nop,nop,TS val 722468 ecr 722468], length 2896

23:12:05.918753 IP 10.0.0.1.56477 > 10.0.0.2.5001: Flags [.], seq 36225:39121, ack 1, win 58, options [nop,nop,TS val 722474 ecr 722474], length 2896

23:12:05.942720 IP 10.0.0.1.56477 > 10.0.0.2.5001: Flags [.], seq 39121:40569, ack 1, win 58, options [nop,nop,TS val 722480 ecr 722480], length 1448

23:12:05.954882 IP 10.0.0.1.56477 > 10.0.0.2.5001: Flags [.], seq 40569:42017, ack 1, win 58, options [nop,nop,TS val 722483 ecr 722483], length 1448

23:12:05.967068 IP 10.0.0.1.56477 > 10.0.0.2.5001: Flags [.], seq 42017:43465, ack 1, win 58, options [nop,nop,TS val 722487 ecr 722486], length 1448

23:12:05.979242 IP 10.0.0.1.56477 > 10.0.0.2.5001: Flags [.], seq 43465:44913, ack 1, win 58, options [nop,nop,TS val 722490 ecr 722489], length 1448

23:12:05.990999 IP 10.0.0.1.56477 > 10.0.0.2.5001: Flags [.], seq 44913:47809, ack 1, win 58, options [nop,nop,TS val 722493 ecr 722492], length 2896

23:12:06.015407 IP 10.0.0.1.56477 > 10.0.0.2.5001: Flags [.], seq 50705:53601, ack 1, win 58, options [nop,nop,TS val 722505 ecr 722504], length 2896

23:12:06.039714 IP 10.0.0.1.56477 > 10.0.0.2.5001: Flags [.], seq 53601:56497, ack 1, win 58, options [nop,nop,TS val 722511 ecr 722510], length 2896

23:12:06.063681 IP 10.0.0.1.56477 > 10.0.0.2.5001: Flags [.], seq 56497:59393, ack 1, win 58, options [nop,nop,TS val 722517 ecr 722516], length 2896

23:12:06.088048 IP 10.0.0.1.56477 > 10.0.0.2.5001: Flags [.], seq 59393:62289, ack 1, win 58, options [nop,nop,TS val 722520 ecr 722519], length 2896

23:12:06.112124 IP 10.0.0.1.56477 > 10.0.0.2.5001: Flags [P.], seq 62289:65185, ack 1, win 58, options [nop,nop,TS val 722523 ecr 722522], length 2896

23:12:06.136421 IP 10.0.0.1.56477 > 10.0.0.2.5001: Flags [.], seq 47809:49257, ack 1, win 58, options [nop,nop,TS val 722529 ecr 722528], length 1448

23:12:06.148600 IP 10.0.0.1.56477 > 10.0.0.2.5001: Flags [.], seq 65185:66633, ack 1, win 58, options [nop,nop,TS val 722529 ecr 722528], length 1448

23:12:06.160734 IP 10.0.0.1.56477 > 10.0.0.2.5001: Flags [P.], seq 49257:50705, ack 1, win 58, options [nop,nop,TS val 722541 ecr 722540], length 1448

23:12:06.172797 IP 10.0.0.1.56477 > 10.0.0.2.5001: Flags [.], seq 66633:68081, ack 1, win 58, options [nop,nop,TS val 722541 ecr 722540], length 1448

23:12:06.184926 IP 10.0.0.1.56477 > 10.0.0.2.5001: Flags [.], seq 68081:70977, ack 1, win 58, options [nop,nop,TS val 722547 ecr 722546], length 2896

23:12:06.209124 IP 10.0.0.1.56477 > 10.0.0.2.5001: Flags [.], seq 70977:73873, ack 1, win 58, options [nop,nop,TS val 722553 ecr 722553], length 2896

23:12:06.233371 IP 10.0.0.1.56477 > 10.0.0.2.5001: Flags [.], seq 73873:75321, ack 1, win 58, options [nop,nop,TS val 722559 ecr 722559], length 1448

23:12:06.245652 IP 10.0.0.1.56477 > 10.0.0.2.5001: Flags [.], seq 75321:76769, ack 1, win 58, options [nop,nop,TS val 722562 ecr 722562], length 1448

23:12:06.257920 IP 10.0.0.1.56477 > 10.0.0.2.5001: Flags [.], seq 76769:79665, ack 1, win 58, options [nop,nop,TS val 722568 ecr 722568], length 2896

23:12:06.281802 IP 10.0.0.1.56477 > 10.0.0.2.5001: Flags [.], seq 79665:82561, ack 1, win 58, options [nop,nop,TS val 722571 ecr 722571], length 2896

23:12:06.306165 IP 10.0.0.1.56477 > 10.0.0.2.5001: Flags [.], seq 82561:85457, ack 1, win 58, options [nop,nop,TS val 722577 ecr 722577], length 2896

23:12:06.330509 IP 10.0.0.1.56477 > 10.0.0.2.5001: Flags [.], seq 85457:88353, ack 1, win 58, options [nop,nop,TS val 722583 ecr 722583], length 2896

23:12:06.354436 IP 10.0.0.1.56477 > 10.0.0.2.5001: Flags [.], seq 88353:91249, ack 1, win 58, options [nop,nop,TS val 722590 ecr 722589], length 2896

23:12:06.378852 IP 10.0.0.1.56477 > 10.0.0.2.5001: Flags [.], seq 91249:94145, ack 1, win 58, options [nop,nop,TS val 722590 ecr 722589], length 2896

23:12:06.403110 IP 10.0.0.1.56477 > 10.0.0.2.5001: Flags [P.], seq 94145:97041, ack 1, win 58, options [nop,nop,TS val 722595 ecr 722595], length 2896

23:12:06.427182 IP 10.0.0.1.56477 > 10.0.0.2.5001: Flags [.], seq 97041:99937, ack 1, win 58, options [nop,nop,TS val 722602 ecr 722601], length 2896

23:12:06.451547 IP 10.0.0.1.56477 > 10.0.0.2.5001: Flags [.], seq 99937:102833, ack 1, win 58, options [nop,nop,TS val 722608 ecr 722607], length 2896

23:12:06.475670 IP 10.0.0.1.56477 > 10.0.0.2.5001: Flags [.], seq 102833:105729, ack 1, win 58, options [nop,nop,TS val 722614 ecr 722613], length 2896

23:12:06.499871 IP 10.0.0.1.56477 > 10.0.0.2.5001: Flags [.], seq 105729:108625, ack 1, win 58, options [nop,nop,TS val 722620 ecr 722619], length 2896

23:12:06.524099 IP 10.0.0.1.56477 > 10.0.0.2.5001: Flags [.], seq 108625:111521, ack 1, win 58, options [nop,nop,TS val 722626 ecr 722625], length 2896

23:12:06.548297 IP 10.0.0.1.56477 > 10.0.0.2.5001: Flags [.], seq 111521:114417, ack 1, win 58, options [nop,nop,TS val 722632 ecr 722631], length 2896

23:12:06.572488 IP 10.0.0.1.56477 > 10.0.0.2.5001: Flags [.], seq 114417:117313, ack 1, win 58, options [nop,nop,TS val 722638 ecr 722637], length 2896

23:12:06.596685 IP 10.0.0.1.56477 > 10.0.0.2.5001: Flags [.], seq 117313:120209, ack 1, win 58, options [nop,nop,TS val 722644 ecr 722643], length 2896

23:12:06.620856 IP 10.0.0.1.56477 > 10.0.0.2.5001: Flags [.], seq 120209:123105, ack 1, win 58, options [nop,nop,TS val 722650 ecr 722649], length 2896

23:12:06.645230 IP 10.0.0.1.56477 > 10.0.0.2.5001: Flags [P.], seq 123105:126001, ack 1, win 58, options [nop,nop,TS val 722656 ecr 722655], length 2896

23:12:06.669588 IP 10.0.0.1.56477 > 10.0.0.2.5001: Flags [.], seq 126001:128897, ack 1, win 58, options [nop,nop,TS val 722662 ecr 722662], length 2896

23:12:06.693472 IP 10.0.0.1.56477 > 10.0.0.2.5001: Flags [.], seq 128897:131793, ack 1, win 58, options [nop,nop,TS val 722668 ecr 722668], length 2896

23:12:06.717905 IP 10.0.0.1.56477 > 10.0.0.2.5001: Flags [.], seq 131793:134689, ack 1, win 58, options [nop,nop,TS val 722674 ecr 722674], length 2896

23:12:06.742207 IP 10.0.0.1.56477 > 10.0.0.2.5001: Flags [.], seq 134689:137585, ack 1, win 58, options [nop,nop,TS val 722680 ecr 722680], length 2896

23:12:06.766579 IP 10.0.0.1.56477 > 10.0.0.2.5001: Flags [.], seq 137585:140481, ack 1, win 58, options [nop,nop,TS val 722686 ecr 722686], length 2896

23:12:06.790516 IP 10.0.0.1.56477 > 10.0.0.2.5001: Flags [.], seq 140481:143377, ack 1, win 58, options [nop,nop,TS val 722692 ecr 722692], length 2896

23:12:06.814837 IP 10.0.0.1.56477 > 10.0.0.2.5001: Flags [.], seq 143377:146273, ack 1, win 58, options [nop,nop,TS val 722698 ecr 722698], length 2896

23:12:06.839082 IP 10.0.0.1.56477 > 10.0.0.2.5001: Flags [.], seq 146273:149169, ack 1, win 58, options [nop,nop,TS val 722705 ecr 722704], length 2896

23:12:06.863228 IP 10.0.0.1.56477 > 10.0.0.2.5001: Flags [.], seq 149169:152065, ack 1, win 58, options [nop,nop,TS val 722711 ecr 722710], length 2896

23:12:06.887515 IP 10.0.0.1.56477 > 10.0.0.2.5001: Flags [P.], seq 152065:154961, ack 1, win 58, options [nop,nop,TS val 722717 ecr 722716], length 2896

23:12:06.911794 IP 10.0.0.1.56477 > 10.0.0.2.5001: Flags [.], seq 154961:157857, ack 1, win 58, options [nop,nop,TS val 722723 ecr 722722], length 2896

23:12:06.935878 IP 10.0.0.1.56477 > 10.0.0.2.5001: Flags [.], seq 157857:160753, ack 1, win 58, options [nop,nop,TS val 722729 ecr 722728], length 2896

23:12:06.960101 IP 10.0.0.1.56477 > 10.0.0.2.5001: Flags [.], seq 160753:163649, ack 1, win 58, options [nop,nop,TS val 722735 ecr 722734], length 2896

23:12:06.984286 IP 10.0.0.1.56477 > 10.0.0.2.5001: Flags [.], seq 163649:166545, ack 1, win 58, options [nop,nop,TS val 722741 ecr 722740], length 2896

23:12:07.008490 IP 10.0.0.1.56477 > 10.0.0.2.5001: Flags [.], seq 166545:169441, ack 1, win 58, options [nop,nop,TS val 722753 ecr 722752], length 2896

23:12:07.032646 IP 10.0.0.1.56477 > 10.0.0.2.5001: Flags [.], seq 169441:172337, ack 1, win 58, options [nop,nop,TS val 722753 ecr 722752], length 2896

23:12:07.057264 IP 10.0.0.1.56477 > 10.0.0.2.5001: Flags [.], seq 172337:175233, ack 1, win 58, options [nop,nop,TS val 722759 ecr 722758], length 2896

23:12:07.081246 IP 10.0.0.1.56477 > 10.0.0.2.5001: Flags [.], seq 175233:178129, ack 1, win 58, options [nop,nop,TS val 722765 ecr 722764], length 2896

23:12:07.105582 IP 10.0.0.1.56477 > 10.0.0.2.5001: Flags [.], seq 178129:181025, ack 1, win 58, options [nop,nop,TS val 722771 ecr 722771], length 2896

23:12:07.129839 IP 10.0.0.1.56477 > 10.0.0.2.5001: Flags [P.], seq 181025:183921, ack 1, win 58, options [nop,nop,TS val 722777 ecr 722777], length 2896

23:12:07.153944 IP 10.0.0.1.56477 > 10.0.0.2.5001: Flags [.], seq 183921:186817, ack 1, win 58, options [nop,nop,TS val 722783 ecr 722783], length 2896

23:12:07.178298 IP 10.0.0.1.56477 > 10.0.0.2.5001: Flags [.], seq 186817:189713, ack 1, win 58, options [nop,nop,TS val 722789 ecr 722789], length 2896

23:12:07.202243 IP 10.0.0.1.56477 > 10.0.0.2.5001: Flags [.], seq 189713:192609, ack 1, win 58, options [nop,nop,TS val 722795 ecr 722795], length 2896

23:12:07.226614 IP 10.0.0.1.56477 > 10.0.0.2.5001: Flags [.], seq 178129:179577, ack 1, win 58, options [nop,nop,TS val 722808 ecr 722807], length 1448

23:12:07.238771 IP 10.0.0.1.56477 > 10.0.0.2.5001: Flags [.], seq 179577:181025, ack 1, win 58, options [nop,nop,TS val 722814 ecr 722813], length 1448

23:12:07.250875 IP 10.0.0.1.56477 > 10.0.0.2.5001: Flags [.], seq 192609:194057, ack 1, win 58, options [nop,nop,TS val 722814 ecr 722813], length 1448

23:12:07.263007 IP 10.0.0.1.56477 > 10.0.0.2.5001: Flags [.], seq 194057:195505, ack 1, win 58, options [nop,nop,TS val 722820 ecr 722819], length 1448

23:12:07.274976 IP 10.0.0.1.56477 > 10.0.0.2.5001: Flags [.], seq 195505:196953, ack 1, win 58, options [nop,nop,TS val 722820 ecr 722819], length 1448

23:12:07.287154 IP 10.0.0.1.56477 > 10.0.0.2.5001: Flags [.], seq 196953:198401, ack 1, win 58, options [nop,nop,TS val 722826 ecr 722825], length 1448

23:12:07.299278 IP 10.0.0.1.56477 > 10.0.0.2.5001: Flags [.], seq 198401:199849, ack 1, win 58, options [nop,nop,TS val 722826 ecr 722825], length 1448

23:12:07.311402 IP 10.0.0.1.56477 > 10.0.0.2.5001: Flags [.], seq 199849:201297, ack 1, win 58, options [nop,nop,TS val 722832 ecr 722831], length 1448

23:12:07.323473 IP 10.0.0.1.56477 > 10.0.0.2.5001: Flags [.], seq 201297:204193, ack 1, win 58, options [nop,nop,TS val 722838 ecr 722837], length 2896

23:12:07.347668 IP 10.0.0.1.56477 > 10.0.0.2.5001: Flags [.], seq 204193:207089, ack 1, win 58, options [nop,nop,TS val 722841 ecr 722840], length 2896

23:12:07.371867 IP 10.0.0.1.56477 > 10.0.0.2.5001: Flags [.], seq 207089:209985, ack 1, win 58, options [nop,nop,TS val 722847 ecr 722846], length 2896

23:12:07.396027 IP 10.0.0.1.56477 > 10.0.0.2.5001: Flags [P.], seq 209985:212881, ack 1, win 58, options [nop,nop,TS val 722853 ecr 722852], length 2896

23:12:07.420343 IP 10.0.0.1.56477 > 10.0.0.2.5001: Flags [.], seq 212881:215777, ack 1, win 58, options [nop,nop,TS val 722856 ecr 722855], length 2896

23:12:07.444690 IP 10.0.0.1.56477 > 10.0.0.2.5001: Flags [.], seq 215777:218673, ack 1, win 58, options [nop,nop,TS val 722862 ecr 722861], length 2896

23:12:07.469052 IP 10.0.0.1.56477 > 10.0.0.2.5001: Flags [.], seq 218673:221569, ack 1, win 58, options [nop,nop,TS val 722874 ecr 722873], length 2896

23:12:07.493031 IP 10.0.0.1.56477 > 10.0.0.2.5001: Flags [.], seq 221569:224465, ack 1, win 58, options [nop,nop,TS val 722874 ecr 722873], length 2896

23:12:07.517448 IP 10.0.0.1.56477 > 10.0.0.2.5001: Flags [.], seq 224465:227361, ack 1, win 58, options [nop,nop,TS val 722880 ecr 722880], length 2896

23:12:07.541725 IP 10.0.0.1.56477 > 10.0.0.2.5001: Flags [.], seq 227361:230257, ack 1, win 58, options [nop,nop,TS val 722886 ecr 722886], length 2896

23:12:07.565732 IP 10.0.0.1.56477 > 10.0.0.2.5001: Flags [.], seq 230257:233153, ack 1, win 58, options [nop,nop,TS val 722892 ecr 722892], length 2896

23:12:07.589885 IP 10.0.0.1.56477 > 10.0.0.2.5001: Flags [.], seq 233153:236049, ack 1, win 58, options [nop,nop,TS val 722898 ecr 722898], length 2896

23:12:07.614005 IP 10.0.0.1.56477 > 10.0.0.2.5001: Flags [.], seq 236049:238945, ack 1, win 58, options [nop,nop,TS val 722904 ecr 722904], length 2896

23:12:07.638434 IP 10.0.0.1.56477 > 10.0.0.2.5001: Flags [P.], seq 238945:241841, ack 1, win 58, options [nop,nop,TS val 722916 ecr 722916], length 2896

23:12:07.662693 IP 10.0.0.1.56477 > 10.0.0.2.5001: Flags [.], seq 241841:244737, ack 1, win 58, options [nop,nop,TS val 722916 ecr 722916], length 2896

23:12:07.686722 IP 10.0.0.1.56477 > 10.0.0.2.5001: Flags [.], seq 244737:247633, ack 1, win 58, options [nop,nop,TS val 722916 ecr 722916], length 2896

23:12:07.711085 IP 10.0.0.1.56477 > 10.0.0.2.5001: Flags [.], seq 247633:250529, ack 1, win 58, options [nop,nop,TS val 722923 ecr 722922], length 2896

23:12:07.735240 IP 10.0.0.1.56477 > 10.0.0.2.5001: Flags [.], seq 250529:253425, ack 1, win 58, options [nop,nop,TS val 722929 ecr 722928], length 2896

23:12:07.759449 IP 10.0.0.1.56477 > 10.0.0.2.5001: Flags [.], seq 253425:256321, ack 1, win 58, options [nop,nop,TS val 722935 ecr 722934], length 2896

23:12:07.783676 IP 10.0.0.1.56477 > 10.0.0.2.5001: Flags [.], seq 256321:259217, ack 1, win 58, options [nop,nop,TS val 722947 ecr 722946], length 2896

23:12:07.807833 IP 10.0.0.1.56477 > 10.0.0.2.5001: Flags [.], seq 259217:262113, ack 1, win 58, options [nop,nop,TS val 722947 ecr 722946], length 2896

23:12:07.832115 IP 10.0.0.1.56477 > 10.0.0.2.5001: Flags [.], seq 262113:265009, ack 1, win 58, options [nop,nop,TS val 722953 ecr 722952], length 2896

23:12:07.856435 IP 10.0.0.1.56477 > 10.0.0.2.5001: Flags [.], seq 265009:267905, ack 1, win 58, options [nop,nop,TS val 722959 ecr 722958], length 2896

23:12:07.880793 IP 10.0.0.1.56477 > 10.0.0.2.5001: Flags [P.], seq 267905:270801, ack 1, win 58, options [nop,nop,TS val 722965 ecr 722964], length 2896

23:12:07.904846 IP 10.0.0.1.56477 > 10.0.0.2.5001: Flags [.], seq 270801:273697, ack 1, win 58, options [nop,nop,TS val 722971 ecr 722970], length 2896

23:12:07.929153 IP 10.0.0.1.56477 > 10.0.0.2.5001: Flags [.], seq 273697:276593, ack 1, win 58, options [nop,nop,TS val 722977 ecr 722976], length 2896

23:12:07.953490 IP 10.0.0.1.56477 > 10.0.0.2.5001: Flags [.], seq 276593:279489, ack 1, win 58, options [nop,nop,TS val 722983 ecr 722982], length 2896

23:12:07.977549 IP 10.0.0.1.56477 > 10.0.0.2.5001: Flags [.], seq 279489:282385, ack 1, win 58, options [nop,nop,TS val 722989 ecr 722989], length 2896

23:12:08.001837 IP 10.0.0.1.56477 > 10.0.0.2.5001: Flags [.], seq 282385:285281, ack 1, win 58, options [nop,nop,TS val 722995 ecr 722995], length 2896

23:12:08.026053 IP 10.0.0.1.56477 > 10.0.0.2.5001: Flags [.], seq 285281:288177, ack 1, win 58, options [nop,nop,TS val 723001 ecr 723001], length 2896

23:12:08.050210 IP 10.0.0.1.56477 > 10.0.0.2.5001: Flags [.], seq 288177:291073, ack 1, win 58, options [nop,nop,TS val 723007 ecr 723007], length 2896

23:12:08.074433 IP 10.0.0.1.56477 > 10.0.0.2.5001: Flags [.], seq 291073:293969, ack 1, win 58, options [nop,nop,TS val 723013 ecr 723013], length 2896

23:12:08.098646 IP 10.0.0.1.56477 > 10.0.0.2.5001: Flags [.], seq 293969:296865, ack 1, win 58, options [nop,nop,TS val 723019 ecr 723019], length 2896

23:12:08.122848 IP 10.0.0.1.56477 > 10.0.0.2.5001: Flags [P.], seq 296865:299761, ack 1, win 58, options [nop,nop,TS val 723026 ecr 723025], length 2896

23:12:08.147039 IP 10.0.0.1.56477 > 10.0.0.2.5001: Flags [.], seq 299761:302657, ack 1, win 58, options [nop,nop,TS val 723038 ecr 723037], length 2896

23:12:08.171143 IP 10.0.0.1.56477 > 10.0.0.2.5001: Flags [.], seq 302657:305553, ack 1, win 58, options [nop,nop,TS val 723038 ecr 723037], length 2896

23:12:08.195558 IP 10.0.0.1.56477 > 10.0.0.2.5001: Flags [.], seq 305553:308449, ack 1, win 58, options [nop,nop,TS val 723044 ecr 723043], length 2896

23:12:08.219854 IP 10.0.0.1.56477 > 10.0.0.2.5001: Flags [.], seq 308449:311345, ack 1, win 58, options [nop,nop,TS val 723050 ecr 723049], length 2896

23:12:08.244359 IP 10.0.0.1.56477 > 10.0.0.2.5001: Flags [.], seq 311345:314241, ack 1, win 58, options [nop,nop,TS val 723056 ecr 723055], length 2896

23:12:08.268213 IP 10.0.0.1.56477 > 10.0.0.2.5001: Flags [.], seq 314241:317137, ack 1, win 58, options [nop,nop,TS val 723062 ecr 723061], length 2896

23:12:08.292564 IP 10.0.0.1.56477 > 10.0.0.2.5001: Flags [.], seq 317137:320033, ack 1, win 58, options [nop,nop,TS val 723068 ecr 723067], length 2896

23:12:08.316859 IP 10.0.0.1.56477 > 10.0.0.2.5001: Flags [.], seq 320033:322929, ack 1, win 58, options [nop,nop,TS val 723074 ecr 723073], length 2896

23:12:08.340897 IP 10.0.0.1.56477 > 10.0.0.2.5001: Flags [.], seq 322929:325825, ack 1, win 58, options [nop,nop,TS val 723080 ecr 723079], length 2896

23:12:08.365257 IP 10.0.0.1.56477 > 10.0.0.2.5001: Flags [P.], seq 325825:328721, ack 1, win 58, options [nop,nop,TS val 723086 ecr 723086], length 2896

23:12:08.389714 IP 10.0.0.1.56477 > 10.0.0.2.5001: Flags [.], seq 328721:331617, ack 1, win 58, options [nop,nop,TS val 723092 ecr 723092], length 2896

23:12:08.413678 IP 10.0.0.1.56477 > 10.0.0.2.5001: Flags [.], seq 331617:334513, ack 1, win 58, options [nop,nop,TS val 723098 ecr 723098], length 2896

23:12:08.437734 IP 10.0.0.1.56477 > 10.0.0.2.5001: Flags [.], seq 334513:337409, ack 1, win 58, options [nop,nop,TS val 723104 ecr 723104], length 2896

23:12:08.462082 IP 10.0.0.1.56477 > 10.0.0.2.5001: Flags [.], seq 337409:340305, ack 1, win 58, options [nop,nop,TS val 723110 ecr 723110], length 2896

23:12:08.486251 IP 10.0.0.1.56477 > 10.0.0.2.5001: Flags [.], seq 340305:343201, ack 1, win 58, options [nop,nop,TS val 723116 ecr 723116], length 2896

23:12:08.510417 IP 10.0.0.1.56477 > 10.0.0.2.5001: Flags [.], seq 343201:346097, ack 1, win 58, options [nop,nop,TS val 723122 ecr 723122], length 2896

23:12:08.534650 IP 10.0.0.1.56477 > 10.0.0.2.5001: Flags [.], seq 346097:348993, ack 1, win 58, options [nop,nop,TS val 723128 ecr 723128], length 2896

23:12:08.558834 IP 10.0.0.1.56477 > 10.0.0.2.5001: Flags [.], seq 348993:351889, ack 1, win 58, options [nop,nop,TS val 723135 ecr 723134], length 2896

23:12:08.583035 IP 10.0.0.1.56477 > 10.0.0.2.5001: Flags [.], seq 351889:354785, ack 1, win 58, options [nop,nop,TS val 723141 ecr 723140], length 2896

23:12:08.607461 IP 10.0.0.1.56477 > 10.0.0.2.5001: Flags [P.], seq 354785:357681, ack 1, win 58, options [nop,nop,TS val 723147 ecr 723146], length 2896

23:12:08.631811 IP 10.0.0.1.56477 > 10.0.0.2.5001: Flags [.], seq 343201:344649, ack 1, win 58, options [nop,nop,TS val 723159 ecr 723158], length 1448

23:12:08.643631 IP 10.0.0.1.56477 > 10.0.0.2.5001: Flags [.], seq 344649:346097, ack 1, win 58, options [nop,nop,TS val 723171 ecr 723170], length 1448

23:12:08.655813 IP 10.0.0.1.56477 > 10.0.0.2.5001: Flags [.], seq 348993:350441, ack 1, win 58, options [nop,nop,TS val 723171 ecr 723170], length 1448

23:12:08.667979 IP 10.0.0.1.56477 > 10.0.0.2.5001: Flags [.], seq 357681:359129, ack 1, win 58, options [nop,nop,TS val 723171 ecr 723170], length 1448

23:12:08.680158 IP 10.0.0.1.56477 > 10.0.0.2.5001: Flags [.], seq 350441:351889, ack 1, win 58, options [nop,nop,TS val 723177 ecr 723176], length 1448

23:12:08.692326 IP 10.0.0.1.56477 > 10.0.0.2.5001: Flags [.], seq 359129:360577, ack 1, win 58, options [nop,nop,TS val 723177 ecr 723176], length 1448

23:12:08.704134 IP 10.0.0.1.56477 > 10.0.0.2.5001: Flags [.], seq 360577:362025, ack 1, win 58, options [nop,nop,TS val 723177 ecr 723176], length 1448

23:12:08.716325 IP 10.0.0.1.56477 > 10.0.0.2.5001: Flags [.], seq 362025:363473, ack 1, win 58, options [nop,nop,TS val 723183 ecr 723182], length 1448

23:12:08.728503 IP 10.0.0.1.56477 > 10.0.0.2.5001: Flags [.], seq 363473:364921, ack 1, win 58, options [nop,nop,TS val 723186 ecr 723185], length 1448

23:12:08.740679 IP 10.0.0.1.56477 > 10.0.0.2.5001: Flags [.], seq 364921:366369, ack 1, win 58, options [nop,nop,TS val 723189 ecr 723188], length 1448

23:12:08.752835 IP 10.0.0.1.56477 > 10.0.0.2.5001: Flags [.], seq 366369:367817, ack 1, win 58, options [nop,nop,TS val 723192 ecr 723191], length 1448

23:12:08.764963 IP 10.0.0.1.56477 > 10.0.0.2.5001: Flags [.], seq 367817:369265, ack 1, win 58, options [nop,nop,TS val 723195 ecr 723195], length 1448

23:12:08.776855 IP 10.0.0.1.56477 > 10.0.0.2.5001: Flags [.], seq 369265:372161, ack 1, win 58, options [nop,nop,TS val 723198 ecr 723198], length 2896

23:12:08.801212 IP 10.0.0.1.56477 > 10.0.0.2.5001: Flags [.], seq 372161:375057, ack 1, win 58, options [nop,nop,TS val 723204 ecr 723204], length 2896

23:12:08.825460 IP 10.0.0.1.56477 > 10.0.0.2.5001: Flags [.], seq 375057:377953, ack 1, win 58, options [nop,nop,TS val 723210 ecr 723210], length 2896

23:12:08.849497 IP 10.0.0.1.56477 > 10.0.0.2.5001: Flags [.], seq 377953:380849, ack 1, win 58, options [nop,nop,TS val 723213 ecr 723213], length 2896

23:12:08.873682 IP 10.0.0.1.56477 > 10.0.0.2.5001: Flags [.], seq 380849:383745, ack 1, win 58, options [nop,nop,TS val 723225 ecr 723225], length 2896

23:12:08.897958 IP 10.0.0.1.56477 > 10.0.0.2.5001: Flags [P.], seq 383745:386641, ack 1, win 58, options [nop,nop,TS val 723225 ecr 723225], length 2896

23:12:08.922176 IP 10.0.0.1.56477 > 10.0.0.2.5001: Flags [.], seq 386641:389537, ack 1, win 58, options [nop,nop,TS val 723231 ecr 723231], length 2896

23:12:08.946383 IP 10.0.0.1.56477 > 10.0.0.2.5001: Flags [.], seq 389537:392433, ack 1, win 58, options [nop,nop,TS val 723237 ecr 723237], length 2896

23:12:08.970951 IP 10.0.0.1.56477 > 10.0.0.2.5001: Flags [.], seq 392433:395329, ack 1, win 58, options [nop,nop,TS val 723243 ecr 723243], length 2896

23:12:08.994891 IP 10.0.0.1.56477 > 10.0.0.2.5001: Flags [.], seq 395329:398225, ack 1, win 58, options [nop,nop,TS val 723249 ecr 723249], length 2896

23:12:09.019278 IP 10.0.0.1.56477 > 10.0.0.2.5001: Flags [.], seq 398225:401121, ack 1, win 58, options [nop,nop,TS val 723256 ecr 723255], length 2896

23:12:09.043635 IP 10.0.0.1.56477 > 10.0.0.2.5001: Flags [.], seq 401121:404017, ack 1, win 58, options [nop,nop,TS val 723262 ecr 723261], length 2896

23:12:09.067603 IP 10.0.0.1.56477 > 10.0.0.2.5001: Flags [.], seq 404017:406913, ack 1, win 58, options [nop,nop,TS val 723262 ecr 723261], length 2896

23:12:09.091959 IP 10.0.0.1.56477 > 10.0.0.2.5001: Flags [.], seq 406913:409809, ack 1, win 58, options [nop,nop,TS val 723268 ecr 723267], length 2896

23:12:09.116015 IP 10.0.0.1.56477 > 10.0.0.2.5001: Flags [P.], seq 412705:415601, ack 1, win 58, options [nop,nop,TS val 723280 ecr 723279], length 2896

23:12:09.140293 IP 10.0.0.1.56477 > 10.0.0.2.5001: Flags [.], seq 415601:418497, ack 1, win 58, options [nop,nop,TS val 723286 ecr 723285], length 2896

23:12:09.164641 IP 10.0.0.1.56477 > 10.0.0.2.5001: Flags [.], seq 418497:421393, ack 1, win 58, options [nop,nop,TS val 723292 ecr 723291], length 2896

23:12:09.188619 IP 10.0.0.1.56477 > 10.0.0.2.5001: Flags [.], seq 421393:424289, ack 1, win 58, options [nop,nop,TS val 723298 ecr 723297], length 2896

23:12:09.212985 IP 10.0.0.1.56477 > 10.0.0.2.5001: Flags [.], seq 409809:411257, ack 1, win 58, options [nop,nop,TS val 723304 ecr 723303], length 1448

23:12:09.225108 IP 10.0.0.1.56477 > 10.0.0.2.5001: Flags [.], seq 411257:412705, ack 1, win 58, options [nop,nop,TS val 723310 ecr 723310], length 1448

23:12:09.237199 IP 10.0.0.1.56477 > 10.0.0.2.5001: Flags [.], seq 424289:425737, ack 1, win 58, options [nop,nop,TS val 723310 ecr 723310], length 1448

23:12:09.249301 IP 10.0.0.1.56477 > 10.0.0.2.5001: Flags [.], seq 425737:427185, ack 1, win 58, options [nop,nop,TS val 723316 ecr 723316], length 1448

23:12:09.261411 IP 10.0.0.1.56477 > 10.0.0.2.5001: Flags [.], seq 427185:428633, ack 1, win 58, options [nop,nop,TS val 723316 ecr 723316], length 1448

23:12:09.273522 IP 10.0.0.1.56477 > 10.0.0.2.5001: Flags [.], seq 428633:430081, ack 1, win 58, options [nop,nop,TS val 723322 ecr 723322], length 1448

23:12:09.285629 IP 10.0.0.1.56477 > 10.0.0.2.5001: Flags [.], seq 430081:431529, ack 1, win 58, options [nop,nop,TS val 723322 ecr 723322], length 1448

23:12:09.297679 IP 10.0.0.1.56477 > 10.0.0.2.5001: Flags [.], seq 431529:432977, ack 1, win 58, options [nop,nop,TS val 723328 ecr 723328], length 1448

23:12:09.309817 IP 10.0.0.1.56477 > 10.0.0.2.5001: Flags [.], seq 432977:435873, ack 1, win 58, options [nop,nop,TS val 723334 ecr 723334], length 2896

23:12:09.333967 IP 10.0.0.1.56477 > 10.0.0.2.5001: Flags [.], seq 435873:438769, ack 1, win 58, options [nop,nop,TS val 723337 ecr 723337], length 2896

23:12:09.358222 IP 10.0.0.1.56477 > 10.0.0.2.5001: Flags [.], seq 438769:441665, ack 1, win 58, options [nop,nop,TS val 723343 ecr 723343], length 2896

23:12:09.382743 IP 10.0.0.1.56477 > 10.0.0.2.5001: Flags [P.], seq 441665:444561, ack 1, win 58, options [nop,nop,TS val 723349 ecr 723349], length 2896

23:12:09.406731 IP 10.0.0.1.56477 > 10.0.0.2.5001: Flags [.], seq 444561:447457, ack 1, win 58, options [nop,nop,TS val 723353 ecr 723352], length 2896

23:12:09.431173 IP 10.0.0.1.56477 > 10.0.0.2.5001: Flags [.], seq 447457:450353, ack 1, win 58, options [nop,nop,TS val 723359 ecr 723358], length 2896

23:12:09.455467 IP 10.0.0.1.56477 > 10.0.0.2.5001: Flags [.], seq 450353:453249, ack 1, win 58, options [nop,nop,TS val 723365 ecr 723364], length 2896

23:12:09.479477 IP 10.0.0.1.56477 > 10.0.0.2.5001: Flags [.], seq 453249:456145, ack 1, win 58, options [nop,nop,TS val 723371 ecr 723370], length 2896

23:12:09.503682 IP 10.0.0.1.56477 > 10.0.0.2.5001: Flags [.], seq 456145:459041, ack 1, win 58, options [nop,nop,TS val 723377 ecr 723376], length 2896

23:12:09.527927 IP 10.0.0.1.56477 > 10.0.0.2.5001: Flags [.], seq 459041:461937, ack 1, win 58, options [nop,nop,TS val 723383 ecr 723382], length 2896

23:12:09.552143 IP 10.0.0.1.56477 > 10.0.0.2.5001: Flags [.], seq 461937:464833, ack 1, win 58, options [nop,nop,TS val 723389 ecr 723388], length 2896

23:12:09.576509 IP 10.0.0.1.56477 > 10.0.0.2.5001: Flags [.], seq 464833:467729, ack 1, win 58, options [nop,nop,TS val 723395 ecr 723394], length 2896

23:12:09.600686 IP 10.0.0.1.56477 > 10.0.0.2.5001: Flags [.], seq 467729:470625, ack 1, win 58, options [nop,nop,TS val 723401 ecr 723400], length 2896

23:12:09.624827 IP 10.0.0.1.56477 > 10.0.0.2.5001: Flags [.], seq 473521:476417, ack 1, win 58, options [nop,nop,TS val 723413 ecr 723413], length 2896

23:12:09.649088 IP 10.0.0.1.56477 > 10.0.0.2.5001: Flags [.], seq 476417:479313, ack 1, win 58, options [nop,nop,TS val 723419 ecr 723419], length 2896

23:12:09.673194 IP 10.0.0.1.56477 > 10.0.0.2.5001: Flags [.], seq 479313:482209, ack 1, win 58, options [nop,nop,TS val 723425 ecr 723425], length 2896

23:12:09.697422 IP 10.0.0.1.56477 > 10.0.0.2.5001: Flags [.], seq 470625:472073, ack 1, win 58, options [nop,nop,TS val 723431 ecr 723431], length 1448

23:12:09.709518 IP 10.0.0.1.56477 > 10.0.0.2.5001: Flags [P.], seq 472073:473521, ack 1, win 58, options [nop,nop,TS val 723437 ecr 723437], length 1448

23:12:09.721585 IP 10.0.0.1.56477 > 10.0.0.2.5001: Flags [.], seq 482209:485105, ack 1, win 58, options [nop,nop,TS val 723437 ecr 723437], length 2896

23:12:09.746324 IP 10.0.0.1.56477 > 10.0.0.2.5001: Flags [.], seq 485105:488001, ack 1, win 58, options [nop,nop,TS val 723443 ecr 723443], length 2896

23:12:09.770091 IP 10.0.0.1.56477 > 10.0.0.2.5001: Flags [.], seq 488001:489449, ack 1, win 58, options [nop,nop,TS val 723449 ecr 723449], length 1448

23:12:09.782286 IP 10.0.0.1.56477 > 10.0.0.2.5001: Flags [.], seq 489449:490897, ack 1, win 58, options [nop,nop,TS val 723452 ecr 723452], length 1448

23:12:09.794438 IP 10.0.0.1.56477 > 10.0.0.2.5001: Flags [.], seq 490897:493793, ack 1, win 58, options [nop,nop,TS val 723455 ecr 723455], length 2896

23:12:09.818770 IP 10.0.0.1.56477 > 10.0.0.2.5001: Flags [.], seq 493793:496689, ack 1, win 58, options [nop,nop,TS val 723462 ecr 723461], length 2896

23:12:09.842779 IP 10.0.0.1.56477 > 10.0.0.2.5001: Flags [.], seq 496689:499585, ack 1, win 58, options [nop,nop,TS val 723468 ecr 723467], length 2896

23:12:09.866946 IP 10.0.0.1.56477 > 10.0.0.2.5001: Flags [P.], seq 499585:502481, ack 1, win 58, options [nop,nop,TS val 723474 ecr 723473], length 2896

23:12:09.891419 IP 10.0.0.1.56477 > 10.0.0.2.5001: Flags [.], seq 502481:505377, ack 1, win 58, options [nop,nop,TS val 723474 ecr 723473], length 2896

23:12:09.915492 IP 10.0.0.1.56477 > 10.0.0.2.5001: Flags [.], seq 505377:508273, ack 1, win 58, options [nop,nop,TS val 723480 ecr 723479], length 2896

23:12:09.939791 IP 10.0.0.1.56477 > 10.0.0.2.5001: Flags [.], seq 508273:511169, ack 1, win 58, options [nop,nop,TS val 723486 ecr 723485], length 2896

23:12:09.964051 IP 10.0.0.1.56477 > 10.0.0.2.5001: Flags [.], seq 511169:514065, ack 1, win 58, options [nop,nop,TS val 723492 ecr 723491], length 2896

23:12:09.988126 IP 10.0.0.1.56477 > 10.0.0.2.5001: Flags [.], seq 514065:516961, ack 1, win 58, options [nop,nop,TS val 723498 ecr 723497], length 2896

23:12:10.012398 IP 10.0.0.1.56477 > 10.0.0.2.5001: Flags [.], seq 516961:519857, ack 1, win 58, options [nop,nop,TS val 723510 ecr 723509], length 2896

23:12:10.036440 IP 10.0.0.1.56477 > 10.0.0.2.5001: Flags [.], seq 519857:522753, ack 1, win 58, options [nop,nop,TS val 723510 ecr 723509], length 2896

23:12:10.060851 IP 10.0.0.1.56477 > 10.0.0.2.5001: Flags [.], seq 525649:528545, ack 1, win 58, options [nop,nop,TS val 723522 ecr 723521], length 2896

23:12:10.084994 IP 10.0.0.1.56477 > 10.0.0.2.5001: Flags [P.], seq 528545:531441, ack 1, win 58, options [nop,nop,TS val 723528 ecr 723528], length 2896

23:12:10.109170 IP 10.0.0.1.56477 > 10.0.0.2.5001: Flags [.], seq 531441:534337, ack 1, win 58, options [nop,nop,TS val 723534 ecr 723534], length 2896

23:12:10.133441 IP 10.0.0.1.56477 > 10.0.0.2.5001: Flags [.], seq 522753:524201, ack 1, win 58, options [nop,nop,TS val 723540 ecr 723540], length 1448

23:12:10.145713 IP 10.0.0.1.56477 > 10.0.0.2.5001: Flags [.], seq 524201:525649, ack 1, win 58, options [nop,nop,TS val 723546 ecr 723546], length 1448

23:12:10.157767 IP 10.0.0.1.56477 > 10.0.0.2.5001: Flags [.], seq 534337:535785, ack 1, win 58, options [nop,nop,TS val 723546 ecr 723546], length 1448

23:12:10.169935 IP 10.0.0.1.56477 > 10.0.0.2.5001: Flags [.], seq 535785:537233, ack 1, win 58, options [nop,nop,TS val 723552 ecr 723552], length 1448

23:12:10.181866 IP 10.0.0.1.56477 > 10.0.0.2.5001: Flags [.], seq 537233:538681, ack 1, win 58, options [nop,nop,TS val 723552 ecr 723552], length 1448

23:12:10.194054 IP 10.0.0.1.56477 > 10.0.0.2.5001: Flags [.], seq 538681:540129, ack 1, win 58, options [nop,nop,TS val 723558 ecr 723558], length 1448

23:12:10.206215 IP 10.0.0.1.56477 > 10.0.0.2.5001: Flags [.], seq 540129:543025, ack 1, win 58, options [nop,nop,TS val 723564 ecr 723564], length 2896

23:12:10.230571 IP 10.0.0.1.56477 > 10.0.0.2.5001: Flags [.], seq 543025:545921, ack 1, win 58, options [nop,nop,TS val 723568 ecr 723567], length 2896

23:12:10.254550 IP 10.0.0.1.56477 > 10.0.0.2.5001: Flags [.], seq 545921:548817, ack 1, win 58, options [nop,nop,TS val 723574 ecr 723573], length 2896

23:12:10.278950 IP 10.0.0.1.56477 > 10.0.0.2.5001: Flags [.], seq 548817:551713, ack 1, win 58, options [nop,nop,TS val 723577 ecr 723576], length 2896

23:12:10.303247 IP 10.0.0.1.56477 > 10.0.0.2.5001: Flags [.], seq 551713:554609, ack 1, win 58, options [nop,nop,TS val 723583 ecr 723582], length 2896

23:12:10.327291 IP 10.0.0.1.56477 > 10.0.0.2.5001: Flags [.], seq 554609:557505, ack 1, win 58, options [nop,nop,TS val 723589 ecr 723588], length 2896

23:12:10.351662 IP 10.0.0.1.56477 > 10.0.0.2.5001: Flags [.], seq 557505:560401, ack 1, win 58, options [nop,nop,TS val 723595 ecr 723594], length 2896

23:12:10.375799 IP 10.0.0.1.56477 > 10.0.0.2.5001: Flags [P.], seq 560401:563297, ack 1, win 58, options [nop,nop,TS val 723601 ecr 723600], length 2896

23:12:10.399972 IP 10.0.0.1.56477 > 10.0.0.2.5001: Flags [.], seq 563297:566193, ack 1, win 58, options [nop,nop,TS val 723607 ecr 723606], length 2896

23:12:10.424262 IP 10.0.0.1.56477 > 10.0.0.2.5001: Flags [.], seq 566193:569089, ack 1, win 58, options [nop,nop,TS val 723613 ecr 723612], length 2896

23:12:10.448444 IP 10.0.0.1.56477 > 10.0.0.2.5001: Flags [.], seq 569089:571985, ack 1, win 58, options [nop,nop,TS val 723619 ecr 723618], length 2896

23:12:10.472563 IP 10.0.0.1.56477 > 10.0.0.2.5001: Flags [.], seq 563297:564745, ack 1, win 58, options [nop,nop,TS val 723631 ecr 723631], length 1448

23:12:10.484683 IP 10.0.0.1.56477 > 10.0.0.2.5001: Flags [.], seq 564745:566193, ack 1, win 58, options [nop,nop,TS val 723637 ecr 723637], length 1448

23:12:10.496754 IP 10.0.0.1.56477 > 10.0.0.2.5001: Flags [.], seq 571985:574881, ack 1, win 58, options [nop,nop,TS val 723637 ecr 723637], length 2896

23:12:10.520993 IP 10.0.0.1.56477 > 10.0.0.2.5001: Flags [.], seq 574881:576329, ack 1, win 58, options [nop,nop,TS val 723643 ecr 723643], length 1448

23:12:10.533078 IP 10.0.0.1.56477 > 10.0.0.2.5001: Flags [.], seq 576329:577777, ack 1, win 58, options [nop,nop,TS val 723646 ecr 723646], length 1448

23:12:10.545250 IP 10.0.0.1.56477 > 10.0.0.2.5001: Flags [.], seq 577777:580673, ack 1, win 58, options [nop,nop,TS val 723649 ecr 723649], length 2896

23:12:10.569599 IP 10.0.0.1.56477 > 10.0.0.2.5001: Flags [.], seq 580673:583569, ack 1, win 58, options [nop,nop,TS val 723655 ecr 723655], length 2896

23:12:10.593780 IP 10.0.0.1.56477 > 10.0.0.2.5001: Flags [.], seq 583569:586465, ack 1, win 58, options [nop,nop,TS val 723661 ecr 723661], length 2896

23:12:10.609232 ARP, Request who-has 10.0.0.1 tell 10.0.0.2, length 28

23:12:10.617947 IP 10.0.0.1.56477 > 10.0.0.2.5001: Flags [P.], seq 589361:592257, ack 1, win 58, options [nop,nop,TS val 723667 ecr 723667], length 2896

23:12:10.642332 IP 10.0.0.1.56477 > 10.0.0.2.5001: Flags [.], seq 592257:595153, ack 1, win 58, options [nop,nop,TS val 723673 ecr 723673], length 2896

23:12:10.666517 ARP, Reply 10.0.0.1 is-at 5e:e6:fd:ce:0d:ff, length 28

23:12:10.666558 IP 10.0.0.1.56477 > 10.0.0.2.5001: Flags [.], seq 586465:587913, ack 1, win 58, options [nop,nop,TS val 723680 ecr 723679], length 1448

23:12:10.678787 IP 10.0.0.1.56477 > 10.0.0.2.5001: Flags [.], seq 587913:589361, ack 1, win 58, options [nop,nop,TS val 723686 ecr 723685], length 1448

23:12:10.690963 IP 10.0.0.1.56477 > 10.0.0.2.5001: Flags [.], seq 595153:598049, ack 1, win 58, options [nop,nop,TS val 723686 ecr 723685], length 2896

23:12:10.715293 IP 10.0.0.1.56477 > 10.0.0.2.5001: Flags [.], seq 598049:599497, ack 1, win 58, options [nop,nop,TS val 723692 ecr 723691], length 1448

23:12:10.727367 IP 10.0.0.1.56477 > 10.0.0.2.5001: Flags [.], seq 599497:600945, ack 1, win 58, options [nop,nop,TS val 723695 ecr 723694], length 1448

23:12:10.739291 IP 10.0.0.1.56477 > 10.0.0.2.5001: Flags [.], seq 600945:603841, ack 1, win 58, options [nop,nop,TS val 723698 ecr 723697], length 2896

23:12:10.763671 IP 10.0.0.1.56477 > 10.0.0.2.5001: Flags [.], seq 603841:606737, ack 1, win 58, options [nop,nop,TS val 723704 ecr 723703], length 2896

23:12:10.787935 IP 10.0.0.1.56477 > 10.0.0.2.5001: Flags [.], seq 606737:609633, ack 1, win 58, options [nop,nop,TS val 723710 ecr 723709], length 2896

23:12:10.812009 IP 10.0.0.1.56477 > 10.0.0.2.5001: Flags [.], seq 609633:612529, ack 1, win 58, options [nop,nop,TS val 723710 ecr 723709], length 2896

23:12:10.836294 IP 10.0.0.1.56477 > 10.0.0.2.5001: Flags [.], seq 612529:615425, ack 1, win 58, options [nop,nop,TS val 723716 ecr 723715], length 2896

23:12:10.860462 IP 10.0.0.1.56477 > 10.0.0.2.5001: Flags [.], seq 615425:618321, ack 1, win 58, options [nop,nop,TS val 723722 ecr 723721], length 2896

23:12:10.884654 IP 10.0.0.1.56477 > 10.0.0.2.5001: Flags [P.], seq 618321:621217, ack 1, win 58, options [nop,nop,TS val 723728 ecr 723727], length 2896

23:12:10.908869 IP 10.0.0.1.56477 > 10.0.0.2.5001: Flags [.], seq 621217:624113, ack 1, win 58, options [nop,nop,TS val 723734 ecr 723734], length 2896

23:12:10.933069 IP 10.0.0.1.56477 > 10.0.0.2.5001: Flags [.], seq 624113:627009, ack 1, win 58, options [nop,nop,TS val 723740 ecr 723740], length 2896

23:12:10.957457 IP 10.0.0.1.56477 > 10.0.0.2.5001: Flags [.], seq 627009:629905, ack 1, win 58, options [nop,nop,TS val 723746 ecr 723746], length 2896

23:12:10.981753 IP 10.0.0.1.56477 > 10.0.0.2.5001: Flags [.], seq 629905:632801, ack 1, win 58, options [nop,nop,TS val 723752 ecr 723752], length 2896

23:12:11.006107 IP 10.0.0.1.56477 > 10.0.0.2.5001: Flags [.], seq 632801:635697, ack 1, win 58, options [nop,nop,TS val 723758 ecr 723758], length 2896

23:12:11.030094 IP 10.0.0.1.56477 > 10.0.0.2.5001: Flags [.], seq 635697:638593, ack 1, win 58, options [nop,nop,TS val 723764 ecr 723764], length 2896

23:12:11.054510 IP 10.0.0.1.56477 > 10.0.0.2.5001: Flags [.], seq 638593:641489, ack 1, win 58, options [nop,nop,TS val 723771 ecr 723770], length 2896

23:12:11.078741 IP 10.0.0.1.56477 > 10.0.0.2.5001: Flags [.], seq 641489:644385, ack 1, win 58, options [nop,nop,TS val 723777 ecr 723776], length 2896

23:12:11.102696 IP 10.0.0.1.56477 > 10.0.0.2.5001: Flags [.], seq 644385:647281, ack 1, win 58, options [nop,nop,TS val 723783 ecr 723782], length 2896

23:12:11.127092 IP 10.0.0.1.56477 > 10.0.0.2.5001: Flags [.], seq 647281:650177, ack 1, win 58, options [nop,nop,TS val 723789 ecr 723788], length 2896

23:12:11.151038 IP 10.0.0.1.56477 > 10.0.0.2.5001: Flags [P.], seq 650177:653073, ack 1, win 58, options [nop,nop,TS val 723795 ecr 723794], length 2896

23:12:11.175476 IP 10.0.0.1.56477 > 10.0.0.2.5001: Flags [.], seq 653073:655969, ack 1, win 58, options [nop,nop,TS val 723801 ecr 723800], length 2896

23:12:11.199692 IP 10.0.0.1.56477 > 10.0.0.2.5001: Flags [.], seq 655969:658865, ack 1, win 58, options [nop,nop,TS val 723807 ecr 723806], length 2896

23:12:11.223782 IP 10.0.0.1.56477 > 10.0.0.2.5001: Flags [.], seq 658865:661761, ack 1, win 58, options [nop,nop,TS val 723813 ecr 723812], length 2896

23:12:11.248129 IP 10.0.0.1.56477 > 10.0.0.2.5001: Flags [.], seq 661761:664657, ack 1, win 58, options [nop,nop,TS val 723819 ecr 723818], length 2896

23:12:11.272273 IP 10.0.0.1.56477 > 10.0.0.2.5001: Flags [.], seq 664657:667553, ack 1, win 58, options [nop,nop,TS val 723825 ecr 723824], length 2896

23:12:11.296465 IP 10.0.0.1.56477 > 10.0.0.2.5001: Flags [.], seq 667553:670449, ack 1, win 58, options [nop,nop,TS val 723831 ecr 723830], length 2896

23:12:11.320800 IP 10.0.0.1.56477 > 10.0.0.2.5001: Flags [.], seq 670449:673345, ack 1, win 58, options [nop,nop,TS val 723837 ecr 723837], length 2896

23:12:11.345150 IP 10.0.0.1.56477 > 10.0.0.2.5001: Flags [.], seq 673345:676241, ack 1, win 58, options [nop,nop,TS val 723843 ecr 723843], length 2896

23:12:11.369144 IP 10.0.0.1.56477 > 10.0.0.2.5001: Flags [.], seq 676241:679137, ack 1, win 58, options [nop,nop,TS val 723849 ecr 723849], length 2896

23:12:11.393516 IP 10.0.0.1.56477 > 10.0.0.2.5001: Flags [P.], seq 679137:682033, ack 1, win 58, options [nop,nop,TS val 723855 ecr 723855], length 2896

23:12:11.417861 IP 10.0.0.1.56477 > 10.0.0.2.5001: Flags [.], seq 682033:684929, ack 1, win 58, options [nop,nop,TS val 723861 ecr 723861], length 2896

23:12:11.441922 IP 10.0.0.1.56477 > 10.0.0.2.5001: Flags [.], seq 684929:687825, ack 1, win 58, options [nop,nop,TS val 723867 ecr 723867], length 2896

23:12:11.466183 IP 10.0.0.1.56477 > 10.0.0.2.5001: Flags [.], seq 687825:690721, ack 1, win 58, options [nop,nop,TS val 723873 ecr 723873], length 2896

23:12:11.490500 IP 10.0.0.1.56477 > 10.0.0.2.5001: Flags [.], seq 690721:693617, ack 1, win 58, options [nop,nop,TS val 723879 ecr 723879], length 2896

23:12:11.514497 IP 10.0.0.1.56477 > 10.0.0.2.5001: Flags [.], seq 693617:696513, ack 1, win 58, options [nop,nop,TS val 723886 ecr 723885], length 2896

23:12:11.538852 IP 10.0.0.1.56477 > 10.0.0.2.5001: Flags [.], seq 696513:699409, ack 1, win 58, options [nop,nop,TS val 723892 ecr 723891], length 2896

23:12:11.563120 IP 10.0.0.1.56477 > 10.0.0.2.5001: Flags [.], seq 699409:702305, ack 1, win 58, options [nop,nop,TS val 723898 ecr 723897], length 2896

23:12:11.587199 IP 10.0.0.1.56477 > 10.0.0.2.5001: Flags [.], seq 702305:705201, ack 1, win 58, options [nop,nop,TS val 723904 ecr 723903], length 2896

23:12:11.611497 IP 10.0.0.1.56477 > 10.0.0.2.5001: Flags [.], seq 705201:708097, ack 1, win 58, options [nop,nop,TS val 723910 ecr 723909], length 2896

23:12:11.635659 IP 10.0.0.1.56477 > 10.0.0.2.5001: Flags [P.], seq 708097:710993, ack 1, win 58, options [nop,nop,TS val 723916 ecr 723915], length 2896

23:12:11.659882 IP 10.0.0.1.56477 > 10.0.0.2.5001: Flags [.], seq 710993:713889, ack 1, win 58, options [nop,nop,TS val 723916 ecr 723915], length 2896

23:12:11.684107 IP 10.0.0.1.56477 > 10.0.0.2.5001: Flags [.], seq 713889:716785, ack 1, win 58, options [nop,nop,TS val 723922 ecr 723921], length 2896

23:12:11.708283 IP 10.0.0.1.56477 > 10.0.0.2.5001: Flags [.], seq 716785:719681, ack 1, win 58, options [nop,nop,TS val 723928 ecr 723927], length 2896

23:12:11.733502 IP 10.0.0.1.56477 > 10.0.0.2.5001: Flags [.], seq 719681:722577, ack 1, win 58, options [nop,nop,TS val 723934 ecr 723933], length 2896

23:12:11.756861 IP 10.0.0.1.56477 > 10.0.0.2.5001: Flags [.], seq 722577:725473, ack 1, win 58, options [nop,nop,TS val 723940 ecr 723939], length 2896

23:12:11.781268 IP 10.0.0.1.56477 > 10.0.0.2.5001: Flags [.], seq 725473:728369, ack 1, win 58, options [nop,nop,TS val 723946 ecr 723946], length 2896

23:12:11.805246 IP 10.0.0.1.56477 > 10.0.0.2.5001: Flags [.], seq 728369:731265, ack 1, win 58, options [nop,nop,TS val 723952 ecr 723952], length 2896

23:12:11.829598 IP 10.0.0.1.56477 > 10.0.0.2.5001: Flags [.], seq 731265:734161, ack 1, win 58, options [nop,nop,TS val 723958 ecr 723958], length 2896

23:12:11.854014 IP 10.0.0.1.56477 > 10.0.0.2.5001: Flags [.], seq 734161:737057, ack 1, win 58, options [nop,nop,TS val 723964 ecr 723964], length 2896

23:12:11.877925 IP 10.0.0.1.56477 > 10.0.0.2.5001: Flags [P.], seq 737057:739953, ack 1, win 58, options [nop,nop,TS val 723970 ecr 723970], length 2896

23:12:11.902929 IP 10.0.0.1.56477 > 10.0.0.2.5001: Flags [.], seq 739953:742849, ack 1, win 58, options [nop,nop,TS val 723976 ecr 723976], length 2896

23:12:11.926474 IP 10.0.0.1.56477 > 10.0.0.2.5001: Flags [.], seq 742849:745745, ack 1, win 58, options [nop,nop,TS val 723982 ecr 723982], length 2896

23:12:11.950585 IP 10.0.0.1.56477 > 10.0.0.2.5001: Flags [.], seq 745745:748641, ack 1, win 58, options [nop,nop,TS val 723989 ecr 723988], length 2896

23:12:11.974869 IP 10.0.0.1.56477 > 10.0.0.2.5001: Flags [.], seq 748641:751537, ack 1, win 58, options [nop,nop,TS val 723995 ecr 723994], length 2896

23:12:11.999061 IP 10.0.0.1.56477 > 10.0.0.2.5001: Flags [.], seq 751537:754433, ack 1, win 58, options [nop,nop,TS val 724001 ecr 724000], length 2896

23:12:12.023261 IP 10.0.0.1.56477 > 10.0.0.2.5001: Flags [.], seq 754433:757329, ack 1, win 58, options [nop,nop,TS val 724007 ecr 724006], length 2896

23:12:12.047441 IP 10.0.0.1.56477 > 10.0.0.2.5001: Flags [.], seq 757329:760225, ack 1, win 58, options [nop,nop,TS val 724013 ecr 724012], length 2896

23:12:12.071610 IP 10.0.0.1.56477 > 10.0.0.2.5001: Flags [.], seq 760225:763121, ack 1, win 58, options [nop,nop,TS val 724019 ecr 724018], length 2896

23:12:12.095790 IP 10.0.0.1.56477 > 10.0.0.2.5001: Flags [.], seq 763121:766017, ack 1, win 58, options [nop,nop,TS val 724025 ecr 724024], length 2896

23:12:12.120159 IP 10.0.0.1.56477 > 10.0.0.2.5001: Flags [P.], seq 766017:768913, ack 1, win 58, options [nop,nop,TS val 724031 ecr 724030], length 2896

23:12:12.144621 IP 10.0.0.1.56477 > 10.0.0.2.5001: Flags [.], seq 768913:771809, ack 1, win 58, options [nop,nop,TS val 724037 ecr 724036], length 2896

23:12:12.168627 IP 10.0.0.1.56477 > 10.0.0.2.5001: Flags [.], seq 771809:774705, ack 1, win 58, options [nop,nop,TS val 724043 ecr 724042], length 2896

23:12:12.192979 IP 10.0.0.1.56477 > 10.0.0.2.5001: Flags [.], seq 774705:777601, ack 1, win 58, options [nop,nop,TS val 724055 ecr 724054], length 2896

23:12:12.217285 IP 10.0.0.1.56477 > 10.0.0.2.5001: Flags [.], seq 777601:780497, ack 1, win 58, options [nop,nop,TS val 724055 ecr 724054], length 2896

23:12:12.241292 IP 10.0.0.1.56477 > 10.0.0.2.5001: Flags [.], seq 780497:783393, ack 1, win 58, options [nop,nop,TS val 724061 ecr 724061], length 2896

23:12:12.265659 IP 10.0.0.1.56477 > 10.0.0.2.5001: Flags [.], seq 783393:786289, ack 1, win 58, options [nop,nop,TS val 724067 ecr 724067], length 2896

23:12:12.289750 IP 10.0.0.1.56477 > 10.0.0.2.5001: Flags [.], seq 786289:789185, ack 1, win 58, options [nop,nop,TS val 724073 ecr 724073], length 2896

23:12:12.313997 IP 10.0.0.1.56477 > 10.0.0.2.5001: Flags [.], seq 789185:792081, ack 1, win 58, options [nop,nop,TS val 724079 ecr 724079], length 2896

23:12:12.338243 IP 10.0.0.1.56477 > 10.0.0.2.5001: Flags [.], seq 792081:794977, ack 1, win 58, options [nop,nop,TS val 724085 ecr 724085], length 2896

23:12:12.362279 IP 10.0.0.1.56477 > 10.0.0.2.5001: Flags [P.], seq 794977:797873, ack 1, win 58, options [nop,nop,TS val 724091 ecr 724091], length 2896

23:12:12.386661 IP 10.0.0.1.56477 > 10.0.0.2.5001: Flags [.], seq 797873:800769, ack 1, win 58, options [nop,nop,TS val 724097 ecr 724097], length 2896

23:12:12.410865 IP 10.0.0.1.56477 > 10.0.0.2.5001: Flags [.], seq 800769:803665, ack 1, win 58, options [nop,nop,TS val 724104 ecr 724103], length 2896

23:12:12.435003 IP 10.0.0.1.56477 > 10.0.0.2.5001: Flags [.], seq 803665:806561, ack 1, win 58, options [nop,nop,TS val 724104 ecr 724103], length 2896

23:12:12.459272 IP 10.0.0.1.56477 > 10.0.0.2.5001: Flags [.], seq 806561:809457, ack 1, win 58, options [nop,nop,TS val 724110 ecr 724109], length 2896

23:12:12.483462 IP 10.0.0.1.56477 > 10.0.0.2.5001: Flags [.], seq 809457:812353, ack 1, win 58, options [nop,nop,TS val 724116 ecr 724115], length 2896

23:12:12.507574 IP 10.0.0.1.56477 > 10.0.0.2.5001: Flags [.], seq 812353:815249, ack 1, win 58, options [nop,nop,TS val 724122 ecr 724121], length 2896

23:12:12.532044 IP 10.0.0.1.56477 > 10.0.0.2.5001: Flags [.], seq 815249:818145, ack 1, win 58, options [nop,nop,TS val 724128 ecr 724127], length 2896

23:12:12.556415 IP 10.0.0.1.56477 > 10.0.0.2.5001: Flags [.], seq 818145:821041, ack 1, win 58, options [nop,nop,TS val 724134 ecr 724133], length 2896

23:12:12.580376 IP 10.0.0.1.56477 > 10.0.0.2.5001: Flags [.], seq 821041:823937, ack 1, win 58, options [nop,nop,TS val 724140 ecr 724139], length 2896

23:12:12.604723 IP 10.0.0.1.56477 > 10.0.0.2.5001: Flags [P.], seq 823937:826833, ack 1, win 58, options [nop,nop,TS val 724146 ecr 724145], length 2896

23:12:12.629050 IP 10.0.0.1.56477 > 10.0.0.2.5001: Flags [.], seq 826833:829729, ack 1, win 58, options [nop,nop,TS val 724152 ecr 724151], length 2896

23:12:12.653128 IP 10.0.0.1.56477 > 10.0.0.2.5001: Flags [.], seq 829729:832625, ack 1, win 58, options [nop,nop,TS val 724158 ecr 724157], length 2896

23:12:12.677541 IP 10.0.0.1.56477 > 10.0.0.2.5001: Flags [.], seq 832625:835521, ack 1, win 58, options [nop,nop,TS val 724164 ecr 724164], length 2896

23:12:12.701720 IP 10.0.0.1.56477 > 10.0.0.2.5001: Flags [.], seq 835521:838417, ack 1, win 58, options [nop,nop,TS val 724176 ecr 724176], length 2896

23:12:12.725805 IP 10.0.0.1.56477 > 10.0.0.2.5001: Flags [.], seq 838417:841313, ack 1, win 58, options [nop,nop,TS val 724176 ecr 724176], length 2896

23:12:12.750129 IP 10.0.0.1.56477 > 10.0.0.2.5001: Flags [.], seq 841313:844209, ack 1, win 58, options [nop,nop,TS val 724182 ecr 724182], length 2896

23:12:12.774287 IP 10.0.0.1.56477 > 10.0.0.2.5001: Flags [.], seq 844209:847105, ack 1, win 58, options [nop,nop,TS val 724195 ecr 724194], length 2896

23:12:12.798433 IP 10.0.0.1.56477 > 10.0.0.2.5001: Flags [.], seq 847105:850001, ack 1, win 58, options [nop,nop,TS val 724195 ecr 724194], length 2896

23:12:12.822690 IP 10.0.0.1.56477 > 10.0.0.2.5001: Flags [.], seq 850001:852897, ack 1, win 58, options [nop,nop,TS val 724201 ecr 724200], length 2896

23:12:12.846879 IP 10.0.0.1.56477 > 10.0.0.2.5001: Flags [P.], seq 852897:855793, ack 1, win 58, options [nop,nop,TS val 724207 ecr 724206], length 2896

23:12:12.870957 IP 10.0.0.1.56477 > 10.0.0.2.5001: Flags [.], seq 855793:858689, ack 1, win 58, options [nop,nop,TS val 724213 ecr 724212], length 2896

23:12:12.895366 IP 10.0.0.1.56477 > 10.0.0.2.5001: Flags [.], seq 858689:861585, ack 1, win 58, options [nop,nop,TS val 724219 ecr 724218], length 2896

23:12:12.919800 IP 10.0.0.1.56477 > 10.0.0.2.5001: Flags [.], seq 861585:864481, ack 1, win 58, options [nop,nop,TS val 724225 ecr 724224], length 2896

23:12:12.943725 IP 10.0.0.1.56477 > 10.0.0.2.5001: Flags [.], seq 850001:851449, ack 1, win 58, options [nop,nop,TS val 724237 ecr 724236], length 1448

23:12:12.955856 IP 10.0.0.1.56477 > 10.0.0.2.5001: Flags [.], seq 851449:852897, ack 1, win 58, options [nop,nop,TS val 724243 ecr 724242], length 1448

23:12:12.968068 IP 10.0.0.1.56477 > 10.0.0.2.5001: Flags [.], seq 864481:865929, ack 1, win 58, options [nop,nop,TS val 724243 ecr 724242], length 1448

23:12:12.980242 IP 10.0.0.1.56477 > 10.0.0.2.5001: Flags [.], seq 865929:867377, ack 1, win 58, options [nop,nop,TS val 724249 ecr 724248], length 1448

23:12:12.992420 IP 10.0.0.1.56477 > 10.0.0.2.5001: Flags [.], seq 867377:868825, ack 1, win 58, options [nop,nop,TS val 724249 ecr 724248], length 1448

23:12:13.004421 IP 10.0.0.1.56477 > 10.0.0.2.5001: Flags [.], seq 868825:870273, ack 1, win 58, options [nop,nop,TS val 724255 ecr 724254], length 1448

23:12:13.016403 IP 10.0.0.1.56477 > 10.0.0.2.5001: Flags [.], seq 870273:871721, ack 1, win 58, options [nop,nop,TS val 724255 ecr 724254], length 1448

23:12:13.028578 IP 10.0.0.1.56477 > 10.0.0.2.5001: Flags [.], seq 871721:873169, ack 1, win 58, options [nop,nop,TS val 724261 ecr 724260], length 1448

23:12:13.040757 IP 10.0.0.1.56477 > 10.0.0.2.5001: Flags [.], seq 873169:876065, ack 1, win 58, options [nop,nop,TS val 724270 ecr 724270], length 2896

23:12:13.065097 IP 10.0.0.1.56477 > 10.0.0.2.5001: Flags [.], seq 876065:878961, ack 1, win 58, options [nop,nop,TS val 724270 ecr 724270], length 2896

23:12:13.089097 IP 10.0.0.1.56477 > 10.0.0.2.5001: Flags [.], seq 878961:881857, ack 1, win 58, options [nop,nop,TS val 724276 ecr 724276], length 2896

23:12:13.113472 IP 10.0.0.1.56477 > 10.0.0.2.5001: Flags [P.], seq 881857:884753, ack 1, win 58, options [nop,nop,TS val 724282 ecr 724282], length 2896

23:12:13.137608 IP 10.0.0.1.56477 > 10.0.0.2.5001: Flags [.], seq 884753:887649, ack 1, win 58, options [nop,nop,TS val 724285 ecr 724285], length 2896

23:12:13.161814 IP 10.0.0.1.56477 > 10.0.0.2.5001: Flags [.], seq 887649:890545, ack 1, win 58, options [nop,nop,TS val 724291 ecr 724291], length 2896

23:12:13.186042 IP 10.0.0.1.56477 > 10.0.0.2.5001: Flags [.], seq 890545:893441, ack 1, win 58, options [nop,nop,TS val 724297 ecr 724297], length 2896

23:12:13.210240 IP 10.0.0.1.56477 > 10.0.0.2.5001: Flags [.], seq 893441:896337, ack 1, win 58, options [nop,nop,TS val 724303 ecr 724303], length 2896

23:12:13.234400 IP 10.0.0.1.56477 > 10.0.0.2.5001: Flags [.], seq 896337:899233, ack 1, win 58, options [nop,nop,TS val 724309 ecr 724309], length 2896

23:12:13.258637 IP 10.0.0.1.56477 > 10.0.0.2.5001: Flags [.], seq 899233:902129, ack 1, win 58, options [nop,nop,TS val 724316 ecr 724315], length 2896

23:12:13.282808 IP 10.0.0.1.56477 > 10.0.0.2.5001: Flags [.], seq 902129:905025, ack 1, win 58, options [nop,nop,TS val 724322 ecr 724321], length 2896

23:12:13.307159 IP 10.0.0.1.56477 > 10.0.0.2.5001: Flags [.], seq 905025:907921, ack 1, win 58, options [nop,nop,TS val 724328 ecr 724327], length 2896

23:12:13.331508 IP 10.0.0.1.56477 > 10.0.0.2.5001: Flags [.], seq 907921:910817, ack 1, win 58, options [nop,nop,TS val 724334 ecr 724333], length 2896

23:12:13.355591 IP 10.0.0.1.56477 > 10.0.0.2.5001: Flags [.], seq 910817:913713, ack 1, win 58, options [nop,nop,TS val 724340 ecr 724339], length 2896

23:12:13.379830 IP 10.0.0.1.56477 > 10.0.0.2.5001: Flags [P.], seq 913713:916609, ack 1, win 58, options [nop,nop,TS val 724346 ecr 724345], length 2896

23:12:13.404211 IP 10.0.0.1.56477 > 10.0.0.2.5001: Flags [.], seq 916609:919505, ack 1, win 58, options [nop,nop,TS val 724352 ecr 724351], length 2896

23:12:13.428147 IP 10.0.0.1.56477 > 10.0.0.2.5001: Flags [.], seq 919505:922401, ack 1, win 58, options [nop,nop,TS val 724358 ecr 724357], length 2896

23:12:13.452523 IP 10.0.0.1.56477 > 10.0.0.2.5001: Flags [.], seq 922401:925297, ack 1, win 58, options [nop,nop,TS val 724364 ecr 724363], length 2896

23:12:13.476832 IP 10.0.0.1.56477 > 10.0.0.2.5001: Flags [.], seq 925297:928193, ack 1, win 58, options [nop,nop,TS val 724370 ecr 724369], length 2896

23:12:13.500830 IP 10.0.0.1.56477 > 10.0.0.2.5001: Flags [.], seq 928193:931089, ack 1, win 58, options [nop,nop,TS val 724370 ecr 724369], length 2896

23:12:13.525197 IP 10.0.0.1.56477 > 10.0.0.2.5001: Flags [.], seq 931089:933985, ack 1, win 58, options [nop,nop,TS val 724376 ecr 724376], length 2896

23:12:13.549434 IP 10.0.0.1.56477 > 10.0.0.2.5001: Flags [.], seq 933985:936881, ack 1, win 58, options [nop,nop,TS val 724382 ecr 724382], length 2896

23:12:13.573563 IP 10.0.0.1.56477 > 10.0.0.2.5001: Flags [.], seq 936881:939777, ack 1, win 58, options [nop,nop,TS val 724388 ecr 724388], length 2896

23:12:13.597805 IP 10.0.0.1.56477 > 10.0.0.2.5001: Flags [.], seq 939777:942673, ack 1, win 58, options [nop,nop,TS val 724394 ecr 724394], length 2896

23:12:13.621989 IP 10.0.0.1.56477 > 10.0.0.2.5001: Flags [P.], seq 942673:945569, ack 1, win 58, options [nop,nop,TS val 724400 ecr 724400], length 2896

23:12:13.646150 IP 10.0.0.1.56477 > 10.0.0.2.5001: Flags [.], seq 945569:948465, ack 1, win 58, options [nop,nop,TS val 724406 ecr 724406], length 2896

23:12:13.670569 IP 10.0.0.1.56477 > 10.0.0.2.5001: Flags [.], seq 948465:951361, ack 1, win 58, options [nop,nop,TS val 724412 ecr 724412], length 2896

23:12:13.694956 IP 10.0.0.1.56477 > 10.0.0.2.5001: Flags [.], seq 951361:954257, ack 1, win 58, options [nop,nop,TS val 724418 ecr 724418], length 2896

23:12:13.718916 IP 10.0.0.1.56477 > 10.0.0.2.5001: Flags [.], seq 954257:957153, ack 1, win 58, options [nop,nop,TS val 724425 ecr 724424], length 2896

23:12:13.743266 IP 10.0.0.1.56477 > 10.0.0.2.5001: Flags [.], seq 957153:960049, ack 1, win 58, options [nop,nop,TS val 724431 ecr 724430], length 2896

23:12:13.767627 IP 10.0.0.1.56477 > 10.0.0.2.5001: Flags [.], seq 960049:962945, ack 1, win 58, options [nop,nop,TS val 724437 ecr 724436], length 2896

23:12:13.791613 IP 10.0.0.1.56477 > 10.0.0.2.5001: Flags [.], seq 962945:965841, ack 1, win 58, options [nop,nop,TS val 724443 ecr 724442], length 2896

23:12:13.815983 IP 10.0.0.1.56477 > 10.0.0.2.5001: Flags [.], seq 951361:952809, ack 1, win 58, options [nop,nop,TS val 724455 ecr 724454], length 1448

23:12:13.828103 IP 10.0.0.1.56477 > 10.0.0.2.5001: Flags [.], seq 952809:954257, ack 1, win 58, options [nop,nop,TS val 724461 ecr 724460], length 1448

23:12:13.840183 IP 10.0.0.1.56477 > 10.0.0.2.5001: Flags [.], seq 965841:967289, ack 1, win 58, options [nop,nop,TS val 724461 ecr 724460], length 1448

23:12:13.852141 IP 10.0.0.1.56477 > 10.0.0.2.5001: Flags [.], seq 967289:968737, ack 1, win 58, options [nop,nop,TS val 724467 ecr 724466], length 1448

23:12:13.864319 IP 10.0.0.1.56477 > 10.0.0.2.5001: Flags [.], seq 968737:970185, ack 1, win 58, options [nop,nop,TS val 724467 ecr 724466], length 1448

23:12:13.876426 IP 10.0.0.1.56477 > 10.0.0.2.5001: Flags [.], seq 970185:971633, ack 1, win 58, options [nop,nop,TS val 724473 ecr 724472], length 1448

23:12:13.888630 IP 10.0.0.1.56477 > 10.0.0.2.5001: Flags [.], seq 971633:973081, ack 1, win 58, options [nop,nop,TS val 724473 ecr 724472], length 1448

23:12:13.900702 IP 10.0.0.1.56477 > 10.0.0.2.5001: Flags [P.], seq 973081:974529, ack 1, win 58, options [nop,nop,TS val 724479 ecr 724478], length 1448

23:12:13.912622 IP 10.0.0.1.56477 > 10.0.0.2.5001: Flags [.], seq 974529:977425, ack 1, win 58, options [nop,nop,TS val 724485 ecr 724485], length 2896

23:12:13.937019 IP 10.0.0.1.56477 > 10.0.0.2.5001: Flags [.], seq 977425:980321, ack 1, win 58, options [nop,nop,TS val 724488 ecr 724488], length 2896

23:12:13.961217 IP 10.0.0.1.56477 > 10.0.0.2.5001: Flags [.], seq 980321:983217, ack 1, win 58, options [nop,nop,TS val 724494 ecr 724494], length 2896

23:12:13.985390 IP 10.0.0.1.56477 > 10.0.0.2.5001: Flags [.], seq 983217:986113, ack 1, win 58, options [nop,nop,TS val 724500 ecr 724500], length 2896

23:12:14.009607 IP 10.0.0.1.56477 > 10.0.0.2.5001: Flags [.], seq 986113:989009, ack 1, win 58, options [nop,nop,TS val 724503 ecr 724503], length 2896

23:12:14.033728 IP 10.0.0.1.56477 > 10.0.0.2.5001: Flags [.], seq 989009:991905, ack 1, win 58, options [nop,nop,TS val 724509 ecr 724509], length 2896

23:12:14.057989 IP 10.0.0.1.56477 > 10.0.0.2.5001: Flags [.], seq 991905:994801, ack 1, win 58, options [nop,nop,TS val 724515 ecr 724515], length 2896

23:12:14.082362 IP 10.0.0.1.56477 > 10.0.0.2.5001: Flags [.], seq 994801:997697, ack 1, win 58, options [nop,nop,TS val 724521 ecr 724521], length 2896

23:12:14.106731 IP 10.0.0.1.56477 > 10.0.0.2.5001: Flags [.], seq 997697:1000593, ack 1, win 58, options [nop,nop,TS val 724527 ecr 724527], length 2896

23:12:14.130725 IP 10.0.0.1.56477 > 10.0.0.2.5001: Flags [P.], seq 1000593:1003489, ack 1, win 58, options [nop,nop,TS val 724533 ecr 724533], length 2896

23:12:14.155029 IP 10.0.0.1.56477 > 10.0.0.2.5001: Flags [.], seq 991905:993353, ack 1, win 58, options [nop,nop,TS val 724546 ecr 724545], length 1448

23:12:14.167255 IP 10.0.0.1.56477 > 10.0.0.2.5001: Flags [.], seq 993353:994801, ack 1, win 58, options [nop,nop,TS val 724552 ecr 724551], length 1448

23:12:14.179415 IP 10.0.0.1.56477 > 10.0.0.2.5001: Flags [.], seq 1003489:1006385, ack 1, win 58, options [nop,nop,TS val 724552 ecr 724551], length 2896

23:12:14.203418 IP 10.0.0.1.56477 > 10.0.0.2.5001: Flags [.], seq 1006385:1009281, ack 1, win 58, options [nop,nop,TS val 724558 ecr 724557], length 2896

23:12:14.227769 IP 10.0.0.1.56477 > 10.0.0.2.5001: Flags [.], seq 1009281:1010729, ack 1, win 58, options [nop,nop,TS val 724564 ecr 724563], length 1448

23:12:14.239947 IP 10.0.0.1.56477 > 10.0.0.2.5001: Flags [.], seq 1010729:1012177, ack 1, win 58, options [nop,nop,TS val 724567 ecr 724566], length 1448

23:12:14.252063 IP 10.0.0.1.56477 > 10.0.0.2.5001: Flags [.], seq 1012177:1015073, ack 1, win 58, options [nop,nop,TS val 724570 ecr 724569], length 2896

23:12:14.276139 IP 10.0.0.1.56477 > 10.0.0.2.5001: Flags [.], seq 1015073:1017969, ack 1, win 58, options [nop,nop,TS val 724576 ecr 724575], length 2896

23:12:14.300465 IP 10.0.0.1.56477 > 10.0.0.2.5001: Flags [.], seq 1017969:1020865, ack 1, win 58, options [nop,nop,TS val 724582 ecr 724581], length 2896

23:12:14.324658 IP 10.0.0.1.56477 > 10.0.0.2.5001: Flags [.], seq 1020865:1023761, ack 1, win 58, options [nop,nop,TS val 724588 ecr 724587], length 2896

23:12:14.348856 IP 10.0.0.1.56477 > 10.0.0.2.5001: Flags [.], seq 1023761:1026657, ack 1, win 58, options [nop,nop,TS val 724594 ecr 724594], length 2896

23:12:14.373042 IP 10.0.0.1.56477 > 10.0.0.2.5001: Flags [.], seq 1026657:1029553, ack 1, win 58, options [nop,nop,TS val 724600 ecr 724600], length 2896

23:12:14.397232 IP 10.0.0.1.56477 > 10.0.0.2.5001: Flags [P.], seq 1029553:1032449, ack 1, win 58, options [nop,nop,TS val 724606 ecr 724606], length 2896

23:12:14.421423 IP 10.0.0.1.56477 > 10.0.0.2.5001: Flags [.], seq 1032449:1035345, ack 1, win 58, options [nop,nop,TS val 724612 ecr 724612], length 2896

23:12:14.445911 IP 10.0.0.1.56477 > 10.0.0.2.5001: Flags [.], seq 1035345:1038241, ack 1, win 58, options [nop,nop,TS val 724618 ecr 724618], length 2896

23:12:14.470200 IP 10.0.0.1.56477 > 10.0.0.2.5001: Flags [.], seq 1038241:1041137, ack 1, win 58, options [nop,nop,TS val 724624 ecr 724624], length 2896

23:12:14.494170 IP 10.0.0.1.56477 > 10.0.0.2.5001: Flags [.], seq 1041137:1044033, ack 1, win 58, options [nop,nop,TS val 724631 ecr 724630], length 2896

23:12:14.518431 IP 10.0.0.1.56477 > 10.0.0.2.5001: Flags [.], seq 1044033:1046929, ack 1, win 58, options [nop,nop,TS val 724637 ecr 724636], length 2896

23:12:14.542829 IP 10.0.0.1.56477 > 10.0.0.2.5001: Flags [.], seq 1046929:1049825, ack 1, win 58, options [nop,nop,TS val 724643 ecr 724642], length 2896

23:12:14.566795 IP 10.0.0.1.56477 > 10.0.0.2.5001: Flags [.], seq 1049825:1052721, ack 1, win 58, options [nop,nop,TS val 724649 ecr 724648], length 2896

23:12:14.590931 IP 10.0.0.1.56477 > 10.0.0.2.5001: Flags [.], seq 1052721:1055617, ack 1, win 58, options [nop,nop,TS val 724655 ecr 724654], length 2896

23:12:14.615389 IP 10.0.0.1.56477 > 10.0.0.2.5001: Flags [.], seq 1055617:1058513, ack 1, win 58, options [nop,nop,TS val 724655 ecr 724654], length 2896

23:12:14.639477 IP 10.0.0.1.56477 > 10.0.0.2.5001: Flags [P.], seq 1058513:1061409, ack 1, win 58, options [nop,nop,TS val 724667 ecr 724666], length 2896

23:12:14.663801 IP 10.0.0.1.56477 > 10.0.0.2.5001: Flags [.], seq 1061409:1064305, ack 1, win 58, options [nop,nop,TS val 724667 ecr 724666], length 2896

23:12:14.687825 IP 10.0.0.1.56477 > 10.0.0.2.5001: Flags [.], seq 1064305:1067201, ack 1, win 58, options [nop,nop,TS val 724673 ecr 724672], length 2896

23:12:14.712165 IP 10.0.0.1.56477 > 10.0.0.2.5001: Flags [.], seq 1067201:1070097, ack 1, win 58, options [nop,nop,TS val 724679 ecr 724678], length 2896

23:12:14.736361 IP 10.0.0.1.56477 > 10.0.0.2.5001: Flags [.], seq 1070097:1072993, ack 1, win 58, options [nop,nop,TS val 724685 ecr 724684], length 2896

23:12:14.760510 IP 10.0.0.1.56477 > 10.0.0.2.5001: Flags [.], seq 1072993:1075889, ack 1, win 58, options [nop,nop,TS val 724691 ecr 724690], length 2896

23:12:14.784779 IP 10.0.0.1.56477 > 10.0.0.2.5001: Flags [.], seq 1075889:1078785, ack 1, win 58, options [nop,nop,TS val 724697 ecr 724696], length 2896

23:12:14.808979 IP 10.0.0.1.56477 > 10.0.0.2.5001: Flags [.], seq 1078785:1081681, ack 1, win 58, options [nop,nop,TS val 724703 ecr 724703], length 2896

23:12:14.833186 IP 10.0.0.1.56477 > 10.0.0.2.5001: Flags [.], seq 1081681:1084577, ack 1, win 58, options [nop,nop,TS val 724709 ecr 724709], length 2896

23:12:14.857487 IP 10.0.0.1.56477 > 10.0.0.2.5001: Flags [.], seq 1084577:1087473, ack 1, win 58, options [nop,nop,TS val 724715 ecr 724715], length 2896

23:12:14.881834 IP 10.0.0.1.56477 > 10.0.0.2.5001: Flags [P.], seq 1087473:1090369, ack 1, win 58, options [nop,nop,TS val 724721 ecr 724721], length 2896

23:12:14.905790 IP 10.0.0.1.56477 > 10.0.0.2.5001: Flags [.], seq 1090369:1093265, ack 1, win 58, options [nop,nop,TS val 724727 ecr 724727], length 2896

23:12:14.930221 IP 10.0.0.1.56477 > 10.0.0.2.5001: Flags [.], seq 1081681:1083129, ack 1, win 58, options [nop,nop,TS val 724739 ecr 724739], length 1448

23:12:14.942148 IP 10.0.0.1.56477 > 10.0.0.2.5001: Flags [.], seq 1083129:1084577, ack 1, win 58, options [nop,nop,TS val 724745 ecr 724745], length 1448

23:12:14.954630 IP 10.0.0.1.56477 > 10.0.0.2.5001: Flags [.], seq 1093265:1094713, ack 1, win 58, options [nop,nop,TS val 724745 ecr 724745], length 1448

23:12:14.966356 IP 10.0.0.1.56477 > 10.0.0.2.5001: Flags [.], seq 1094713:1096161, ack 1, win 58, options [nop,nop,TS val 724752 ecr 724751], length 1448

23:12:14.978570 IP 10.0.0.1.56477 > 10.0.0.2.5001: Flags [.], seq 1096161:1097609, ack 1, win 58, options [nop,nop,TS val 724752 ecr 724751], length 1448

23:12:14.990768 IP 10.0.0.1.56477 > 10.0.0.2.5001: Flags [.], seq 1097609:1099057, ack 1, win 58, options [nop,nop,TS val 724758 ecr 724757], length 1448

23:12:15.002923 IP 10.0.0.1.56477 > 10.0.0.2.5001: Flags [.], seq 1099057:1101953, ack 1, win 58, options [nop,nop,TS val 724764 ecr 724763], length 2896

23:12:15.027114 IP 10.0.0.1.56477 > 10.0.0.2.5001: Flags [.], seq 1101953:1104849, ack 1, win 58, options [nop,nop,TS val 724767 ecr 724766], length 2896

23:12:15.051214 IP 10.0.0.1.56477 > 10.0.0.2.5001: Flags [.], seq 1104849:1107745, ack 1, win 58, options [nop,nop,TS val 724773 ecr 724772], length 2896

23:12:15.075592 IP 10.0.0.1.56477 > 10.0.0.2.5001: Flags [.], seq 1107745:1110641, ack 1, win 58, options [nop,nop,TS val 724776 ecr 724775], length 2896

23:12:15.099736 IP 10.0.0.1.56477 > 10.0.0.2.5001: Flags [.], seq 1110641:1113537, ack 1, win 58, options [nop,nop,TS val 724782 ecr 724781], length 2896

23:12:15.123932 IP 10.0.0.1.56477 > 10.0.0.2.5001: Flags [.], seq 1113537:1116433, ack 1, win 58, options [nop,nop,TS val 724788 ecr 724787], length 2896

23:12:15.148137 IP 10.0.0.1.56477 > 10.0.0.2.5001: Flags [P.], seq 1116433:1119329, ack 1, win 58, options [nop,nop,TS val 724794 ecr 724793], length 2896

23:12:15.172264 IP 10.0.0.1.56477 > 10.0.0.2.5001: Flags [.], seq 1119329:1122225, ack 1, win 58, options [nop,nop,TS val 724800 ecr 724799], length 2896

23:12:15.196537 IP 10.0.0.1.56477 > 10.0.0.2.5001: Flags [.], seq 1122225:1125121, ack 1, win 58, options [nop,nop,TS val 724806 ecr 724805], length 2896

23:12:15.220917 IP 10.0.0.1.56477 > 10.0.0.2.5001: Flags [.], seq 1125121:1128017, ack 1, win 58, options [nop,nop,TS val 724818 ecr 724818], length 2896

23:12:15.244950 IP 10.0.0.1.56477 > 10.0.0.2.5001: Flags [.], seq 1128017:1130913, ack 1, win 58, options [nop,nop,TS val 724818 ecr 724818], length 2896

23:12:15.269318 IP 10.0.0.1.56477 > 10.0.0.2.5001: Flags [.], seq 1130913:1133809, ack 1, win 58, options [nop,nop,TS val 724824 ecr 724824], length 2896

23:12:15.293683 IP 10.0.0.1.56477 > 10.0.0.2.5001: Flags [.], seq 1133809:1136705, ack 1, win 58, options [nop,nop,TS val 724830 ecr 724830], length 2896

23:12:15.317622 IP 10.0.0.1.56477 > 10.0.0.2.5001: Flags [.], seq 1136705:1139601, ack 1, win 58, options [nop,nop,TS val 724836 ecr 724836], length 2896

23:12:15.341993 IP 10.0.0.1.56477 > 10.0.0.2.5001: Flags [.], seq 1139601:1142497, ack 1, win 58, options [nop,nop,TS val 724842 ecr 724842], length 2896

23:12:15.366349 IP 10.0.0.1.56477 > 10.0.0.2.5001: Flags [.], seq 1142497:1145393, ack 1, win 58, options [nop,nop,TS val 724848 ecr 724848], length 2896

23:12:15.390330 IP 10.0.0.1.56477 > 10.0.0.2.5001: Flags [P.], seq 1145393:1148289, ack 1, win 58, options [nop,nop,TS val 724854 ecr 724854], length 2896

23:12:15.414649 IP 10.0.0.1.56477 > 10.0.0.2.5001: Flags [.], seq 1148289:1151185, ack 1, win 58, options [nop,nop,TS val 724854 ecr 724854], length 2896

23:12:15.438952 IP 10.0.0.1.56477 > 10.0.0.2.5001: Flags [.], seq 1151185:1154081, ack 1, win 58, options [nop,nop,TS val 724861 ecr 724860], length 2896

23:12:15.463037 IP 10.0.0.1.56477 > 10.0.0.2.5001: Flags [.], seq 1154081:1156977, ack 1, win 58, options [nop,nop,TS val 724867 ecr 724866], length 2896

23:12:15.487368 IP 10.0.0.1.56477 > 10.0.0.2.5001: Flags [.], seq 1156977:1159873, ack 1, win 58, options [nop,nop,TS val 724873 ecr 724872], length 2896

23:12:15.511566 IP 10.0.0.1.56477 > 10.0.0.2.5001: Flags [.], seq 1159873:1162769, ack 1, win 58, options [nop,nop,TS val 724879 ecr 724878], length 2896

23:12:15.535717 IP 10.0.0.1.56477 > 10.0.0.2.5001: Flags [.], seq 1162769:1165665, ack 1, win 58, options [nop,nop,TS val 724885 ecr 724884], length 2896

23:12:15.559961 IP 10.0.0.1.56477 > 10.0.0.2.5001: Flags [.], seq 1165665:1168561, ack 1, win 58, options [nop,nop,TS val 724891 ecr 724890], length 2896

23:12:15.584162 IP 10.0.0.1.56477 > 10.0.0.2.5001: Flags [.], seq 1168561:1171457, ack 1, win 58, options [nop,nop,TS val 724897 ecr 724896], length 2896

23:12:15.608357 IP 10.0.0.1.56477 > 10.0.0.2.5001: Flags [.], seq 1171457:1174353, ack 1, win 58, options [nop,nop,TS val 724903 ecr 724902], length 2896

23:12:15.632638 IP 10.0.0.1.56477 > 10.0.0.2.5001: Flags [P.], seq 1174353:1177249, ack 1, win 58, options [nop,nop,TS val 724909 ecr 724908], length 2896

23:12:15.657085 IP 10.0.0.1.56477 > 10.0.0.2.5001: Flags [.], seq 1177249:1180145, ack 1, win 58, options [nop,nop,TS val 724915 ecr 724914], length 2896

23:12:15.681061 IP 10.0.0.1.56477 > 10.0.0.2.5001: Flags [.], seq 1180145:1183041, ack 1, win 58, options [nop,nop,TS val 724921 ecr 724921], length 2896

23:12:15.705428 IP 10.0.0.1.56477 > 10.0.0.2.5001: Flags [.], seq 1183041:1185937, ack 1, win 58, options [nop,nop,TS val 724927 ecr 724927], length 2896

23:12:15.729741 IP 10.0.0.1.56477 > 10.0.0.2.5001: Flags [.], seq 1185937:1188833, ack 1, win 58, options [nop,nop,TS val 724933 ecr 724933], length 2896

23:12:15.753759 IP 10.0.0.1.56477 > 10.0.0.2.5001: Flags [.], seq 1188833:1191729, ack 1, win 58, options [nop,nop,TS val 724939 ecr 724939], length 2896

23:12:15.778047 IP 10.0.0.1.56477 > 10.0.0.2.5001: Flags [.], seq 1191729:1194625, ack 1, win 58, options [nop,nop,TS val 724945 ecr 724945], length 2896

23:12:15.802334 IP 10.0.0.1.56477 > 10.0.0.2.5001: Flags [.], seq 1194625:1197521, ack 1, win 58, options [nop,nop,TS val 724951 ecr 724951], length 2896

23:12:15.826420 IP 10.0.0.1.56477 > 10.0.0.2.5001: Flags [.], seq 1197521:1200417, ack 1, win 58, options [nop,nop,TS val 724957 ecr 724957], length 2896

23:12:15.850728 IP 10.0.0.1.56477 > 10.0.0.2.5001: Flags [.], seq 1200417:1203313, ack 1, win 58, options [nop,nop,TS val 724964 ecr 724963], length 2896

23:12:15.874850 IP 10.0.0.1.56477 > 10.0.0.2.5001: Flags [P.], seq 1203313:1206209, ack 1, win 58, options [nop,nop,TS val 724970 ecr 724969], length 2896

23:12:15.899116 IP 10.0.0.1.56477 > 10.0.0.2.5001: Flags [.], seq 1206209:1209105, ack 1, win 58, options [nop,nop,TS val 724976 ecr 724975], length 2896

23:12:15.923322 IP 10.0.0.1.56477 > 10.0.0.2.5001: Flags [.], seq 1209105:1212001, ack 1, win 58, options [nop,nop,TS val 724982 ecr 724981], length 2896

23:12:15.947514 IP 10.0.0.1.56477 > 10.0.0.2.5001: Flags [.], seq 1212001:1214897, ack 1, win 58, options [nop,nop,TS val 724988 ecr 724987], length 2896

23:12:15.971714 IP 10.0.0.1.56477 > 10.0.0.2.5001: Flags [.], seq 1214897:1217793, ack 1, win 58, options [nop,nop,TS val 724994 ecr 724993], length 2896

23:12:15.995881 IP 10.0.0.1.56477 > 10.0.0.2.5001: Flags [.], seq 1217793:1220689, ack 1, win 58, options [nop,nop,TS val 725000 ecr 724999], length 2896

23:12:16.020107 IP 10.0.0.1.56477 > 10.0.0.2.5001: Flags [.], seq 1220689:1223585, ack 1, win 58, options [nop,nop,TS val 725006 ecr 725005], length 2896

23:12:16.044552 IP 10.0.0.1.56477 > 10.0.0.2.5001: Flags [.], seq 1223585:1226481, ack 1, win 58, options [nop,nop,TS val 725012 ecr 725011], length 2896

23:12:16.068884 IP 10.0.0.1.56477 > 10.0.0.2.5001: Flags [.], seq 1226481:1229377, ack 1, win 58, options [nop,nop,TS val 725018 ecr 725017], length 2896

23:12:16.092731 IP 10.0.0.1.56477 > 10.0.0.2.5001: Flags [.], seq 1229377:1232273, ack 1, win 58, options [nop,nop,TS val 725024 ecr 725023], length 2896

23:12:16.117165 IP 10.0.0.1.56477 > 10.0.0.2.5001: Flags [P.], seq 1232273:1235169, ack 1, win 58, options [nop,nop,TS val 725030 ecr 725029], length 2896

23:12:16.141507 IP 10.0.0.1.56477 > 10.0.0.2.5001: Flags [.], seq 1235169:1238065, ack 1, win 58, options [nop,nop,TS val 725042 ecr 725042], length 2896

23:12:16.165454 IP 10.0.0.1.56477 > 10.0.0.2.5001: Flags [.], seq 1238065:1240961, ack 1, win 58, options [nop,nop,TS val 725042 ecr 725042], length 2896

23:12:16.189866 IP 10.0.0.1.56477 > 10.0.0.2.5001: Flags [.], seq 1240961:1243857, ack 1, win 58, options [nop,nop,TS val 725048 ecr 725048], length 2896

23:12:16.214164 IP 10.0.0.1.56477 > 10.0.0.2.5001: Flags [.], seq 1243857:1246753, ack 1, win 58, options [nop,nop,TS val 725054 ecr 725054], length 2896

23:12:16.238186 IP 10.0.0.1.56477 > 10.0.0.2.5001: Flags [.], seq 1246753:1249649, ack 1, win 58, options [nop,nop,TS val 725060 ecr 725060], length 2896

23:12:16.262533 IP 10.0.0.1.56477 > 10.0.0.2.5001: Flags [.], seq 1249649:1252545, ack 1, win 58, options [nop,nop,TS val 725066 ecr 725066], length 2896

23:12:16.286733 IP 10.0.0.1.56477 > 10.0.0.2.5001: Flags [.], seq 1240961:1242409, ack 1, win 58, options [nop,nop,TS val 725079 ecr 725078], length 1448

23:12:16.298812 IP 10.0.0.1.56477 > 10.0.0.2.5001: Flags [.], seq 1242409:1243857, ack 1, win 58, options [nop,nop,TS val 725085 ecr 725084], length 1448

23:12:16.310869 IP 10.0.0.1.56477 > 10.0.0.2.5001: Flags [.], seq 1252545:1255441, ack 1, win 58, options [nop,nop,TS val 725085 ecr 725084], length 2896

23:12:16.335095 IP 10.0.0.1.56477 > 10.0.0.2.5001: Flags [.], seq 1255441:1258337, ack 1, win 58, options [nop,nop,TS val 725091 ecr 725090], length 2896

23:12:16.359320 IP 10.0.0.1.56477 > 10.0.0.2.5001: Flags [.], seq 1258337:1259785, ack 1, win 58, options [nop,nop,TS val 725097 ecr 725096], length 1448

23:12:16.371339 IP 10.0.0.1.56477 > 10.0.0.2.5001: Flags [.], seq 1259785:1261233, ack 1, win 58, options [nop,nop,TS val 725100 ecr 725099], length 1448

23:12:16.383524 IP 10.0.0.1.56477 > 10.0.0.2.5001: Flags [P.], seq 1261233:1264129, ack 1, win 58, options [nop,nop,TS val 725103 ecr 725102], length 2896

23:12:16.407720 IP 10.0.0.1.56477 > 10.0.0.2.5001: Flags [.], seq 1264129:1267025, ack 1, win 58, options [nop,nop,TS val 725109 ecr 725108], length 2896

23:12:16.432252 IP 10.0.0.1.56477 > 10.0.0.2.5001: Flags [.], seq 1267025:1269921, ack 1, win 58, options [nop,nop,TS val 725115 ecr 725114], length 2896

23:12:16.456250 IP 10.0.0.1.56477 > 10.0.0.2.5001: Flags [.], seq 1269921:1272817, ack 1, win 58, options [nop,nop,TS val 725121 ecr 725120], length 2896

23:12:16.480602 IP 10.0.0.1.56477 > 10.0.0.2.5001: Flags [.], seq 1272817:1275713, ack 1, win 58, options [nop,nop,TS val 725121 ecr 725120], length 2896

23:12:16.504713 IP 10.0.0.1.56477 > 10.0.0.2.5001: Flags [.], seq 1275713:1278609, ack 1, win 58, options [nop,nop,TS val 725127 ecr 725126], length 2896

23:12:16.528936 IP 10.0.0.1.56477 > 10.0.0.2.5001: Flags [.], seq 1278609:1281505, ack 1, win 58, options [nop,nop,TS val 725133 ecr 725133], length 2896

23:12:16.553291 IP 10.0.0.1.56477 > 10.0.0.2.5001: Flags [.], seq 1281505:1284401, ack 1, win 58, options [nop,nop,TS val 725139 ecr 725139], length 2896

23:12:16.577502 IP 10.0.0.1.56477 > 10.0.0.2.5001: Flags [.], seq 1284401:1287297, ack 1, win 58, options [nop,nop,TS val 725145 ecr 725145], length 2896

23:12:16.601621 IP 10.0.0.1.56477 > 10.0.0.2.5001: Flags [.], seq 1287297:1290193, ack 1, win 58, options [nop,nop,TS val 725151 ecr 725151], length 2896

23:12:16.625901 IP 10.0.0.1.56477 > 10.0.0.2.5001: Flags [P.], seq 1290193:1293089, ack 1, win 58, options [nop,nop,TS val 725157 ecr 725157], length 2896

23:12:16.649891 IP 10.0.0.1.56477 > 10.0.0.2.5001: Flags [.], seq 1293089:1295985, ack 1, win 58, options [nop,nop,TS val 725163 ecr 725163], length 2896

23:12:16.674355 IP 10.0.0.1.56477 > 10.0.0.2.5001: Flags [.], seq 1295985:1298881, ack 1, win 58, options [nop,nop,TS val 725169 ecr 725169], length 2896

23:12:16.698572 IP 10.0.0.1.56477 > 10.0.0.2.5001: Flags [.], seq 1298881:1301777, ack 1, win 58, options [nop,nop,TS val 725175 ecr 725175], length 2896

23:12:16.722765 IP 10.0.0.1.56477 > 10.0.0.2.5001: Flags [.], seq 1301777:1304673, ack 1, win 58, options [nop,nop,TS val 725182 ecr 725181], length 2896

23:12:16.746955 IP 10.0.0.1.56477 > 10.0.0.2.5001: Flags [.], seq 1304673:1307569, ack 1, win 58, options [nop,nop,TS val 725188 ecr 725187], length 2896

23:12:16.771052 IP 10.0.0.1.56477 > 10.0.0.2.5001: Flags [.], seq 1307569:1310465, ack 1, win 58, options [nop,nop,TS val 725194 ecr 725193], length 2896

23:12:16.795656 IP 10.0.0.1.56477 > 10.0.0.2.5001: Flags [.], seq 1310465:1313361, ack 1, win 58, options [nop,nop,TS val 725200 ecr 725199], length 2896

23:12:16.819635 IP 10.0.0.1.56477 > 10.0.0.2.5001: Flags [.], seq 1313361:1316257, ack 1, win 58, options [nop,nop,TS val 725206 ecr 725205], length 2896

23:12:16.844002 IP 10.0.0.1.56477 > 10.0.0.2.5001: Flags [.], seq 1316257:1319153, ack 1, win 58, options [nop,nop,TS val 725212 ecr 725211], length 2896

23:12:16.868059 IP 10.0.0.1.56477 > 10.0.0.2.5001: Flags [P.], seq 1319153:1322049, ack 1, win 58, options [nop,nop,TS val 725218 ecr 725217], length 2896

23:12:16.892232 IP 10.0.0.1.56477 > 10.0.0.2.5001: Flags [.], seq 1322049:1324945, ack 1, win 58, options [nop,nop,TS val 725224 ecr 725223], length 2896

23:12:16.916523 IP 10.0.0.1.56477 > 10.0.0.2.5001: Flags [.], seq 1324945:1327841, ack 1, win 58, options [nop,nop,TS val 725230 ecr 725229], length 2896

23:12:16.940955 IP 10.0.0.1.56477 > 10.0.0.2.5001: Flags [.], seq 1327841:1330737, ack 1, win 58, options [nop,nop,TS val 725236 ecr 725236], length 2896

23:12:16.964881 IP 10.0.0.1.56477 > 10.0.0.2.5001: Flags [.], seq 1330737:1333633, ack 1, win 58, options [nop,nop,TS val 725242 ecr 725241], length 2896

23:12:16.989257 IP 10.0.0.1.56477 > 10.0.0.2.5001: Flags [.], seq 1333633:1336529, ack 1, win 58, options [nop,nop,TS val 725248 ecr 725248], length 2896

23:12:17.013534 IP 10.0.0.1.56477 > 10.0.0.2.5001: Flags [.], seq 1336529:1339425, ack 1, win 58, options [nop,nop,TS val 725254 ecr 725254], length 2896

23:12:17.037601 IP 10.0.0.1.56477 > 10.0.0.2.5001: Flags [.], seq 1339425:1342321, ack 1, win 58, options [nop,nop,TS val 725260 ecr 725260], length 2896

23:12:17.061955 IP 10.0.0.1.56477 > 10.0.0.2.5001: Flags [.], seq 1342321:1345217, ack 1, win 58, options [nop,nop,TS val 725266 ecr 725266], length 2896

23:12:17.086111 IP 10.0.0.1.56477 > 10.0.0.2.5001: Flags [.], seq 1345217:1348113, ack 1, win 58, options [nop,nop,TS val 725272 ecr 725272], length 2896

23:12:17.110295 IP 10.0.0.1.56477 > 10.0.0.2.5001: Flags [P.], seq 1348113:1351009, ack 1, win 58, options [nop,nop,TS val 725278 ecr 725278], length 2896

23:12:17.134491 IP 10.0.0.1.56477 > 10.0.0.2.5001: Flags [.], seq 1351009:1353905, ack 1, win 58, options [nop,nop,TS val 725284 ecr 725284], length 2896

23:12:17.158691 IP 10.0.0.1.56477 > 10.0.0.2.5001: Flags [.], seq 1353905:1356801, ack 1, win 58, options [nop,nop,TS val 725291 ecr 725290], length 2896

23:12:17.182865 IP 10.0.0.1.56477 > 10.0.0.2.5001: Flags [.], seq 1356801:1359697, ack 1, win 58, options [nop,nop,TS val 725297 ecr 725296], length 2896

23:12:17.207325 IP 10.0.0.1.56477 > 10.0.0.2.5001: Flags [.], seq 1359697:1362593, ack 1, win 58, options [nop,nop,TS val 725303 ecr 725302], length 2896

23:12:17.231631 IP 10.0.0.1.56477 > 10.0.0.2.5001: Flags [.], seq 1362593:1365489, ack 1, win 58, options [nop,nop,TS val 725309 ecr 725308], length 2896

23:12:17.255668 IP 10.0.0.1.56477 > 10.0.0.2.5001: Flags [.], seq 1365489:1368385, ack 1, win 58, options [nop,nop,TS val 725315 ecr 725314], length 2896

23:12:17.280021 IP 10.0.0.1.56477 > 10.0.0.2.5001: Flags [.], seq 1368385:1371281, ack 1, win 58, options [nop,nop,TS val 725327 ecr 725326], length 2896

23:12:17.304297 IP 10.0.0.1.56477 > 10.0.0.2.5001: Flags [.], seq 1371281:1374177, ack 1, win 58, options [nop,nop,TS val 725327 ecr 725326], length 2896

23:12:17.328336 IP 10.0.0.1.56477 > 10.0.0.2.5001: Flags [.], seq 1374177:1377073, ack 1, win 58, options [nop,nop,TS val 725333 ecr 725332], length 2896

23:12:17.352679 IP 10.0.0.1.56477 > 10.0.0.2.5001: Flags [P.], seq 1377073:1379969, ack 1, win 58, options [nop,nop,TS val 725339 ecr 725338], length 2896

23:12:17.376899 IP 10.0.0.1.56477 > 10.0.0.2.5001: Flags [.], seq 1379969:1382865, ack 1, win 58, options [nop,nop,TS val 725345 ecr 725344], length 2896

23:12:17.401013 IP 10.0.0.1.56477 > 10.0.0.2.5001: Flags [.], seq 1382865:1385761, ack 1, win 58, options [nop,nop,TS val 725351 ecr 725351], length 2896

23:12:17.425257 IP 10.0.0.1.56477 > 10.0.0.2.5001: Flags [.], seq 1385761:1388657, ack 1, win 58, options [nop,nop,TS val 725357 ecr 725357], length 2896

23:12:17.449722 IP 10.0.0.1.56477 > 10.0.0.2.5001: Flags [.], seq 1388657:1391553, ack 1, win 58, options [nop,nop,TS val 725363 ecr 725363], length 2896

23:12:17.473678 IP 10.0.0.1.56477 > 10.0.0.2.5001: Flags [.], seq 1391553:1394449, ack 1, win 58, options [nop,nop,TS val 725369 ecr 725369], length 2896

23:12:17.497765 IP 10.0.0.1.56477 > 10.0.0.2.5001: Flags [.], seq 1394449:1397345, ack 1, win 58, options [nop,nop,TS val 725375 ecr 725375], length 2896

23:12:17.522061 IP 10.0.0.1.56477 > 10.0.0.2.5001: Flags [.], seq 1397345:1398793, ack 1, win 58, options [nop,nop,TS val 725378 ecr 725375], length 1448

23:12:17.534200 IP 10.0.0.1.56477 > 10.0.0.2.5001: Flags [.], seq 1398793:1400241, ack 1, win 58, options [nop,nop,TS val 725382 ecr 725381], length 1448

23:12:17.546212 IP 10.0.0.1.56477 > 10.0.0.2.5001: Flags [.], seq 1400241:1403137, ack 1, win 58, options [nop,nop,TS val 725388 ecr 725387], length 2896

23:12:17.570527 IP 10.0.0.1.56477 > 10.0.0.2.5001: Flags [.], seq 1391553:1393001, ack 1, win 58, options [nop,nop,TS val 725399 ecr 725399], length 1448

23:12:17.582534 IP 10.0.0.1.56477 > 10.0.0.2.5001: Flags [.], seq 1393001:1394449, ack 1, win 58, options [nop,nop,TS val 725406 ecr 725405], length 1448

23:12:17.594830 IP 10.0.0.1.56477 > 10.0.0.2.5001: Flags [.], seq 1403137:1404585, ack 1, win 58, options [nop,nop,TS val 725406 ecr 725405], length 1448

23:12:17.607020 IP 10.0.0.1.56477 > 10.0.0.2.5001: Flags [.], seq 1404585:1406033, ack 1, win 58, options [nop,nop,TS val 725409 ecr 725408], length 1448

23:12:17.619207 IP 10.0.0.1.56477 > 10.0.0.2.5001: Flags [P.], seq 1406033:1408929, ack 1, win 58, options [nop,nop,TS val 725412 ecr 725411], length 2896

23:12:17.643182 IP 10.0.0.1.56477 > 10.0.0.2.5001: Flags [.], seq 1408929:1410377, ack 1, win 58, options [nop,nop,TS val 725418 ecr 725417], length 1448

23:12:17.655348 IP 10.0.0.1.56477 > 10.0.0.2.5001: Flags [.], seq 1410377:1411825, ack 1, win 58, options [nop,nop,TS val 725421 ecr 725420], length 1448

23:12:17.667566 IP 10.0.0.1.56477 > 10.0.0.2.5001: Flags [.], seq 1411825:1414721, ack 1, win 58, options [nop,nop,TS val 725424 ecr 725423], length 2896

23:12:17.691891 IP 10.0.0.1.56477 > 10.0.0.2.5001: Flags [.], seq 1414721:1417617, ack 1, win 58, options [nop,nop,TS val 725430 ecr 725429], length 2896

23:12:17.715880 IP 10.0.0.1.56477 > 10.0.0.2.5001: Flags [.], seq 1417617:1420513, ack 1, win 58, options [nop,nop,TS val 725436 ecr 725435], length 2896

23:12:17.740236 IP 10.0.0.1.56477 > 10.0.0.2.5001: Flags [.], seq 1420513:1423409, ack 1, win 58, options [nop,nop,TS val 725442 ecr 725441], length 2896

23:12:17.764492 IP 10.0.0.1.56477 > 10.0.0.2.5001: Flags [.], seq 1423409:1426305, ack 1, win 58, options [nop,nop,TS val 725442 ecr 725441], length 2896

23:12:17.788567 IP 10.0.0.1.56477 > 10.0.0.2.5001: Flags [.], seq 1426305:1429201, ack 1, win 58, options [nop,nop,TS val 725448 ecr 725447], length 2896

23:12:17.812883 IP 10.0.0.1.56477 > 10.0.0.2.5001: Flags [.], seq 1429201:1432097, ack 1, win 58, options [nop,nop,TS val 725454 ecr 725453], length 2896

23:12:17.837056 IP 10.0.0.1.56477 > 10.0.0.2.5001: Flags [.], seq 1432097:1434993, ack 1, win 58, options [nop,nop,TS val 725460 ecr 725460], length 2896

23:12:17.861275 IP 10.0.0.1.56477 > 10.0.0.2.5001: Flags [P.], seq 1434993:1437889, ack 1, win 58, options [nop,nop,TS val 725466 ecr 725466], length 2896

23:12:17.885466 IP 10.0.0.1.56477 > 10.0.0.2.5001: Flags [.], seq 1437889:1440785, ack 1, win 58, options [nop,nop,TS val 725472 ecr 725472], length 2896

23:12:17.909612 IP 10.0.0.1.56477 > 10.0.0.2.5001: Flags [FP.], seq 1440785:1441817, ack 1, win 58, options [nop,nop,TS val 725472 ecr 725472], length 1032

23:12:18.186704 IP 10.0.0.1.56477 > 10.0.0.2.5001: Flags [FP.], seq 1440785:1441817, ack 1, win 58, options [nop,nop,TS val 725571 ecr 725496], length 1032

23:12:18.486700 IP 10.0.0.1.56477 > 10.0.0.2.5001: Flags [FP.], seq 1440785:1441817, ack 1, win 58, options [nop,nop,TS val 725646 ecr 725496], length 1032



cnt=
568
