23:35:23.468949 IP 10.0.0.1.44064 > 10.0.0.2.5001: UDP, length 1470

23:35:23.473463 IP 10.0.0.1.44064 > 10.0.0.2.5001: UDP, length 1470

23:35:23.480497 IP 10.0.0.1.44064 > 10.0.0.2.5001: UDP, length 1470

23:35:23.492587 IP 10.0.0.1.44064 > 10.0.0.2.5001: UDP, length 1470

23:35:23.504706 IP 10.0.0.1.44064 > 10.0.0.2.5001: UDP, length 1470

23:35:23.516823 IP 10.0.0.1.44064 > 10.0.0.2.5001: UDP, length 1470

23:35:23.528815 IP 10.0.0.1.44064 > 10.0.0.2.5001: UDP, length 1470

23:35:23.540953 IP 10.0.0.1.44064 > 10.0.0.2.5001: UDP, length 1470

23:35:23.553075 IP 10.0.0.1.44064 > 10.0.0.2.5001: UDP, length 1470

23:35:23.565194 IP 10.0.0.1.44064 > 10.0.0.2.5001: UDP, length 1470

23:35:23.577172 IP 10.0.0.1.44064 > 10.0.0.2.5001: UDP, length 1470

23:35:23.589329 IP 10.0.0.1.44064 > 10.0.0.2.5001: UDP, length 1470

23:35:23.601364 IP 10.0.0.1.44064 > 10.0.0.2.5001: UDP, length 1470

23:35:23.613584 IP 10.0.0.1.44064 > 10.0.0.2.5001: UDP, length 1470

23:35:23.625684 IP 10.0.0.1.44064 > 10.0.0.2.5001: UDP, length 1470

23:35:23.637685 IP 10.0.0.1.44064 > 10.0.0.2.5001: UDP, length 1470

23:35:23.649779 IP 10.0.0.1.44064 > 10.0.0.2.5001: UDP, length 1470

23:35:23.661879 IP 10.0.0.1.44064 > 10.0.0.2.5001: UDP, length 1470

23:35:23.673961 IP 10.0.0.1.44064 > 10.0.0.2.5001: UDP, length 1470

23:35:23.686131 IP 10.0.0.1.44064 > 10.0.0.2.5001: UDP, length 1470

23:35:23.698162 IP 10.0.0.1.44064 > 10.0.0.2.5001: UDP, length 1470

23:35:23.710308 IP 10.0.0.1.44064 > 10.0.0.2.5001: UDP, length 1470

23:35:23.722453 IP 10.0.0.1.44064 > 10.0.0.2.5001: UDP, length 1470

23:35:23.734436 IP 10.0.0.1.44064 > 10.0.0.2.5001: UDP, length 1470

23:35:23.746465 IP 10.0.0.1.44064 > 10.0.0.2.5001: UDP, length 1470

23:35:23.758669 IP 10.0.0.1.44064 > 10.0.0.2.5001: UDP, length 1470

23:35:23.770706 IP 10.0.0.1.44064 > 10.0.0.2.5001: UDP, length 1470

23:35:23.782814 IP 10.0.0.1.44064 > 10.0.0.2.5001: UDP, length 1470

23:35:23.794910 IP 10.0.0.1.44064 > 10.0.0.2.5001: UDP, length 1470

23:35:23.806980 IP 10.0.0.1.44064 > 10.0.0.2.5001: UDP, length 1470

23:35:23.819163 IP 10.0.0.1.44064 > 10.0.0.2.5001: UDP, length 1470

23:35:23.831272 IP 10.0.0.1.44064 > 10.0.0.2.5001: UDP, length 1470

23:35:23.843411 IP 10.0.0.1.44064 > 10.0.0.2.5001: UDP, length 1470

23:35:23.855385 IP 10.0.0.1.44064 > 10.0.0.2.5001: UDP, length 1470

23:35:23.867507 IP 10.0.0.1.44064 > 10.0.0.2.5001: UDP, length 1470

23:35:23.879593 IP 10.0.0.1.44064 > 10.0.0.2.5001: UDP, length 1470

23:35:23.891719 IP 10.0.0.1.44064 > 10.0.0.2.5001: UDP, length 1470

23:35:23.903783 IP 10.0.0.1.44064 > 10.0.0.2.5001: UDP, length 1470

23:35:23.915895 IP 10.0.0.1.44064 > 10.0.0.2.5001: UDP, length 1470

23:35:23.927968 IP 10.0.0.1.44064 > 10.0.0.2.5001: UDP, length 1470

23:35:23.940093 IP 10.0.0.1.44064 > 10.0.0.2.5001: UDP, length 1470

23:35:23.952206 IP 10.0.0.1.44064 > 10.0.0.2.5001: UDP, length 1470

23:35:23.964328 IP 10.0.0.1.44064 > 10.0.0.2.5001: UDP, length 1470

23:35:23.976314 IP 10.0.0.1.44064 > 10.0.0.2.5001: UDP, length 1470

23:35:23.988423 IP 10.0.0.1.44064 > 10.0.0.2.5001: UDP, length 1470

23:35:24.000608 IP 10.0.0.1.44064 > 10.0.0.2.5001: UDP, length 1470

23:35:24.012724 IP 10.0.0.1.44064 > 10.0.0.2.5001: UDP, length 1470

23:35:24.024845 IP 10.0.0.1.44064 > 10.0.0.2.5001: UDP, length 1470

23:35:24.036830 IP 10.0.0.1.44064 > 10.0.0.2.5001: UDP, length 1470

23:35:24.048873 IP 10.0.0.1.44064 > 10.0.0.2.5001: UDP, length 1470

23:35:24.061112 IP 10.0.0.1.44064 > 10.0.0.2.5001: UDP, length 1470

23:35:24.073254 IP 10.0.0.1.44064 > 10.0.0.2.5001: UDP, length 1470

23:35:24.085325 IP 10.0.0.1.44064 > 10.0.0.2.5001: UDP, length 1470

23:35:24.097335 IP 10.0.0.1.44064 > 10.0.0.2.5001: UDP, length 1470

23:35:24.109515 IP 10.0.0.1.44064 > 10.0.0.2.5001: UDP, length 1470

23:35:24.121558 IP 10.0.0.1.44064 > 10.0.0.2.5001: UDP, length 1470

23:35:24.133693 IP 10.0.0.1.44064 > 10.0.0.2.5001: UDP, length 1470

23:35:24.145671 IP 10.0.0.1.44064 > 10.0.0.2.5001: UDP, length 1470

23:35:24.157803 IP 10.0.0.1.44064 > 10.0.0.2.5001: UDP, length 1470

23:35:24.169965 IP 10.0.0.1.44064 > 10.0.0.2.5001: UDP, length 1470

23:35:24.182051 IP 10.0.0.1.44064 > 10.0.0.2.5001: UDP, length 1470

23:35:24.194271 IP 10.0.0.1.44064 > 10.0.0.2.5001: UDP, length 1470

23:35:24.206165 IP 10.0.0.1.44064 > 10.0.0.2.5001: UDP, length 1470

23:35:24.218325 IP 10.0.0.1.44064 > 10.0.0.2.5001: UDP, length 1470

23:35:24.230447 IP 10.0.0.1.44064 > 10.0.0.2.5001: UDP, length 1470

23:35:24.242463 IP 10.0.0.1.44064 > 10.0.0.2.5001: UDP, length 1470

23:35:24.254666 IP 10.0.0.1.44064 > 10.0.0.2.5001: UDP, length 1470

23:35:24.266676 IP 10.0.0.1.44064 > 10.0.0.2.5001: UDP, length 1470

23:35:24.278818 IP 10.0.0.1.44064 > 10.0.0.2.5001: UDP, length 1470

23:35:24.290940 IP 10.0.0.1.44064 > 10.0.0.2.5001: UDP, length 1470

23:35:24.303054 IP 10.0.0.1.44064 > 10.0.0.2.5001: UDP, length 1470

23:35:24.314989 IP 10.0.0.1.44064 > 10.0.0.2.5001: UDP, length 1470

23:35:24.327185 IP 10.0.0.1.44064 > 10.0.0.2.5001: UDP, length 1470

23:35:24.339301 IP 10.0.0.1.44064 > 10.0.0.2.5001: UDP, length 1470

23:35:24.351425 IP 10.0.0.1.44064 > 10.0.0.2.5001: UDP, length 1470

23:35:24.363547 IP 10.0.0.1.44064 > 10.0.0.2.5001: UDP, length 1470

23:35:24.375535 IP 10.0.0.1.44064 > 10.0.0.2.5001: UDP, length 1470

23:35:24.387676 IP 10.0.0.1.44064 > 10.0.0.2.5001: UDP, length 1470

23:35:24.399787 IP 10.0.0.1.44064 > 10.0.0.2.5001: UDP, length 1470

23:35:24.411914 IP 10.0.0.1.44064 > 10.0.0.2.5001: UDP, length 1470

23:35:24.424026 IP 10.0.0.1.44064 > 10.0.0.2.5001: UDP, length 1470

23:35:24.436026 IP 10.0.0.1.44064 > 10.0.0.2.5001: UDP, length 1470

23:35:24.448166 IP 10.0.0.1.44064 > 10.0.0.2.5001: UDP, length 1470

23:35:24.460357 IP 10.0.0.1.44064 > 10.0.0.2.5001: UDP, length 1470

23:35:24.472399 IP 10.0.0.1.44064 > 10.0.0.2.5001: UDP, length 1470

23:35:24.484359 IP 10.0.0.1.44064 > 10.0.0.2.5001: UDP, length 1470

23:35:24.496526 IP 10.0.0.1.44064 > 10.0.0.2.5001: UDP, length 1470

23:35:24.508524 IP 10.0.0.1.44064 > 10.0.0.2.5001: UDP, length 1470

23:35:24.520839 IP 10.0.0.1.44064 > 10.0.0.2.5001: UDP, length 1470

23:35:24.532760 IP 10.0.0.1.44064 > 10.0.0.2.5001: UDP, length 1470

23:35:24.544822 IP 10.0.0.1.44064 > 10.0.0.2.5001: UDP, length 1470

23:35:24.557090 IP 10.0.0.1.44064 > 10.0.0.2.5001: UDP, length 1470

23:35:24.569207 IP 10.0.0.1.44064 > 10.0.0.2.5001: UDP, length 1470

23:35:24.581296 IP 10.0.0.1.44064 > 10.0.0.2.5001: UDP, length 1470

23:35:24.593510 IP 10.0.0.1.44064 > 10.0.0.2.5001: UDP, length 1470

23:35:24.605375 IP 10.0.0.1.44064 > 10.0.0.2.5001: UDP, length 1470

23:35:24.617644 IP 10.0.0.1.44064 > 10.0.0.2.5001: UDP, length 1470

23:35:24.629688 IP 10.0.0.1.44064 > 10.0.0.2.5001: UDP, length 1470

23:35:24.641617 IP 10.0.0.1.44064 > 10.0.0.2.5001: UDP, length 1470

23:35:24.653907 IP 10.0.0.1.44064 > 10.0.0.2.5001: UDP, length 1470

23:35:24.665853 IP 10.0.0.1.44064 > 10.0.0.2.5001: UDP, length 1470

23:35:24.677991 IP 10.0.0.1.44064 > 10.0.0.2.5001: UDP, length 1470

23:35:24.690112 IP 10.0.0.1.44064 > 10.0.0.2.5001: UDP, length 1470

23:35:24.702225 IP 10.0.0.1.44064 > 10.0.0.2.5001: UDP, length 1470

23:35:24.714164 IP 10.0.0.1.44064 > 10.0.0.2.5001: UDP, length 1470

23:35:24.726358 IP 10.0.0.1.44064 > 10.0.0.2.5001: UDP, length 1470

23:35:24.738479 IP 10.0.0.1.44064 > 10.0.0.2.5001: UDP, length 1470

23:35:24.750597 IP 10.0.0.1.44064 > 10.0.0.2.5001: UDP, length 1470

23:35:24.762727 IP 10.0.0.1.44064 > 10.0.0.2.5001: UDP, length 1470

23:35:24.774732 IP 10.0.0.1.44064 > 10.0.0.2.5001: UDP, length 1470

23:35:24.786845 IP 10.0.0.1.44064 > 10.0.0.2.5001: UDP, length 1470

23:35:24.798976 IP 10.0.0.1.44064 > 10.0.0.2.5001: UDP, length 1470

23:35:24.811084 IP 10.0.0.1.44064 > 10.0.0.2.5001: UDP, length 1470

23:35:24.823164 IP 10.0.0.1.44064 > 10.0.0.2.5001: UDP, length 1470

23:35:24.835223 IP 10.0.0.1.44064 > 10.0.0.2.5001: UDP, length 1470

23:35:24.847339 IP 10.0.0.1.44064 > 10.0.0.2.5001: UDP, length 1470

23:35:24.859450 IP 10.0.0.1.44064 > 10.0.0.2.5001: UDP, length 1470

23:35:24.871508 IP 10.0.0.1.44064 > 10.0.0.2.5001: UDP, length 1470

23:35:24.883523 IP 10.0.0.1.44064 > 10.0.0.2.5001: UDP, length 1470

23:35:24.895708 IP 10.0.0.1.44064 > 10.0.0.2.5001: UDP, length 1470

23:35:24.907761 IP 10.0.0.1.44064 > 10.0.0.2.5001: UDP, length 1470

23:35:24.919925 IP 10.0.0.1.44064 > 10.0.0.2.5001: UDP, length 1470

23:35:24.931979 IP 10.0.0.1.44064 > 10.0.0.2.5001: UDP, length 1470

23:35:24.944033 IP 10.0.0.1.44064 > 10.0.0.2.5001: UDP, length 1470

23:35:24.956186 IP 10.0.0.1.44064 > 10.0.0.2.5001: UDP, length 1470

23:35:24.968226 IP 10.0.0.1.44064 > 10.0.0.2.5001: UDP, length 1470

23:35:24.981632 IP 10.0.0.1.44064 > 10.0.0.2.5001: UDP, length 1470

23:35:24.992440 IP 10.0.0.1.44064 > 10.0.0.2.5001: UDP, length 1470

23:35:25.004532 IP 10.0.0.1.44064 > 10.0.0.2.5001: UDP, length 1470

23:35:25.016672 IP 10.0.0.1.44064 > 10.0.0.2.5001: UDP, length 1470

23:35:25.028761 IP 10.0.0.1.44064 > 10.0.0.2.5001: UDP, length 1470

23:35:25.040917 IP 10.0.0.1.44064 > 10.0.0.2.5001: UDP, length 1470

23:35:25.052863 IP 10.0.0.1.44064 > 10.0.0.2.5001: UDP, length 1470

23:35:25.065031 IP 10.0.0.1.44064 > 10.0.0.2.5001: UDP, length 1470

23:35:25.077158 IP 10.0.0.1.44064 > 10.0.0.2.5001: UDP, length 1470

23:35:25.089277 IP 10.0.0.1.44064 > 10.0.0.2.5001: UDP, length 1470

23:35:25.101388 IP 10.0.0.1.44064 > 10.0.0.2.5001: UDP, length 1470

23:35:25.113319 IP 10.0.0.1.44064 > 10.0.0.2.5001: UDP, length 1470

23:35:25.125535 IP 10.0.0.1.44064 > 10.0.0.2.5001: UDP, length 1470

23:35:25.137646 IP 10.0.0.1.44064 > 10.0.0.2.5001: UDP, length 1470

23:35:25.149769 IP 10.0.0.1.44064 > 10.0.0.2.5001: UDP, length 1470

23:35:25.161883 IP 10.0.0.1.44064 > 10.0.0.2.5001: UDP, length 1470

23:35:25.173861 IP 10.0.0.1.44064 > 10.0.0.2.5001: UDP, length 1470

23:35:25.185892 IP 10.0.0.1.44064 > 10.0.0.2.5001: UDP, length 1470

23:35:25.198139 IP 10.0.0.1.44064 > 10.0.0.2.5001: UDP, length 1470

23:35:25.210255 IP 10.0.0.1.44064 > 10.0.0.2.5001: UDP, length 1470

23:35:25.222188 IP 10.0.0.1.44064 > 10.0.0.2.5001: UDP, length 1470

23:35:25.234339 IP 10.0.0.1.44064 > 10.0.0.2.5001: UDP, length 1470

23:35:25.246458 IP 10.0.0.1.44064 > 10.0.0.2.5001: UDP, length 1470

23:35:25.258589 IP 10.0.0.1.44064 > 10.0.0.2.5001: UDP, length 1470

23:35:25.270747 IP 10.0.0.1.44064 > 10.0.0.2.5001: UDP, length 1470

23:35:25.282668 IP 10.0.0.1.44064 > 10.0.0.2.5001: UDP, length 1470

23:35:25.294864 IP 10.0.0.1.44064 > 10.0.0.2.5001: UDP, length 1470

23:35:25.306980 IP 10.0.0.1.44064 > 10.0.0.2.5001: UDP, length 1470

23:35:25.319054 IP 10.0.0.1.44064 > 10.0.0.2.5001: UDP, length 1470

23:35:25.331213 IP 10.0.0.1.44064 > 10.0.0.2.5001: UDP, length 1470

23:35:25.343217 IP 10.0.0.1.44064 > 10.0.0.2.5001: UDP, length 1470

23:35:25.355340 IP 10.0.0.1.44064 > 10.0.0.2.5001: UDP, length 1470

23:35:25.367465 IP 10.0.0.1.44064 > 10.0.0.2.5001: UDP, length 1470

23:35:25.379488 IP 10.0.0.1.44064 > 10.0.0.2.5001: UDP, length 1470

23:35:25.391615 IP 10.0.0.1.44064 > 10.0.0.2.5001: UDP, length 1470

23:35:25.403729 IP 10.0.0.1.44064 > 10.0.0.2.5001: UDP, length 1470

23:35:25.415823 IP 10.0.0.1.44064 > 10.0.0.2.5001: UDP, length 1470

23:35:25.427957 IP 10.0.0.1.44064 > 10.0.0.2.5001: UDP, length 1470

23:35:25.440073 IP 10.0.0.1.44064 > 10.0.0.2.5001: UDP, length 1470

23:35:25.452016 IP 10.0.0.1.44064 > 10.0.0.2.5001: UDP, length 1470

23:35:25.464220 IP 10.0.0.1.44064 > 10.0.0.2.5001: UDP, length 1470

23:35:25.476367 IP 10.0.0.1.44064 > 10.0.0.2.5001: UDP, length 1470

23:35:25.488423 IP 10.0.0.1.44064 > 10.0.0.2.5001: UDP, length 1470

23:35:25.500563 IP 10.0.0.1.44064 > 10.0.0.2.5001: UDP, length 1470

23:35:25.512557 IP 10.0.0.1.44064 > 10.0.0.2.5001: UDP, length 1470

23:35:25.524701 IP 10.0.0.1.44064 > 10.0.0.2.5001: UDP, length 1470

23:35:25.536810 IP 10.0.0.1.44064 > 10.0.0.2.5001: UDP, length 1470

23:35:25.548931 IP 10.0.0.1.44064 > 10.0.0.2.5001: UDP, length 1470

23:35:25.561032 IP 10.0.0.1.44064 > 10.0.0.2.5001: UDP, length 1470

23:35:25.573070 IP 10.0.0.1.44064 > 10.0.0.2.5001: UDP, length 1470

23:35:25.585187 IP 10.0.0.1.44064 > 10.0.0.2.5001: UDP, length 1470

23:35:25.597287 IP 10.0.0.1.44064 > 10.0.0.2.5001: UDP, length 1470

23:35:25.609431 IP 10.0.0.1.44064 > 10.0.0.2.5001: UDP, length 1470

23:35:25.621376 IP 10.0.0.1.44064 > 10.0.0.2.5001: UDP, length 1470

23:35:25.633569 IP 10.0.0.1.44064 > 10.0.0.2.5001: UDP, length 1470

23:35:25.645689 IP 10.0.0.1.44064 > 10.0.0.2.5001: UDP, length 1470

23:35:25.657680 IP 10.0.0.1.44064 > 10.0.0.2.5001: UDP, length 1470

23:35:25.669920 IP 10.0.0.1.44064 > 10.0.0.2.5001: UDP, length 1470

23:35:25.681885 IP 10.0.0.1.44064 > 10.0.0.2.5001: UDP, length 1470

23:35:25.694061 IP 10.0.0.1.44064 > 10.0.0.2.5001: UDP, length 1470

23:35:25.706075 IP 10.0.0.1.44064 > 10.0.0.2.5001: UDP, length 1470

23:35:25.718257 IP 10.0.0.1.44064 > 10.0.0.2.5001: UDP, length 1470

23:35:25.730392 IP 10.0.0.1.44064 > 10.0.0.2.5001: UDP, length 1470

23:35:25.742378 IP 10.0.0.1.44064 > 10.0.0.2.5001: UDP, length 1470

23:35:25.754500 IP 10.0.0.1.44064 > 10.0.0.2.5001: UDP, length 1470

23:35:25.766650 IP 10.0.0.1.44064 > 10.0.0.2.5001: UDP, length 1470

23:35:25.778739 IP 10.0.0.1.44064 > 10.0.0.2.5001: UDP, length 1470

23:35:25.790707 IP 10.0.0.1.44064 > 10.0.0.2.5001: UDP, length 1470

23:35:25.802870 IP 10.0.0.1.44064 > 10.0.0.2.5001: UDP, length 1470

23:35:25.815012 IP 10.0.0.1.44064 > 10.0.0.2.5001: UDP, length 1470

23:35:25.827142 IP 10.0.0.1.44064 > 10.0.0.2.5001: UDP, length 1470

23:35:25.839229 IP 10.0.0.1.44064 > 10.0.0.2.5001: UDP, length 1470

23:35:25.851322 IP 10.0.0.1.44064 > 10.0.0.2.5001: UDP, length 1470

23:35:25.863335 IP 10.0.0.1.44064 > 10.0.0.2.5001: UDP, length 1470

23:35:25.875487 IP 10.0.0.1.44064 > 10.0.0.2.5001: UDP, length 1470

23:35:25.887574 IP 10.0.0.1.44064 > 10.0.0.2.5001: UDP, length 1470

23:35:25.899612 IP 10.0.0.1.44064 > 10.0.0.2.5001: UDP, length 1470

23:35:25.911705 IP 10.0.0.1.44064 > 10.0.0.2.5001: UDP, length 1470

23:35:25.923835 IP 10.0.0.1.44064 > 10.0.0.2.5001: UDP, length 1470

23:35:25.935992 IP 10.0.0.1.44064 > 10.0.0.2.5001: UDP, length 1470

23:35:25.948105 IP 10.0.0.1.44064 > 10.0.0.2.5001: UDP, length 1470

23:35:25.960279 IP 10.0.0.1.44064 > 10.0.0.2.5001: UDP, length 1470

23:35:25.972355 IP 10.0.0.1.44064 > 10.0.0.2.5001: UDP, length 1470

23:35:25.984354 IP 10.0.0.1.44064 > 10.0.0.2.5001: UDP, length 1470

23:35:25.996430 IP 10.0.0.1.44064 > 10.0.0.2.5001: UDP, length 1470

23:35:26.008508 IP 10.0.0.1.44064 > 10.0.0.2.5001: UDP, length 1470

23:35:26.020512 IP 10.0.0.1.44064 > 10.0.0.2.5001: UDP, length 1470

23:35:26.032671 IP 10.0.0.1.44064 > 10.0.0.2.5001: UDP, length 1470

23:35:26.044844 IP 10.0.0.1.44064 > 10.0.0.2.5001: UDP, length 1470

23:35:26.056939 IP 10.0.0.1.44064 > 10.0.0.2.5001: UDP, length 1470

23:35:26.069065 IP 10.0.0.1.44064 > 10.0.0.2.5001: UDP, length 1470

23:35:26.081080 IP 10.0.0.1.44064 > 10.0.0.2.5001: UDP, length 1470

23:35:26.093203 IP 10.0.0.1.44064 > 10.0.0.2.5001: UDP, length 1470

23:35:26.105527 IP 10.0.0.1.44064 > 10.0.0.2.5001: UDP, length 1470

23:35:26.117557 IP 10.0.0.1.44064 > 10.0.0.2.5001: UDP, length 1470

23:35:26.129631 IP 10.0.0.1.44064 > 10.0.0.2.5001: UDP, length 1470

23:35:26.141577 IP 10.0.0.1.44064 > 10.0.0.2.5001: UDP, length 1470

23:35:26.153701 IP 10.0.0.1.44064 > 10.0.0.2.5001: UDP, length 1470

23:35:26.165780 IP 10.0.0.1.44064 > 10.0.0.2.5001: UDP, length 1470

23:35:26.177978 IP 10.0.0.1.44064 > 10.0.0.2.5001: UDP, length 1470

23:35:26.189927 IP 10.0.0.1.44064 > 10.0.0.2.5001: UDP, length 1470

23:35:26.202166 IP 10.0.0.1.44064 > 10.0.0.2.5001: UDP, length 1470

23:35:26.214271 IP 10.0.0.1.44064 > 10.0.0.2.5001: UDP, length 1470

23:35:26.226330 IP 10.0.0.1.44064 > 10.0.0.2.5001: UDP, length 1470

23:35:26.238350 IP 10.0.0.1.44064 > 10.0.0.2.5001: UDP, length 1470

23:35:26.250398 IP 10.0.0.1.44064 > 10.0.0.2.5001: UDP, length 1470

23:35:26.262517 IP 10.0.0.1.44064 > 10.0.0.2.5001: UDP, length 1470

23:35:26.274693 IP 10.0.0.1.44064 > 10.0.0.2.5001: UDP, length 1470

23:35:26.286789 IP 10.0.0.1.44064 > 10.0.0.2.5001: UDP, length 1470

23:35:26.298775 IP 10.0.0.1.44064 > 10.0.0.2.5001: UDP, length 1470

23:35:26.310918 IP 10.0.0.1.44064 > 10.0.0.2.5001: UDP, length 1470

23:35:26.323038 IP 10.0.0.1.44064 > 10.0.0.2.5001: UDP, length 1470

23:35:26.335100 IP 10.0.0.1.44064 > 10.0.0.2.5001: UDP, length 1470

23:35:26.347241 IP 10.0.0.1.44064 > 10.0.0.2.5001: UDP, length 1470

23:35:26.359263 IP 10.0.0.1.44064 > 10.0.0.2.5001: UDP, length 1470

23:35:26.371416 IP 10.0.0.1.44064 > 10.0.0.2.5001: UDP, length 1470

23:35:26.383519 IP 10.0.0.1.44064 > 10.0.0.2.5001: UDP, length 1470

23:35:26.395653 IP 10.0.0.1.44064 > 10.0.0.2.5001: UDP, length 1470

23:35:26.407626 IP 10.0.0.1.44064 > 10.0.0.2.5001: UDP, length 1470

23:35:26.419738 IP 10.0.0.1.44064 > 10.0.0.2.5001: UDP, length 1470

23:35:26.431899 IP 10.0.0.1.44064 > 10.0.0.2.5001: UDP, length 1470

23:35:26.444019 IP 10.0.0.1.44064 > 10.0.0.2.5001: UDP, length 1470

23:35:26.456128 IP 10.0.0.1.44064 > 10.0.0.2.5001: UDP, length 1470

23:35:26.468258 IP 10.0.0.1.44064 > 10.0.0.2.5001: UDP, length 1470

23:35:26.480225 IP 10.0.0.1.44064 > 10.0.0.2.5001: UDP, length 1470

23:35:26.492334 IP 10.0.0.1.44064 > 10.0.0.2.5001: UDP, length 1470

23:35:26.504510 IP 10.0.0.1.44064 > 10.0.0.2.5001: UDP, length 1470

23:35:26.516624 IP 10.0.0.1.44064 > 10.0.0.2.5001: UDP, length 1470

23:35:26.528577 IP 10.0.0.1.44064 > 10.0.0.2.5001: UDP, length 1470

23:35:26.540758 IP 10.0.0.1.44064 > 10.0.0.2.5001: UDP, length 1470

23:35:26.552882 IP 10.0.0.1.44064 > 10.0.0.2.5001: UDP, length 1470

23:35:26.564981 IP 10.0.0.1.44064 > 10.0.0.2.5001: UDP, length 1470

23:35:26.577105 IP 10.0.0.1.44064 > 10.0.0.2.5001: UDP, length 1470

23:35:26.589083 IP 10.0.0.1.44064 > 10.0.0.2.5001: UDP, length 1470

23:35:26.601236 IP 10.0.0.1.44064 > 10.0.0.2.5001: UDP, length 1470

23:35:26.613363 IP 10.0.0.1.44064 > 10.0.0.2.5001: UDP, length 1470

23:35:26.625457 IP 10.0.0.1.44064 > 10.0.0.2.5001: UDP, length 1470

23:35:26.637605 IP 10.0.0.1.44064 > 10.0.0.2.5001: UDP, length 1470

23:35:26.649596 IP 10.0.0.1.44064 > 10.0.0.2.5001: UDP, length 1470

23:35:26.661718 IP 10.0.0.1.44064 > 10.0.0.2.5001: UDP, length 1470

23:35:26.673746 IP 10.0.0.1.44064 > 10.0.0.2.5001: UDP, length 1470

23:35:26.685980 IP 10.0.0.1.44064 > 10.0.0.2.5001: UDP, length 1470

23:35:26.698015 IP 10.0.0.1.44064 > 10.0.0.2.5001: UDP, length 1470

23:35:26.710084 IP 10.0.0.1.44064 > 10.0.0.2.5001: UDP, length 1470

23:35:26.722236 IP 10.0.0.1.44064 > 10.0.0.2.5001: UDP, length 1470

23:35:26.734297 IP 10.0.0.1.44064 > 10.0.0.2.5001: UDP, length 1470

23:35:26.746360 IP 10.0.0.1.44064 > 10.0.0.2.5001: UDP, length 1470

23:35:26.758432 IP 10.0.0.1.44064 > 10.0.0.2.5001: UDP, length 1470

23:35:26.770589 IP 10.0.0.1.44064 > 10.0.0.2.5001: UDP, length 1470

23:35:26.782562 IP 10.0.0.1.44064 > 10.0.0.2.5001: UDP, length 1470

23:35:26.794822 IP 10.0.0.1.44064 > 10.0.0.2.5001: UDP, length 1470

23:35:26.806942 IP 10.0.0.1.44064 > 10.0.0.2.5001: UDP, length 1470

23:35:26.818926 IP 10.0.0.1.44064 > 10.0.0.2.5001: UDP, length 1470

23:35:26.831072 IP 10.0.0.1.44064 > 10.0.0.2.5001: UDP, length 1470

23:35:26.843193 IP 10.0.0.1.44064 > 10.0.0.2.5001: UDP, length 1470

23:35:26.855306 IP 10.0.0.1.44064 > 10.0.0.2.5001: UDP, length 1470

23:35:26.867454 IP 10.0.0.1.44064 > 10.0.0.2.5001: UDP, length 1470

23:35:26.879405 IP 10.0.0.1.44064 > 10.0.0.2.5001: UDP, length 1470

23:35:26.891626 IP 10.0.0.1.44064 > 10.0.0.2.5001: UDP, length 1470

23:35:26.904230 IP 10.0.0.1.44064 > 10.0.0.2.5001: UDP, length 1470

23:35:26.915797 IP 10.0.0.1.44064 > 10.0.0.2.5001: UDP, length 1470

23:35:26.927763 IP 10.0.0.1.44064 > 10.0.0.2.5001: UDP, length 1470

23:35:26.939878 IP 10.0.0.1.44064 > 10.0.0.2.5001: UDP, length 1470

23:35:26.951993 IP 10.0.0.1.44064 > 10.0.0.2.5001: UDP, length 1470

23:35:26.964251 IP 10.0.0.1.44064 > 10.0.0.2.5001: UDP, length 1470

23:35:26.976343 IP 10.0.0.1.44064 > 10.0.0.2.5001: UDP, length 1470

23:35:26.988238 IP 10.0.0.1.44064 > 10.0.0.2.5001: UDP, length 1470

23:35:27.000456 IP 10.0.0.1.44064 > 10.0.0.2.5001: UDP, length 1470

23:35:27.012572 IP 10.0.0.1.44064 > 10.0.0.2.5001: UDP, length 1470

23:35:27.024659 IP 10.0.0.1.44064 > 10.0.0.2.5001: UDP, length 1470

23:35:27.036804 IP 10.0.0.1.44064 > 10.0.0.2.5001: UDP, length 1470

23:35:27.048781 IP 10.0.0.1.44064 > 10.0.0.2.5001: UDP, length 1470

23:35:27.060883 IP 10.0.0.1.44064 > 10.0.0.2.5001: UDP, length 1470

23:35:27.073010 IP 10.0.0.1.44064 > 10.0.0.2.5001: UDP, length 1470

23:35:27.085061 IP 10.0.0.1.44064 > 10.0.0.2.5001: UDP, length 1470

23:35:27.097075 IP 10.0.0.1.44064 > 10.0.0.2.5001: UDP, length 1470

23:35:27.109258 IP 10.0.0.1.44064 > 10.0.0.2.5001: UDP, length 1470

23:35:27.121347 IP 10.0.0.1.44064 > 10.0.0.2.5001: UDP, length 1470

23:35:27.133468 IP 10.0.0.1.44064 > 10.0.0.2.5001: UDP, length 1470

23:35:27.145528 IP 10.0.0.1.44064 > 10.0.0.2.5001: UDP, length 1470

23:35:27.157537 IP 10.0.0.1.44064 > 10.0.0.2.5001: UDP, length 1470

23:35:27.169765 IP 10.0.0.1.44064 > 10.0.0.2.5001: UDP, length 1470

23:35:27.181889 IP 10.0.0.1.44064 > 10.0.0.2.5001: UDP, length 1470

23:35:27.194008 IP 10.0.0.1.44064 > 10.0.0.2.5001: UDP, length 1470

23:35:27.206125 IP 10.0.0.1.44064 > 10.0.0.2.5001: UDP, length 1470

23:35:27.218039 IP 10.0.0.1.44064 > 10.0.0.2.5001: UDP, length 1470

23:35:27.230258 IP 10.0.0.1.44064 > 10.0.0.2.5001: UDP, length 1470

23:35:27.242364 IP 10.0.0.1.44064 > 10.0.0.2.5001: UDP, length 1470

23:35:27.254468 IP 10.0.0.1.44064 > 10.0.0.2.5001: UDP, length 1470

23:35:27.266430 IP 10.0.0.1.44064 > 10.0.0.2.5001: UDP, length 1470

23:35:27.278615 IP 10.0.0.1.44064 > 10.0.0.2.5001: UDP, length 1470

23:35:27.290744 IP 10.0.0.1.44064 > 10.0.0.2.5001: UDP, length 1470

23:35:27.302853 IP 10.0.0.1.44064 > 10.0.0.2.5001: UDP, length 1470

23:35:27.314975 IP 10.0.0.1.44064 > 10.0.0.2.5001: UDP, length 1470

23:35:27.326942 IP 10.0.0.1.44064 > 10.0.0.2.5001: UDP, length 1470

23:35:27.338999 IP 10.0.0.1.44064 > 10.0.0.2.5001: UDP, length 1470

23:35:27.351187 IP 10.0.0.1.44064 > 10.0.0.2.5001: UDP, length 1470

23:35:27.363335 IP 10.0.0.1.44064 > 10.0.0.2.5001: UDP, length 1470

23:35:27.375463 IP 10.0.0.1.44064 > 10.0.0.2.5001: UDP, length 1470

23:35:27.387442 IP 10.0.0.1.44064 > 10.0.0.2.5001: UDP, length 1470

23:35:27.399584 IP 10.0.0.1.44064 > 10.0.0.2.5001: UDP, length 1470

23:35:27.411684 IP 10.0.0.1.44064 > 10.0.0.2.5001: UDP, length 1470

23:35:27.423835 IP 10.0.0.1.44064 > 10.0.0.2.5001: UDP, length 1470

23:35:27.435806 IP 10.0.0.1.44064 > 10.0.0.2.5001: UDP, length 1470

23:35:27.447959 IP 10.0.0.1.44064 > 10.0.0.2.5001: UDP, length 1470

23:35:27.460068 IP 10.0.0.1.44064 > 10.0.0.2.5001: UDP, length 1470

23:35:27.472082 IP 10.0.0.1.44064 > 10.0.0.2.5001: UDP, length 1470

23:35:27.484256 IP 10.0.0.1.44064 > 10.0.0.2.5001: UDP, length 1470

23:35:27.496299 IP 10.0.0.1.44064 > 10.0.0.2.5001: UDP, length 1470

23:35:27.508431 IP 10.0.0.1.44064 > 10.0.0.2.5001: UDP, length 1470

23:35:27.520549 IP 10.0.0.1.44064 > 10.0.0.2.5001: UDP, length 1470

23:35:27.532570 IP 10.0.0.1.44064 > 10.0.0.2.5001: UDP, length 1470

23:35:27.544762 IP 10.0.0.1.44064 > 10.0.0.2.5001: UDP, length 1470

23:35:27.556789 IP 10.0.0.1.44064 > 10.0.0.2.5001: UDP, length 1470

23:35:27.568935 IP 10.0.0.1.44064 > 10.0.0.2.5001: UDP, length 1470

23:35:27.581049 IP 10.0.0.1.44064 > 10.0.0.2.5001: UDP, length 1470

23:35:27.593166 IP 10.0.0.1.44064 > 10.0.0.2.5001: UDP, length 1470

23:35:27.605114 IP 10.0.0.1.44064 > 10.0.0.2.5001: UDP, length 1470

23:35:27.617302 IP 10.0.0.1.44064 > 10.0.0.2.5001: UDP, length 1470

23:35:27.629454 IP 10.0.0.1.44064 > 10.0.0.2.5001: UDP, length 1470

23:35:27.641539 IP 10.0.0.1.44064 > 10.0.0.2.5001: UDP, length 1470

23:35:27.653674 IP 10.0.0.1.44064 > 10.0.0.2.5001: UDP, length 1470

23:35:27.665637 IP 10.0.0.1.44064 > 10.0.0.2.5001: UDP, length 1470

23:35:27.677796 IP 10.0.0.1.44064 > 10.0.0.2.5001: UDP, length 1470

23:35:27.689911 IP 10.0.0.1.44064 > 10.0.0.2.5001: UDP, length 1470

23:35:27.702027 IP 10.0.0.1.44064 > 10.0.0.2.5001: UDP, length 1470

23:35:27.714182 IP 10.0.0.1.44064 > 10.0.0.2.5001: UDP, length 1470

23:35:27.726104 IP 10.0.0.1.44064 > 10.0.0.2.5001: UDP, length 1470

23:35:27.738224 IP 10.0.0.1.44064 > 10.0.0.2.5001: UDP, length 1470

23:35:27.750400 IP 10.0.0.1.44064 > 10.0.0.2.5001: UDP, length 1470

23:35:27.762507 IP 10.0.0.1.44064 > 10.0.0.2.5001: UDP, length 1470

23:35:27.774519 IP 10.0.0.1.44064 > 10.0.0.2.5001: UDP, length 1470

23:35:27.786625 IP 10.0.0.1.44064 > 10.0.0.2.5001: UDP, length 1470

23:35:27.798711 IP 10.0.0.1.44064 > 10.0.0.2.5001: UDP, length 1470

23:35:27.810887 IP 10.0.0.1.44064 > 10.0.0.2.5001: UDP, length 1470

23:35:27.822987 IP 10.0.0.1.44064 > 10.0.0.2.5001: UDP, length 1470

23:35:27.834962 IP 10.0.0.1.44064 > 10.0.0.2.5001: UDP, length 1470

23:35:27.847127 IP 10.0.0.1.44064 > 10.0.0.2.5001: UDP, length 1470

23:35:27.859245 IP 10.0.0.1.44064 > 10.0.0.2.5001: UDP, length 1470

23:35:27.871289 IP 10.0.0.1.44064 > 10.0.0.2.5001: UDP, length 1470

23:35:27.883369 IP 10.0.0.1.44064 > 10.0.0.2.5001: UDP, length 1470

23:35:27.895430 IP 10.0.0.1.44064 > 10.0.0.2.5001: UDP, length 1470

23:35:27.907484 IP 10.0.0.1.44064 > 10.0.0.2.5001: UDP, length 1470

23:35:27.919691 IP 10.0.0.1.44064 > 10.0.0.2.5001: UDP, length 1470

23:35:27.931781 IP 10.0.0.1.44064 > 10.0.0.2.5001: UDP, length 1470

23:35:27.943888 IP 10.0.0.1.44064 > 10.0.0.2.5001: UDP, length 1470

23:35:27.955957 IP 10.0.0.1.44064 > 10.0.0.2.5001: UDP, length 1470

23:35:27.968097 IP 10.0.0.1.44064 > 10.0.0.2.5001: UDP, length 1470

23:35:27.980214 IP 10.0.0.1.44064 > 10.0.0.2.5001: UDP, length 1470

23:35:27.992279 IP 10.0.0.1.44064 > 10.0.0.2.5001: UDP, length 1470

23:35:28.004275 IP 10.0.0.1.44064 > 10.0.0.2.5001: UDP, length 1470

23:35:28.016456 IP 10.0.0.1.44064 > 10.0.0.2.5001: UDP, length 1470

23:35:28.028575 IP 10.0.0.1.44064 > 10.0.0.2.5001: UDP, length 1470

23:35:28.040691 IP 10.0.0.1.44064 > 10.0.0.2.5001: UDP, length 1470

23:35:28.052807 IP 10.0.0.1.44064 > 10.0.0.2.5001: UDP, length 1470

23:35:28.064797 IP 10.0.0.1.44064 > 10.0.0.2.5001: UDP, length 1470

23:35:28.076944 IP 10.0.0.1.44064 > 10.0.0.2.5001: UDP, length 1470

23:35:28.089079 IP 10.0.0.1.44064 > 10.0.0.2.5001: UDP, length 1470

23:35:28.101177 IP 10.0.0.1.44064 > 10.0.0.2.5001: UDP, length 1470

23:35:28.113311 IP 10.0.0.1.44064 > 10.0.0.2.5001: UDP, length 1470

23:35:28.125320 IP 10.0.0.1.44064 > 10.0.0.2.5001: UDP, length 1470

23:35:28.137462 IP 10.0.0.1.44064 > 10.0.0.2.5001: UDP, length 1470

23:35:28.149565 IP 10.0.0.1.44064 > 10.0.0.2.5001: UDP, length 1470

23:35:28.161691 IP 10.0.0.1.44064 > 10.0.0.2.5001: UDP, length 1470

23:35:28.173656 IP 10.0.0.1.44064 > 10.0.0.2.5001: UDP, length 1470

23:35:28.185817 IP 10.0.0.1.44064 > 10.0.0.2.5001: UDP, length 1470

23:35:28.197940 IP 10.0.0.1.44064 > 10.0.0.2.5001: UDP, length 1470

23:35:28.210059 IP 10.0.0.1.44064 > 10.0.0.2.5001: UDP, length 1470

23:35:28.222128 IP 10.0.0.1.44064 > 10.0.0.2.5001: UDP, length 1470

23:35:28.234140 IP 10.0.0.1.44064 > 10.0.0.2.5001: UDP, length 1470

23:35:28.246251 IP 10.0.0.1.44064 > 10.0.0.2.5001: UDP, length 1470

23:35:28.258402 IP 10.0.0.1.44064 > 10.0.0.2.5001: UDP, length 1470

23:35:28.270545 IP 10.0.0.1.44064 > 10.0.0.2.5001: UDP, length 1470

23:35:28.282548 IP 10.0.0.1.44064 > 10.0.0.2.5001: UDP, length 1470

23:35:28.294642 IP 10.0.0.1.44064 > 10.0.0.2.5001: UDP, length 1470

23:35:28.306791 IP 10.0.0.1.44064 > 10.0.0.2.5001: UDP, length 1470

23:35:28.318900 IP 10.0.0.1.44064 > 10.0.0.2.5001: UDP, length 1470

23:35:28.331030 IP 10.0.0.1.44064 > 10.0.0.2.5001: UDP, length 1470

23:35:28.343056 IP 10.0.0.1.44064 > 10.0.0.2.5001: UDP, length 1470

23:35:28.355152 IP 10.0.0.1.44064 > 10.0.0.2.5001: UDP, length 1470

23:35:28.367287 IP 10.0.0.1.44064 > 10.0.0.2.5001: UDP, length 1470

23:35:28.379302 IP 10.0.0.1.44064 > 10.0.0.2.5001: UDP, length 1470

23:35:28.391506 IP 10.0.0.1.44064 > 10.0.0.2.5001: UDP, length 1470

23:35:28.403428 IP 10.0.0.1.44064 > 10.0.0.2.5001: UDP, length 1470

23:35:28.415641 IP 10.0.0.1.44064 > 10.0.0.2.5001: UDP, length 1470

23:35:28.427755 IP 10.0.0.1.44064 > 10.0.0.2.5001: UDP, length 1470

23:35:28.439874 IP 10.0.0.1.44064 > 10.0.0.2.5001: UDP, length 1470

23:35:28.451962 IP 10.0.0.1.44064 > 10.0.0.2.5001: UDP, length 1470

23:35:28.463965 IP 10.0.0.1.44064 > 10.0.0.2.5001: UDP, length 1470

23:35:28.476215 IP 10.0.0.1.44064 > 10.0.0.2.5001: UDP, length 1470

23:35:28.488317 IP 10.0.0.1.44064 > 10.0.0.2.5001: UDP, length 1470

23:35:28.500470 IP 10.0.0.1.44064 > 10.0.0.2.5001: UDP, length 1470

23:35:28.512390 IP 10.0.0.1.44064 > 10.0.0.2.5001: UDP, length 1470

23:35:28.524620 IP 10.0.0.1.44064 > 10.0.0.2.5001: UDP, length 1470

23:35:28.536801 IP 10.0.0.1.44064 > 10.0.0.2.5001: UDP, length 1470

23:35:28.548864 IP 10.0.0.1.44064 > 10.0.0.2.5001: UDP, length 1470

23:35:28.560954 IP 10.0.0.1.44064 > 10.0.0.2.5001: UDP, length 1470

23:35:28.573007 IP 10.0.0.1.44064 > 10.0.0.2.5001: UDP, length 1470

23:35:28.584996 IP 10.0.0.1.44064 > 10.0.0.2.5001: UDP, length 1470

23:35:28.597174 IP 10.0.0.1.44064 > 10.0.0.2.5001: UDP, length 1470

23:35:28.609278 IP 10.0.0.1.44064 > 10.0.0.2.5001: UDP, length 1470

23:35:28.621250 IP 10.0.0.1.44064 > 10.0.0.2.5001: UDP, length 1470

23:35:28.633496 IP 10.0.0.1.44064 > 10.0.0.2.5001: UDP, length 1470

23:35:28.645891 IP 10.0.0.1.44064 > 10.0.0.2.5001: UDP, length 1470

23:35:28.657874 IP 10.0.0.1.44064 > 10.0.0.2.5001: UDP, length 1470

23:35:28.669829 IP 10.0.0.1.44064 > 10.0.0.2.5001: UDP, length 1470

23:35:28.681891 IP 10.0.0.1.44064 > 10.0.0.2.5001: UDP, length 1470

23:35:28.694121 IP 10.0.0.1.44064 > 10.0.0.2.5001: UDP, length 1470

23:35:28.706130 IP 10.0.0.1.44064 > 10.0.0.2.5001: UDP, length 1470

23:35:28.718302 IP 10.0.0.1.44064 > 10.0.0.2.5001: UDP, length 1470

23:35:28.730424 IP 10.0.0.1.44064 > 10.0.0.2.5001: UDP, length 1470

23:35:28.742215 IP 10.0.0.1.44064 > 10.0.0.2.5001: UDP, length 1470

23:35:28.754334 IP 10.0.0.1.44064 > 10.0.0.2.5001: UDP, length 1470

23:35:28.766562 IP 10.0.0.1.44064 > 10.0.0.2.5001: UDP, length 1470

23:35:28.778730 IP 10.0.0.1.44064 > 10.0.0.2.5001: UDP, length 1470

23:35:28.790876 IP 10.0.0.1.44064 > 10.0.0.2.5001: UDP, length 1470

23:35:28.802725 IP 10.0.0.1.44064 > 10.0.0.2.5001: UDP, length 1470

23:35:28.814834 IP 10.0.0.1.44064 > 10.0.0.2.5001: UDP, length 1470

23:35:28.826980 IP 10.0.0.1.44064 > 10.0.0.2.5001: UDP, length 1470

23:35:28.839175 IP 10.0.0.1.44064 > 10.0.0.2.5001: UDP, length 1470

23:35:28.851257 IP 10.0.0.1.44064 > 10.0.0.2.5001: UDP, length 1470

23:35:28.863422 IP 10.0.0.1.44064 > 10.0.0.2.5001: UDP, length 1470

23:35:28.875289 IP 10.0.0.1.44064 > 10.0.0.2.5001: UDP, length 1470

23:35:28.887462 IP 10.0.0.1.44064 > 10.0.0.2.5001: UDP, length 1470

23:35:28.899582 IP 10.0.0.1.44064 > 10.0.0.2.5001: UDP, length 1470

23:35:28.911698 IP 10.0.0.1.44064 > 10.0.0.2.5001: UDP, length 1470

23:35:28.923751 IP 10.0.0.1.44064 > 10.0.0.2.5001: UDP, length 1470

23:35:28.935856 IP 10.0.0.1.44064 > 10.0.0.2.5001: UDP, length 1470

23:35:28.947890 IP 10.0.0.1.44064 > 10.0.0.2.5001: UDP, length 1470

23:35:28.960007 IP 10.0.0.1.44064 > 10.0.0.2.5001: UDP, length 1470

23:35:28.972073 IP 10.0.0.1.44064 > 10.0.0.2.5001: UDP, length 1470

23:35:28.984176 IP 10.0.0.1.44064 > 10.0.0.2.5001: UDP, length 1470

23:35:28.996187 IP 10.0.0.1.44064 > 10.0.0.2.5001: UDP, length 1470

23:35:29.008263 IP 10.0.0.1.44064 > 10.0.0.2.5001: UDP, length 1470

23:35:29.020470 IP 10.0.0.1.44064 > 10.0.0.2.5001: UDP, length 1470

23:35:29.032563 IP 10.0.0.1.44064 > 10.0.0.2.5001: UDP, length 1470

23:35:29.044788 IP 10.0.0.1.44064 > 10.0.0.2.5001: UDP, length 1470

23:35:29.056976 IP 10.0.0.1.44064 > 10.0.0.2.5001: UDP, length 1470

23:35:29.069163 IP 10.0.0.1.44064 > 10.0.0.2.5001: UDP, length 1470

23:35:29.080875 IP 10.0.0.1.44064 > 10.0.0.2.5001: UDP, length 1470

23:35:29.093058 IP 10.0.0.1.44064 > 10.0.0.2.5001: UDP, length 1470

23:35:29.105220 IP 10.0.0.1.44064 > 10.0.0.2.5001: UDP, length 1470

23:35:29.117377 IP 10.0.0.1.44064 > 10.0.0.2.5001: UDP, length 1470

23:35:29.129554 IP 10.0.0.1.44064 > 10.0.0.2.5001: UDP, length 1470

23:35:29.141720 IP 10.0.0.1.44064 > 10.0.0.2.5001: UDP, length 1470

23:35:29.153574 IP 10.0.0.1.44064 > 10.0.0.2.5001: UDP, length 1470

23:35:29.165640 IP 10.0.0.1.44064 > 10.0.0.2.5001: UDP, length 1470

23:35:29.177837 IP 10.0.0.1.44064 > 10.0.0.2.5001: UDP, length 1470

23:35:29.189964 IP 10.0.0.1.44064 > 10.0.0.2.5001: UDP, length 1470

23:35:29.202067 IP 10.0.0.1.44064 > 10.0.0.2.5001: UDP, length 1470

23:35:29.214205 IP 10.0.0.1.44064 > 10.0.0.2.5001: UDP, length 1470

23:35:29.226124 IP 10.0.0.1.44064 > 10.0.0.2.5001: UDP, length 1470

23:35:29.238275 IP 10.0.0.1.44064 > 10.0.0.2.5001: UDP, length 1470

23:35:29.250397 IP 10.0.0.1.44064 > 10.0.0.2.5001: UDP, length 1470

23:35:29.262511 IP 10.0.0.1.44064 > 10.0.0.2.5001: UDP, length 1470

23:35:29.274504 IP 10.0.0.1.44064 > 10.0.0.2.5001: UDP, length 1470

23:35:29.286641 IP 10.0.0.1.44064 > 10.0.0.2.5001: UDP, length 1470

23:35:29.298825 IP 10.0.0.1.44064 > 10.0.0.2.5001: UDP, length 1470

23:35:29.310913 IP 10.0.0.1.44064 > 10.0.0.2.5001: UDP, length 1470

23:35:29.322968 IP 10.0.0.1.44064 > 10.0.0.2.5001: UDP, length 1470

23:35:29.335122 IP 10.0.0.1.44064 > 10.0.0.2.5001: UDP, length 1470

23:35:29.347122 IP 10.0.0.1.44064 > 10.0.0.2.5001: UDP, length 1470

23:35:29.359225 IP 10.0.0.1.44064 > 10.0.0.2.5001: UDP, length 1470

23:35:29.371201 IP 10.0.0.1.44064 > 10.0.0.2.5001: UDP, length 1470

23:35:29.383421 IP 10.0.0.1.44064 > 10.0.0.2.5001: UDP, length 1470

23:35:29.395561 IP 10.0.0.1.44064 > 10.0.0.2.5001: UDP, length 1470

23:35:29.407808 IP 10.0.0.1.44064 > 10.0.0.2.5001: UDP, length 1470

23:35:29.419979 IP 10.0.0.1.44064 > 10.0.0.2.5001: UDP, length 1470

23:35:29.432123 IP 10.0.0.1.44064 > 10.0.0.2.5001: UDP, length 1470

23:35:29.444325 IP 10.0.0.1.44064 > 10.0.0.2.5001: UDP, length 1470

23:35:29.461116 IP 10.0.0.1.44064 > 10.0.0.2.5001: UDP, length 1470

23:35:29.468057 IP 10.0.0.1.44064 > 10.0.0.2.5001: UDP, length 1470

23:35:29.480139 IP 10.0.0.1.44064 > 10.0.0.2.5001: UDP, length 1470

23:35:29.492166 IP 10.0.0.1.44064 > 10.0.0.2.5001: UDP, length 1470

23:35:29.504301 IP 10.0.0.1.44064 > 10.0.0.2.5001: UDP, length 1470

23:35:29.516479 IP 10.0.0.1.44064 > 10.0.0.2.5001: UDP, length 1470

23:35:29.528635 IP 10.0.0.1.44064 > 10.0.0.2.5001: UDP, length 1470

23:35:29.540799 IP 10.0.0.1.44064 > 10.0.0.2.5001: UDP, length 1470

23:35:29.552900 IP 10.0.0.1.44064 > 10.0.0.2.5001: UDP, length 1470

23:35:29.564759 IP 10.0.0.1.44064 > 10.0.0.2.5001: UDP, length 1470

23:35:29.576914 IP 10.0.0.1.44064 > 10.0.0.2.5001: UDP, length 1470

23:35:29.589073 IP 10.0.0.1.44064 > 10.0.0.2.5001: UDP, length 1470

23:35:29.601201 IP 10.0.0.1.44064 > 10.0.0.2.5001: UDP, length 1470

23:35:29.613314 IP 10.0.0.1.44064 > 10.0.0.2.5001: UDP, length 1470

23:35:29.625333 IP 10.0.0.1.44064 > 10.0.0.2.5001: UDP, length 1470

23:35:29.637367 IP 10.0.0.1.44064 > 10.0.0.2.5001: UDP, length 1470

23:35:29.649531 IP 10.0.0.1.44064 > 10.0.0.2.5001: UDP, length 1470

23:35:29.661692 IP 10.0.0.1.44064 > 10.0.0.2.5001: UDP, length 1470

23:35:29.673586 IP 10.0.0.1.44064 > 10.0.0.2.5001: UDP, length 1470

23:35:29.685813 IP 10.0.0.1.44064 > 10.0.0.2.5001: UDP, length 1470

23:35:29.697788 IP 10.0.0.1.44064 > 10.0.0.2.5001: UDP, length 1470

23:35:29.709961 IP 10.0.0.1.44064 > 10.0.0.2.5001: UDP, length 1470

23:35:29.722022 IP 10.0.0.1.44064 > 10.0.0.2.5001: UDP, length 1470

23:35:29.734120 IP 10.0.0.1.44064 > 10.0.0.2.5001: UDP, length 1470

23:35:29.746143 IP 10.0.0.1.44064 > 10.0.0.2.5001: UDP, length 1470

23:35:29.758284 IP 10.0.0.1.44064 > 10.0.0.2.5001: UDP, length 1470

23:35:29.770385 IP 10.0.0.1.44064 > 10.0.0.2.5001: UDP, length 1470

23:35:29.782525 IP 10.0.0.1.44064 > 10.0.0.2.5001: UDP, length 1470

23:35:29.794697 IP 10.0.0.1.44064 > 10.0.0.2.5001: UDP, length 1470

23:35:29.806826 IP 10.0.0.1.44064 > 10.0.0.2.5001: UDP, length 1470

23:35:29.819010 IP 10.0.0.1.44064 > 10.0.0.2.5001: UDP, length 1470

23:35:29.831184 IP 10.0.0.1.44064 > 10.0.0.2.5001: UDP, length 1470

23:35:29.842973 IP 10.0.0.1.44064 > 10.0.0.2.5001: UDP, length 1470

23:35:29.855053 IP 10.0.0.1.44064 > 10.0.0.2.5001: UDP, length 1470

23:35:29.867293 IP 10.0.0.1.44064 > 10.0.0.2.5001: UDP, length 1470

23:35:29.879435 IP 10.0.0.1.44064 > 10.0.0.2.5001: UDP, length 1470

23:35:29.891599 IP 10.0.0.1.44064 > 10.0.0.2.5001: UDP, length 1470

23:35:29.903724 IP 10.0.0.1.44064 > 10.0.0.2.5001: UDP, length 1470

23:35:29.915513 IP 10.0.0.1.44064 > 10.0.0.2.5001: UDP, length 1470

23:35:29.927687 IP 10.0.0.1.44064 > 10.0.0.2.5001: UDP, length 1470

23:35:29.939851 IP 10.0.0.1.44064 > 10.0.0.2.5001: UDP, length 1470

23:35:29.951976 IP 10.0.0.1.44064 > 10.0.0.2.5001: UDP, length 1470

23:35:29.964105 IP 10.0.0.1.44064 > 10.0.0.2.5001: UDP, length 1470

23:35:29.976001 IP 10.0.0.1.44064 > 10.0.0.2.5001: UDP, length 1470

23:35:29.988134 IP 10.0.0.1.44064 > 10.0.0.2.5001: UDP, length 1470

23:35:30.000339 IP 10.0.0.1.44064 > 10.0.0.2.5001: UDP, length 1470

23:35:30.012455 IP 10.0.0.1.44064 > 10.0.0.2.5001: UDP, length 1470

23:35:30.024509 IP 10.0.0.1.44064 > 10.0.0.2.5001: UDP, length 1470

23:35:30.036611 IP 10.0.0.1.44064 > 10.0.0.2.5001: UDP, length 1470

23:35:30.048620 IP 10.0.0.1.44064 > 10.0.0.2.5001: UDP, length 1470

23:35:30.060791 IP 10.0.0.1.44064 > 10.0.0.2.5001: UDP, length 1470

23:35:30.072824 IP 10.0.0.1.44064 > 10.0.0.2.5001: UDP, length 1470

23:35:30.084898 IP 10.0.0.1.44064 > 10.0.0.2.5001: UDP, length 1470

23:35:30.096984 IP 10.0.0.1.44064 > 10.0.0.2.5001: UDP, length 1470

23:35:30.109088 IP 10.0.0.1.44064 > 10.0.0.2.5001: UDP, length 1470

23:35:30.121117 IP 10.0.0.1.44064 > 10.0.0.2.5001: UDP, length 1470

23:35:30.133222 IP 10.0.0.1.44064 > 10.0.0.2.5001: UDP, length 1470

23:35:30.145537 IP 10.0.0.1.44064 > 10.0.0.2.5001: UDP, length 1470

23:35:30.157676 IP 10.0.0.1.44064 > 10.0.0.2.5001: UDP, length 1470

23:35:30.169793 IP 10.0.0.1.44064 > 10.0.0.2.5001: UDP, length 1470

23:35:30.181764 IP 10.0.0.1.44064 > 10.0.0.2.5001: UDP, length 1470

23:35:30.193773 IP 10.0.0.1.44064 > 10.0.0.2.5001: UDP, length 1470

23:35:30.205933 IP 10.0.0.1.44064 > 10.0.0.2.5001: UDP, length 1470

23:35:30.218085 IP 10.0.0.1.44064 > 10.0.0.2.5001: UDP, length 1470

23:35:30.230224 IP 10.0.0.1.44064 > 10.0.0.2.5001: UDP, length 1470

23:35:30.242423 IP 10.0.0.1.44064 > 10.0.0.2.5001: UDP, length 1470

23:35:30.254218 IP 10.0.0.1.44064 > 10.0.0.2.5001: UDP, length 1470

23:35:30.266357 IP 10.0.0.1.44064 > 10.0.0.2.5001: UDP, length 1470

23:35:30.278533 IP 10.0.0.1.44064 > 10.0.0.2.5001: UDP, length 1470

23:35:30.290725 IP 10.0.0.1.44064 > 10.0.0.2.5001: UDP, length 1470

23:35:30.302851 IP 10.0.0.1.44064 > 10.0.0.2.5001: UDP, length 1470

23:35:30.314936 IP 10.0.0.1.44064 > 10.0.0.2.5001: UDP, length 1470

23:35:30.326761 IP 10.0.0.1.44064 > 10.0.0.2.5001: UDP, length 1470

23:35:30.338965 IP 10.0.0.1.44064 > 10.0.0.2.5001: UDP, length 1470

23:35:30.351116 IP 10.0.0.1.44064 > 10.0.0.2.5001: UDP, length 1470

23:35:30.363274 IP 10.0.0.1.44064 > 10.0.0.2.5001: UDP, length 1470

23:35:30.375323 IP 10.0.0.1.44064 > 10.0.0.2.5001: UDP, length 1470

23:35:30.387486 IP 10.0.0.1.44064 > 10.0.0.2.5001: UDP, length 1470

23:35:30.399388 IP 10.0.0.1.44064 > 10.0.0.2.5001: UDP, length 1470

23:35:30.411554 IP 10.0.0.1.44064 > 10.0.0.2.5001: UDP, length 1470

23:35:30.423682 IP 10.0.0.1.44064 > 10.0.0.2.5001: UDP, length 1470

23:35:30.435758 IP 10.0.0.1.44064 > 10.0.0.2.5001: UDP, length 1470

23:35:30.447788 IP 10.0.0.1.44064 > 10.0.0.2.5001: UDP, length 1470

23:35:30.459898 IP 10.0.0.1.44064 > 10.0.0.2.5001: UDP, length 1470

23:35:30.473621 IP 10.0.0.1.44064 > 10.0.0.2.5001: UDP, length 1470

23:35:30.484151 IP 10.0.0.1.44064 > 10.0.0.2.5001: UDP, length 1470

23:35:30.496072 IP 10.0.0.1.44064 > 10.0.0.2.5001: UDP, length 1470

23:35:30.508213 IP 10.0.0.1.44064 > 10.0.0.2.5001: UDP, length 1470

23:35:30.520626 IP 10.0.0.1.44064 > 10.0.0.2.5001: UDP, length 1470

23:35:30.532394 IP 10.0.0.1.44064 > 10.0.0.2.5001: UDP, length 1470

23:35:30.544567 IP 10.0.0.1.44064 > 10.0.0.2.5001: UDP, length 1470

23:35:30.556721 IP 10.0.0.1.44064 > 10.0.0.2.5001: UDP, length 1470

23:35:30.568890 IP 10.0.0.1.44064 > 10.0.0.2.5001: UDP, length 1470

23:35:30.581050 IP 10.0.0.1.44064 > 10.0.0.2.5001: UDP, length 1470

23:35:30.593210 IP 10.0.0.1.44064 > 10.0.0.2.5001: UDP, length 1470

23:35:30.604970 IP 10.0.0.1.44064 > 10.0.0.2.5001: UDP, length 1470

23:35:30.617157 IP 10.0.0.1.44064 > 10.0.0.2.5001: UDP, length 1470

23:35:30.629323 IP 10.0.0.1.44064 > 10.0.0.2.5001: UDP, length 1470

23:35:30.641525 IP 10.0.0.1.44064 > 10.0.0.2.5001: UDP, length 1470

23:35:30.653643 IP 10.0.0.1.44064 > 10.0.0.2.5001: UDP, length 1470

23:35:30.665813 IP 10.0.0.1.44064 > 10.0.0.2.5001: UDP, length 1470

23:35:30.677588 IP 10.0.0.1.44064 > 10.0.0.2.5001: UDP, length 1470

23:35:30.689780 IP 10.0.0.1.44064 > 10.0.0.2.5001: UDP, length 1470

23:35:30.701913 IP 10.0.0.1.44064 > 10.0.0.2.5001: UDP, length 1470

23:35:30.714080 IP 10.0.0.1.44064 > 10.0.0.2.5001: UDP, length 1470

23:35:30.726139 IP 10.0.0.1.44064 > 10.0.0.2.5001: UDP, length 1470

23:35:30.738313 IP 10.0.0.1.44064 > 10.0.0.2.5001: UDP, length 1470

23:35:30.750154 IP 10.0.0.1.44064 > 10.0.0.2.5001: UDP, length 1470

23:35:30.762312 IP 10.0.0.1.44064 > 10.0.0.2.5001: UDP, length 1470

23:35:30.774458 IP 10.0.0.1.44064 > 10.0.0.2.5001: UDP, length 1470

23:35:30.786570 IP 10.0.0.1.44064 > 10.0.0.2.5001: UDP, length 1470

23:35:30.798617 IP 10.0.0.1.44064 > 10.0.0.2.5001: UDP, length 1470

23:35:30.810594 IP 10.0.0.1.44064 > 10.0.0.2.5001: UDP, length 1470

23:35:30.822784 IP 10.0.0.1.44064 > 10.0.0.2.5001: UDP, length 1470

23:35:30.834878 IP 10.0.0.1.44064 > 10.0.0.2.5001: UDP, length 1470

23:35:30.846941 IP 10.0.0.1.44064 > 10.0.0.2.5001: UDP, length 1470

23:35:30.859054 IP 10.0.0.1.44064 > 10.0.0.2.5001: UDP, length 1470

23:35:30.871125 IP 10.0.0.1.44064 > 10.0.0.2.5001: UDP, length 1470

23:35:30.883227 IP 10.0.0.1.44064 > 10.0.0.2.5001: UDP, length 1470

23:35:30.895429 IP 10.0.0.1.44064 > 10.0.0.2.5001: UDP, length 1470

23:35:30.907647 IP 10.0.0.1.44064 > 10.0.0.2.5001: UDP, length 1470

23:35:30.919753 IP 10.0.0.1.44064 > 10.0.0.2.5001: UDP, length 1470

23:35:30.931910 IP 10.0.0.1.44064 > 10.0.0.2.5001: UDP, length 1470

23:35:30.944102 IP 10.0.0.1.44064 > 10.0.0.2.5001: UDP, length 1470

23:35:30.956203 IP 10.0.0.1.44064 > 10.0.0.2.5001: UDP, length 1470

23:35:30.967995 IP 10.0.0.1.44064 > 10.0.0.2.5001: UDP, length 1470

23:35:30.980041 IP 10.0.0.1.44064 > 10.0.0.2.5001: UDP, length 1470

23:35:30.992118 IP 10.0.0.1.44064 > 10.0.0.2.5001: UDP, length 1470

23:35:31.004288 IP 10.0.0.1.44064 > 10.0.0.2.5001: UDP, length 1470

23:35:31.016584 IP 10.0.0.1.44064 > 10.0.0.2.5001: UDP, length 1470

23:35:31.028726 IP 10.0.0.1.44064 > 10.0.0.2.5001: UDP, length 1470

23:35:31.040454 IP 10.0.0.1.44064 > 10.0.0.2.5001: UDP, length 1470

23:35:31.052612 IP 10.0.0.1.44064 > 10.0.0.2.5001: UDP, length 1470

23:35:31.064884 IP 10.0.0.1.44064 > 10.0.0.2.5001: UDP, length 1470

23:35:31.076843 IP 10.0.0.1.44064 > 10.0.0.2.5001: UDP, length 1470

23:35:31.089114 IP 10.0.0.1.44064 > 10.0.0.2.5001: UDP, length 1470

23:35:31.101108 IP 10.0.0.1.44064 > 10.0.0.2.5001: UDP, length 1470

23:35:31.113054 IP 10.0.0.1.44064 > 10.0.0.2.5001: UDP, length 1470

23:35:31.125232 IP 10.0.0.1.44064 > 10.0.0.2.5001: UDP, length 1470

23:35:31.137378 IP 10.0.0.1.44064 > 10.0.0.2.5001: UDP, length 1470

23:35:31.149481 IP 10.0.0.1.44064 > 10.0.0.2.5001: UDP, length 1470

23:35:31.161532 IP 10.0.0.1.44064 > 10.0.0.2.5001: UDP, length 1470

23:35:31.173535 IP 10.0.0.1.44064 > 10.0.0.2.5001: UDP, length 1470

23:35:31.185659 IP 10.0.0.1.44064 > 10.0.0.2.5001: UDP, length 1470

23:35:31.197760 IP 10.0.0.1.44064 > 10.0.0.2.5001: UDP, length 1470

23:35:31.209869 IP 10.0.0.1.44064 > 10.0.0.2.5001: UDP, length 1470

23:35:31.221920 IP 10.0.0.1.44064 > 10.0.0.2.5001: UDP, length 1470

23:35:31.234063 IP 10.0.0.1.44064 > 10.0.0.2.5001: UDP, length 1470

23:35:31.246078 IP 10.0.0.1.44064 > 10.0.0.2.5001: UDP, length 1470

23:35:31.258204 IP 10.0.0.1.44064 > 10.0.0.2.5001: UDP, length 1470

23:35:31.270388 IP 10.0.0.1.44064 > 10.0.0.2.5001: UDP, length 1470

23:35:31.282555 IP 10.0.0.1.44064 > 10.0.0.2.5001: UDP, length 1470

23:35:31.294699 IP 10.0.0.1.44064 > 10.0.0.2.5001: UDP, length 1470

23:35:31.306837 IP 10.0.0.1.44064 > 10.0.0.2.5001: UDP, length 1470

23:35:31.318647 IP 10.0.0.1.44064 > 10.0.0.2.5001: UDP, length 1470

23:35:31.330807 IP 10.0.0.1.44064 > 10.0.0.2.5001: UDP, length 1470

23:35:31.342961 IP 10.0.0.1.44064 > 10.0.0.2.5001: UDP, length 1470

23:35:31.355116 IP 10.0.0.1.44064 > 10.0.0.2.5001: UDP, length 1470

23:35:31.367252 IP 10.0.0.1.44064 > 10.0.0.2.5001: UDP, length 1470

23:35:31.379408 IP 10.0.0.1.44064 > 10.0.0.2.5001: UDP, length 1470

23:35:31.391141 IP 10.0.0.1.44064 > 10.0.0.2.5001: UDP, length 1470

23:35:31.403397 IP 10.0.0.1.44064 > 10.0.0.2.5001: UDP, length 1470

23:35:31.415540 IP 10.0.0.1.44064 > 10.0.0.2.5001: UDP, length 1470

23:35:31.427719 IP 10.0.0.1.44064 > 10.0.0.2.5001: UDP, length 1470

23:35:31.439865 IP 10.0.0.1.44064 > 10.0.0.2.5001: UDP, length 1470

23:35:31.451900 IP 10.0.0.1.44064 > 10.0.0.2.5001: UDP, length 1470

23:35:31.463779 IP 10.0.0.1.44064 > 10.0.0.2.5001: UDP, length 1470

23:35:31.475982 IP 10.0.0.1.44064 > 10.0.0.2.5001: UDP, length 1470

23:35:31.488539 IP 10.0.0.1.44064 > 10.0.0.2.5001: UDP, length 1470

23:35:31.500261 IP 10.0.0.1.44064 > 10.0.0.2.5001: UDP, length 1470

23:35:31.512323 IP 10.0.0.1.44064 > 10.0.0.2.5001: UDP, length 1470

23:35:31.524399 IP 10.0.0.1.44064 > 10.0.0.2.5001: UDP, length 1470

23:35:31.536417 IP 10.0.0.1.44064 > 10.0.0.2.5001: UDP, length 1470

23:35:31.548568 IP 10.0.0.1.44064 > 10.0.0.2.5001: UDP, length 1470

23:35:31.560681 IP 10.0.0.1.44064 > 10.0.0.2.5001: UDP, length 1470

23:35:31.572732 IP 10.0.0.1.44064 > 10.0.0.2.5001: UDP, length 1470

23:35:31.584850 IP 10.0.0.1.44064 > 10.0.0.2.5001: UDP, length 1470

23:35:31.596895 IP 10.0.0.1.44064 > 10.0.0.2.5001: UDP, length 1470

23:35:31.609006 IP 10.0.0.1.44064 > 10.0.0.2.5001: UDP, length 1470

23:35:31.620986 IP 10.0.0.1.44064 > 10.0.0.2.5001: UDP, length 1470

23:35:31.633169 IP 10.0.0.1.44064 > 10.0.0.2.5001: UDP, length 1470

23:35:31.645524 IP 10.0.0.1.44064 > 10.0.0.2.5001: UDP, length 1470

23:35:31.657651 IP 10.0.0.1.44064 > 10.0.0.2.5001: UDP, length 1470

23:35:31.669649 IP 10.0.0.1.44064 > 10.0.0.2.5001: UDP, length 1470

23:35:31.681667 IP 10.0.0.1.44064 > 10.0.0.2.5001: UDP, length 1470

23:35:31.693810 IP 10.0.0.1.44064 > 10.0.0.2.5001: UDP, length 1470

23:35:31.705983 IP 10.0.0.1.44064 > 10.0.0.2.5001: UDP, length 1470

23:35:31.718122 IP 10.0.0.1.44064 > 10.0.0.2.5001: UDP, length 1470

23:35:31.730298 IP 10.0.0.1.44064 > 10.0.0.2.5001: UDP, length 1470

23:35:31.742397 IP 10.0.0.1.44064 > 10.0.0.2.5001: UDP, length 1470

23:35:31.754097 IP 10.0.0.1.44064 > 10.0.0.2.5001: UDP, length 1470

23:35:31.766407 IP 10.0.0.1.44064 > 10.0.0.2.5001: UDP, length 1470

23:35:31.778563 IP 10.0.0.1.44064 > 10.0.0.2.5001: UDP, length 1470

23:35:31.790738 IP 10.0.0.1.44064 > 10.0.0.2.5001: UDP, length 1470

23:35:31.802780 IP 10.0.0.1.44064 > 10.0.0.2.5001: UDP, length 1470

23:35:31.815029 IP 10.0.0.1.44064 > 10.0.0.2.5001: UDP, length 1470

23:35:31.826801 IP 10.0.0.1.44064 > 10.0.0.2.5001: UDP, length 1470

23:35:31.838955 IP 10.0.0.1.44064 > 10.0.0.2.5001: UDP, length 1470

23:35:31.851143 IP 10.0.0.1.44064 > 10.0.0.2.5001: UDP, length 1470

23:35:31.863247 IP 10.0.0.1.44064 > 10.0.0.2.5001: UDP, length 1470

23:35:31.875078 IP 10.0.0.1.44064 > 10.0.0.2.5001: UDP, length 1470

23:35:31.887462 IP 10.0.0.1.44064 > 10.0.0.2.5001: UDP, length 1470

23:35:31.899270 IP 10.0.0.1.44064 > 10.0.0.2.5001: UDP, length 1470

23:35:31.911413 IP 10.0.0.1.44064 > 10.0.0.2.5001: UDP, length 1470

23:35:31.923548 IP 10.0.0.1.44064 > 10.0.0.2.5001: UDP, length 1470

23:35:31.935620 IP 10.0.0.1.44064 > 10.0.0.2.5001: UDP, length 1470

23:35:31.947631 IP 10.0.0.1.44064 > 10.0.0.2.5001: UDP, length 1470

23:35:31.959707 IP 10.0.0.1.44064 > 10.0.0.2.5001: UDP, length 1470

23:35:31.971865 IP 10.0.0.1.44064 > 10.0.0.2.5001: UDP, length 1470

23:35:31.983954 IP 10.0.0.1.44064 > 10.0.0.2.5001: UDP, length 1470

23:35:31.995941 IP 10.0.0.1.44064 > 10.0.0.2.5001: UDP, length 1470

23:35:32.008106 IP 10.0.0.1.44064 > 10.0.0.2.5001: UDP, length 1470

23:35:32.020594 IP 10.0.0.1.44064 > 10.0.0.2.5001: UDP, length 1470

23:35:32.032352 IP 10.0.0.1.44064 > 10.0.0.2.5001: UDP, length 1470

23:35:32.044502 IP 10.0.0.1.44064 > 10.0.0.2.5001: UDP, length 1470

23:35:32.056668 IP 10.0.0.1.44064 > 10.0.0.2.5001: UDP, length 1470

23:35:32.068806 IP 10.0.0.1.44064 > 10.0.0.2.5001: UDP, length 1470

23:35:32.080938 IP 10.0.0.1.44064 > 10.0.0.2.5001: UDP, length 1470

23:35:32.093002 IP 10.0.0.1.44064 > 10.0.0.2.5001: UDP, length 1470

23:35:32.104931 IP 10.0.0.1.44064 > 10.0.0.2.5001: UDP, length 1470

23:35:32.117085 IP 10.0.0.1.44064 > 10.0.0.2.5001: UDP, length 1470

23:35:32.129247 IP 10.0.0.1.44064 > 10.0.0.2.5001: UDP, length 1470

23:35:32.141442 IP 10.0.0.1.44064 > 10.0.0.2.5001: UDP, length 1470

23:35:32.153557 IP 10.0.0.1.44064 > 10.0.0.2.5001: UDP, length 1470

23:35:32.165599 IP 10.0.0.1.44064 > 10.0.0.2.5001: UDP, length 1470

23:35:32.177533 IP 10.0.0.1.44064 > 10.0.0.2.5001: UDP, length 1470

23:35:32.189680 IP 10.0.0.1.44064 > 10.0.0.2.5001: UDP, length 1470

23:35:32.201845 IP 10.0.0.1.44064 > 10.0.0.2.5001: UDP, length 1470

23:35:32.213974 IP 10.0.0.1.44064 > 10.0.0.2.5001: UDP, length 1470

23:35:32.226039 IP 10.0.0.1.44064 > 10.0.0.2.5001: UDP, length 1470

23:35:32.237868 IP 10.0.0.1.44064 > 10.0.0.2.5001: UDP, length 1470

23:35:32.250128 IP 10.0.0.1.44064 > 10.0.0.2.5001: UDP, length 1470

23:35:32.262293 IP 10.0.0.1.44064 > 10.0.0.2.5001: UDP, length 1470

23:35:32.274245 IP 10.0.0.1.44064 > 10.0.0.2.5001: UDP, length 1470

23:35:32.286550 IP 10.0.0.1.44064 > 10.0.0.2.5001: UDP, length 1470

23:35:32.298520 IP 10.0.0.1.44064 > 10.0.0.2.5001: UDP, length 1470

23:35:32.310579 IP 10.0.0.1.44064 > 10.0.0.2.5001: UDP, length 1470

23:35:32.322684 IP 10.0.0.1.44064 > 10.0.0.2.5001: UDP, length 1470

23:35:32.334757 IP 10.0.0.1.44064 > 10.0.0.2.5001: UDP, length 1470

23:35:32.346847 IP 10.0.0.1.44064 > 10.0.0.2.5001: UDP, length 1470

23:35:32.358950 IP 10.0.0.1.44064 > 10.0.0.2.5001: UDP, length 1470

23:35:32.371055 IP 10.0.0.1.44064 > 10.0.0.2.5001: UDP, length 1470

23:35:32.383114 IP 10.0.0.1.44064 > 10.0.0.2.5001: UDP, length 1470

23:35:32.395256 IP 10.0.0.1.44064 > 10.0.0.2.5001: UDP, length 1470

23:35:32.407474 IP 10.0.0.1.44064 > 10.0.0.2.5001: UDP, length 1470

23:35:32.419618 IP 10.0.0.1.44064 > 10.0.0.2.5001: UDP, length 1470

23:35:32.431791 IP 10.0.0.1.44064 > 10.0.0.2.5001: UDP, length 1470

23:35:32.443811 IP 10.0.0.1.44064 > 10.0.0.2.5001: UDP, length 1470

23:35:32.455724 IP 10.0.0.1.44064 > 10.0.0.2.5001: UDP, length 1470

23:35:32.468074 IP 10.0.0.1.44064 > 10.0.0.2.5001: UDP, length 1470

23:35:32.480060 IP 10.0.0.1.44064 > 10.0.0.2.5001: UDP, length 1470

23:35:32.492260 IP 10.0.0.1.44064 > 10.0.0.2.5001: UDP, length 1470

23:35:32.504148 IP 10.0.0.1.44064 > 10.0.0.2.5001: UDP, length 1470

23:35:32.516078 IP 10.0.0.1.44064 > 10.0.0.2.5001: UDP, length 1470

23:35:32.528319 IP 10.0.0.1.44064 > 10.0.0.2.5001: UDP, length 1470

23:35:32.540475 IP 10.0.0.1.44064 > 10.0.0.2.5001: UDP, length 1470

23:35:32.552639 IP 10.0.0.1.44064 > 10.0.0.2.5001: UDP, length 1470

23:35:32.564792 IP 10.0.0.1.44064 > 10.0.0.2.5001: UDP, length 1470

23:35:32.576804 IP 10.0.0.1.44064 > 10.0.0.2.5001: UDP, length 1470

23:35:32.588762 IP 10.0.0.1.44064 > 10.0.0.2.5001: UDP, length 1470

23:35:32.600921 IP 10.0.0.1.44064 > 10.0.0.2.5001: UDP, length 1470

23:35:32.613086 IP 10.0.0.1.44064 > 10.0.0.2.5001: UDP, length 1470

23:35:32.625171 IP 10.0.0.1.44064 > 10.0.0.2.5001: UDP, length 1470

23:35:32.637239 IP 10.0.0.1.44064 > 10.0.0.2.5001: UDP, length 1470

23:35:32.649336 IP 10.0.0.1.44064 > 10.0.0.2.5001: UDP, length 1470

23:35:32.661372 IP 10.0.0.1.44064 > 10.0.0.2.5001: UDP, length 1470

23:35:32.673571 IP 10.0.0.1.44064 > 10.0.0.2.5001: UDP, length 1470

23:35:32.685607 IP 10.0.0.1.44064 > 10.0.0.2.5001: UDP, length 1470

23:35:32.697815 IP 10.0.0.1.44064 > 10.0.0.2.5001: UDP, length 1470

23:35:32.709768 IP 10.0.0.1.44064 > 10.0.0.2.5001: UDP, length 1470

23:35:32.721754 IP 10.0.0.1.44064 > 10.0.0.2.5001: UDP, length 1470

23:35:32.734123 IP 10.0.0.1.44064 > 10.0.0.2.5001: UDP, length 1470

23:35:32.745939 IP 10.0.0.1.44064 > 10.0.0.2.5001: UDP, length 1470

23:35:32.758081 IP 10.0.0.1.44064 > 10.0.0.2.5001: UDP, length 1470

23:35:32.770422 IP 10.0.0.1.44064 > 10.0.0.2.5001: UDP, length 1470

23:35:32.782598 IP 10.0.0.1.44064 > 10.0.0.2.5001: UDP, length 1470

23:35:32.794293 IP 10.0.0.1.44064 > 10.0.0.2.5001: UDP, length 1470

23:35:32.806528 IP 10.0.0.1.44064 > 10.0.0.2.5001: UDP, length 1470

23:35:32.818682 IP 10.0.0.1.44064 > 10.0.0.2.5001: UDP, length 1470

23:35:32.830791 IP 10.0.0.1.44064 > 10.0.0.2.5001: UDP, length 1470

23:35:32.843011 IP 10.0.0.1.44064 > 10.0.0.2.5001: UDP, length 1470

23:35:32.855150 IP 10.0.0.1.44064 > 10.0.0.2.5001: UDP, length 1470

23:35:32.866969 IP 10.0.0.1.44064 > 10.0.0.2.5001: UDP, length 1470

23:35:32.879172 IP 10.0.0.1.44064 > 10.0.0.2.5001: UDP, length 1470

23:35:32.891277 IP 10.0.0.1.44064 > 10.0.0.2.5001: UDP, length 1470

23:35:32.903637 IP 10.0.0.1.44064 > 10.0.0.2.5001: UDP, length 1470

23:35:32.915547 IP 10.0.0.1.44064 > 10.0.0.2.5001: UDP, length 1470

23:35:32.927608 IP 10.0.0.1.44064 > 10.0.0.2.5001: UDP, length 1470

23:35:32.939564 IP 10.0.0.1.44064 > 10.0.0.2.5001: UDP, length 1470

23:35:32.951722 IP 10.0.0.1.44064 > 10.0.0.2.5001: UDP, length 1470

23:35:32.963787 IP 10.0.0.1.44064 > 10.0.0.2.5001: UDP, length 1470

23:35:32.975998 IP 10.0.0.1.44064 > 10.0.0.2.5001: UDP, length 1470

23:35:32.988113 IP 10.0.0.1.44064 > 10.0.0.2.5001: UDP, length 1470

23:35:32.999968 IP 10.0.0.1.44064 > 10.0.0.2.5001: UDP, length 1470

23:35:33.012169 IP 10.0.0.1.44064 > 10.0.0.2.5001: UDP, length 1470

23:35:33.024294 IP 10.0.0.1.44064 > 10.0.0.2.5001: UDP, length 1470

23:35:33.036437 IP 10.0.0.1.44064 > 10.0.0.2.5001: UDP, length 1470

23:35:33.048478 IP 10.0.0.1.44064 > 10.0.0.2.5001: UDP, length 1470

23:35:33.060603 IP 10.0.0.1.44064 > 10.0.0.2.5001: UDP, length 1470

23:35:33.072551 IP 10.0.0.1.44064 > 10.0.0.2.5001: UDP, length 1470

23:35:33.084757 IP 10.0.0.1.44064 > 10.0.0.2.5001: UDP, length 1470

23:35:33.096794 IP 10.0.0.1.44064 > 10.0.0.2.5001: UDP, length 1470

23:35:33.108904 IP 10.0.0.1.44064 > 10.0.0.2.5001: UDP, length 1470

23:35:33.120913 IP 10.0.0.1.44064 > 10.0.0.2.5001: UDP, length 1470

23:35:33.133028 IP 10.0.0.1.44064 > 10.0.0.2.5001: UDP, length 1470

23:35:33.145125 IP 10.0.0.1.44064 > 10.0.0.2.5001: UDP, length 1470

23:35:33.157311 IP 10.0.0.1.44064 > 10.0.0.2.5001: UDP, length 1470

23:35:33.169483 IP 10.0.0.1.44064 > 10.0.0.2.5001: UDP, length 1470

23:35:33.181624 IP 10.0.0.1.44064 > 10.0.0.2.5001: UDP, length 1470

23:35:33.193778 IP 10.0.0.1.44064 > 10.0.0.2.5001: UDP, length 1470

23:35:33.205945 IP 10.0.0.1.44064 > 10.0.0.2.5001: UDP, length 1470

23:35:33.217718 IP 10.0.0.1.44064 > 10.0.0.2.5001: UDP, length 1470

23:35:33.230408 IP 10.0.0.1.44064 > 10.0.0.2.5001: UDP, length 1470

23:35:33.242029 IP 10.0.0.1.44064 > 10.0.0.2.5001: UDP, length 1470

23:35:33.254231 IP 10.0.0.1.44064 > 10.0.0.2.5001: UDP, length 1470

23:35:33.266343 IP 10.0.0.1.44064 > 10.0.0.2.5001: UDP, length 1470

23:35:33.278397 IP 10.0.0.1.44064 > 10.0.0.2.5001: UDP, length 1470

23:35:33.290423 IP 10.0.0.1.44064 > 10.0.0.2.5001: UDP, length 1470

23:35:33.302511 IP 10.0.0.1.44064 > 10.0.0.2.5001: UDP, length 1470

23:35:33.314714 IP 10.0.0.1.44064 > 10.0.0.2.5001: UDP, length 1470

23:35:33.326862 IP 10.0.0.1.44064 > 10.0.0.2.5001: UDP, length 1470

23:35:33.338914 IP 10.0.0.1.44064 > 10.0.0.2.5001: UDP, length 1470

23:35:33.351030 IP 10.0.0.1.44064 > 10.0.0.2.5001: UDP, length 1470

23:35:33.362975 IP 10.0.0.1.44064 > 10.0.0.2.5001: UDP, length 1470

23:35:33.375185 IP 10.0.0.1.44064 > 10.0.0.2.5001: UDP, length 1470

23:35:33.387325 IP 10.0.0.1.44064 > 10.0.0.2.5001: UDP, length 1470

23:35:33.399344 IP 10.0.0.1.44064 > 10.0.0.2.5001: UDP, length 1470

23:35:33.411451 IP 10.0.0.1.44064 > 10.0.0.2.5001: UDP, length 1470

23:35:33.423553 IP 10.0.0.1.44064 > 10.0.0.2.5001: UDP, length 1470

23:35:33.435597 IP 10.0.0.1.44064 > 10.0.0.2.5001: UDP, length 1470

23:35:33.447609 IP 10.0.0.1.44064 > 10.0.0.2.5001: UDP, length 1470

23:35:33.459785 IP 10.0.0.1.44064 > 10.0.0.2.5001: UDP, length 1470

23:35:33.471833 IP 10.0.0.1.44064 > 10.0.0.2.5001: UDP, length 1470

23:35:33.483869 IP 10.0.0.1.44064 > 10.0.0.2.5001: UDP, length 1470

23:35:33.496071 IP 10.0.0.1.44064 > 10.0.0.2.5001: UDP, length 1470

23:35:33.508021 IP 10.0.0.1.44064 > 10.0.0.2.5001: UDP, length 1470

23:35:33.520239 IP 10.0.0.1.44064 > 10.0.0.2.5001: UDP, length 1470

23:35:33.532354 IP 10.0.0.1.44064 > 10.0.0.2.5001: UDP, length 1470

23:35:33.544565 IP 10.0.0.1.44064 > 10.0.0.2.5001: UDP, length 1470

23:35:33.556745 IP 10.0.0.1.44064 > 10.0.0.2.5001: UDP, length 1470

23:35:33.568485 IP 10.0.0.1.44064 > 10.0.0.2.5001: UDP, length 1470

23:35:33.580670 IP 10.0.0.1.44064 > 10.0.0.2.5001: UDP, length 1470

23:35:33.592824 IP 10.0.0.1.44064 > 10.0.0.2.5001: UDP, length 1470

23:35:33.605030 IP 10.0.0.1.44064 > 10.0.0.2.5001: UDP, length 1470

23:35:33.617170 IP 10.0.0.1.44064 > 10.0.0.2.5001: UDP, length 1470

23:35:33.629267 IP 10.0.0.1.44064 > 10.0.0.2.5001: UDP, length 1470

23:35:33.641103 IP 10.0.0.1.44064 > 10.0.0.2.5001: UDP, length 1470

23:35:33.653260 IP 10.0.0.1.44064 > 10.0.0.2.5001: UDP, length 1470

23:35:33.665462 IP 10.0.0.1.44064 > 10.0.0.2.5001: UDP, length 1470

23:35:33.677505 IP 10.0.0.1.44064 > 10.0.0.2.5001: UDP, length 1470

23:35:33.689718 IP 10.0.0.1.44064 > 10.0.0.2.5001: UDP, length 1470

23:35:33.701828 IP 10.0.0.1.44064 > 10.0.0.2.5001: UDP, length 1470

23:35:33.713730 IP 10.0.0.1.44064 > 10.0.0.2.5001: UDP, length 1470

23:35:33.725879 IP 10.0.0.1.44064 > 10.0.0.2.5001: UDP, length 1470

23:35:33.738052 IP 10.0.0.1.44064 > 10.0.0.2.5001: UDP, length 1470

23:35:33.750098 IP 10.0.0.1.44064 > 10.0.0.2.5001: UDP, length 1470

23:35:33.762202 IP 10.0.0.1.44064 > 10.0.0.2.5001: UDP, length 1470

23:35:33.774131 IP 10.0.0.1.44064 > 10.0.0.2.5001: UDP, length 1470

23:35:33.786316 IP 10.0.0.1.44064 > 10.0.0.2.5001: UDP, length 1470

23:35:33.798422 IP 10.0.0.1.44064 > 10.0.0.2.5001: UDP, length 1470

23:35:33.810530 IP 10.0.0.1.44064 > 10.0.0.2.5001: UDP, length 1470

23:35:33.822595 IP 10.0.0.1.44064 > 10.0.0.2.5001: UDP, length 1470

23:35:33.834658 IP 10.0.0.1.44064 > 10.0.0.2.5001: UDP, length 1470

23:35:33.846744 IP 10.0.0.1.44064 > 10.0.0.2.5001: UDP, length 1470

23:35:33.858870 IP 10.0.0.1.44064 > 10.0.0.2.5001: UDP, length 1470

23:35:33.870943 IP 10.0.0.1.44064 > 10.0.0.2.5001: UDP, length 1470

23:35:33.883001 IP 10.0.0.1.44064 > 10.0.0.2.5001: UDP, length 1470

23:35:33.895331 IP 10.0.0.1.44064 > 10.0.0.2.5001: UDP, length 1470

23:35:33.907648 IP 10.0.0.1.44064 > 10.0.0.2.5001: UDP, length 1470

23:35:33.919290 IP 10.0.0.1.44064 > 10.0.0.2.5001: UDP, length 1470

23:35:33.931470 IP 10.0.0.1.44064 > 10.0.0.2.5001: UDP, length 1470

23:35:33.943623 IP 10.0.0.1.44064 > 10.0.0.2.5001: UDP, length 1470

23:35:33.955778 IP 10.0.0.1.44064 > 10.0.0.2.5001: UDP, length 1470

23:35:33.967936 IP 10.0.0.1.44064 > 10.0.0.2.5001: UDP, length 1470

23:35:33.980142 IP 10.0.0.1.44064 > 10.0.0.2.5001: UDP, length 1470

23:35:33.991881 IP 10.0.0.1.44064 > 10.0.0.2.5001: UDP, length 1470

23:35:34.004047 IP 10.0.0.1.44064 > 10.0.0.2.5001: UDP, length 1470

23:35:34.016166 IP 10.0.0.1.44064 > 10.0.0.2.5001: UDP, length 1470

23:35:34.028367 IP 10.0.0.1.44064 > 10.0.0.2.5001: UDP, length 1470

23:35:34.040536 IP 10.0.0.1.44064 > 10.0.0.2.5001: UDP, length 1470

23:35:34.052634 IP 10.0.0.1.44064 > 10.0.0.2.5001: UDP, length 1470

23:35:34.064478 IP 10.0.0.1.44064 > 10.0.0.2.5001: UDP, length 1470

23:35:34.076650 IP 10.0.0.1.44064 > 10.0.0.2.5001: UDP, length 1470

23:35:34.088802 IP 10.0.0.1.44064 > 10.0.0.2.5001: UDP, length 1470

23:35:34.100956 IP 10.0.0.1.44064 > 10.0.0.2.5001: UDP, length 1470

23:35:34.113062 IP 10.0.0.1.44064 > 10.0.0.2.5001: UDP, length 1470

23:35:34.125108 IP 10.0.0.1.44064 > 10.0.0.2.5001: UDP, length 1470

23:35:34.137079 IP 10.0.0.1.44064 > 10.0.0.2.5001: UDP, length 1470

23:35:34.149230 IP 10.0.0.1.44064 > 10.0.0.2.5001: UDP, length 1470

23:35:34.161340 IP 10.0.0.1.44064 > 10.0.0.2.5001: UDP, length 1470

23:35:34.173400 IP 10.0.0.1.44064 > 10.0.0.2.5001: UDP, length 1470

23:35:34.185517 IP 10.0.0.1.44064 > 10.0.0.2.5001: UDP, length 1470

23:35:34.197478 IP 10.0.0.1.44064 > 10.0.0.2.5001: UDP, length 1470

23:35:34.209667 IP 10.0.0.1.44064 > 10.0.0.2.5001: UDP, length 1470

23:35:34.221730 IP 10.0.0.1.44064 > 10.0.0.2.5001: UDP, length 1470

23:35:34.233876 IP 10.0.0.1.44064 > 10.0.0.2.5001: UDP, length 1470

23:35:34.245946 IP 10.0.0.1.44064 > 10.0.0.2.5001: UDP, length 1470

23:35:34.257964 IP 10.0.0.1.44064 > 10.0.0.2.5001: UDP, length 1470

23:35:34.270017 IP 10.0.0.1.44064 > 10.0.0.2.5001: UDP, length 1470

23:35:34.282246 IP 10.0.0.1.44064 > 10.0.0.2.5001: UDP, length 1470

23:35:34.294401 IP 10.0.0.1.44064 > 10.0.0.2.5001: UDP, length 1470

23:35:34.306554 IP 10.0.0.1.44064 > 10.0.0.2.5001: UDP, length 1470

23:35:34.318667 IP 10.0.0.1.44064 > 10.0.0.2.5001: UDP, length 1470

23:35:34.330839 IP 10.0.0.1.44064 > 10.0.0.2.5001: UDP, length 1470

23:35:34.342641 IP 10.0.0.1.44064 > 10.0.0.2.5001: UDP, length 1470

23:35:34.354833 IP 10.0.0.1.44064 > 10.0.0.2.5001: UDP, length 1470

23:35:34.366990 IP 10.0.0.1.44064 > 10.0.0.2.5001: UDP, length 1470

23:35:34.379106 IP 10.0.0.1.44064 > 10.0.0.2.5001: UDP, length 1470

23:35:34.391325 IP 10.0.0.1.44064 > 10.0.0.2.5001: UDP, length 1470

23:35:34.403387 IP 10.0.0.1.44064 > 10.0.0.2.5001: UDP, length 1470

23:35:34.415267 IP 10.0.0.1.44064 > 10.0.0.2.5001: UDP, length 1470

23:35:34.427430 IP 10.0.0.1.44064 > 10.0.0.2.5001: UDP, length 1470

23:35:34.439588 IP 10.0.0.1.44064 > 10.0.0.2.5001: UDP, length 1470

23:35:34.451719 IP 10.0.0.1.44064 > 10.0.0.2.5001: UDP, length 1470

23:35:34.463824 IP 10.0.0.1.44064 > 10.0.0.2.5001: UDP, length 1470

23:35:34.475688 IP 10.0.0.1.44064 > 10.0.0.2.5001: UDP, length 1470

23:35:34.487854 IP 10.0.0.1.44064 > 10.0.0.2.5001: UDP, length 1470

23:35:34.500086 IP 10.0.0.1.44064 > 10.0.0.2.5001: UDP, length 1470

23:35:34.512159 IP 10.0.0.1.44064 > 10.0.0.2.5001: UDP, length 1470

23:35:34.524208 IP 10.0.0.1.44064 > 10.0.0.2.5001: UDP, length 1470

23:35:34.536320 IP 10.0.0.1.44064 > 10.0.0.2.5001: UDP, length 1470

23:35:34.548321 IP 10.0.0.1.44064 > 10.0.0.2.5001: UDP, length 1470

23:35:34.560517 IP 10.0.0.1.44064 > 10.0.0.2.5001: UDP, length 1470

23:35:34.572533 IP 10.0.0.1.44064 > 10.0.0.2.5001: UDP, length 1470

23:35:34.584641 IP 10.0.0.1.44064 > 10.0.0.2.5001: UDP, length 1470

23:35:34.596697 IP 10.0.0.1.44064 > 10.0.0.2.5001: UDP, length 1470

23:35:34.608800 IP 10.0.0.1.44064 > 10.0.0.2.5001: UDP, length 1470

23:35:34.620802 IP 10.0.0.1.44064 > 10.0.0.2.5001: UDP, length 1470

23:35:34.632944 IP 10.0.0.1.44064 > 10.0.0.2.5001: UDP, length 1470

23:35:34.645207 IP 10.0.0.1.44064 > 10.0.0.2.5001: UDP, length 1470

23:35:34.657460 IP 10.0.0.1.44064 > 10.0.0.2.5001: UDP, length 1470

23:35:34.669533 IP 10.0.0.1.44064 > 10.0.0.2.5001: UDP, length 1470

23:35:34.681616 IP 10.0.0.1.44064 > 10.0.0.2.5001: UDP, length 1470

23:35:34.693503 IP 10.0.0.1.44064 > 10.0.0.2.5001: UDP, length 1470

23:35:34.705643 IP 10.0.0.1.44064 > 10.0.0.2.5001: UDP, length 1470

23:35:34.717797 IP 10.0.0.1.44064 > 10.0.0.2.5001: UDP, length 1470

23:35:34.729954 IP 10.0.0.1.44064 > 10.0.0.2.5001: UDP, length 1470

23:35:34.742145 IP 10.0.0.1.44064 > 10.0.0.2.5001: UDP, length 1470

23:35:34.754166 IP 10.0.0.1.44064 > 10.0.0.2.5001: UDP, length 1470

23:35:34.766050 IP 10.0.0.1.44064 > 10.0.0.2.5001: UDP, length 1470

23:35:34.778226 IP 10.0.0.1.44064 > 10.0.0.2.5001: UDP, length 1470

23:35:34.790377 IP 10.0.0.1.44064 > 10.0.0.2.5001: UDP, length 1470

23:35:34.802531 IP 10.0.0.1.44064 > 10.0.0.2.5001: UDP, length 1470

23:35:34.814678 IP 10.0.0.1.44064 > 10.0.0.2.5001: UDP, length 1470

23:35:34.826418 IP 10.0.0.1.44064 > 10.0.0.2.5001: UDP, length 1470

23:35:34.838661 IP 10.0.0.1.44064 > 10.0.0.2.5001: UDP, length 1470

23:35:34.850829 IP 10.0.0.1.44064 > 10.0.0.2.5001: UDP, length 1470

23:35:34.862824 IP 10.0.0.1.44064 > 10.0.0.2.5001: UDP, length 1470

23:35:34.874940 IP 10.0.0.1.44064 > 10.0.0.2.5001: UDP, length 1470

23:35:34.887089 IP 10.0.0.1.44064 > 10.0.0.2.5001: UDP, length 1470

23:35:34.899049 IP 10.0.0.1.44064 > 10.0.0.2.5001: UDP, length 1470

23:35:34.911201 IP 10.0.0.1.44064 > 10.0.0.2.5001: UDP, length 1470

23:35:34.923301 IP 10.0.0.1.44064 > 10.0.0.2.5001: UDP, length 1470

23:35:34.935417 IP 10.0.0.1.44064 > 10.0.0.2.5001: UDP, length 1470

23:35:34.947508 IP 10.0.0.1.44064 > 10.0.0.2.5001: UDP, length 1470

23:35:34.959505 IP 10.0.0.1.44064 > 10.0.0.2.5001: UDP, length 1470

23:35:34.971674 IP 10.0.0.1.44064 > 10.0.0.2.5001: UDP, length 1470

23:35:34.983902 IP 10.0.0.1.44064 > 10.0.0.2.5001: UDP, length 1470

23:35:34.995835 IP 10.0.0.1.44064 > 10.0.0.2.5001: UDP, length 1470

23:35:35.007901 IP 10.0.0.1.44064 > 10.0.0.2.5001: UDP, length 1470

23:35:35.020345 IP 10.0.0.1.44064 > 10.0.0.2.5001: UDP, length 1470

23:35:35.032093 IP 10.0.0.1.44064 > 10.0.0.2.5001: UDP, length 1470

23:35:35.044335 IP 10.0.0.1.44064 > 10.0.0.2.5001: UDP, length 1470

23:35:35.056398 IP 10.0.0.1.44064 > 10.0.0.2.5001: UDP, length 1470

23:35:35.068641 IP 10.0.0.1.44064 > 10.0.0.2.5001: UDP, length 1470

23:35:35.080882 IP 10.0.0.1.44064 > 10.0.0.2.5001: UDP, length 1470

23:35:35.092992 IP 10.0.0.1.44064 > 10.0.0.2.5001: UDP, length 1470

23:35:35.105098 IP 10.0.0.1.44064 > 10.0.0.2.5001: UDP, length 1470

23:35:35.116923 IP 10.0.0.1.44064 > 10.0.0.2.5001: UDP, length 1470

23:35:35.129075 IP 10.0.0.1.44064 > 10.0.0.2.5001: UDP, length 1470

23:35:35.141240 IP 10.0.0.1.44064 > 10.0.0.2.5001: UDP, length 1470

23:35:35.153396 IP 10.0.0.1.44064 > 10.0.0.2.5001: UDP, length 1470

23:35:35.165584 IP 10.0.0.1.44064 > 10.0.0.2.5001: UDP, length 1470

23:35:35.177686 IP 10.0.0.1.44064 > 10.0.0.2.5001: UDP, length 1470

23:35:35.189544 IP 10.0.0.1.44064 > 10.0.0.2.5001: UDP, length 1470

23:35:35.201632 IP 10.0.0.1.44064 > 10.0.0.2.5001: UDP, length 1470

23:35:35.213817 IP 10.0.0.1.44064 > 10.0.0.2.5001: UDP, length 1470

23:35:35.225908 IP 10.0.0.1.44064 > 10.0.0.2.5001: UDP, length 1470

23:35:35.237889 IP 10.0.0.1.44064 > 10.0.0.2.5001: UDP, length 1470

23:35:35.250027 IP 10.0.0.1.44064 > 10.0.0.2.5001: UDP, length 1470

23:35:35.262048 IP 10.0.0.1.44064 > 10.0.0.2.5001: UDP, length 1470

23:35:35.274053 IP 10.0.0.1.44064 > 10.0.0.2.5001: UDP, length 1470

23:35:35.286328 IP 10.0.0.1.44064 > 10.0.0.2.5001: UDP, length 1470

23:35:35.298468 IP 10.0.0.1.44064 > 10.0.0.2.5001: UDP, length 1470

23:35:35.310425 IP 10.0.0.1.44064 > 10.0.0.2.5001: UDP, length 1470

23:35:35.322482 IP 10.0.0.1.44064 > 10.0.0.2.5001: UDP, length 1470

23:35:35.334558 IP 10.0.0.1.44064 > 10.0.0.2.5001: UDP, length 1470

23:35:35.346646 IP 10.0.0.1.44064 > 10.0.0.2.5001: UDP, length 1470

23:35:35.358727 IP 10.0.0.1.44064 > 10.0.0.2.5001: UDP, length 1470

23:35:35.370912 IP 10.0.0.1.44064 > 10.0.0.2.5001: UDP, length 1470

23:35:35.382834 IP 10.0.0.1.44064 > 10.0.0.2.5001: UDP, length 1470

23:35:35.394988 IP 10.0.0.1.44064 > 10.0.0.2.5001: UDP, length 1470

23:35:35.407172 IP 10.0.0.1.44064 > 10.0.0.2.5001: UDP, length 1470

23:35:35.419329 IP 10.0.0.1.44064 > 10.0.0.2.5001: UDP, length 1470

23:35:35.431483 IP 10.0.0.1.44064 > 10.0.0.2.5001: UDP, length 1470

23:35:35.443644 IP 10.0.0.1.44064 > 10.0.0.2.5001: UDP, length 1470

23:35:35.455813 IP 10.0.0.1.44064 > 10.0.0.2.5001: UDP, length 1470

23:35:35.467575 IP 10.0.0.1.44064 > 10.0.0.2.5001: UDP, length 1470

23:35:35.479761 IP 10.0.0.1.44064 > 10.0.0.2.5001: UDP, length 1470

23:35:35.491948 IP 10.0.0.1.44064 > 10.0.0.2.5001: UDP, length 1470

23:35:35.503945 IP 10.0.0.1.44064 > 10.0.0.2.5001: UDP, length 1470

23:35:35.516202 IP 10.0.0.1.44064 > 10.0.0.2.5001: UDP, length 1470

23:35:35.528183 IP 10.0.0.1.44064 > 10.0.0.2.5001: UDP, length 1470

23:35:35.540180 IP 10.0.0.1.44064 > 10.0.0.2.5001: UDP, length 1470

23:35:35.552336 IP 10.0.0.1.44064 > 10.0.0.2.5001: UDP, length 1470

23:35:35.564499 IP 10.0.0.1.44064 > 10.0.0.2.5001: UDP, length 1470

23:35:35.576607 IP 10.0.0.1.44064 > 10.0.0.2.5001: UDP, length 1470

23:35:35.588748 IP 10.0.0.1.44064 > 10.0.0.2.5001: UDP, length 1470

23:35:35.600805 IP 10.0.0.1.44064 > 10.0.0.2.5001: UDP, length 1470

23:35:35.612787 IP 10.0.0.1.44064 > 10.0.0.2.5001: UDP, length 1470

23:35:35.624950 IP 10.0.0.1.44064 > 10.0.0.2.5001: UDP, length 1470

23:35:35.637047 IP 10.0.0.1.44064 > 10.0.0.2.5001: UDP, length 1470

23:35:35.649119 IP 10.0.0.1.44064 > 10.0.0.2.5001: UDP, length 1470

23:35:35.661238 IP 10.0.0.1.44064 > 10.0.0.2.5001: UDP, length 1470

23:35:35.673201 IP 10.0.0.1.44064 > 10.0.0.2.5001: UDP, length 1470

23:35:35.685479 IP 10.0.0.1.44064 > 10.0.0.2.5001: UDP, length 1470

23:35:35.697499 IP 10.0.0.1.44064 > 10.0.0.2.5001: UDP, length 1470

23:35:35.709575 IP 10.0.0.1.44064 > 10.0.0.2.5001: UDP, length 1470

23:35:35.721628 IP 10.0.0.1.44064 > 10.0.0.2.5001: UDP, length 1470

23:35:35.733781 IP 10.0.0.1.44064 > 10.0.0.2.5001: UDP, length 1470

23:35:35.745713 IP 10.0.0.1.44064 > 10.0.0.2.5001: UDP, length 1470

23:35:35.757879 IP 10.0.0.1.44064 > 10.0.0.2.5001: UDP, length 1470

23:35:35.770134 IP 10.0.0.1.44064 > 10.0.0.2.5001: UDP, length 1470

23:35:35.782284 IP 10.0.0.1.44064 > 10.0.0.2.5001: UDP, length 1470

23:35:35.794320 IP 10.0.0.1.44064 > 10.0.0.2.5001: UDP, length 1470

23:35:35.806607 IP 10.0.0.1.44064 > 10.0.0.2.5001: UDP, length 1470

23:35:35.818406 IP 10.0.0.1.44064 > 10.0.0.2.5001: UDP, length 1470

23:35:35.830551 IP 10.0.0.1.44064 > 10.0.0.2.5001: UDP, length 1470

23:35:35.842720 IP 10.0.0.1.44064 > 10.0.0.2.5001: UDP, length 1470

23:35:35.854900 IP 10.0.0.1.44064 > 10.0.0.2.5001: UDP, length 1470

23:35:35.866928 IP 10.0.0.1.44064 > 10.0.0.2.5001: UDP, length 1470

23:35:35.878981 IP 10.0.0.1.44064 > 10.0.0.2.5001: UDP, length 1470

23:35:35.890993 IP 10.0.0.1.44064 > 10.0.0.2.5001: UDP, length 1470

23:35:35.903191 IP 10.0.0.1.44064 > 10.0.0.2.5001: UDP, length 1470

23:35:35.915332 IP 10.0.0.1.44064 > 10.0.0.2.5001: UDP, length 1470

23:35:35.927434 IP 10.0.0.1.44064 > 10.0.0.2.5001: UDP, length 1470

23:35:35.939522 IP 10.0.0.1.44064 > 10.0.0.2.5001: UDP, length 1470

23:35:35.951390 IP 10.0.0.1.44064 > 10.0.0.2.5001: UDP, length 1470

23:35:35.963586 IP 10.0.0.1.44064 > 10.0.0.2.5001: UDP, length 1470

23:35:35.975759 IP 10.0.0.1.44064 > 10.0.0.2.5001: UDP, length 1470

23:35:35.987976 IP 10.0.0.1.44064 > 10.0.0.2.5001: UDP, length 1470

23:35:35.999914 IP 10.0.0.1.44064 > 10.0.0.2.5001: UDP, length 1470

23:35:36.012056 IP 10.0.0.1.44064 > 10.0.0.2.5001: UDP, length 1470

23:35:36.024026 IP 10.0.0.1.44064 > 10.0.0.2.5001: UDP, length 1470

23:35:36.036187 IP 10.0.0.1.44064 > 10.0.0.2.5001: UDP, length 1470

23:35:36.048269 IP 10.0.0.1.44064 > 10.0.0.2.5001: UDP, length 1470

23:35:36.060402 IP 10.0.0.1.44064 > 10.0.0.2.5001: UDP, length 1470

23:35:36.072435 IP 10.0.0.1.44064 > 10.0.0.2.5001: UDP, length 1470

23:35:36.084790 IP 10.0.0.1.44064 > 10.0.0.2.5001: UDP, length 1470

23:35:36.096599 IP 10.0.0.1.44064 > 10.0.0.2.5001: UDP, length 1470

23:35:36.108710 IP 10.0.0.1.44064 > 10.0.0.2.5001: UDP, length 1470

23:35:36.120823 IP 10.0.0.1.44064 > 10.0.0.2.5001: UDP, length 1470

23:35:36.132781 IP 10.0.0.1.44064 > 10.0.0.2.5001: UDP, length 1470

23:35:36.145255 IP 10.0.0.1.44064 > 10.0.0.2.5001: UDP, length 1470

23:35:36.157375 IP 10.0.0.1.44064 > 10.0.0.2.5001: UDP, length 1470

23:35:36.169186 IP 10.0.0.1.44064 > 10.0.0.2.5001: UDP, length 1470

23:35:36.181341 IP 10.0.0.1.44064 > 10.0.0.2.5001: UDP, length 1470

23:35:36.193522 IP 10.0.0.1.44064 > 10.0.0.2.5001: UDP, length 1470

23:35:36.205682 IP 10.0.0.1.44064 > 10.0.0.2.5001: UDP, length 1470

23:35:36.217835 IP 10.0.0.1.44064 > 10.0.0.2.5001: UDP, length 1470

23:35:36.229949 IP 10.0.0.1.44064 > 10.0.0.2.5001: UDP, length 1470

23:35:36.241779 IP 10.0.0.1.44064 > 10.0.0.2.5001: UDP, length 1470

23:35:36.253945 IP 10.0.0.1.44064 > 10.0.0.2.5001: UDP, length 1470

23:35:36.266094 IP 10.0.0.1.44064 > 10.0.0.2.5001: UDP, length 1470

23:35:36.278170 IP 10.0.0.1.44064 > 10.0.0.2.5001: UDP, length 1470

23:35:36.290382 IP 10.0.0.1.44064 > 10.0.0.2.5001: UDP, length 1470

23:35:36.302167 IP 10.0.0.1.44064 > 10.0.0.2.5001: UDP, length 1470

23:35:36.314336 IP 10.0.0.1.44064 > 10.0.0.2.5001: UDP, length 1470

23:35:36.326530 IP 10.0.0.1.44064 > 10.0.0.2.5001: UDP, length 1470

23:35:36.338695 IP 10.0.0.1.44064 > 10.0.0.2.5001: UDP, length 1470

23:35:36.350754 IP 10.0.0.1.44064 > 10.0.0.2.5001: UDP, length 1470

23:35:36.362868 IP 10.0.0.1.44064 > 10.0.0.2.5001: UDP, length 1470

23:35:36.374827 IP 10.0.0.1.44064 > 10.0.0.2.5001: UDP, length 1470

23:35:36.387010 IP 10.0.0.1.44064 > 10.0.0.2.5001: UDP, length 1470

23:35:36.399084 IP 10.0.0.1.44064 > 10.0.0.2.5001: UDP, length 1470

23:35:36.411194 IP 10.0.0.1.44064 > 10.0.0.2.5001: UDP, length 1470

23:35:36.423251 IP 10.0.0.1.44064 > 10.0.0.2.5001: UDP, length 1470

23:35:36.435231 IP 10.0.0.1.44064 > 10.0.0.2.5001: UDP, length 1470

23:35:36.447409 IP 10.0.0.1.44064 > 10.0.0.2.5001: UDP, length 1470

23:35:36.459525 IP 10.0.0.1.44064 > 10.0.0.2.5001: UDP, length 1470

23:35:36.471581 IP 10.0.0.1.44064 > 10.0.0.2.5001: UDP, length 1470

23:35:36.483901 IP 10.0.0.1.44064 > 10.0.0.2.5001: UDP, length 1470

23:35:36.496043 IP 10.0.0.1.44064 > 10.0.0.2.5001: UDP, length 1470

23:35:36.507820 IP 10.0.0.1.44064 > 10.0.0.2.5001: UDP, length 1470

23:35:36.520005 IP 10.0.0.1.44064 > 10.0.0.2.5001: UDP, length 1470

23:35:36.532243 IP 10.0.0.1.44064 > 10.0.0.2.5001: UDP, length 1470

23:35:36.544371 IP 10.0.0.1.44064 > 10.0.0.2.5001: UDP, length 1470

23:35:36.556568 IP 10.0.0.1.44064 > 10.0.0.2.5001: UDP, length 1470

23:35:36.568719 IP 10.0.0.1.44064 > 10.0.0.2.5001: UDP, length 1470

23:35:36.580693 IP 10.0.0.1.44064 > 10.0.0.2.5001: UDP, length 1470

23:35:36.592635 IP 10.0.0.1.44064 > 10.0.0.2.5001: UDP, length 1470

23:35:36.604767 IP 10.0.0.1.44064 > 10.0.0.2.5001: UDP, length 1470

23:35:36.616937 IP 10.0.0.1.44064 > 10.0.0.2.5001: UDP, length 1470

23:35:36.629108 IP 10.0.0.1.44064 > 10.0.0.2.5001: UDP, length 1470

23:35:36.641308 IP 10.0.0.1.44064 > 10.0.0.2.5001: UDP, length 1470

23:35:36.653351 IP 10.0.0.1.44064 > 10.0.0.2.5001: UDP, length 1470

23:35:36.665204 IP 10.0.0.1.44064 > 10.0.0.2.5001: UDP, length 1470

23:35:36.677380 IP 10.0.0.1.44064 > 10.0.0.2.5001: UDP, length 1470

23:35:36.689584 IP 10.0.0.1.44064 > 10.0.0.2.5001: UDP, length 1470

23:35:36.701614 IP 10.0.0.1.44064 > 10.0.0.2.5001: UDP, length 1470

23:35:36.713686 IP 10.0.0.1.44064 > 10.0.0.2.5001: UDP, length 1470

23:35:36.725738 IP 10.0.0.1.44064 > 10.0.0.2.5001: UDP, length 1470

23:35:36.737736 IP 10.0.0.1.44064 > 10.0.0.2.5001: UDP, length 1470

23:35:36.749847 IP 10.0.0.1.44064 > 10.0.0.2.5001: UDP, length 1470

23:35:36.762017 IP 10.0.0.1.44064 > 10.0.0.2.5001: UDP, length 1470

23:35:36.774083 IP 10.0.0.1.44064 > 10.0.0.2.5001: UDP, length 1470

23:35:36.786166 IP 10.0.0.1.44064 > 10.0.0.2.5001: UDP, length 1470

23:35:36.798145 IP 10.0.0.1.44064 > 10.0.0.2.5001: UDP, length 1470

23:35:36.810320 IP 10.0.0.1.44064 > 10.0.0.2.5001: UDP, length 1470

23:35:36.822397 IP 10.0.0.1.44064 > 10.0.0.2.5001: UDP, length 1470

23:35:36.834458 IP 10.0.0.1.44064 > 10.0.0.2.5001: UDP, length 1470

23:35:36.846547 IP 10.0.0.1.44064 > 10.0.0.2.5001: UDP, length 1470

23:35:36.858651 IP 10.0.0.1.44064 > 10.0.0.2.5001: UDP, length 1470

23:35:36.870713 IP 10.0.0.1.44064 > 10.0.0.2.5001: UDP, length 1470

23:35:36.882786 IP 10.0.0.1.44064 > 10.0.0.2.5001: UDP, length 1470

23:35:36.895031 IP 10.0.0.1.44064 > 10.0.0.2.5001: UDP, length 1470

23:35:36.907302 IP 10.0.0.1.44064 > 10.0.0.2.5001: UDP, length 1470

23:35:36.919397 IP 10.0.0.1.44064 > 10.0.0.2.5001: UDP, length 1470

23:35:36.931544 IP 10.0.0.1.44064 > 10.0.0.2.5001: UDP, length 1470

23:35:36.943304 IP 10.0.0.1.44064 > 10.0.0.2.5001: UDP, length 1470

23:35:36.955452 IP 10.0.0.1.44064 > 10.0.0.2.5001: UDP, length 1470

23:35:36.967552 IP 10.0.0.1.44064 > 10.0.0.2.5001: UDP, length 1470

23:35:36.979842 IP 10.0.0.1.44064 > 10.0.0.2.5001: UDP, length 1470

23:35:36.992020 IP 10.0.0.1.44064 > 10.0.0.2.5001: UDP, length 1470

23:35:37.003748 IP 10.0.0.1.44064 > 10.0.0.2.5001: UDP, length 1470

23:35:37.015933 IP 10.0.0.1.44064 > 10.0.0.2.5001: UDP, length 1470

23:35:37.028081 IP 10.0.0.1.44064 > 10.0.0.2.5001: UDP, length 1470

23:35:37.040248 IP 10.0.0.1.44064 > 10.0.0.2.5001: UDP, length 1470

23:35:37.052492 IP 10.0.0.1.44064 > 10.0.0.2.5001: UDP, length 1470

23:35:37.064885 IP 10.0.0.1.44064 > 10.0.0.2.5001: UDP, length 1470

23:35:37.076330 IP 10.0.0.1.44064 > 10.0.0.2.5001: UDP, length 1470

23:35:37.088528 IP 10.0.0.1.44064 > 10.0.0.2.5001: UDP, length 1470

23:35:37.100749 IP 10.0.0.1.44064 > 10.0.0.2.5001: UDP, length 1470

23:35:37.112818 IP 10.0.0.1.44064 > 10.0.0.2.5001: UDP, length 1470

23:35:37.124894 IP 10.0.0.1.44064 > 10.0.0.2.5001: UDP, length 1470

23:35:37.136935 IP 10.0.0.1.44064 > 10.0.0.2.5001: UDP, length 1470

23:35:37.148980 IP 10.0.0.1.44064 > 10.0.0.2.5001: UDP, length 1470

23:35:37.161135 IP 10.0.0.1.44064 > 10.0.0.2.5001: UDP, length 1470

23:35:37.173193 IP 10.0.0.1.44064 > 10.0.0.2.5001: UDP, length 1470

23:35:37.185311 IP 10.0.0.1.44064 > 10.0.0.2.5001: UDP, length 1470

23:35:37.197358 IP 10.0.0.1.44064 > 10.0.0.2.5001: UDP, length 1470

23:35:37.209385 IP 10.0.0.1.44064 > 10.0.0.2.5001: UDP, length 1470

23:35:37.221531 IP 10.0.0.1.44064 > 10.0.0.2.5001: UDP, length 1470

23:35:37.233687 IP 10.0.0.1.44064 > 10.0.0.2.5001: UDP, length 1470

23:35:37.245880 IP 10.0.0.1.44064 > 10.0.0.2.5001: UDP, length 1470

23:35:37.257754 IP 10.0.0.1.44064 > 10.0.0.2.5001: UDP, length 1470

23:35:37.270211 IP 10.0.0.1.44064 > 10.0.0.2.5001: UDP, length 1470

23:35:37.281968 IP 10.0.0.1.44064 > 10.0.0.2.5001: UDP, length 1470

23:35:37.294377 IP 10.0.0.1.44064 > 10.0.0.2.5001: UDP, length 1470

23:35:37.306400 IP 10.0.0.1.44064 > 10.0.0.2.5001: UDP, length 1470

23:35:37.318505 IP 10.0.0.1.44064 > 10.0.0.2.5001: UDP, length 1470

23:35:37.330480 IP 10.0.0.1.44064 > 10.0.0.2.5001: UDP, length 1470

23:35:37.342871 IP 10.0.0.1.44064 > 10.0.0.2.5001: UDP, length 1470

23:35:37.354592 IP 10.0.0.1.44064 > 10.0.0.2.5001: UDP, length 1470

23:35:37.366807 IP 10.0.0.1.44064 > 10.0.0.2.5001: UDP, length 1470

23:35:37.378967 IP 10.0.0.1.44064 > 10.0.0.2.5001: UDP, length 1470

23:35:37.391108 IP 10.0.0.1.44064 > 10.0.0.2.5001: UDP, length 1470

23:35:37.403244 IP 10.0.0.1.44064 > 10.0.0.2.5001: UDP, length 1470

23:35:37.415356 IP 10.0.0.1.44064 > 10.0.0.2.5001: UDP, length 1470

23:35:37.427095 IP 10.0.0.1.44064 > 10.0.0.2.5001: UDP, length 1470

23:35:37.439374 IP 10.0.0.1.44064 > 10.0.0.2.5001: UDP, length 1470

23:35:37.451553 IP 10.0.0.1.44064 > 10.0.0.2.5001: UDP, length 1470

23:35:37.463739 IP 10.0.0.1.44064 > 10.0.0.2.5001: UDP, length 1470

23:35:37.475653 IP 10.0.0.1.44064 > 10.0.0.2.5001: UDP, length 1470

23:35:37.487848 IP 10.0.0.1.44064 > 10.0.0.2.5001: UDP, length 1470

23:35:37.499705 IP 10.0.0.1.44064 > 10.0.0.2.5001: UDP, length 1470

23:35:37.511890 IP 10.0.0.1.44064 > 10.0.0.2.5001: UDP, length 1470

23:35:37.524014 IP 10.0.0.1.44064 > 10.0.0.2.5001: UDP, length 1470

23:35:37.536124 IP 10.0.0.1.44064 > 10.0.0.2.5001: UDP, length 1470

23:35:37.548172 IP 10.0.0.1.44064 > 10.0.0.2.5001: UDP, length 1470

23:35:37.560286 IP 10.0.0.1.44064 > 10.0.0.2.5001: UDP, length 1470

23:35:37.572337 IP 10.0.0.1.44064 > 10.0.0.2.5001: UDP, length 1470

23:35:37.584454 IP 10.0.0.1.44064 > 10.0.0.2.5001: UDP, length 1470

23:35:37.596506 IP 10.0.0.1.44064 > 10.0.0.2.5001: UDP, length 1470

23:35:37.608612 IP 10.0.0.1.44064 > 10.0.0.2.5001: UDP, length 1470

23:35:37.620925 IP 10.0.0.1.44064 > 10.0.0.2.5001: UDP, length 1470

23:35:37.632797 IP 10.0.0.1.44064 > 10.0.0.2.5001: UDP, length 1470

23:35:37.644921 IP 10.0.0.1.44064 > 10.0.0.2.5001: UDP, length 1470

23:35:37.657069 IP 10.0.0.1.44064 > 10.0.0.2.5001: UDP, length 1470

23:35:37.669225 IP 10.0.0.1.44064 > 10.0.0.2.5001: UDP, length 1470

23:35:37.681428 IP 10.0.0.1.44064 > 10.0.0.2.5001: UDP, length 1470

23:35:37.693602 IP 10.0.0.1.44064 > 10.0.0.2.5001: UDP, length 1470

23:35:37.705489 IP 10.0.0.1.44064 > 10.0.0.2.5001: UDP, length 1470

23:35:37.717510 IP 10.0.0.1.44064 > 10.0.0.2.5001: UDP, length 1470

23:35:37.729658 IP 10.0.0.1.44064 > 10.0.0.2.5001: UDP, length 1470

23:35:37.741884 IP 10.0.0.1.44064 > 10.0.0.2.5001: UDP, length 1470

23:35:37.753992 IP 10.0.0.1.44064 > 10.0.0.2.5001: UDP, length 1470

23:35:37.766137 IP 10.0.0.1.44064 > 10.0.0.2.5001: UDP, length 1470

23:35:37.777886 IP 10.0.0.1.44064 > 10.0.0.2.5001: UDP, length 1470

23:35:37.790086 IP 10.0.0.1.44064 > 10.0.0.2.5001: UDP, length 1470

23:35:37.802278 IP 10.0.0.1.44064 > 10.0.0.2.5001: UDP, length 1470

23:35:37.814341 IP 10.0.0.1.44064 > 10.0.0.2.5001: UDP, length 1470

23:35:37.826500 IP 10.0.0.1.44064 > 10.0.0.2.5001: UDP, length 1470

23:35:37.838568 IP 10.0.0.1.44064 > 10.0.0.2.5001: UDP, length 1470

23:35:37.850535 IP 10.0.0.1.44064 > 10.0.0.2.5001: UDP, length 1470

23:35:37.862704 IP 10.0.0.1.44064 > 10.0.0.2.5001: UDP, length 1470

23:35:37.874733 IP 10.0.0.1.44064 > 10.0.0.2.5001: UDP, length 1470

23:35:37.886945 IP 10.0.0.1.44064 > 10.0.0.2.5001: UDP, length 1470

23:35:37.898987 IP 10.0.0.1.44064 > 10.0.0.2.5001: UDP, length 1470

23:35:37.911031 IP 10.0.0.1.44064 > 10.0.0.2.5001: UDP, length 1470

23:35:37.923104 IP 10.0.0.1.44064 > 10.0.0.2.5001: UDP, length 1470

23:35:37.935273 IP 10.0.0.1.44064 > 10.0.0.2.5001: UDP, length 1470

23:35:37.947317 IP 10.0.0.1.44064 > 10.0.0.2.5001: UDP, length 1470

23:35:37.959545 IP 10.0.0.1.44064 > 10.0.0.2.5001: UDP, length 1470

23:35:37.971460 IP 10.0.0.1.44064 > 10.0.0.2.5001: UDP, length 1470

23:35:37.983594 IP 10.0.0.1.44064 > 10.0.0.2.5001: UDP, length 1470

23:35:37.995702 IP 10.0.0.1.44064 > 10.0.0.2.5001: UDP, length 1470

23:35:38.007665 IP 10.0.0.1.44064 > 10.0.0.2.5001: UDP, length 1470

23:35:38.020046 IP 10.0.0.1.44064 > 10.0.0.2.5001: UDP, length 1470

23:35:38.032202 IP 10.0.0.1.44064 > 10.0.0.2.5001: UDP, length 1470

23:35:38.044388 IP 10.0.0.1.44064 > 10.0.0.2.5001: UDP, length 1470

23:35:38.056160 IP 10.0.0.1.44064 > 10.0.0.2.5001: UDP, length 1470

23:35:38.068328 IP 10.0.0.1.44064 > 10.0.0.2.5001: UDP, length 1470

23:35:38.080522 IP 10.0.0.1.44064 > 10.0.0.2.5001: UDP, length 1470

23:35:38.092633 IP 10.0.0.1.44064 > 10.0.0.2.5001: UDP, length 1470

23:35:38.104866 IP 10.0.0.1.44064 > 10.0.0.2.5001: UDP, length 1470

23:35:38.116956 IP 10.0.0.1.44064 > 10.0.0.2.5001: UDP, length 1470

23:35:38.128746 IP 10.0.0.1.44064 > 10.0.0.2.5001: UDP, length 1470

23:35:38.140909 IP 10.0.0.1.44064 > 10.0.0.2.5001: UDP, length 1470

23:35:38.153058 IP 10.0.0.1.44064 > 10.0.0.2.5001: UDP, length 1470

23:35:38.165221 IP 10.0.0.1.44064 > 10.0.0.2.5001: UDP, length 1470

23:35:38.177323 IP 10.0.0.1.44064 > 10.0.0.2.5001: UDP, length 1470

23:35:38.189153 IP 10.0.0.1.44064 > 10.0.0.2.5001: UDP, length 1470

23:35:38.201344 IP 10.0.0.1.44064 > 10.0.0.2.5001: UDP, length 1470

23:35:38.213526 IP 10.0.0.1.44064 > 10.0.0.2.5001: UDP, length 1470

23:35:38.225633 IP 10.0.0.1.44064 > 10.0.0.2.5001: UDP, length 1470

23:35:38.237764 IP 10.0.0.1.44064 > 10.0.0.2.5001: UDP, length 1470

23:35:38.249772 IP 10.0.0.1.44064 > 10.0.0.2.5001: UDP, length 1470

23:35:38.261780 IP 10.0.0.1.44064 > 10.0.0.2.5001: UDP, length 1470

23:35:38.273831 IP 10.0.0.1.44064 > 10.0.0.2.5001: UDP, length 1470

23:35:38.286072 IP 10.0.0.1.44064 > 10.0.0.2.5001: UDP, length 1470

23:35:38.298321 IP 10.0.0.1.44064 > 10.0.0.2.5001: UDP, length 1470

23:35:38.310228 IP 10.0.0.1.44064 > 10.0.0.2.5001: UDP, length 1470

23:35:38.322283 IP 10.0.0.1.44064 > 10.0.0.2.5001: UDP, length 1470

23:35:38.334360 IP 10.0.0.1.44064 > 10.0.0.2.5001: UDP, length 1470

23:35:38.346419 IP 10.0.0.1.44064 > 10.0.0.2.5001: UDP, length 1470

23:35:38.358557 IP 10.0.0.1.44064 > 10.0.0.2.5001: UDP, length 1470

23:35:38.370858 IP 10.0.0.1.44064 > 10.0.0.2.5001: UDP, length 1470

23:35:38.382735 IP 10.0.0.1.44064 > 10.0.0.2.5001: UDP, length 1470

23:35:38.394769 IP 10.0.0.1.44064 > 10.0.0.2.5001: UDP, length 1470

23:35:38.406932 IP 10.0.0.1.44064 > 10.0.0.2.5001: UDP, length 1470

23:35:38.419117 IP 10.0.0.1.44064 > 10.0.0.2.5001: UDP, length 1470

23:35:38.431277 IP 10.0.0.1.44064 > 10.0.0.2.5001: UDP, length 1470

23:35:38.443431 IP 10.0.0.1.44064 > 10.0.0.2.5001: UDP, length 1470

23:35:38.455577 IP 10.0.0.1.44064 > 10.0.0.2.5001: UDP, length 1470

23:35:38.467396 IP 10.0.0.1.44064 > 10.0.0.2.5001: UDP, length 1470

23:35:38.479552 IP 10.0.0.1.44064 > 10.0.0.2.5001: UDP, length 1470

23:35:38.491715 IP 10.0.0.1.44064 > 10.0.0.2.5001: UDP, length 1470

23:35:38.503756 IP 10.0.0.1.44064 > 10.0.0.2.5001: UDP, length 1470

23:35:38.515994 IP 10.0.0.1.44064 > 10.0.0.2.5001: UDP, length 1470

23:35:38.528115 IP 10.0.0.1.44064 > 10.0.0.2.5001: UDP, length 1470

23:35:38.539956 IP 10.0.0.1.44064 > 10.0.0.2.5001: UDP, length 1470

23:35:38.552129 IP 10.0.0.1.44064 > 10.0.0.2.5001: UDP, length 1470

23:35:38.564314 IP 10.0.0.1.44064 > 10.0.0.2.5001: UDP, length 1470

23:35:38.576453 IP 10.0.0.1.44064 > 10.0.0.2.5001: UDP, length 1470

23:35:38.588607 IP 10.0.0.1.44064 > 10.0.0.2.5001: UDP, length 1470

23:35:38.600630 IP 10.0.0.1.44064 > 10.0.0.2.5001: UDP, length 1470

23:35:38.612563 IP 10.0.0.1.44064 > 10.0.0.2.5001: UDP, length 1470

23:35:38.624727 IP 10.0.0.1.44064 > 10.0.0.2.5001: UDP, length 1470

23:35:38.636857 IP 10.0.0.1.44064 > 10.0.0.2.5001: UDP, length 1470

23:35:38.648930 IP 10.0.0.1.44064 > 10.0.0.2.5001: UDP, length 1470

23:35:38.661078 IP 10.0.0.1.44064 > 10.0.0.2.5001: UDP, length 1470

23:35:38.673121 IP 10.0.0.1.44064 > 10.0.0.2.5001: UDP, length 1470

23:35:38.685170 IP 10.0.0.1.44064 > 10.0.0.2.5001: UDP, length 1470

23:35:38.697251 IP 10.0.0.1.44064 > 10.0.0.2.5001: UDP, length 1470

23:35:38.709371 IP 10.0.0.1.44064 > 10.0.0.2.5001: UDP, length 1470

23:35:38.721395 IP 10.0.0.1.44064 > 10.0.0.2.5001: UDP, length 1470

23:35:38.733523 IP 10.0.0.1.44064 > 10.0.0.2.5001: UDP, length 1470

23:35:38.745508 IP 10.0.0.1.44064 > 10.0.0.2.5001: UDP, length 1470

23:35:38.757620 IP 10.0.0.1.44064 > 10.0.0.2.5001: UDP, length 1470

23:35:38.769900 IP 10.0.0.1.44064 > 10.0.0.2.5001: UDP, length 1470

23:35:38.782050 IP 10.0.0.1.44064 > 10.0.0.2.5001: UDP, length 1470

23:35:38.794256 IP 10.0.0.1.44064 > 10.0.0.2.5001: UDP, length 1470

23:35:38.806375 IP 10.0.0.1.44064 > 10.0.0.2.5001: UDP, length 1470

23:35:38.818094 IP 10.0.0.1.44064 > 10.0.0.2.5001: UDP, length 1470

23:35:38.830320 IP 10.0.0.1.44064 > 10.0.0.2.5001: UDP, length 1470

23:35:38.842478 IP 10.0.0.1.44064 > 10.0.0.2.5001: UDP, length 1470

23:35:38.854618 IP 10.0.0.1.44064 > 10.0.0.2.5001: UDP, length 1470

23:35:38.866599 IP 10.0.0.1.44064 > 10.0.0.2.5001: UDP, length 1470

23:35:38.878819 IP 10.0.0.1.44064 > 10.0.0.2.5001: UDP, length 1470

23:35:38.890721 IP 10.0.0.1.44064 > 10.0.0.2.5001: UDP, length 1470

23:35:38.902919 IP 10.0.0.1.44064 > 10.0.0.2.5001: UDP, length 1470

23:35:38.915058 IP 10.0.0.1.44064 > 10.0.0.2.5001: UDP, length 1470

23:35:38.927209 IP 10.0.0.1.44064 > 10.0.0.2.5001: UDP, length 1470

23:35:38.939278 IP 10.0.0.1.44064 > 10.0.0.2.5001: UDP, length 1470

23:35:38.951377 IP 10.0.0.1.44064 > 10.0.0.2.5001: UDP, length 1470

23:35:38.963378 IP 10.0.0.1.44064 > 10.0.0.2.5001: UDP, length 1470

23:35:38.975552 IP 10.0.0.1.44064 > 10.0.0.2.5001: UDP, length 1470

23:35:38.987755 IP 10.0.0.1.44064 > 10.0.0.2.5001: UDP, length 1470

23:35:38.999748 IP 10.0.0.1.44064 > 10.0.0.2.5001: UDP, length 1470

23:35:39.011854 IP 10.0.0.1.44064 > 10.0.0.2.5001: UDP, length 1470

23:35:39.023813 IP 10.0.0.1.44064 > 10.0.0.2.5001: UDP, length 1470

23:35:39.035981 IP 10.0.0.1.44064 > 10.0.0.2.5001: UDP, length 1470

23:35:39.048072 IP 10.0.0.1.44064 > 10.0.0.2.5001: UDP, length 1470

23:35:39.060207 IP 10.0.0.1.44064 > 10.0.0.2.5001: UDP, length 1470

23:35:39.072236 IP 10.0.0.1.44064 > 10.0.0.2.5001: UDP, length 1470

23:35:39.084465 IP 10.0.0.1.44064 > 10.0.0.2.5001: UDP, length 1470

23:35:39.096407 IP 10.0.0.1.44064 > 10.0.0.2.5001: UDP, length 1470

23:35:39.108608 IP 10.0.0.1.44064 > 10.0.0.2.5001: UDP, length 1470

23:35:39.120862 IP 10.0.0.1.44064 > 10.0.0.2.5001: UDP, length 1470

23:35:39.132725 IP 10.0.0.1.44064 > 10.0.0.2.5001: UDP, length 1470

23:35:39.145091 IP 10.0.0.1.44064 > 10.0.0.2.5001: UDP, length 1470

23:35:39.157225 IP 10.0.0.1.44064 > 10.0.0.2.5001: UDP, length 1470

23:35:39.169206 IP 10.0.0.1.44064 > 10.0.0.2.5001: UDP, length 1470

23:35:39.181185 IP 10.0.0.1.44064 > 10.0.0.2.5001: UDP, length 1470

23:35:39.193331 IP 10.0.0.1.44064 > 10.0.0.2.5001: UDP, length 1470

23:35:39.205534 IP 10.0.0.1.44064 > 10.0.0.2.5001: UDP, length 1470

23:35:39.217665 IP 10.0.0.1.44064 > 10.0.0.2.5001: UDP, length 1470

23:35:39.229819 IP 10.0.0.1.44064 > 10.0.0.2.5001: UDP, length 1470

23:35:39.241787 IP 10.0.0.1.44064 > 10.0.0.2.5001: UDP, length 1470

23:35:39.253656 IP 10.0.0.1.44064 > 10.0.0.2.5001: UDP, length 1470

23:35:39.265756 IP 10.0.0.1.44064 > 10.0.0.2.5001: UDP, length 1470

23:35:39.278000 IP 10.0.0.1.44064 > 10.0.0.2.5001: UDP, length 1470

23:35:39.290162 IP 10.0.0.1.44064 > 10.0.0.2.5001: UDP, length 1470

23:35:39.302268 IP 10.0.0.1.44064 > 10.0.0.2.5001: UDP, length 1470

23:35:39.314339 IP 10.0.0.1.44064 > 10.0.0.2.5001: UDP, length 1470

23:35:39.326203 IP 10.0.0.1.44064 > 10.0.0.2.5001: UDP, length 1470

23:35:39.338421 IP 10.0.0.1.44064 > 10.0.0.2.5001: UDP, length 1470

23:35:39.350585 IP 10.0.0.1.44064 > 10.0.0.2.5001: UDP, length 1470

23:35:39.362703 IP 10.0.0.1.44064 > 10.0.0.2.5001: UDP, length 1470

23:35:39.374710 IP 10.0.0.1.44064 > 10.0.0.2.5001: UDP, length 1470

23:35:39.386660 IP 10.0.0.1.44064 > 10.0.0.2.5001: UDP, length 1470

23:35:39.398895 IP 10.0.0.1.44064 > 10.0.0.2.5001: UDP, length 1470

23:35:39.410991 IP 10.0.0.1.44064 > 10.0.0.2.5001: UDP, length 1470

23:35:39.423049 IP 10.0.0.1.44064 > 10.0.0.2.5001: UDP, length 1470

23:35:39.435156 IP 10.0.0.1.44064 > 10.0.0.2.5001: UDP, length 1470

23:35:39.447202 IP 10.0.0.1.44064 > 10.0.0.2.5001: UDP, length 1470

23:35:39.464308 IP 10.0.0.1.44064 > 10.0.0.2.5001: UDP, length 1470

23:35:39.471336 IP 10.0.0.1.44064 > 10.0.0.2.5001: UDP, length 1470

23:35:39.483443 IP 10.0.0.1.44064 > 10.0.0.2.5001: UDP, length 1470

23:35:39.495504 IP 10.0.0.1.44064 > 10.0.0.2.5001: UDP, length 1470

23:35:39.507562 IP 10.0.0.1.44064 > 10.0.0.2.5001: UDP, length 1470

23:35:39.519866 IP 10.0.0.1.44064 > 10.0.0.2.5001: UDP, length 1470

23:35:39.532025 IP 10.0.0.1.44064 > 10.0.0.2.5001: UDP, length 1470

23:35:39.544055 IP 10.0.0.1.44064 > 10.0.0.2.5001: UDP, length 1470

23:35:39.556388 IP 10.0.0.1.44064 > 10.0.0.2.5001: UDP, length 1470

23:35:39.568144 IP 10.0.0.1.44064 > 10.0.0.2.5001: UDP, length 1470

23:35:39.580304 IP 10.0.0.1.44064 > 10.0.0.2.5001: UDP, length 1470

23:35:39.592463 IP 10.0.0.1.44064 > 10.0.0.2.5001: UDP, length 1470

23:35:39.604612 IP 10.0.0.1.44064 > 10.0.0.2.5001: UDP, length 1470

23:35:39.616817 IP 10.0.0.1.44064 > 10.0.0.2.5001: UDP, length 1470

23:35:39.628881 IP 10.0.0.1.44064 > 10.0.0.2.5001: UDP, length 1470

23:35:39.640751 IP 10.0.0.1.44064 > 10.0.0.2.5001: UDP, length 1470

23:35:39.652909 IP 10.0.0.1.44064 > 10.0.0.2.5001: UDP, length 1470

23:35:39.665077 IP 10.0.0.1.44064 > 10.0.0.2.5001: UDP, length 1470

23:35:39.677152 IP 10.0.0.1.44064 > 10.0.0.2.5001: UDP, length 1470

23:35:39.689317 IP 10.0.0.1.44064 > 10.0.0.2.5001: UDP, length 1470

23:35:39.701127 IP 10.0.0.1.44064 > 10.0.0.2.5001: UDP, length 1470

23:35:39.713621 IP 10.0.0.1.44064 > 10.0.0.2.5001: UDP, length 1470

23:35:39.725521 IP 10.0.0.1.44064 > 10.0.0.2.5001: UDP, length 1470

23:35:39.737664 IP 10.0.0.1.44064 > 10.0.0.2.5001: UDP, length 1470

23:35:39.749710 IP 10.0.0.1.44064 > 10.0.0.2.5001: UDP, length 1470

23:35:39.761842 IP 10.0.0.1.44064 > 10.0.0.2.5001: UDP, length 1470

23:35:39.773769 IP 10.0.0.1.44064 > 10.0.0.2.5001: UDP, length 1470

23:35:39.785978 IP 10.0.0.1.44064 > 10.0.0.2.5001: UDP, length 1470

23:35:39.798071 IP 10.0.0.1.44064 > 10.0.0.2.5001: UDP, length 1470

23:35:39.810179 IP 10.0.0.1.44064 > 10.0.0.2.5001: UDP, length 1470

23:35:39.822238 IP 10.0.0.1.44064 > 10.0.0.2.5001: UDP, length 1470

23:35:39.837625 IP 10.0.0.1.44064 > 10.0.0.2.5001: UDP, length 1470

23:35:39.846340 IP 10.0.0.1.44064 > 10.0.0.2.5001: UDP, length 1470

23:35:39.858442 IP 10.0.0.1.44064 > 10.0.0.2.5001: UDP, length 1470

23:35:39.870656 IP 10.0.0.1.44064 > 10.0.0.2.5001: UDP, length 1470

23:35:39.882584 IP 10.0.0.1.44064 > 10.0.0.2.5001: UDP, length 1470

23:35:39.894890 IP 10.0.0.1.44064 > 10.0.0.2.5001: UDP, length 1470

23:35:39.907156 IP 10.0.0.1.44064 > 10.0.0.2.5001: UDP, length 1470

23:35:39.919267 IP 10.0.0.1.44064 > 10.0.0.2.5001: UDP, length 1470

23:35:39.931024 IP 10.0.0.1.44064 > 10.0.0.2.5001: UDP, length 1470

23:35:39.943185 IP 10.0.0.1.44064 > 10.0.0.2.5001: UDP, length 1470

23:35:39.955253 IP 10.0.0.1.44064 > 10.0.0.2.5001: UDP, length 1470

23:35:39.967503 IP 10.0.0.1.44064 > 10.0.0.2.5001: UDP, length 1470

23:35:39.979671 IP 10.0.0.1.44064 > 10.0.0.2.5001: UDP, length 1470

23:35:39.991810 IP 10.0.0.1.44064 > 10.0.0.2.5001: UDP, length 1470

23:35:40.003624 IP 10.0.0.1.44064 > 10.0.0.2.5001: UDP, length 1470

23:35:40.015728 IP 10.0.0.1.44064 > 10.0.0.2.5001: UDP, length 1470

23:35:40.027940 IP 10.0.0.1.44064 > 10.0.0.2.5001: UDP, length 1470

23:35:40.040120 IP 10.0.0.1.44064 > 10.0.0.2.5001: UDP, length 1470

23:35:40.052168 IP 10.0.0.1.44064 > 10.0.0.2.5001: UDP, length 1470

23:35:40.064271 IP 10.0.0.1.44064 > 10.0.0.2.5001: UDP, length 1470

23:35:40.076179 IP 10.0.0.1.44064 > 10.0.0.2.5001: UDP, length 1470

23:35:40.088369 IP 10.0.0.1.44064 > 10.0.0.2.5001: UDP, length 1470

23:35:40.100542 IP 10.0.0.1.44064 > 10.0.0.2.5001: UDP, length 1470

23:35:40.112610 IP 10.0.0.1.44064 > 10.0.0.2.5001: UDP, length 1470

23:35:40.124654 IP 10.0.0.1.44064 > 10.0.0.2.5001: UDP, length 1470

23:35:40.136628 IP 10.0.0.1.44064 > 10.0.0.2.5001: UDP, length 1470

23:35:40.148827 IP 10.0.0.1.44064 > 10.0.0.2.5001: UDP, length 1470

23:35:40.160943 IP 10.0.0.1.44064 > 10.0.0.2.5001: UDP, length 1470

23:35:40.172998 IP 10.0.0.1.44064 > 10.0.0.2.5001: UDP, length 1470

23:35:40.185145 IP 10.0.0.1.44064 > 10.0.0.2.5001: UDP, length 1470

23:35:40.197164 IP 10.0.0.1.44064 > 10.0.0.2.5001: UDP, length 1470

23:35:40.209259 IP 10.0.0.1.44064 > 10.0.0.2.5001: UDP, length 1470

23:35:40.221303 IP 10.0.0.1.44064 > 10.0.0.2.5001: UDP, length 1470

23:35:40.233472 IP 10.0.0.1.44064 > 10.0.0.2.5001: UDP, length 1470

23:35:40.245807 IP 10.0.0.1.44064 > 10.0.0.2.5001: UDP, length 1470

23:35:40.257703 IP 10.0.0.1.44064 > 10.0.0.2.5001: UDP, length 1470

23:35:40.270063 IP 10.0.0.1.44064 > 10.0.0.2.5001: UDP, length 1470

23:35:40.281839 IP 10.0.0.1.44064 > 10.0.0.2.5001: UDP, length 1470

23:35:40.294064 IP 10.0.0.1.44064 > 10.0.0.2.5001: UDP, length 1470

23:35:40.306164 IP 10.0.0.1.44064 > 10.0.0.2.5001: UDP, length 1470

23:35:40.318265 IP 10.0.0.1.44064 > 10.0.0.2.5001: UDP, length 1470

23:35:40.330478 IP 10.0.0.1.44064 > 10.0.0.2.5001: UDP, length 1470

23:35:40.342587 IP 10.0.0.1.44064 > 10.0.0.2.5001: UDP, length 1470

23:35:40.354335 IP 10.0.0.1.44064 > 10.0.0.2.5001: UDP, length 1470

23:35:40.366574 IP 10.0.0.1.44064 > 10.0.0.2.5001: UDP, length 1470

23:35:40.378723 IP 10.0.0.1.44064 > 10.0.0.2.5001: UDP, length 1470

23:35:40.391003 IP 10.0.0.1.44064 > 10.0.0.2.5001: UDP, length 1470

23:35:40.403019 IP 10.0.0.1.44064 > 10.0.0.2.5001: UDP, length 1470

23:35:40.414972 IP 10.0.0.1.44064 > 10.0.0.2.5001: UDP, length 1470

23:35:40.426998 IP 10.0.0.1.44064 > 10.0.0.2.5001: UDP, length 1470

23:35:40.439147 IP 10.0.0.1.44064 > 10.0.0.2.5001: UDP, length 1470

23:35:40.451309 IP 10.0.0.1.44064 > 10.0.0.2.5001: UDP, length 1470

23:35:40.463567 IP 10.0.0.1.44064 > 10.0.0.2.5001: UDP, length 1470

23:35:40.475402 IP 10.0.0.1.44064 > 10.0.0.2.5001: UDP, length 1470

23:35:40.487396 IP 10.0.0.1.44064 > 10.0.0.2.5001: UDP, length 1470

23:35:40.499610 IP 10.0.0.1.44064 > 10.0.0.2.5001: UDP, length 1470

23:35:40.511751 IP 10.0.0.1.44064 > 10.0.0.2.5001: UDP, length 1470

23:35:40.523826 IP 10.0.0.1.44064 > 10.0.0.2.5001: UDP, length 1470

23:35:40.535920 IP 10.0.0.1.44064 > 10.0.0.2.5001: UDP, length 1470

23:35:40.547966 IP 10.0.0.1.44064 > 10.0.0.2.5001: UDP, length 1470

23:35:40.560030 IP 10.0.0.1.44064 > 10.0.0.2.5001: UDP, length 1470

23:35:40.572843 IP 10.0.0.1.44064 > 10.0.0.2.5001: UDP, length 1470

23:35:40.585647 IP 10.0.0.1.44064 > 10.0.0.2.5001: UDP, length 1470

23:35:40.586033 IP 10.0.0.2.5001 > 10.0.0.1.44064: UDP, length 1470

23:35:40.589332 IP 10.0.0.2.5001 > 10.0.0.1.44064: UDP, length 1470

23:35:40.596648 IP 10.0.0.1.44064 > 10.0.0.2.5001: UDP, length 1470

23:35:40.600177 IP 10.0.0.2.5001 > 10.0.0.1.44064: UDP, length 1470

23:35:40.609022 IP 10.0.0.1.44064 > 10.0.0.2.5001: UDP, length 1470

23:35:40.612294 IP 10.0.0.2.5001 > 10.0.0.1.44064: UDP, length 1470

23:35:40.621088 IP 10.0.0.1.44064 > 10.0.0.2.5001: UDP, length 1470

23:35:40.624574 IP 10.0.0.2.5001 > 10.0.0.1.44064: UDP, length 1470

23:35:40.633236 IP 10.0.0.1.44064 > 10.0.0.2.5001: UDP, length 1470

23:35:40.636731 IP 10.0.0.2.5001 > 10.0.0.1.44064: UDP, length 1470

23:35:40.645372 IP 10.0.0.1.44064 > 10.0.0.2.5001: UDP, length 1470

23:35:40.649020 IP 10.0.0.2.5001 > 10.0.0.1.44064: UDP, length 1470

23:35:40.657676 IP 10.0.0.1.44064 > 10.0.0.2.5001: UDP, length 1470

23:35:40.661141 IP 10.0.0.2.5001 > 10.0.0.1.44064: UDP, length 1470

23:35:40.670031 IP 10.0.0.1 > 10.0.0.2: ICMP 10.0.0.1 udp port 44064 unreachable, length 556

23:35:40.674619 IP 10.0.0.1 > 10.0.0.2: ICMP 10.0.0.1 udp port 44064 unreachable, length 556

23:35:40.679279 IP 10.0.0.1 > 10.0.0.2: ICMP 10.0.0.1 udp port 44064 unreachable, length 556

23:35:40.684079 IP 10.0.0.1 > 10.0.0.2: ICMP 10.0.0.1 udp port 44064 unreachable, length 556

23:35:40.688808 IP 10.0.0.1 > 10.0.0.2: ICMP 10.0.0.1 udp port 44064 unreachable, length 556

23:35:40.693610 IP 10.0.0.1 > 10.0.0.2: ICMP 10.0.0.1 udp port 44064 unreachable, length 556



cnt=
1438
