23:27:10.184479 IP 10.0.0.1.39710 > 10.0.0.2.5001: UDP, length 1470

23:27:10.276448 IP 10.0.0.1.39710 > 10.0.0.2.5001: UDP, length 1470

23:27:10.368507 IP 10.0.0.1.39710 > 10.0.0.2.5001: UDP, length 1470

23:27:10.460338 IP 10.0.0.1.39710 > 10.0.0.2.5001: UDP, length 1470

23:27:10.552672 IP 10.0.0.1.39710 > 10.0.0.2.5001: UDP, length 1470

23:27:10.643902 IP 10.0.0.1.39710 > 10.0.0.2.5001: UDP, length 1470

23:27:10.736641 IP 10.0.0.1.39710 > 10.0.0.2.5001: UDP, length 1470

23:27:10.828215 IP 10.0.0.1.39710 > 10.0.0.2.5001: UDP, length 1470

23:27:10.920810 IP 10.0.0.1.39710 > 10.0.0.2.5001: UDP, length 1470

23:27:11.011528 IP 10.0.0.1.39710 > 10.0.0.2.5001: UDP, length 1470

23:27:11.103259 IP 10.0.0.1.39710 > 10.0.0.2.5001: UDP, length 1470

23:27:11.195182 IP 10.0.0.1.39710 > 10.0.0.2.5001: UDP, length 1470

23:27:11.286945 IP 10.0.0.1.39710 > 10.0.0.2.5001: UDP, length 1470

23:27:11.378949 IP 10.0.0.1.39710 > 10.0.0.2.5001: UDP, length 1470

23:27:11.471263 IP 10.0.0.1.39710 > 10.0.0.2.5001: UDP, length 1470

23:27:11.562959 IP 10.0.0.1.39710 > 10.0.0.2.5001: UDP, length 1470

23:27:11.654817 IP 10.0.0.1.39710 > 10.0.0.2.5001: UDP, length 1470

23:27:11.746665 IP 10.0.0.1.39710 > 10.0.0.2.5001: UDP, length 1470

23:27:11.838273 IP 10.0.0.1.39710 > 10.0.0.2.5001: UDP, length 1470

23:27:11.929859 IP 10.0.0.1.39710 > 10.0.0.2.5001: UDP, length 1470

23:27:12.021890 IP 10.0.0.1.39710 > 10.0.0.2.5001: UDP, length 1470

23:27:12.113731 IP 10.0.0.1.39710 > 10.0.0.2.5001: UDP, length 1470

23:27:12.205635 IP 10.0.0.1.39710 > 10.0.0.2.5001: UDP, length 1470

23:27:12.297868 IP 10.0.0.1.39710 > 10.0.0.2.5001: UDP, length 1470

23:27:12.389567 IP 10.0.0.1.39710 > 10.0.0.2.5001: UDP, length 1470

23:27:12.481605 IP 10.0.0.1.39710 > 10.0.0.2.5001: UDP, length 1470

23:27:12.573054 IP 10.0.0.1.39710 > 10.0.0.2.5001: UDP, length 1470

23:27:12.665090 IP 10.0.0.1.39710 > 10.0.0.2.5001: UDP, length 1470

23:27:12.757476 IP 10.0.0.1.39710 > 10.0.0.2.5001: UDP, length 1470

23:27:12.940800 IP 10.0.0.1.39710 > 10.0.0.2.5001: UDP, length 1470

23:27:13.032523 IP 10.0.0.1.39710 > 10.0.0.2.5001: UDP, length 1470

23:27:13.124131 IP 10.0.0.1.39710 > 10.0.0.2.5001: UDP, length 1470

23:27:13.216753 IP 10.0.0.1.39710 > 10.0.0.2.5001: UDP, length 1470

23:27:13.308061 IP 10.0.0.1.39710 > 10.0.0.2.5001: UDP, length 1470

23:27:13.399718 IP 10.0.0.1.39710 > 10.0.0.2.5001: UDP, length 1470

23:27:13.491612 IP 10.0.0.1.39710 > 10.0.0.2.5001: UDP, length 1470

23:27:13.583966 IP 10.0.0.1.39710 > 10.0.0.2.5001: UDP, length 1470

23:27:13.676029 IP 10.0.0.1.39710 > 10.0.0.2.5001: UDP, length 1470

23:27:13.768582 IP 10.0.0.1.39710 > 10.0.0.2.5001: UDP, length 1470

23:27:13.859683 IP 10.0.0.1.39710 > 10.0.0.2.5001: UDP, length 1470

23:27:13.951213 IP 10.0.0.1.39710 > 10.0.0.2.5001: UDP, length 1470

23:27:14.043461 IP 10.0.0.1.39710 > 10.0.0.2.5001: UDP, length 1470

23:27:14.135693 IP 10.0.0.1.39710 > 10.0.0.2.5001: UDP, length 1470

23:27:14.226709 IP 10.0.0.1.39710 > 10.0.0.2.5001: UDP, length 1470

23:27:14.319406 IP 10.0.0.1.39710 > 10.0.0.2.5001: UDP, length 1470

23:27:14.410976 IP 10.0.0.1.39710 > 10.0.0.2.5001: UDP, length 1470

23:27:14.502685 IP 10.0.0.1.39710 > 10.0.0.2.5001: UDP, length 1470

23:27:14.594345 IP 10.0.0.1.39710 > 10.0.0.2.5001: UDP, length 1470

23:27:14.686591 IP 10.0.0.1.39710 > 10.0.0.2.5001: UDP, length 1470

23:27:14.778198 IP 10.0.0.1.39710 > 10.0.0.2.5001: UDP, length 1470

23:27:14.871883 IP 10.0.0.1.39710 > 10.0.0.2.5001: UDP, length 1470

23:27:14.962724 IP 10.0.0.1.39710 > 10.0.0.2.5001: UDP, length 1470

23:27:15.056190 IP 10.0.0.1.39710 > 10.0.0.2.5001: UDP, length 1470

23:27:15.145721 IP 10.0.0.1.39710 > 10.0.0.2.5001: UDP, length 1470

23:27:15.237520 IP 10.0.0.1.39710 > 10.0.0.2.5001: UDP, length 1470

23:27:15.328487 IP 10.0.0.1.39710 > 10.0.0.2.5001: UDP, length 1470

23:27:15.343177 IP 10.0.0.2.5001 > 10.0.0.1.39710: UDP, length 1470



cnt=
58
