23:29:05.114154 IP 10.0.0.1.33303 > 10.0.0.2.5001: UDP, length 1470

23:29:05.161328 IP 10.0.0.1.33303 > 10.0.0.2.5001: UDP, length 1470

23:29:05.206425 IP 10.0.0.1.33303 > 10.0.0.2.5001: UDP, length 1470

23:29:05.252492 IP 10.0.0.1.33303 > 10.0.0.2.5001: UDP, length 1470

23:29:05.299968 IP 10.0.0.1.33303 > 10.0.0.2.5001: UDP, length 1470

23:29:05.344419 IP 10.0.0.1.33303 > 10.0.0.2.5001: UDP, length 1470

23:29:05.390144 IP 10.0.0.1.33303 > 10.0.0.2.5001: UDP, length 1470

23:29:05.436259 IP 10.0.0.1.33303 > 10.0.0.2.5001: UDP, length 1470

23:29:05.482189 IP 10.0.0.1.33303 > 10.0.0.2.5001: UDP, length 1470

23:29:05.528101 IP 10.0.0.1.33303 > 10.0.0.2.5001: UDP, length 1470

23:29:05.573858 IP 10.0.0.1.33303 > 10.0.0.2.5001: UDP, length 1470

23:29:05.619934 IP 10.0.0.1.33303 > 10.0.0.2.5001: UDP, length 1470

23:29:05.665911 IP 10.0.0.1.33303 > 10.0.0.2.5001: UDP, length 1470

23:29:05.711547 IP 10.0.0.1.33303 > 10.0.0.2.5001: UDP, length 1470

23:29:05.757590 IP 10.0.0.1.33303 > 10.0.0.2.5001: UDP, length 1470

23:29:05.804141 IP 10.0.0.1.33303 > 10.0.0.2.5001: UDP, length 1470

23:29:05.849541 IP 10.0.0.1.33303 > 10.0.0.2.5001: UDP, length 1470

23:29:05.895112 IP 10.0.0.1.33303 > 10.0.0.2.5001: UDP, length 1470

23:29:05.941202 IP 10.0.0.1.33303 > 10.0.0.2.5001: UDP, length 1470

23:29:05.987264 IP 10.0.0.1.33303 > 10.0.0.2.5001: UDP, length 1470

23:29:06.033406 IP 10.0.0.1.33303 > 10.0.0.2.5001: UDP, length 1470

23:29:06.079092 IP 10.0.0.1.33303 > 10.0.0.2.5001: UDP, length 1470

23:29:06.125265 IP 10.0.0.1.33303 > 10.0.0.2.5001: UDP, length 1470

23:29:06.171129 IP 10.0.0.1.33303 > 10.0.0.2.5001: UDP, length 1470

23:29:06.217021 IP 10.0.0.1.33303 > 10.0.0.2.5001: UDP, length 1470

23:29:06.263078 IP 10.0.0.1.33303 > 10.0.0.2.5001: UDP, length 1470

23:29:06.354886 IP 10.0.0.1.33303 > 10.0.0.2.5001: UDP, length 1470

23:29:06.400478 IP 10.0.0.1.33303 > 10.0.0.2.5001: UDP, length 1470

23:29:06.447217 IP 10.0.0.1.33303 > 10.0.0.2.5001: UDP, length 1470

23:29:06.539031 IP 10.0.0.1.33303 > 10.0.0.2.5001: UDP, length 1470

23:29:06.585615 IP 10.0.0.1.33303 > 10.0.0.2.5001: UDP, length 1470

23:29:06.677163 IP 10.0.0.1.33303 > 10.0.0.2.5001: UDP, length 1470

23:29:06.722558 IP 10.0.0.1.33303 > 10.0.0.2.5001: UDP, length 1470

23:29:06.768597 IP 10.0.0.1.33303 > 10.0.0.2.5001: UDP, length 1470

23:29:06.814291 IP 10.0.0.1.33303 > 10.0.0.2.5001: UDP, length 1470

23:29:06.861699 IP 10.0.0.1.33303 > 10.0.0.2.5001: UDP, length 1470

23:29:06.907896 IP 10.0.0.1.33303 > 10.0.0.2.5001: UDP, length 1470

23:29:06.951734 IP 10.0.0.1.33303 > 10.0.0.2.5001: UDP, length 1470

23:29:06.998087 IP 10.0.0.1.33303 > 10.0.0.2.5001: UDP, length 1470

23:29:07.044679 IP 10.0.0.1.33303 > 10.0.0.2.5001: UDP, length 1470

23:29:07.089502 IP 10.0.0.1.33303 > 10.0.0.2.5001: UDP, length 1470

23:29:07.135773 IP 10.0.0.1.33303 > 10.0.0.2.5001: UDP, length 1470

23:29:07.181562 IP 10.0.0.1.33303 > 10.0.0.2.5001: UDP, length 1470

23:29:07.227906 IP 10.0.0.1.33303 > 10.0.0.2.5001: UDP, length 1470

23:29:07.273772 IP 10.0.0.1.33303 > 10.0.0.2.5001: UDP, length 1470

23:29:07.320206 IP 10.0.0.1.33303 > 10.0.0.2.5001: UDP, length 1470

23:29:07.365607 IP 10.0.0.1.33303 > 10.0.0.2.5001: UDP, length 1470

23:29:07.411887 IP 10.0.0.1.33303 > 10.0.0.2.5001: UDP, length 1470

23:29:07.457710 IP 10.0.0.1.33303 > 10.0.0.2.5001: UDP, length 1470

23:29:07.503306 IP 10.0.0.1.33303 > 10.0.0.2.5001: UDP, length 1470

23:29:07.549739 IP 10.0.0.1.33303 > 10.0.0.2.5001: UDP, length 1470

23:29:07.595551 IP 10.0.0.1.33303 > 10.0.0.2.5001: UDP, length 1470

23:29:07.641122 IP 10.0.0.1.33303 > 10.0.0.2.5001: UDP, length 1470

23:29:07.687262 IP 10.0.0.1.33303 > 10.0.0.2.5001: UDP, length 1470

23:29:07.733005 IP 10.0.0.1.33303 > 10.0.0.2.5001: UDP, length 1470

23:29:07.778912 IP 10.0.0.1.33303 > 10.0.0.2.5001: UDP, length 1470

23:29:07.825105 IP 10.0.0.1.33303 > 10.0.0.2.5001: UDP, length 1470

23:29:07.870249 IP 10.0.0.1.33303 > 10.0.0.2.5001: UDP, length 1470

23:29:07.916811 IP 10.0.0.1.33303 > 10.0.0.2.5001: UDP, length 1470

23:29:07.962093 IP 10.0.0.1.33303 > 10.0.0.2.5001: UDP, length 1470

23:29:08.008316 IP 10.0.0.1.33303 > 10.0.0.2.5001: UDP, length 1470

23:29:08.054570 IP 10.0.0.1.33303 > 10.0.0.2.5001: UDP, length 1470

23:29:08.100269 IP 10.0.0.1.33303 > 10.0.0.2.5001: UDP, length 1470

23:29:08.146588 IP 10.0.0.1.33303 > 10.0.0.2.5001: UDP, length 1470

23:29:08.192246 IP 10.0.0.1.33303 > 10.0.0.2.5001: UDP, length 1470

23:29:08.238448 IP 10.0.0.1.33303 > 10.0.0.2.5001: UDP, length 1470

23:29:08.284312 IP 10.0.0.1.33303 > 10.0.0.2.5001: UDP, length 1470

23:29:08.330149 IP 10.0.0.1.33303 > 10.0.0.2.5001: UDP, length 1470

23:29:08.376331 IP 10.0.0.1.33303 > 10.0.0.2.5001: UDP, length 1470

23:29:08.422047 IP 10.0.0.1.33303 > 10.0.0.2.5001: UDP, length 1470

23:29:08.468016 IP 10.0.0.1.33303 > 10.0.0.2.5001: UDP, length 1470

23:29:08.513688 IP 10.0.0.1.33303 > 10.0.0.2.5001: UDP, length 1470

23:29:08.559989 IP 10.0.0.1.33303 > 10.0.0.2.5001: UDP, length 1470

23:29:08.605971 IP 10.0.0.1.33303 > 10.0.0.2.5001: UDP, length 1470

23:29:08.651825 IP 10.0.0.1.33303 > 10.0.0.2.5001: UDP, length 1470

23:29:08.697723 IP 10.0.0.1.33303 > 10.0.0.2.5001: UDP, length 1470

23:29:08.743791 IP 10.0.0.1.33303 > 10.0.0.2.5001: UDP, length 1470

23:29:08.789743 IP 10.0.0.1.33303 > 10.0.0.2.5001: UDP, length 1470

23:29:08.835689 IP 10.0.0.1.33303 > 10.0.0.2.5001: UDP, length 1470

23:29:08.881516 IP 10.0.0.1.33303 > 10.0.0.2.5001: UDP, length 1470

23:29:08.927068 IP 10.0.0.1.33303 > 10.0.0.2.5001: UDP, length 1470

23:29:08.973234 IP 10.0.0.1.33303 > 10.0.0.2.5001: UDP, length 1470

23:29:09.019591 IP 10.0.0.1.33303 > 10.0.0.2.5001: UDP, length 1470

23:29:09.065624 IP 10.0.0.1.33303 > 10.0.0.2.5001: UDP, length 1470

23:29:09.170689 IP 10.0.0.1.33303 > 10.0.0.2.5001: UDP, length 1470

23:29:09.203721 IP 10.0.0.1.33303 > 10.0.0.2.5001: UDP, length 1470

23:29:09.249487 IP 10.0.0.1.33303 > 10.0.0.2.5001: UDP, length 1470

23:29:09.296398 IP 10.0.0.1.33303 > 10.0.0.2.5001: UDP, length 1470

23:29:09.340604 IP 10.0.0.1.33303 > 10.0.0.2.5001: UDP, length 1470

23:29:09.432616 IP 10.0.0.1.33303 > 10.0.0.2.5001: UDP, length 1470

23:29:09.478574 IP 10.0.0.1.33303 > 10.0.0.2.5001: UDP, length 1470

23:29:09.524778 IP 10.0.0.1.33303 > 10.0.0.2.5001: UDP, length 1470

23:29:09.570647 IP 10.0.0.1.33303 > 10.0.0.2.5001: UDP, length 1470

23:29:09.616661 IP 10.0.0.1.33303 > 10.0.0.2.5001: UDP, length 1470

23:29:09.662321 IP 10.0.0.1.33303 > 10.0.0.2.5001: UDP, length 1470

23:29:09.708599 IP 10.0.0.1.33303 > 10.0.0.2.5001: UDP, length 1470

23:29:09.754760 IP 10.0.0.1.33303 > 10.0.0.2.5001: UDP, length 1470

23:29:09.800190 IP 10.0.0.1.33303 > 10.0.0.2.5001: UDP, length 1470

23:29:09.846496 IP 10.0.0.1.33303 > 10.0.0.2.5001: UDP, length 1470

23:29:09.891563 IP 10.0.0.1.33303 > 10.0.0.2.5001: UDP, length 1470

23:29:09.937726 IP 10.0.0.1.33303 > 10.0.0.2.5001: UDP, length 1470

23:29:09.984056 IP 10.0.0.1.33303 > 10.0.0.2.5001: UDP, length 1470

23:29:10.029686 IP 10.0.0.1.33303 > 10.0.0.2.5001: UDP, length 1470

23:29:10.076389 IP 10.0.0.1.33303 > 10.0.0.2.5001: UDP, length 1470

23:29:10.121499 IP 10.0.0.1.33303 > 10.0.0.2.5001: UDP, length 1470

23:29:10.166772 IP 10.0.0.1.33303 > 10.0.0.2.5001: UDP, length 1470

23:29:10.175856 IP 10.0.0.2.5001 > 10.0.0.1.33303: UDP, length 1470



cnt=
108
