23:25:10.745707 IP 10.0.0.1.56845 > 10.0.0.2.5001: UDP, length 1470

23:25:10.929944 IP 10.0.0.1.56845 > 10.0.0.2.5001: UDP, length 1470

23:25:11.114347 IP 10.0.0.1.56845 > 10.0.0.2.5001: UDP, length 1470

23:25:11.481573 IP 10.0.0.1.56845 > 10.0.0.2.5001: UDP, length 1470

23:25:11.665172 IP 10.0.0.1.56845 > 10.0.0.2.5001: UDP, length 1470

23:25:11.848754 IP 10.0.0.1.56845 > 10.0.0.2.5001: UDP, length 1470

23:25:12.033223 IP 10.0.0.1.56845 > 10.0.0.2.5001: UDP, length 1470

23:25:12.216715 IP 10.0.0.1.56845 > 10.0.0.2.5001: UDP, length 1470

23:25:12.400326 IP 10.0.0.1.56845 > 10.0.0.2.5001: UDP, length 1470

23:25:12.584026 IP 10.0.0.1.56845 > 10.0.0.2.5001: UDP, length 1470

23:25:12.767981 IP 10.0.0.1.56845 > 10.0.0.2.5001: UDP, length 1470

23:25:12.951496 IP 10.0.0.1.56845 > 10.0.0.2.5001: UDP, length 1470

23:25:13.134892 IP 10.0.0.1.56845 > 10.0.0.2.5001: UDP, length 1470

23:25:13.319293 IP 10.0.0.1.56845 > 10.0.0.2.5001: UDP, length 1470

23:25:13.503006 IP 10.0.0.1.56845 > 10.0.0.2.5001: UDP, length 1470

23:25:13.870389 IP 10.0.0.1.56845 > 10.0.0.2.5001: UDP, length 1470

23:25:14.054246 IP 10.0.0.1.56845 > 10.0.0.2.5001: UDP, length 1470

23:25:14.237913 IP 10.0.0.1.56845 > 10.0.0.2.5001: UDP, length 1470

23:25:14.422226 IP 10.0.0.1.56845 > 10.0.0.2.5001: UDP, length 1470

23:25:14.605475 IP 10.0.0.1.56845 > 10.0.0.2.5001: UDP, length 1470

23:25:14.788849 IP 10.0.0.1.56845 > 10.0.0.2.5001: UDP, length 1470

23:25:14.973250 IP 10.0.0.1.56845 > 10.0.0.2.5001: UDP, length 1470

23:25:15.156319 IP 10.0.0.1.56845 > 10.0.0.2.5001: UDP, length 1470

23:25:15.340144 IP 10.0.0.1.56845 > 10.0.0.2.5001: UDP, length 1470

23:25:15.524471 IP 10.0.0.1.56845 > 10.0.0.2.5001: UDP, length 1470

23:25:15.707945 IP 10.0.0.1.56845 > 10.0.0.2.5001: UDP, length 1470

23:25:15.891650 IP 10.0.0.1.56845 > 10.0.0.2.5001: UDP, length 1470

23:25:16.073908 IP 10.0.0.1.56845 > 10.0.0.2.5001: UDP, length 1470

23:25:16.086279 IP 10.0.0.2.5001 > 10.0.0.1.56845: UDP, length 1470



cnt=
30
