23:34:00.366408 IP 10.0.0.1.52832 > 10.0.0.2.5001: UDP, length 1470

23:34:00.379214 IP 10.0.0.1.52832 > 10.0.0.2.5001: UDP, length 1470

23:34:00.390296 IP 10.0.0.1.52832 > 10.0.0.2.5001: UDP, length 1470

23:34:00.401693 IP 10.0.0.1.52832 > 10.0.0.2.5001: UDP, length 1470

23:34:00.413217 IP 10.0.0.1.52832 > 10.0.0.2.5001: UDP, length 1470

23:34:00.424622 IP 10.0.0.1.52832 > 10.0.0.2.5001: UDP, length 1470

23:34:00.435513 IP 10.0.0.1.52832 > 10.0.0.2.5001: UDP, length 1470

23:34:00.447541 IP 10.0.0.1.52832 > 10.0.0.2.5001: UDP, length 1470

23:34:00.458839 IP 10.0.0.1.52832 > 10.0.0.2.5001: UDP, length 1470

23:34:00.469663 IP 10.0.0.1.52832 > 10.0.0.2.5001: UDP, length 1470

23:34:00.481149 IP 10.0.0.1.52832 > 10.0.0.2.5001: UDP, length 1470

23:34:00.492586 IP 10.0.0.1.52832 > 10.0.0.2.5001: UDP, length 1470

23:34:00.504283 IP 10.0.0.1.52832 > 10.0.0.2.5001: UDP, length 1470

23:34:00.515893 IP 10.0.0.1.52832 > 10.0.0.2.5001: UDP, length 1470

23:34:00.527374 IP 10.0.0.1.52832 > 10.0.0.2.5001: UDP, length 1470

23:34:00.538914 IP 10.0.0.1.52832 > 10.0.0.2.5001: UDP, length 1470

23:34:00.550211 IP 10.0.0.1.52832 > 10.0.0.2.5001: UDP, length 1470

23:34:00.561607 IP 10.0.0.1.52832 > 10.0.0.2.5001: UDP, length 1470

23:34:00.573079 IP 10.0.0.1.52832 > 10.0.0.2.5001: UDP, length 1470

23:34:00.584536 IP 10.0.0.1.52832 > 10.0.0.2.5001: UDP, length 1470

23:34:00.607750 IP 10.0.0.1.52832 > 10.0.0.2.5001: UDP, length 1470

23:34:00.619914 IP 10.0.0.1.52832 > 10.0.0.2.5001: UDP, length 1470

23:34:00.631876 IP 10.0.0.1.52832 > 10.0.0.2.5001: UDP, length 1470

23:34:00.643778 IP 10.0.0.1.52832 > 10.0.0.2.5001: UDP, length 1470

23:34:00.656047 IP 10.0.0.1.52832 > 10.0.0.2.5001: UDP, length 1470

23:34:00.667938 IP 10.0.0.1.52832 > 10.0.0.2.5001: UDP, length 1470

23:34:00.680932 IP 10.0.0.1.52832 > 10.0.0.2.5001: UDP, length 1470

23:34:00.692290 IP 10.0.0.1.52832 > 10.0.0.2.5001: UDP, length 1470

23:34:00.704403 IP 10.0.0.1.52832 > 10.0.0.2.5001: UDP, length 1470

23:34:00.716319 IP 10.0.0.1.52832 > 10.0.0.2.5001: UDP, length 1470

23:34:00.740941 IP 10.0.0.1.52832 > 10.0.0.2.5001: UDP, length 1470

23:34:00.753018 IP 10.0.0.1.52832 > 10.0.0.2.5001: UDP, length 1470

23:34:00.765015 IP 10.0.0.1.52832 > 10.0.0.2.5001: UDP, length 1470

23:34:00.776782 IP 10.0.0.1.52832 > 10.0.0.2.5001: UDP, length 1470

23:34:00.789209 IP 10.0.0.1.52832 > 10.0.0.2.5001: UDP, length 1470

23:34:00.801019 IP 10.0.0.1.52832 > 10.0.0.2.5001: UDP, length 1470

23:34:00.813498 IP 10.0.0.1.52832 > 10.0.0.2.5001: UDP, length 1470

23:34:00.838134 IP 10.0.0.1.52832 > 10.0.0.2.5001: UDP, length 1470

23:34:00.849493 IP 10.0.0.1.52832 > 10.0.0.2.5001: UDP, length 1470

23:34:00.861515 IP 10.0.0.1.52832 > 10.0.0.2.5001: UDP, length 1470

23:34:00.873686 IP 10.0.0.1.52832 > 10.0.0.2.5001: UDP, length 1470

23:34:00.885842 IP 10.0.0.1.52832 > 10.0.0.2.5001: UDP, length 1470

23:34:00.898078 IP 10.0.0.1.52832 > 10.0.0.2.5001: UDP, length 1470

23:34:00.909958 IP 10.0.0.1.52832 > 10.0.0.2.5001: UDP, length 1470

23:34:00.922546 IP 10.0.0.1.52832 > 10.0.0.2.5001: UDP, length 1470

23:34:00.934173 IP 10.0.0.1.52832 > 10.0.0.2.5001: UDP, length 1470

23:34:00.946175 IP 10.0.0.1.52832 > 10.0.0.2.5001: UDP, length 1470

23:34:00.958398 IP 10.0.0.1.52832 > 10.0.0.2.5001: UDP, length 1470

23:34:00.970220 IP 10.0.0.1.52832 > 10.0.0.2.5001: UDP, length 1470

23:34:00.982466 IP 10.0.0.1.52832 > 10.0.0.2.5001: UDP, length 1470

23:34:00.994419 IP 10.0.0.1.52832 > 10.0.0.2.5001: UDP, length 1470

23:34:01.006581 IP 10.0.0.1.52832 > 10.0.0.2.5001: UDP, length 1470

23:34:01.018854 IP 10.0.0.1.52832 > 10.0.0.2.5001: UDP, length 1470

23:34:01.031115 IP 10.0.0.1.52832 > 10.0.0.2.5001: UDP, length 1470

23:34:01.043138 IP 10.0.0.1.52832 > 10.0.0.2.5001: UDP, length 1470

23:34:01.055486 IP 10.0.0.1.52832 > 10.0.0.2.5001: UDP, length 1470

23:34:01.067247 IP 10.0.0.1.52832 > 10.0.0.2.5001: UDP, length 1470

23:34:01.079477 IP 10.0.0.1.52832 > 10.0.0.2.5001: UDP, length 1470

23:34:01.091748 IP 10.0.0.1.52832 > 10.0.0.2.5001: UDP, length 1470

23:34:01.103591 IP 10.0.0.1.52832 > 10.0.0.2.5001: UDP, length 1470

23:34:01.115800 IP 10.0.0.1.52832 > 10.0.0.2.5001: UDP, length 1470

23:34:01.127995 IP 10.0.0.1.52832 > 10.0.0.2.5001: UDP, length 1470

23:34:01.140470 IP 10.0.0.1.52832 > 10.0.0.2.5001: UDP, length 1470

23:34:01.152174 IP 10.0.0.1.52832 > 10.0.0.2.5001: UDP, length 1470

23:34:01.164315 IP 10.0.0.1.52832 > 10.0.0.2.5001: UDP, length 1470

23:34:01.176574 IP 10.0.0.1.52832 > 10.0.0.2.5001: UDP, length 1470

23:34:01.188219 IP 10.0.0.1.52832 > 10.0.0.2.5001: UDP, length 1470

23:34:01.200186 IP 10.0.0.1.52832 > 10.0.0.2.5001: UDP, length 1470

23:34:01.212444 IP 10.0.0.1.52832 > 10.0.0.2.5001: UDP, length 1470

23:34:01.224304 IP 10.0.0.1.52832 > 10.0.0.2.5001: UDP, length 1470

23:34:01.236335 IP 10.0.0.1.52832 > 10.0.0.2.5001: UDP, length 1470

23:34:01.248570 IP 10.0.0.1.52832 > 10.0.0.2.5001: UDP, length 1470

23:34:01.260689 IP 10.0.0.1.52832 > 10.0.0.2.5001: UDP, length 1470

23:34:01.272581 IP 10.0.0.1.52832 > 10.0.0.2.5001: UDP, length 1470

23:34:01.284889 IP 10.0.0.1.52832 > 10.0.0.2.5001: UDP, length 1470

23:34:01.297102 IP 10.0.0.1.52832 > 10.0.0.2.5001: UDP, length 1470

23:34:01.309036 IP 10.0.0.1.52832 > 10.0.0.2.5001: UDP, length 1470

23:34:01.320922 IP 10.0.0.1.52832 > 10.0.0.2.5001: UDP, length 1470

23:34:01.333273 IP 10.0.0.1.52832 > 10.0.0.2.5001: UDP, length 1470

23:34:01.345536 IP 10.0.0.1.52832 > 10.0.0.2.5001: UDP, length 1470

23:34:01.357519 IP 10.0.0.1.52832 > 10.0.0.2.5001: UDP, length 1470

23:34:01.369503 IP 10.0.0.1.52832 > 10.0.0.2.5001: UDP, length 1470

23:34:01.381708 IP 10.0.0.1.52832 > 10.0.0.2.5001: UDP, length 1470

23:34:01.393625 IP 10.0.0.1.52832 > 10.0.0.2.5001: UDP, length 1470

23:34:01.405869 IP 10.0.0.1.52832 > 10.0.0.2.5001: UDP, length 1470

23:34:01.418035 IP 10.0.0.1.52832 > 10.0.0.2.5001: UDP, length 1470

23:34:01.430186 IP 10.0.0.1.52832 > 10.0.0.2.5001: UDP, length 1470

23:34:01.442326 IP 10.0.0.1.52832 > 10.0.0.2.5001: UDP, length 1470

23:34:01.454354 IP 10.0.0.1.52832 > 10.0.0.2.5001: UDP, length 1470

23:34:01.466263 IP 10.0.0.1.52832 > 10.0.0.2.5001: UDP, length 1470

23:34:01.479063 IP 10.0.0.1.52832 > 10.0.0.2.5001: UDP, length 1470

23:34:01.490459 IP 10.0.0.1.52832 > 10.0.0.2.5001: UDP, length 1470

23:34:01.502362 IP 10.0.0.1.52832 > 10.0.0.2.5001: UDP, length 1470

23:34:01.514571 IP 10.0.0.1.52832 > 10.0.0.2.5001: UDP, length 1470

23:34:01.526690 IP 10.0.0.1.52832 > 10.0.0.2.5001: UDP, length 1470

23:34:01.538903 IP 10.0.0.1.52832 > 10.0.0.2.5001: UDP, length 1470

23:34:01.551066 IP 10.0.0.1.52832 > 10.0.0.2.5001: UDP, length 1470

23:34:01.563101 IP 10.0.0.1.52832 > 10.0.0.2.5001: UDP, length 1470

23:34:01.575104 IP 10.0.0.1.52832 > 10.0.0.2.5001: UDP, length 1470

23:34:01.587049 IP 10.0.0.1.52832 > 10.0.0.2.5001: UDP, length 1470

23:34:01.599663 IP 10.0.0.1.52832 > 10.0.0.2.5001: UDP, length 1470

23:34:01.611756 IP 10.0.0.1.52832 > 10.0.0.2.5001: UDP, length 1470

23:34:01.623742 IP 10.0.0.1.52832 > 10.0.0.2.5001: UDP, length 1470

23:34:01.636181 IP 10.0.0.1.52832 > 10.0.0.2.5001: UDP, length 1470

23:34:01.648114 IP 10.0.0.1.52832 > 10.0.0.2.5001: UDP, length 1470

23:34:01.660015 IP 10.0.0.1.52832 > 10.0.0.2.5001: UDP, length 1470

23:34:01.672330 IP 10.0.0.1.52832 > 10.0.0.2.5001: UDP, length 1470

23:34:01.684300 IP 10.0.0.1.52832 > 10.0.0.2.5001: UDP, length 1470

23:34:01.696702 IP 10.0.0.1.52832 > 10.0.0.2.5001: UDP, length 1470

23:34:01.708379 IP 10.0.0.1.52832 > 10.0.0.2.5001: UDP, length 1470

23:34:01.720494 IP 10.0.0.1.52832 > 10.0.0.2.5001: UDP, length 1470

23:34:01.732437 IP 10.0.0.1.52832 > 10.0.0.2.5001: UDP, length 1470

23:34:01.744380 IP 10.0.0.1.52832 > 10.0.0.2.5001: UDP, length 1470

23:34:01.768696 IP 10.0.0.1.52832 > 10.0.0.2.5001: UDP, length 1470

23:34:01.780940 IP 10.0.0.1.52832 > 10.0.0.2.5001: UDP, length 1470

23:34:01.793166 IP 10.0.0.1.52832 > 10.0.0.2.5001: UDP, length 1470

23:34:01.805357 IP 10.0.0.1.52832 > 10.0.0.2.5001: UDP, length 1470

23:34:01.817391 IP 10.0.0.1.52832 > 10.0.0.2.5001: UDP, length 1470

23:34:01.829556 IP 10.0.0.1.52832 > 10.0.0.2.5001: UDP, length 1470

23:34:01.841664 IP 10.0.0.1.52832 > 10.0.0.2.5001: UDP, length 1470

23:34:01.853620 IP 10.0.0.1.52832 > 10.0.0.2.5001: UDP, length 1470

23:34:01.865523 IP 10.0.0.1.52832 > 10.0.0.2.5001: UDP, length 1470

23:34:01.878098 IP 10.0.0.1.52832 > 10.0.0.2.5001: UDP, length 1470

23:34:01.890690 IP 10.0.0.1.52832 > 10.0.0.2.5001: UDP, length 1470

23:34:01.902344 IP 10.0.0.1.52832 > 10.0.0.2.5001: UDP, length 1470

23:34:01.914645 IP 10.0.0.1.52832 > 10.0.0.2.5001: UDP, length 1470

23:34:01.926528 IP 10.0.0.1.52832 > 10.0.0.2.5001: UDP, length 1470

23:34:01.938293 IP 10.0.0.1.52832 > 10.0.0.2.5001: UDP, length 1470

23:34:01.950302 IP 10.0.0.1.52832 > 10.0.0.2.5001: UDP, length 1470

23:34:01.961798 IP 10.0.0.1.52832 > 10.0.0.2.5001: UDP, length 1470

23:34:01.974234 IP 10.0.0.1.52832 > 10.0.0.2.5001: UDP, length 1470

23:34:01.986403 IP 10.0.0.1.52832 > 10.0.0.2.5001: UDP, length 1470

23:34:01.998293 IP 10.0.0.1.52832 > 10.0.0.2.5001: UDP, length 1470

23:34:02.010771 IP 10.0.0.1.52832 > 10.0.0.2.5001: UDP, length 1470

23:34:02.022969 IP 10.0.0.1.52832 > 10.0.0.2.5001: UDP, length 1470

23:34:02.034664 IP 10.0.0.1.52832 > 10.0.0.2.5001: UDP, length 1470

23:34:02.047178 IP 10.0.0.1.52832 > 10.0.0.2.5001: UDP, length 1470

23:34:02.060962 IP 10.0.0.1.52832 > 10.0.0.2.5001: UDP, length 1470

23:34:02.070644 IP 10.0.0.1.52832 > 10.0.0.2.5001: UDP, length 1470

23:34:02.083008 IP 10.0.0.1.52832 > 10.0.0.2.5001: UDP, length 1470

23:34:02.095237 IP 10.0.0.1.52832 > 10.0.0.2.5001: UDP, length 1470

23:34:02.107264 IP 10.0.0.1.52832 > 10.0.0.2.5001: UDP, length 1470

23:34:02.119235 IP 10.0.0.1.52832 > 10.0.0.2.5001: UDP, length 1470

23:34:02.131321 IP 10.0.0.1.52832 > 10.0.0.2.5001: UDP, length 1470

23:34:02.144082 IP 10.0.0.1.52832 > 10.0.0.2.5001: UDP, length 1470

23:34:02.155713 IP 10.0.0.1.52832 > 10.0.0.2.5001: UDP, length 1470

23:34:02.167768 IP 10.0.0.1.52832 > 10.0.0.2.5001: UDP, length 1470

23:34:02.179829 IP 10.0.0.1.52832 > 10.0.0.2.5001: UDP, length 1470

23:34:02.191841 IP 10.0.0.1.52832 > 10.0.0.2.5001: UDP, length 1470

23:34:02.203886 IP 10.0.0.1.52832 > 10.0.0.2.5001: UDP, length 1470

23:34:02.216037 IP 10.0.0.1.52832 > 10.0.0.2.5001: UDP, length 1470

23:34:02.228086 IP 10.0.0.1.52832 > 10.0.0.2.5001: UDP, length 1470

23:34:02.252200 IP 10.0.0.1.52832 > 10.0.0.2.5001: UDP, length 1470

23:34:02.264711 IP 10.0.0.1.52832 > 10.0.0.2.5001: UDP, length 1470

23:34:02.276709 IP 10.0.0.1.52832 > 10.0.0.2.5001: UDP, length 1470

23:34:02.288676 IP 10.0.0.1.52832 > 10.0.0.2.5001: UDP, length 1470

23:34:02.300909 IP 10.0.0.1.52832 > 10.0.0.2.5001: UDP, length 1470

23:34:02.312934 IP 10.0.0.1.52832 > 10.0.0.2.5001: UDP, length 1470

23:34:02.324912 IP 10.0.0.1.52832 > 10.0.0.2.5001: UDP, length 1470

23:34:02.337029 IP 10.0.0.1.52832 > 10.0.0.2.5001: UDP, length 1470

23:34:02.349183 IP 10.0.0.1.52832 > 10.0.0.2.5001: UDP, length 1470

23:34:02.361539 IP 10.0.0.1.52832 > 10.0.0.2.5001: UDP, length 1470

23:34:02.373256 IP 10.0.0.1.52832 > 10.0.0.2.5001: UDP, length 1470

23:34:02.385718 IP 10.0.0.1.52832 > 10.0.0.2.5001: UDP, length 1470

23:34:02.397489 IP 10.0.0.1.52832 > 10.0.0.2.5001: UDP, length 1470

23:34:02.409489 IP 10.0.0.1.52832 > 10.0.0.2.5001: UDP, length 1470

23:34:02.421592 IP 10.0.0.1.52832 > 10.0.0.2.5001: UDP, length 1470

23:34:02.434009 IP 10.0.0.1.52832 > 10.0.0.2.5001: UDP, length 1470

23:34:02.445889 IP 10.0.0.1.52832 > 10.0.0.2.5001: UDP, length 1470

23:34:02.458329 IP 10.0.0.1.52832 > 10.0.0.2.5001: UDP, length 1470

23:34:02.469906 IP 10.0.0.1.52832 > 10.0.0.2.5001: UDP, length 1470

23:34:02.482220 IP 10.0.0.1.52832 > 10.0.0.2.5001: UDP, length 1470

23:34:02.494134 IP 10.0.0.1.52832 > 10.0.0.2.5001: UDP, length 1470

23:34:02.506386 IP 10.0.0.1.52832 > 10.0.0.2.5001: UDP, length 1470

23:34:02.518413 IP 10.0.0.1.52832 > 10.0.0.2.5001: UDP, length 1470

23:34:02.530618 IP 10.0.0.1.52832 > 10.0.0.2.5001: UDP, length 1470

23:34:02.542501 IP 10.0.0.1.52832 > 10.0.0.2.5001: UDP, length 1470

23:34:02.554655 IP 10.0.0.1.52832 > 10.0.0.2.5001: UDP, length 1470

23:34:02.579456 IP 10.0.0.1.52832 > 10.0.0.2.5001: UDP, length 1470

23:34:02.591018 IP 10.0.0.1.52832 > 10.0.0.2.5001: UDP, length 1470

23:34:02.603145 IP 10.0.0.1.52832 > 10.0.0.2.5001: UDP, length 1470

23:34:02.615207 IP 10.0.0.1.52832 > 10.0.0.2.5001: UDP, length 1470

23:34:02.627470 IP 10.0.0.1.52832 > 10.0.0.2.5001: UDP, length 1470

23:34:02.639363 IP 10.0.0.1.52832 > 10.0.0.2.5001: UDP, length 1470

23:34:02.651480 IP 10.0.0.1.52832 > 10.0.0.2.5001: UDP, length 1470

23:34:02.663636 IP 10.0.0.1.52832 > 10.0.0.2.5001: UDP, length 1470

23:34:02.676174 IP 10.0.0.1.52832 > 10.0.0.2.5001: UDP, length 1470

23:34:02.688164 IP 10.0.0.1.52832 > 10.0.0.2.5001: UDP, length 1470

23:34:02.700376 IP 10.0.0.1.52832 > 10.0.0.2.5001: UDP, length 1470

23:34:02.712616 IP 10.0.0.1.52832 > 10.0.0.2.5001: UDP, length 1470

23:34:02.736740 IP 10.0.0.1.52832 > 10.0.0.2.5001: UDP, length 1470

23:34:02.748486 IP 10.0.0.1.52832 > 10.0.0.2.5001: UDP, length 1470

23:34:02.760965 IP 10.0.0.1.52832 > 10.0.0.2.5001: UDP, length 1470

23:34:02.772699 IP 10.0.0.1.52832 > 10.0.0.2.5001: UDP, length 1470

23:34:02.784877 IP 10.0.0.1.52832 > 10.0.0.2.5001: UDP, length 1470

23:34:02.797266 IP 10.0.0.1.52832 > 10.0.0.2.5001: UDP, length 1470

23:34:02.809072 IP 10.0.0.1.52832 > 10.0.0.2.5001: UDP, length 1470

23:34:02.821483 IP 10.0.0.1.52832 > 10.0.0.2.5001: UDP, length 1470

23:34:02.833472 IP 10.0.0.1.52832 > 10.0.0.2.5001: UDP, length 1470

23:34:02.845667 IP 10.0.0.1.52832 > 10.0.0.2.5001: UDP, length 1470

23:34:02.857596 IP 10.0.0.1.52832 > 10.0.0.2.5001: UDP, length 1470

23:34:02.869655 IP 10.0.0.1.52832 > 10.0.0.2.5001: UDP, length 1470

23:34:02.881530 IP 10.0.0.1.52832 > 10.0.0.2.5001: UDP, length 1470

23:34:02.893523 IP 10.0.0.1.52832 > 10.0.0.2.5001: UDP, length 1470

23:34:02.906015 IP 10.0.0.1.52832 > 10.0.0.2.5001: UDP, length 1470

23:34:02.918001 IP 10.0.0.1.52832 > 10.0.0.2.5001: UDP, length 1470

23:34:02.930100 IP 10.0.0.1.52832 > 10.0.0.2.5001: UDP, length 1470

23:34:02.941751 IP 10.0.0.1.52832 > 10.0.0.2.5001: UDP, length 1470

23:34:02.953773 IP 10.0.0.1.52832 > 10.0.0.2.5001: UDP, length 1470

23:34:02.965907 IP 10.0.0.1.52832 > 10.0.0.2.5001: UDP, length 1470

23:34:02.978000 IP 10.0.0.1.52832 > 10.0.0.2.5001: UDP, length 1470

23:34:02.990301 IP 10.0.0.1.52832 > 10.0.0.2.5001: UDP, length 1470

23:34:03.002266 IP 10.0.0.1.52832 > 10.0.0.2.5001: UDP, length 1470

23:34:03.014304 IP 10.0.0.1.52832 > 10.0.0.2.5001: UDP, length 1470

23:34:03.026461 IP 10.0.0.1.52832 > 10.0.0.2.5001: UDP, length 1470

23:34:03.038684 IP 10.0.0.1.52832 > 10.0.0.2.5001: UDP, length 1470

23:34:03.050772 IP 10.0.0.1.52832 > 10.0.0.2.5001: UDP, length 1470

23:34:03.063476 IP 10.0.0.1.52832 > 10.0.0.2.5001: UDP, length 1470

23:34:03.074595 IP 10.0.0.1.52832 > 10.0.0.2.5001: UDP, length 1470

23:34:03.086913 IP 10.0.0.1.52832 > 10.0.0.2.5001: UDP, length 1470

23:34:03.099665 IP 10.0.0.1.52832 > 10.0.0.2.5001: UDP, length 1470

23:34:03.111376 IP 10.0.0.1.52832 > 10.0.0.2.5001: UDP, length 1470

23:34:03.123412 IP 10.0.0.1.52832 > 10.0.0.2.5001: UDP, length 1470

23:34:03.135986 IP 10.0.0.1.52832 > 10.0.0.2.5001: UDP, length 1470

23:34:03.147611 IP 10.0.0.1.52832 > 10.0.0.2.5001: UDP, length 1470

23:34:03.159531 IP 10.0.0.1.52832 > 10.0.0.2.5001: UDP, length 1470

23:34:03.171574 IP 10.0.0.1.52832 > 10.0.0.2.5001: UDP, length 1470

23:34:03.184062 IP 10.0.0.1.52832 > 10.0.0.2.5001: UDP, length 1470

23:34:03.195940 IP 10.0.0.1.52832 > 10.0.0.2.5001: UDP, length 1470

23:34:03.207935 IP 10.0.0.1.52832 > 10.0.0.2.5001: UDP, length 1470

23:34:03.220346 IP 10.0.0.1.52832 > 10.0.0.2.5001: UDP, length 1470

23:34:03.232520 IP 10.0.0.1.52832 > 10.0.0.2.5001: UDP, length 1470

23:34:03.244489 IP 10.0.0.1.52832 > 10.0.0.2.5001: UDP, length 1470

23:34:03.256491 IP 10.0.0.1.52832 > 10.0.0.2.5001: UDP, length 1470

23:34:03.268367 IP 10.0.0.1.52832 > 10.0.0.2.5001: UDP, length 1470

23:34:03.280473 IP 10.0.0.1.52832 > 10.0.0.2.5001: UDP, length 1470

23:34:03.292683 IP 10.0.0.1.52832 > 10.0.0.2.5001: UDP, length 1470

23:34:03.305243 IP 10.0.0.1.52832 > 10.0.0.2.5001: UDP, length 1470

23:34:03.316988 IP 10.0.0.1.52832 > 10.0.0.2.5001: UDP, length 1470

23:34:03.328825 IP 10.0.0.1.52832 > 10.0.0.2.5001: UDP, length 1470

23:34:03.341083 IP 10.0.0.1.52832 > 10.0.0.2.5001: UDP, length 1470

23:34:03.353453 IP 10.0.0.1.52832 > 10.0.0.2.5001: UDP, length 1470

23:34:03.365484 IP 10.0.0.1.52832 > 10.0.0.2.5001: UDP, length 1470

23:34:03.377485 IP 10.0.0.1.52832 > 10.0.0.2.5001: UDP, length 1470

23:34:03.389519 IP 10.0.0.1.52832 > 10.0.0.2.5001: UDP, length 1470

23:34:03.401497 IP 10.0.0.1.52832 > 10.0.0.2.5001: UDP, length 1470

23:34:03.413529 IP 10.0.0.1.52832 > 10.0.0.2.5001: UDP, length 1470

23:34:03.426152 IP 10.0.0.1.52832 > 10.0.0.2.5001: UDP, length 1470

23:34:03.437937 IP 10.0.0.1.52832 > 10.0.0.2.5001: UDP, length 1470

23:34:03.449870 IP 10.0.0.1.52832 > 10.0.0.2.5001: UDP, length 1470

23:34:03.461988 IP 10.0.0.1.52832 > 10.0.0.2.5001: UDP, length 1470

23:34:03.473872 IP 10.0.0.1.52832 > 10.0.0.2.5001: UDP, length 1470

23:34:03.486369 IP 10.0.0.1.52832 > 10.0.0.2.5001: UDP, length 1470

23:34:03.498548 IP 10.0.0.1.52832 > 10.0.0.2.5001: UDP, length 1470

23:34:03.510702 IP 10.0.0.1.52832 > 10.0.0.2.5001: UDP, length 1470

23:34:03.522836 IP 10.0.0.1.52832 > 10.0.0.2.5001: UDP, length 1470

23:34:03.534727 IP 10.0.0.1.52832 > 10.0.0.2.5001: UDP, length 1470

23:34:03.546671 IP 10.0.0.1.52832 > 10.0.0.2.5001: UDP, length 1470

23:34:03.558962 IP 10.0.0.1.52832 > 10.0.0.2.5001: UDP, length 1470

23:34:03.570882 IP 10.0.0.1.52832 > 10.0.0.2.5001: UDP, length 1470

23:34:03.583098 IP 10.0.0.1.52832 > 10.0.0.2.5001: UDP, length 1470

23:34:03.595103 IP 10.0.0.1.52832 > 10.0.0.2.5001: UDP, length 1470

23:34:03.607243 IP 10.0.0.1.52832 > 10.0.0.2.5001: UDP, length 1470

23:34:03.619276 IP 10.0.0.1.52832 > 10.0.0.2.5001: UDP, length 1470

23:34:03.631394 IP 10.0.0.1.52832 > 10.0.0.2.5001: UDP, length 1470

23:34:03.643620 IP 10.0.0.1.52832 > 10.0.0.2.5001: UDP, length 1470

23:34:03.655694 IP 10.0.0.1.52832 > 10.0.0.2.5001: UDP, length 1470

23:34:03.667707 IP 10.0.0.1.52832 > 10.0.0.2.5001: UDP, length 1470

23:34:03.680895 IP 10.0.0.1.52832 > 10.0.0.2.5001: UDP, length 1470

23:34:03.691861 IP 10.0.0.1.52832 > 10.0.0.2.5001: UDP, length 1470

23:34:03.704277 IP 10.0.0.1.52832 > 10.0.0.2.5001: UDP, length 1470

23:34:03.716199 IP 10.0.0.1.52832 > 10.0.0.2.5001: UDP, length 1470

23:34:03.728150 IP 10.0.0.1.52832 > 10.0.0.2.5001: UDP, length 1470

23:34:03.740325 IP 10.0.0.1.52832 > 10.0.0.2.5001: UDP, length 1470

23:34:03.752213 IP 10.0.0.1.52832 > 10.0.0.2.5001: UDP, length 1470

23:34:03.764507 IP 10.0.0.1.52832 > 10.0.0.2.5001: UDP, length 1470

23:34:03.776288 IP 10.0.0.1.52832 > 10.0.0.2.5001: UDP, length 1470

23:34:03.788567 IP 10.0.0.1.52832 > 10.0.0.2.5001: UDP, length 1470

23:34:03.801049 IP 10.0.0.1.52832 > 10.0.0.2.5001: UDP, length 1470

23:34:03.812867 IP 10.0.0.1.52832 > 10.0.0.2.5001: UDP, length 1470

23:34:03.824876 IP 10.0.0.1.52832 > 10.0.0.2.5001: UDP, length 1470

23:34:03.837019 IP 10.0.0.1.52832 > 10.0.0.2.5001: UDP, length 1470

23:34:03.849182 IP 10.0.0.1.52832 > 10.0.0.2.5001: UDP, length 1470

23:34:03.861298 IP 10.0.0.1.52832 > 10.0.0.2.5001: UDP, length 1470

23:34:03.873100 IP 10.0.0.1.52832 > 10.0.0.2.5001: UDP, length 1470

23:34:03.885118 IP 10.0.0.1.52832 > 10.0.0.2.5001: UDP, length 1470

23:34:03.897165 IP 10.0.0.1.52832 > 10.0.0.2.5001: UDP, length 1470

23:34:03.909291 IP 10.0.0.1.52832 > 10.0.0.2.5001: UDP, length 1470

23:34:03.921427 IP 10.0.0.1.52832 > 10.0.0.2.5001: UDP, length 1470

23:34:03.933728 IP 10.0.0.1.52832 > 10.0.0.2.5001: UDP, length 1470

23:34:03.945766 IP 10.0.0.1.52832 > 10.0.0.2.5001: UDP, length 1470

23:34:03.957726 IP 10.0.0.1.52832 > 10.0.0.2.5001: UDP, length 1470

23:34:03.969689 IP 10.0.0.1.52832 > 10.0.0.2.5001: UDP, length 1470

23:34:03.982032 IP 10.0.0.1.52832 > 10.0.0.2.5001: UDP, length 1470

23:34:03.994048 IP 10.0.0.1.52832 > 10.0.0.2.5001: UDP, length 1470

23:34:04.006427 IP 10.0.0.1.52832 > 10.0.0.2.5001: UDP, length 1470

23:34:04.018119 IP 10.0.0.1.52832 > 10.0.0.2.5001: UDP, length 1470

23:34:04.030745 IP 10.0.0.1.52832 > 10.0.0.2.5001: UDP, length 1470

23:34:04.042881 IP 10.0.0.1.52832 > 10.0.0.2.5001: UDP, length 1470

23:34:04.055614 IP 10.0.0.1.52832 > 10.0.0.2.5001: UDP, length 1470

23:34:04.067336 IP 10.0.0.1.52832 > 10.0.0.2.5001: UDP, length 1470

23:34:04.078944 IP 10.0.0.1.52832 > 10.0.0.2.5001: UDP, length 1470

23:34:04.090850 IP 10.0.0.1.52832 > 10.0.0.2.5001: UDP, length 1470

23:34:04.103432 IP 10.0.0.1.52832 > 10.0.0.2.5001: UDP, length 1470

23:34:04.115514 IP 10.0.0.1.52832 > 10.0.0.2.5001: UDP, length 1470

23:34:04.127393 IP 10.0.0.1.52832 > 10.0.0.2.5001: UDP, length 1470

23:34:04.139549 IP 10.0.0.1.52832 > 10.0.0.2.5001: UDP, length 1470

23:34:04.151587 IP 10.0.0.1.52832 > 10.0.0.2.5001: UDP, length 1470

23:34:04.163605 IP 10.0.0.1.52832 > 10.0.0.2.5001: UDP, length 1470

23:34:04.176019 IP 10.0.0.1.52832 > 10.0.0.2.5001: UDP, length 1470

23:34:04.187848 IP 10.0.0.1.52832 > 10.0.0.2.5001: UDP, length 1470

23:34:04.199752 IP 10.0.0.1.52832 > 10.0.0.2.5001: UDP, length 1470

23:34:04.211961 IP 10.0.0.1.52832 > 10.0.0.2.5001: UDP, length 1470

23:34:04.223926 IP 10.0.0.1.52832 > 10.0.0.2.5001: UDP, length 1470

23:34:04.236097 IP 10.0.0.1.52832 > 10.0.0.2.5001: UDP, length 1470

23:34:04.248146 IP 10.0.0.1.52832 > 10.0.0.2.5001: UDP, length 1470

23:34:04.260260 IP 10.0.0.1.52832 > 10.0.0.2.5001: UDP, length 1470

23:34:04.272252 IP 10.0.0.1.52832 > 10.0.0.2.5001: UDP, length 1470

23:34:04.296961 IP 10.0.0.1.52832 > 10.0.0.2.5001: UDP, length 1470

23:34:04.309135 IP 10.0.0.1.52832 > 10.0.0.2.5001: UDP, length 1470

23:34:04.321218 IP 10.0.0.1.52832 > 10.0.0.2.5001: UDP, length 1470

23:34:04.333508 IP 10.0.0.1.52832 > 10.0.0.2.5001: UDP, length 1470

23:34:04.345393 IP 10.0.0.1.52832 > 10.0.0.2.5001: UDP, length 1470

23:34:04.357607 IP 10.0.0.1.52832 > 10.0.0.2.5001: UDP, length 1470

23:34:04.369594 IP 10.0.0.1.52832 > 10.0.0.2.5001: UDP, length 1470

23:34:04.381672 IP 10.0.0.1.52832 > 10.0.0.2.5001: UDP, length 1470

23:34:04.393862 IP 10.0.0.1.52832 > 10.0.0.2.5001: UDP, length 1470

23:34:04.405963 IP 10.0.0.1.52832 > 10.0.0.2.5001: UDP, length 1470

23:34:04.418134 IP 10.0.0.1.52832 > 10.0.0.2.5001: UDP, length 1470

23:34:04.430135 IP 10.0.0.1.52832 > 10.0.0.2.5001: UDP, length 1470

23:34:04.441766 IP 10.0.0.1.52832 > 10.0.0.2.5001: UDP, length 1470

23:34:04.453785 IP 10.0.0.1.52832 > 10.0.0.2.5001: UDP, length 1470

23:34:04.466298 IP 10.0.0.1.52832 > 10.0.0.2.5001: UDP, length 1470

23:34:04.478360 IP 10.0.0.1.52832 > 10.0.0.2.5001: UDP, length 1470

23:34:04.490580 IP 10.0.0.1.52832 > 10.0.0.2.5001: UDP, length 1470

23:34:04.502400 IP 10.0.0.1.52832 > 10.0.0.2.5001: UDP, length 1470

23:34:04.514381 IP 10.0.0.1.52832 > 10.0.0.2.5001: UDP, length 1470

23:34:04.526495 IP 10.0.0.1.52832 > 10.0.0.2.5001: UDP, length 1470

23:34:04.538721 IP 10.0.0.1.52832 > 10.0.0.2.5001: UDP, length 1470

23:34:04.550720 IP 10.0.0.1.52832 > 10.0.0.2.5001: UDP, length 1470

23:34:04.562899 IP 10.0.0.1.52832 > 10.0.0.2.5001: UDP, length 1470

23:34:04.574675 IP 10.0.0.1.52832 > 10.0.0.2.5001: UDP, length 1470

23:34:04.599035 IP 10.0.0.1.52832 > 10.0.0.2.5001: UDP, length 1470

23:34:04.611056 IP 10.0.0.1.52832 > 10.0.0.2.5001: UDP, length 1470

23:34:04.623053 IP 10.0.0.1.52832 > 10.0.0.2.5001: UDP, length 1470

23:34:04.635375 IP 10.0.0.1.52832 > 10.0.0.2.5001: UDP, length 1470

23:34:04.647350 IP 10.0.0.1.52832 > 10.0.0.2.5001: UDP, length 1470

23:34:04.659619 IP 10.0.0.1.52832 > 10.0.0.2.5001: UDP, length 1470

23:34:04.671325 IP 10.0.0.1.52832 > 10.0.0.2.5001: UDP, length 1470

23:34:04.683710 IP 10.0.0.1.52832 > 10.0.0.2.5001: UDP, length 1470

23:34:04.707880 IP 10.0.0.1.52832 > 10.0.0.2.5001: UDP, length 1470

23:34:04.719963 IP 10.0.0.1.52832 > 10.0.0.2.5001: UDP, length 1470

23:34:04.732095 IP 10.0.0.1.52832 > 10.0.0.2.5001: UDP, length 1470

23:34:04.744140 IP 10.0.0.1.52832 > 10.0.0.2.5001: UDP, length 1470

23:34:04.756193 IP 10.0.0.1.52832 > 10.0.0.2.5001: UDP, length 1470

23:34:04.768185 IP 10.0.0.1.52832 > 10.0.0.2.5001: UDP, length 1470

23:34:04.780374 IP 10.0.0.1.52832 > 10.0.0.2.5001: UDP, length 1470

23:34:04.792577 IP 10.0.0.1.52832 > 10.0.0.2.5001: UDP, length 1470

23:34:04.805115 IP 10.0.0.1.52832 > 10.0.0.2.5001: UDP, length 1470

23:34:04.816966 IP 10.0.0.1.52832 > 10.0.0.2.5001: UDP, length 1470

23:34:04.828958 IP 10.0.0.1.52832 > 10.0.0.2.5001: UDP, length 1470

23:34:04.840853 IP 10.0.0.1.52832 > 10.0.0.2.5001: UDP, length 1470

23:34:04.853091 IP 10.0.0.1.52832 > 10.0.0.2.5001: UDP, length 1470

23:34:04.865079 IP 10.0.0.1.52832 > 10.0.0.2.5001: UDP, length 1470

23:34:04.877457 IP 10.0.0.1.52832 > 10.0.0.2.5001: UDP, length 1470

23:34:04.889498 IP 10.0.0.1.52832 > 10.0.0.2.5001: UDP, length 1470

23:34:04.901313 IP 10.0.0.1.52832 > 10.0.0.2.5001: UDP, length 1470

23:34:04.913524 IP 10.0.0.1.52832 > 10.0.0.2.5001: UDP, length 1470

23:34:04.925599 IP 10.0.0.1.52832 > 10.0.0.2.5001: UDP, length 1470

23:34:04.937628 IP 10.0.0.1.52832 > 10.0.0.2.5001: UDP, length 1470

23:34:04.949584 IP 10.0.0.1.52832 > 10.0.0.2.5001: UDP, length 1470

23:34:04.961718 IP 10.0.0.1.52832 > 10.0.0.2.5001: UDP, length 1470

23:34:04.973686 IP 10.0.0.1.52832 > 10.0.0.2.5001: UDP, length 1470

23:34:04.986004 IP 10.0.0.1.52832 > 10.0.0.2.5001: UDP, length 1470

23:34:04.998004 IP 10.0.0.1.52832 > 10.0.0.2.5001: UDP, length 1470

23:34:05.010318 IP 10.0.0.1.52832 > 10.0.0.2.5001: UDP, length 1470

23:34:05.022426 IP 10.0.0.1.52832 > 10.0.0.2.5001: UDP, length 1470

23:34:05.034427 IP 10.0.0.1.52832 > 10.0.0.2.5001: UDP, length 1470

23:34:05.046499 IP 10.0.0.1.52832 > 10.0.0.2.5001: UDP, length 1470

23:34:05.058766 IP 10.0.0.1.52832 > 10.0.0.2.5001: UDP, length 1470

23:34:05.070837 IP 10.0.0.1.52832 > 10.0.0.2.5001: UDP, length 1470

23:34:05.082825 IP 10.0.0.1.52832 > 10.0.0.2.5001: UDP, length 1470

23:34:05.094920 IP 10.0.0.1.52832 > 10.0.0.2.5001: UDP, length 1470

23:34:05.107207 IP 10.0.0.1.52832 > 10.0.0.2.5001: UDP, length 1470

23:34:05.118960 IP 10.0.0.1.52832 > 10.0.0.2.5001: UDP, length 1470

23:34:05.143240 IP 10.0.0.1.52832 > 10.0.0.2.5001: UDP, length 1470

23:34:05.155314 IP 10.0.0.1.52832 > 10.0.0.2.5001: UDP, length 1470

23:34:05.167603 IP 10.0.0.1.52832 > 10.0.0.2.5001: UDP, length 1470

23:34:05.179416 IP 10.0.0.1.52832 > 10.0.0.2.5001: UDP, length 1470

23:34:05.191468 IP 10.0.0.1.52832 > 10.0.0.2.5001: UDP, length 1470

23:34:05.203628 IP 10.0.0.1.52832 > 10.0.0.2.5001: UDP, length 1470

23:34:05.215951 IP 10.0.0.1.52832 > 10.0.0.2.5001: UDP, length 1470

23:34:05.227693 IP 10.0.0.1.52832 > 10.0.0.2.5001: UDP, length 1470

23:34:05.239811 IP 10.0.0.1.52832 > 10.0.0.2.5001: UDP, length 1470

23:34:05.251998 IP 10.0.0.1.52832 > 10.0.0.2.5001: UDP, length 1470

23:34:05.264220 IP 10.0.0.1.52832 > 10.0.0.2.5001: UDP, length 1470

23:34:05.276130 IP 10.0.0.1.52832 > 10.0.0.2.5001: UDP, length 1470

23:34:05.288326 IP 10.0.0.1.52832 > 10.0.0.2.5001: UDP, length 1470

23:34:05.300581 IP 10.0.0.1.52832 > 10.0.0.2.5001: UDP, length 1470

23:34:05.312529 IP 10.0.0.1.52832 > 10.0.0.2.5001: UDP, length 1470

23:34:05.324451 IP 10.0.0.1.52832 > 10.0.0.2.5001: UDP, length 1470

23:34:05.336657 IP 10.0.0.1.52832 > 10.0.0.2.5001: UDP, length 1470

23:34:05.348830 IP 10.0.0.1.52832 > 10.0.0.2.5001: UDP, length 1470

23:34:05.360822 IP 10.0.0.1.52832 > 10.0.0.2.5001: UDP, length 1470

23:34:05.372815 IP 10.0.0.1.52832 > 10.0.0.2.5001: UDP, length 1470

23:34:05.385056 IP 10.0.0.1.52832 > 10.0.0.2.5001: UDP, length 1470

23:34:05.397211 IP 10.0.0.1.52832 > 10.0.0.2.5001: UDP, length 1470

23:34:05.409459 IP 10.0.0.1.52832 > 10.0.0.2.5001: UDP, length 1470

23:34:05.421469 IP 10.0.0.1.52832 > 10.0.0.2.5001: UDP, length 1470

23:34:05.434106 IP 10.0.0.1.52832 > 10.0.0.2.5001: UDP, length 1470

23:34:05.445497 IP 10.0.0.1.52832 > 10.0.0.2.5001: UDP, length 1470

23:34:05.457707 IP 10.0.0.1.52832 > 10.0.0.2.5001: UDP, length 1470

23:34:05.469969 IP 10.0.0.1.52832 > 10.0.0.2.5001: UDP, length 1470

23:34:05.482098 IP 10.0.0.1.52832 > 10.0.0.2.5001: UDP, length 1470

23:34:05.494368 IP 10.0.0.1.52832 > 10.0.0.2.5001: UDP, length 1470

23:34:05.506503 IP 10.0.0.1.52832 > 10.0.0.2.5001: UDP, length 1470

23:34:05.518296 IP 10.0.0.1.52832 > 10.0.0.2.5001: UDP, length 1470

23:34:05.530387 IP 10.0.0.1.52832 > 10.0.0.2.5001: UDP, length 1470

23:34:05.542660 IP 10.0.0.1.52832 > 10.0.0.2.5001: UDP, length 1470

23:34:05.555290 IP 10.0.0.1.52832 > 10.0.0.2.5001: UDP, length 1470

23:34:05.566722 IP 10.0.0.1.52832 > 10.0.0.2.5001: UDP, length 1470

23:34:05.578709 IP 10.0.0.1.52832 > 10.0.0.2.5001: UDP, length 1470

23:34:05.591575 IP 10.0.0.1.52832 > 10.0.0.2.5001: UDP, length 1470

23:34:05.606801 IP 10.0.0.2.5001 > 10.0.0.1.52832: UDP, length 1470



cnt=
425
