23:34:32.075437 IP 10.0.0.1.52228 > 10.0.0.2.5001: UDP, length 1470

23:34:32.080455 IP 10.0.0.1.52228 > 10.0.0.2.5001: UDP, length 1470

23:34:32.086977 IP 10.0.0.1.52228 > 10.0.0.2.5001: UDP, length 1470

23:34:32.099105 IP 10.0.0.1.52228 > 10.0.0.2.5001: UDP, length 1470

23:34:32.111187 IP 10.0.0.1.52228 > 10.0.0.2.5001: UDP, length 1470

23:34:32.123249 IP 10.0.0.1.52228 > 10.0.0.2.5001: UDP, length 1470

23:34:32.135356 IP 10.0.0.1.52228 > 10.0.0.2.5001: UDP, length 1470

23:34:32.147400 IP 10.0.0.1.52228 > 10.0.0.2.5001: UDP, length 1470

23:34:32.159699 IP 10.0.0.1.52228 > 10.0.0.2.5001: UDP, length 1470

23:34:32.171632 IP 10.0.0.1.52228 > 10.0.0.2.5001: UDP, length 1470

23:34:32.183743 IP 10.0.0.1.52228 > 10.0.0.2.5001: UDP, length 1470

23:34:32.195862 IP 10.0.0.1.52228 > 10.0.0.2.5001: UDP, length 1470

23:34:32.207882 IP 10.0.0.1.52228 > 10.0.0.2.5001: UDP, length 1470

23:34:32.220066 IP 10.0.0.1.52228 > 10.0.0.2.5001: UDP, length 1470

23:34:32.232160 IP 10.0.0.1.52228 > 10.0.0.2.5001: UDP, length 1470

23:34:32.244274 IP 10.0.0.1.52228 > 10.0.0.2.5001: UDP, length 1470

23:34:32.256262 IP 10.0.0.1.52228 > 10.0.0.2.5001: UDP, length 1470

23:34:32.268405 IP 10.0.0.1.52228 > 10.0.0.2.5001: UDP, length 1470

23:34:32.280527 IP 10.0.0.1.52228 > 10.0.0.2.5001: UDP, length 1470

23:34:32.292643 IP 10.0.0.1.52228 > 10.0.0.2.5001: UDP, length 1470

23:34:32.304738 IP 10.0.0.1.52228 > 10.0.0.2.5001: UDP, length 1470

23:34:32.316834 IP 10.0.0.1.52228 > 10.0.0.2.5001: UDP, length 1470

23:34:32.328939 IP 10.0.0.1.52228 > 10.0.0.2.5001: UDP, length 1470

23:34:32.341010 IP 10.0.0.1.52228 > 10.0.0.2.5001: UDP, length 1470

23:34:32.353128 IP 10.0.0.1.52228 > 10.0.0.2.5001: UDP, length 1470

23:34:32.365149 IP 10.0.0.1.52228 > 10.0.0.2.5001: UDP, length 1470

23:34:32.377263 IP 10.0.0.1.52228 > 10.0.0.2.5001: UDP, length 1470

23:34:32.389374 IP 10.0.0.1.52228 > 10.0.0.2.5001: UDP, length 1470

23:34:32.401483 IP 10.0.0.1.52228 > 10.0.0.2.5001: UDP, length 1470

23:34:32.413607 IP 10.0.0.1.52228 > 10.0.0.2.5001: UDP, length 1470

23:34:32.425713 IP 10.0.0.1.52228 > 10.0.0.2.5001: UDP, length 1470

23:34:32.437805 IP 10.0.0.1.52228 > 10.0.0.2.5001: UDP, length 1470

23:34:32.449895 IP 10.0.0.1.52228 > 10.0.0.2.5001: UDP, length 1470

23:34:32.461976 IP 10.0.0.1.52228 > 10.0.0.2.5001: UDP, length 1470

23:34:32.474006 IP 10.0.0.1.52228 > 10.0.0.2.5001: UDP, length 1470

23:34:32.486087 IP 10.0.0.1.52228 > 10.0.0.2.5001: UDP, length 1470

23:34:32.498231 IP 10.0.0.1.52228 > 10.0.0.2.5001: UDP, length 1470

23:34:32.510351 IP 10.0.0.1.52228 > 10.0.0.2.5001: UDP, length 1470

23:34:32.522444 IP 10.0.0.1.52228 > 10.0.0.2.5001: UDP, length 1470

23:34:32.534508 IP 10.0.0.1.52228 > 10.0.0.2.5001: UDP, length 1470

23:34:32.546605 IP 10.0.0.1.52228 > 10.0.0.2.5001: UDP, length 1470

23:34:32.558716 IP 10.0.0.1.52228 > 10.0.0.2.5001: UDP, length 1470

23:34:32.570751 IP 10.0.0.1.52228 > 10.0.0.2.5001: UDP, length 1470

23:34:32.582869 IP 10.0.0.1.52228 > 10.0.0.2.5001: UDP, length 1470

23:34:32.594906 IP 10.0.0.1.52228 > 10.0.0.2.5001: UDP, length 1470

23:34:32.607087 IP 10.0.0.1.52228 > 10.0.0.2.5001: UDP, length 1470

23:34:32.619205 IP 10.0.0.1.52228 > 10.0.0.2.5001: UDP, length 1470

23:34:32.631325 IP 10.0.0.1.52228 > 10.0.0.2.5001: UDP, length 1470

23:34:32.643435 IP 10.0.0.1.52228 > 10.0.0.2.5001: UDP, length 1470

23:34:32.655539 IP 10.0.0.1.52228 > 10.0.0.2.5001: UDP, length 1470

23:34:32.667576 IP 10.0.0.1.52228 > 10.0.0.2.5001: UDP, length 1470

23:34:32.679721 IP 10.0.0.1.52228 > 10.0.0.2.5001: UDP, length 1470

23:34:32.691825 IP 10.0.0.1.52228 > 10.0.0.2.5001: UDP, length 1470

23:34:32.703913 IP 10.0.0.1.52228 > 10.0.0.2.5001: UDP, length 1470

23:34:32.715891 IP 10.0.0.1.52228 > 10.0.0.2.5001: UDP, length 1470

23:34:32.727976 IP 10.0.0.1.52228 > 10.0.0.2.5001: UDP, length 1470

23:34:32.740185 IP 10.0.0.1.52228 > 10.0.0.2.5001: UDP, length 1470

23:34:32.752289 IP 10.0.0.1.52228 > 10.0.0.2.5001: UDP, length 1470

23:34:32.764315 IP 10.0.0.1.52228 > 10.0.0.2.5001: UDP, length 1470

23:34:32.776503 IP 10.0.0.1.52228 > 10.0.0.2.5001: UDP, length 1470

23:34:32.788580 IP 10.0.0.1.52228 > 10.0.0.2.5001: UDP, length 1470

23:34:32.800640 IP 10.0.0.1.52228 > 10.0.0.2.5001: UDP, length 1470

23:34:32.812778 IP 10.0.0.1.52228 > 10.0.0.2.5001: UDP, length 1470

23:34:32.824763 IP 10.0.0.1.52228 > 10.0.0.2.5001: UDP, length 1470

23:34:32.836916 IP 10.0.0.1.52228 > 10.0.0.2.5001: UDP, length 1470

23:34:32.849033 IP 10.0.0.1.52228 > 10.0.0.2.5001: UDP, length 1470

23:34:32.861060 IP 10.0.0.1.52228 > 10.0.0.2.5001: UDP, length 1470

23:34:32.873115 IP 10.0.0.1.52228 > 10.0.0.2.5001: UDP, length 1470

23:34:32.885358 IP 10.0.0.1.52228 > 10.0.0.2.5001: UDP, length 1470

23:34:32.897364 IP 10.0.0.1.52228 > 10.0.0.2.5001: UDP, length 1470

23:34:32.909456 IP 10.0.0.1.52228 > 10.0.0.2.5001: UDP, length 1470

23:34:32.921504 IP 10.0.0.1.52228 > 10.0.0.2.5001: UDP, length 1470

23:34:32.933559 IP 10.0.0.1.52228 > 10.0.0.2.5001: UDP, length 1470

23:34:32.945677 IP 10.0.0.1.52228 > 10.0.0.2.5001: UDP, length 1470

23:34:32.957803 IP 10.0.0.1.52228 > 10.0.0.2.5001: UDP, length 1470

23:34:32.969962 IP 10.0.0.1.52228 > 10.0.0.2.5001: UDP, length 1470

23:34:32.982108 IP 10.0.0.1.52228 > 10.0.0.2.5001: UDP, length 1470

23:34:32.994167 IP 10.0.0.1.52228 > 10.0.0.2.5001: UDP, length 1470

23:34:33.006295 IP 10.0.0.1.52228 > 10.0.0.2.5001: UDP, length 1470

23:34:33.018393 IP 10.0.0.1.52228 > 10.0.0.2.5001: UDP, length 1470

23:34:33.030495 IP 10.0.0.1.52228 > 10.0.0.2.5001: UDP, length 1470

23:34:33.042588 IP 10.0.0.1.52228 > 10.0.0.2.5001: UDP, length 1470

23:34:33.054587 IP 10.0.0.1.52228 > 10.0.0.2.5001: UDP, length 1470

23:34:33.066720 IP 10.0.0.1.52228 > 10.0.0.2.5001: UDP, length 1470

23:34:33.078858 IP 10.0.0.1.52228 > 10.0.0.2.5001: UDP, length 1470

23:34:33.090970 IP 10.0.0.1.52228 > 10.0.0.2.5001: UDP, length 1470

23:34:33.103077 IP 10.0.0.1.52228 > 10.0.0.2.5001: UDP, length 1470

23:34:33.115196 IP 10.0.0.1.52228 > 10.0.0.2.5001: UDP, length 1470

23:34:33.127229 IP 10.0.0.1.52228 > 10.0.0.2.5001: UDP, length 1470

23:34:33.139366 IP 10.0.0.1.52228 > 10.0.0.2.5001: UDP, length 1470

23:34:33.151456 IP 10.0.0.1.52228 > 10.0.0.2.5001: UDP, length 1470

23:34:33.163414 IP 10.0.0.1.52228 > 10.0.0.2.5001: UDP, length 1470

23:34:33.175631 IP 10.0.0.1.52228 > 10.0.0.2.5001: UDP, length 1470

23:34:33.187637 IP 10.0.0.1.52228 > 10.0.0.2.5001: UDP, length 1470

23:34:33.199878 IP 10.0.0.1.52228 > 10.0.0.2.5001: UDP, length 1470

23:34:33.211935 IP 10.0.0.1.52228 > 10.0.0.2.5001: UDP, length 1470

23:34:33.224050 IP 10.0.0.1.52228 > 10.0.0.2.5001: UDP, length 1470

23:34:33.236126 IP 10.0.0.1.52228 > 10.0.0.2.5001: UDP, length 1470

23:34:33.248224 IP 10.0.0.1.52228 > 10.0.0.2.5001: UDP, length 1470

23:34:33.260276 IP 10.0.0.1.52228 > 10.0.0.2.5001: UDP, length 1470

23:34:33.272325 IP 10.0.0.1.52228 > 10.0.0.2.5001: UDP, length 1470

23:34:33.284460 IP 10.0.0.1.52228 > 10.0.0.2.5001: UDP, length 1470

23:34:33.296564 IP 10.0.0.1.52228 > 10.0.0.2.5001: UDP, length 1470

23:34:33.308669 IP 10.0.0.1.52228 > 10.0.0.2.5001: UDP, length 1470

23:34:33.320689 IP 10.0.0.1.52228 > 10.0.0.2.5001: UDP, length 1470

23:34:33.332795 IP 10.0.0.1.52228 > 10.0.0.2.5001: UDP, length 1470

23:34:33.344999 IP 10.0.0.1.52228 > 10.0.0.2.5001: UDP, length 1470

23:34:33.357106 IP 10.0.0.1.52228 > 10.0.0.2.5001: UDP, length 1470

23:34:33.369193 IP 10.0.0.1.52228 > 10.0.0.2.5001: UDP, length 1470

23:34:33.381301 IP 10.0.0.1.52228 > 10.0.0.2.5001: UDP, length 1470

23:34:33.393290 IP 10.0.0.1.52228 > 10.0.0.2.5001: UDP, length 1470

23:34:33.405453 IP 10.0.0.1.52228 > 10.0.0.2.5001: UDP, length 1470

23:34:33.417550 IP 10.0.0.1.52228 > 10.0.0.2.5001: UDP, length 1470

23:34:33.429664 IP 10.0.0.1.52228 > 10.0.0.2.5001: UDP, length 1470

23:34:33.441773 IP 10.0.0.1.52228 > 10.0.0.2.5001: UDP, length 1470

23:34:33.453711 IP 10.0.0.1.52228 > 10.0.0.2.5001: UDP, length 1470

23:34:33.465954 IP 10.0.0.1.52228 > 10.0.0.2.5001: UDP, length 1470

23:34:33.478141 IP 10.0.0.1.52228 > 10.0.0.2.5001: UDP, length 1470

23:34:33.501446 IP 10.0.0.1.52228 > 10.0.0.2.5001: UDP, length 1470

23:34:33.513463 IP 10.0.0.1.52228 > 10.0.0.2.5001: UDP, length 1470

23:34:33.525445 IP 10.0.0.1.52228 > 10.0.0.2.5001: UDP, length 1470

23:34:33.537518 IP 10.0.0.1.52228 > 10.0.0.2.5001: UDP, length 1470

23:34:33.549463 IP 10.0.0.1.52228 > 10.0.0.2.5001: UDP, length 1470

23:34:33.561714 IP 10.0.0.1.52228 > 10.0.0.2.5001: UDP, length 1470

23:34:33.573749 IP 10.0.0.1.52228 > 10.0.0.2.5001: UDP, length 1470

23:34:33.585868 IP 10.0.0.1.52228 > 10.0.0.2.5001: UDP, length 1470

23:34:33.598001 IP 10.0.0.1.52228 > 10.0.0.2.5001: UDP, length 1470

23:34:33.609940 IP 10.0.0.1.52228 > 10.0.0.2.5001: UDP, length 1470

23:34:33.622217 IP 10.0.0.1.52228 > 10.0.0.2.5001: UDP, length 1470

23:34:33.634126 IP 10.0.0.1.52228 > 10.0.0.2.5001: UDP, length 1470

23:34:33.646492 IP 10.0.0.1.52228 > 10.0.0.2.5001: UDP, length 1470

23:34:33.658631 IP 10.0.0.1.52228 > 10.0.0.2.5001: UDP, length 1470

23:34:33.682577 IP 10.0.0.1.52228 > 10.0.0.2.5001: UDP, length 1470

23:34:33.694682 IP 10.0.0.1.52228 > 10.0.0.2.5001: UDP, length 1470

23:34:33.706717 IP 10.0.0.1.52228 > 10.0.0.2.5001: UDP, length 1470

23:34:33.718833 IP 10.0.0.1.52228 > 10.0.0.2.5001: UDP, length 1470

23:34:33.730938 IP 10.0.0.1.52228 > 10.0.0.2.5001: UDP, length 1470

23:34:33.743060 IP 10.0.0.1.52228 > 10.0.0.2.5001: UDP, length 1470

23:34:33.755012 IP 10.0.0.1.52228 > 10.0.0.2.5001: UDP, length 1470

23:34:33.767243 IP 10.0.0.1.52228 > 10.0.0.2.5001: UDP, length 1470

23:34:33.779175 IP 10.0.0.1.52228 > 10.0.0.2.5001: UDP, length 1470

23:34:33.791339 IP 10.0.0.1.52228 > 10.0.0.2.5001: UDP, length 1470

23:34:33.803338 IP 10.0.0.1.52228 > 10.0.0.2.5001: UDP, length 1470

23:34:33.827685 IP 10.0.0.1.52228 > 10.0.0.2.5001: UDP, length 1470

23:34:33.839812 IP 10.0.0.1.52228 > 10.0.0.2.5001: UDP, length 1470

23:34:33.851940 IP 10.0.0.1.52228 > 10.0.0.2.5001: UDP, length 1470

23:34:33.864042 IP 10.0.0.1.52228 > 10.0.0.2.5001: UDP, length 1470

23:34:33.876026 IP 10.0.0.1.52228 > 10.0.0.2.5001: UDP, length 1470

23:34:33.888172 IP 10.0.0.1.52228 > 10.0.0.2.5001: UDP, length 1470

23:34:33.900194 IP 10.0.0.1.52228 > 10.0.0.2.5001: UDP, length 1470

23:34:33.912358 IP 10.0.0.1.52228 > 10.0.0.2.5001: UDP, length 1470

23:34:33.924351 IP 10.0.0.1.52228 > 10.0.0.2.5001: UDP, length 1470

23:34:33.936472 IP 10.0.0.1.52228 > 10.0.0.2.5001: UDP, length 1470

23:34:33.948630 IP 10.0.0.1.52228 > 10.0.0.2.5001: UDP, length 1470

23:34:33.960740 IP 10.0.0.1.52228 > 10.0.0.2.5001: UDP, length 1470

23:34:33.972689 IP 10.0.0.1.52228 > 10.0.0.2.5001: UDP, length 1470

23:34:33.984845 IP 10.0.0.1.52228 > 10.0.0.2.5001: UDP, length 1470

23:34:33.997097 IP 10.0.0.1.52228 > 10.0.0.2.5001: UDP, length 1470

23:34:34.008980 IP 10.0.0.1.52228 > 10.0.0.2.5001: UDP, length 1470

23:34:34.021122 IP 10.0.0.1.52228 > 10.0.0.2.5001: UDP, length 1470

23:34:34.033270 IP 10.0.0.1.52228 > 10.0.0.2.5001: UDP, length 1470

23:34:34.045485 IP 10.0.0.1.52228 > 10.0.0.2.5001: UDP, length 1470

23:34:34.057527 IP 10.0.0.1.52228 > 10.0.0.2.5001: UDP, length 1470

23:34:34.069676 IP 10.0.0.1.52228 > 10.0.0.2.5001: UDP, length 1470

23:34:34.081592 IP 10.0.0.1.52228 > 10.0.0.2.5001: UDP, length 1470

23:34:34.093744 IP 10.0.0.1.52228 > 10.0.0.2.5001: UDP, length 1470

23:34:34.105975 IP 10.0.0.1.52228 > 10.0.0.2.5001: UDP, length 1470

23:34:34.117828 IP 10.0.0.1.52228 > 10.0.0.2.5001: UDP, length 1470

23:34:34.130029 IP 10.0.0.1.52228 > 10.0.0.2.5001: UDP, length 1470

23:34:34.142373 IP 10.0.0.1.52228 > 10.0.0.2.5001: UDP, length 1470

23:34:34.154276 IP 10.0.0.1.52228 > 10.0.0.2.5001: UDP, length 1470

23:34:34.166400 IP 10.0.0.1.52228 > 10.0.0.2.5001: UDP, length 1470

23:34:34.178503 IP 10.0.0.1.52228 > 10.0.0.2.5001: UDP, length 1470

23:34:34.190661 IP 10.0.0.1.52228 > 10.0.0.2.5001: UDP, length 1470

23:34:34.202669 IP 10.0.0.1.52228 > 10.0.0.2.5001: UDP, length 1470

23:34:34.214605 IP 10.0.0.1.52228 > 10.0.0.2.5001: UDP, length 1470

23:34:34.226686 IP 10.0.0.1.52228 > 10.0.0.2.5001: UDP, length 1470

23:34:34.238914 IP 10.0.0.1.52228 > 10.0.0.2.5001: UDP, length 1470

23:34:34.250996 IP 10.0.0.1.52228 > 10.0.0.2.5001: UDP, length 1470

23:34:34.263109 IP 10.0.0.1.52228 > 10.0.0.2.5001: UDP, length 1470

23:34:34.275133 IP 10.0.0.1.52228 > 10.0.0.2.5001: UDP, length 1470

23:34:34.299614 IP 10.0.0.1.52228 > 10.0.0.2.5001: UDP, length 1470

23:34:34.311733 IP 10.0.0.1.52228 > 10.0.0.2.5001: UDP, length 1470

23:34:34.323690 IP 10.0.0.1.52228 > 10.0.0.2.5001: UDP, length 1470

23:34:34.335813 IP 10.0.0.1.52228 > 10.0.0.2.5001: UDP, length 1470

23:34:34.347735 IP 10.0.0.1.52228 > 10.0.0.2.5001: UDP, length 1470

23:34:34.360039 IP 10.0.0.1.52228 > 10.0.0.2.5001: UDP, length 1470

23:34:34.372136 IP 10.0.0.1.52228 > 10.0.0.2.5001: UDP, length 1470

23:34:34.384142 IP 10.0.0.1.52228 > 10.0.0.2.5001: UDP, length 1470

23:34:34.396160 IP 10.0.0.1.52228 > 10.0.0.2.5001: UDP, length 1470

23:34:34.408491 IP 10.0.0.1.52228 > 10.0.0.2.5001: UDP, length 1470

23:34:34.420658 IP 10.0.0.1.52228 > 10.0.0.2.5001: UDP, length 1470

23:34:34.432508 IP 10.0.0.1.52228 > 10.0.0.2.5001: UDP, length 1470

23:34:34.444594 IP 10.0.0.1.52228 > 10.0.0.2.5001: UDP, length 1470

23:34:34.456490 IP 10.0.0.1.52228 > 10.0.0.2.5001: UDP, length 1470

23:34:34.468724 IP 10.0.0.1.52228 > 10.0.0.2.5001: UDP, length 1470

23:34:34.480808 IP 10.0.0.1.52228 > 10.0.0.2.5001: UDP, length 1470

23:34:34.492933 IP 10.0.0.1.52228 > 10.0.0.2.5001: UDP, length 1470

23:34:34.505036 IP 10.0.0.1.52228 > 10.0.0.2.5001: UDP, length 1470

23:34:34.517171 IP 10.0.0.1.52228 > 10.0.0.2.5001: UDP, length 1470

23:34:34.529289 IP 10.0.0.1.52228 > 10.0.0.2.5001: UDP, length 1470

23:34:34.541301 IP 10.0.0.1.52228 > 10.0.0.2.5001: UDP, length 1470

23:34:34.553512 IP 10.0.0.1.52228 > 10.0.0.2.5001: UDP, length 1470

23:34:34.565495 IP 10.0.0.1.52228 > 10.0.0.2.5001: UDP, length 1470

23:34:34.577561 IP 10.0.0.1.52228 > 10.0.0.2.5001: UDP, length 1470

23:34:34.589686 IP 10.0.0.1.52228 > 10.0.0.2.5001: UDP, length 1470

23:34:34.601801 IP 10.0.0.1.52228 > 10.0.0.2.5001: UDP, length 1470

23:34:34.613923 IP 10.0.0.1.52228 > 10.0.0.2.5001: UDP, length 1470

23:34:34.626026 IP 10.0.0.1.52228 > 10.0.0.2.5001: UDP, length 1470

23:34:34.638115 IP 10.0.0.1.52228 > 10.0.0.2.5001: UDP, length 1470

23:34:34.650256 IP 10.0.0.1.52228 > 10.0.0.2.5001: UDP, length 1470

23:34:34.662308 IP 10.0.0.1.52228 > 10.0.0.2.5001: UDP, length 1470

23:34:34.674329 IP 10.0.0.1.52228 > 10.0.0.2.5001: UDP, length 1470

23:34:34.686370 IP 10.0.0.1.52228 > 10.0.0.2.5001: UDP, length 1470

23:34:34.698410 IP 10.0.0.1.52228 > 10.0.0.2.5001: UDP, length 1470

23:34:34.710693 IP 10.0.0.1.52228 > 10.0.0.2.5001: UDP, length 1470

23:34:34.722700 IP 10.0.0.1.52228 > 10.0.0.2.5001: UDP, length 1470

23:34:34.734714 IP 10.0.0.1.52228 > 10.0.0.2.5001: UDP, length 1470

23:34:34.747004 IP 10.0.0.1.52228 > 10.0.0.2.5001: UDP, length 1470

23:34:34.758893 IP 10.0.0.1.52228 > 10.0.0.2.5001: UDP, length 1470

23:34:34.771042 IP 10.0.0.1.52228 > 10.0.0.2.5001: UDP, length 1470

23:34:34.783303 IP 10.0.0.1.52228 > 10.0.0.2.5001: UDP, length 1470

23:34:34.795254 IP 10.0.0.1.52228 > 10.0.0.2.5001: UDP, length 1470

23:34:34.807377 IP 10.0.0.1.52228 > 10.0.0.2.5001: UDP, length 1470

23:34:34.819460 IP 10.0.0.1.52228 > 10.0.0.2.5001: UDP, length 1470

23:34:34.831565 IP 10.0.0.1.52228 > 10.0.0.2.5001: UDP, length 1470

23:34:34.843790 IP 10.0.0.1.52228 > 10.0.0.2.5001: UDP, length 1470

23:34:34.855886 IP 10.0.0.1.52228 > 10.0.0.2.5001: UDP, length 1470

23:34:34.867990 IP 10.0.0.1.52228 > 10.0.0.2.5001: UDP, length 1470

23:34:34.880088 IP 10.0.0.1.52228 > 10.0.0.2.5001: UDP, length 1470

23:34:34.892145 IP 10.0.0.1.52228 > 10.0.0.2.5001: UDP, length 1470

23:34:34.904212 IP 10.0.0.1.52228 > 10.0.0.2.5001: UDP, length 1470

23:34:34.916130 IP 10.0.0.1.52228 > 10.0.0.2.5001: UDP, length 1470

23:34:34.928243 IP 10.0.0.1.52228 > 10.0.0.2.5001: UDP, length 1470

23:34:34.940399 IP 10.0.0.1.52228 > 10.0.0.2.5001: UDP, length 1470

23:34:34.952422 IP 10.0.0.1.52228 > 10.0.0.2.5001: UDP, length 1470

23:34:34.964553 IP 10.0.0.1.52228 > 10.0.0.2.5001: UDP, length 1470

23:34:34.976824 IP 10.0.0.1.52228 > 10.0.0.2.5001: UDP, length 1470

23:34:34.988958 IP 10.0.0.1.52228 > 10.0.0.2.5001: UDP, length 1470

23:34:35.000968 IP 10.0.0.1.52228 > 10.0.0.2.5001: UDP, length 1470

23:34:35.013159 IP 10.0.0.1.52228 > 10.0.0.2.5001: UDP, length 1470

23:34:35.037239 IP 10.0.0.1.52228 > 10.0.0.2.5001: UDP, length 1470

23:34:35.049365 IP 10.0.0.1.52228 > 10.0.0.2.5001: UDP, length 1470

23:34:35.062028 IP 10.0.0.1.52228 > 10.0.0.2.5001: UDP, length 1470

23:34:35.073515 IP 10.0.0.1.52228 > 10.0.0.2.5001: UDP, length 1470

23:34:35.085606 IP 10.0.0.1.52228 > 10.0.0.2.5001: UDP, length 1470

23:34:35.097701 IP 10.0.0.1.52228 > 10.0.0.2.5001: UDP, length 1470

23:34:35.109771 IP 10.0.0.1.52228 > 10.0.0.2.5001: UDP, length 1470

23:34:35.122039 IP 10.0.0.1.52228 > 10.0.0.2.5001: UDP, length 1470

23:34:35.133868 IP 10.0.0.1.52228 > 10.0.0.2.5001: UDP, length 1470

23:34:35.145945 IP 10.0.0.1.52228 > 10.0.0.2.5001: UDP, length 1470

23:34:35.158304 IP 10.0.0.1.52228 > 10.0.0.2.5001: UDP, length 1470

23:34:35.170330 IP 10.0.0.1.52228 > 10.0.0.2.5001: UDP, length 1470

23:34:35.182452 IP 10.0.0.1.52228 > 10.0.0.2.5001: UDP, length 1470

23:34:35.194634 IP 10.0.0.1.52228 > 10.0.0.2.5001: UDP, length 1470

23:34:35.206694 IP 10.0.0.1.52228 > 10.0.0.2.5001: UDP, length 1470

23:34:35.218747 IP 10.0.0.1.52228 > 10.0.0.2.5001: UDP, length 1470

23:34:35.230707 IP 10.0.0.1.52228 > 10.0.0.2.5001: UDP, length 1470

23:34:35.242895 IP 10.0.0.1.52228 > 10.0.0.2.5001: UDP, length 1470

23:34:35.254886 IP 10.0.0.1.52228 > 10.0.0.2.5001: UDP, length 1470

23:34:35.267077 IP 10.0.0.1.52228 > 10.0.0.2.5001: UDP, length 1470

23:34:35.279192 IP 10.0.0.1.52228 > 10.0.0.2.5001: UDP, length 1470

23:34:35.291193 IP 10.0.0.1.52228 > 10.0.0.2.5001: UDP, length 1470

23:34:35.303418 IP 10.0.0.1.52228 > 10.0.0.2.5001: UDP, length 1470

23:34:35.315519 IP 10.0.0.1.52228 > 10.0.0.2.5001: UDP, length 1470

23:34:35.327672 IP 10.0.0.1.52228 > 10.0.0.2.5001: UDP, length 1470

23:34:35.339691 IP 10.0.0.1.52228 > 10.0.0.2.5001: UDP, length 1470

23:34:35.351848 IP 10.0.0.1.52228 > 10.0.0.2.5001: UDP, length 1470

23:34:35.363729 IP 10.0.0.1.52228 > 10.0.0.2.5001: UDP, length 1470

23:34:35.375926 IP 10.0.0.1.52228 > 10.0.0.2.5001: UDP, length 1470

23:34:35.388044 IP 10.0.0.1.52228 > 10.0.0.2.5001: UDP, length 1470

23:34:35.400161 IP 10.0.0.1.52228 > 10.0.0.2.5001: UDP, length 1470

23:34:35.412266 IP 10.0.0.1.52228 > 10.0.0.2.5001: UDP, length 1470

23:34:35.424223 IP 10.0.0.1.52228 > 10.0.0.2.5001: UDP, length 1470

23:34:35.436433 IP 10.0.0.1.52228 > 10.0.0.2.5001: UDP, length 1470

23:34:35.448765 IP 10.0.0.1.52228 > 10.0.0.2.5001: UDP, length 1470

23:34:35.460628 IP 10.0.0.1.52228 > 10.0.0.2.5001: UDP, length 1470

23:34:35.472672 IP 10.0.0.1.52228 > 10.0.0.2.5001: UDP, length 1470

23:34:35.496914 IP 10.0.0.1.52228 > 10.0.0.2.5001: UDP, length 1470

23:34:35.508942 IP 10.0.0.1.52228 > 10.0.0.2.5001: UDP, length 1470

23:34:35.521049 IP 10.0.0.1.52228 > 10.0.0.2.5001: UDP, length 1470

23:34:35.533201 IP 10.0.0.1.52228 > 10.0.0.2.5001: UDP, length 1470

23:34:35.545384 IP 10.0.0.1.52228 > 10.0.0.2.5001: UDP, length 1470

23:34:35.557376 IP 10.0.0.1.52228 > 10.0.0.2.5001: UDP, length 1470

23:34:35.569444 IP 10.0.0.1.52228 > 10.0.0.2.5001: UDP, length 1470

23:34:35.581653 IP 10.0.0.1.52228 > 10.0.0.2.5001: UDP, length 1470

23:34:35.593546 IP 10.0.0.1.52228 > 10.0.0.2.5001: UDP, length 1470

23:34:35.605750 IP 10.0.0.1.52228 > 10.0.0.2.5001: UDP, length 1470

23:34:35.617753 IP 10.0.0.1.52228 > 10.0.0.2.5001: UDP, length 1470

23:34:35.629945 IP 10.0.0.1.52228 > 10.0.0.2.5001: UDP, length 1470

23:34:35.642106 IP 10.0.0.1.52228 > 10.0.0.2.5001: UDP, length 1470

23:34:35.654230 IP 10.0.0.1.52228 > 10.0.0.2.5001: UDP, length 1470

23:34:35.666420 IP 10.0.0.1.52228 > 10.0.0.2.5001: UDP, length 1470

23:34:35.678332 IP 10.0.0.1.52228 > 10.0.0.2.5001: UDP, length 1470

23:34:35.690692 IP 10.0.0.1.52228 > 10.0.0.2.5001: UDP, length 1470

23:34:35.702403 IP 10.0.0.1.52228 > 10.0.0.2.5001: UDP, length 1470

23:34:35.714620 IP 10.0.0.1.52228 > 10.0.0.2.5001: UDP, length 1470

23:34:35.726705 IP 10.0.0.1.52228 > 10.0.0.2.5001: UDP, length 1470

23:34:35.738825 IP 10.0.0.1.52228 > 10.0.0.2.5001: UDP, length 1470

23:34:35.750976 IP 10.0.0.1.52228 > 10.0.0.2.5001: UDP, length 1470

23:34:35.762944 IP 10.0.0.1.52228 > 10.0.0.2.5001: UDP, length 1470

23:34:35.775133 IP 10.0.0.1.52228 > 10.0.0.2.5001: UDP, length 1470

23:34:35.787297 IP 10.0.0.1.52228 > 10.0.0.2.5001: UDP, length 1470

23:34:35.799338 IP 10.0.0.1.52228 > 10.0.0.2.5001: UDP, length 1470

23:34:35.811434 IP 10.0.0.1.52228 > 10.0.0.2.5001: UDP, length 1470

23:34:35.823397 IP 10.0.0.1.52228 > 10.0.0.2.5001: UDP, length 1470

23:34:35.835568 IP 10.0.0.1.52228 > 10.0.0.2.5001: UDP, length 1470

23:34:35.847655 IP 10.0.0.1.52228 > 10.0.0.2.5001: UDP, length 1470

23:34:35.859847 IP 10.0.0.1.52228 > 10.0.0.2.5001: UDP, length 1470

23:34:35.872211 IP 10.0.0.1.52228 > 10.0.0.2.5001: UDP, length 1470

23:34:35.884135 IP 10.0.0.1.52228 > 10.0.0.2.5001: UDP, length 1470

23:34:35.895944 IP 10.0.0.1.52228 > 10.0.0.2.5001: UDP, length 1470

23:34:35.908136 IP 10.0.0.1.52228 > 10.0.0.2.5001: UDP, length 1470

23:34:35.920336 IP 10.0.0.1.52228 > 10.0.0.2.5001: UDP, length 1470

23:34:35.932449 IP 10.0.0.1.52228 > 10.0.0.2.5001: UDP, length 1470

23:34:35.944719 IP 10.0.0.1.52228 > 10.0.0.2.5001: UDP, length 1470

23:34:35.956491 IP 10.0.0.1.52228 > 10.0.0.2.5001: UDP, length 1470

23:34:35.968819 IP 10.0.0.1.52228 > 10.0.0.2.5001: UDP, length 1470

23:34:35.981000 IP 10.0.0.1.52228 > 10.0.0.2.5001: UDP, length 1470

23:34:35.993137 IP 10.0.0.1.52228 > 10.0.0.2.5001: UDP, length 1470

23:34:36.017278 IP 10.0.0.1.52228 > 10.0.0.2.5001: UDP, length 1470

23:34:36.029518 IP 10.0.0.1.52228 > 10.0.0.2.5001: UDP, length 1470

23:34:36.041481 IP 10.0.0.1.52228 > 10.0.0.2.5001: UDP, length 1470

23:34:36.053446 IP 10.0.0.1.52228 > 10.0.0.2.5001: UDP, length 1470

23:34:36.065595 IP 10.0.0.1.52228 > 10.0.0.2.5001: UDP, length 1470

23:34:36.077499 IP 10.0.0.1.52228 > 10.0.0.2.5001: UDP, length 1470

23:34:36.089634 IP 10.0.0.1.52228 > 10.0.0.2.5001: UDP, length 1470

23:34:36.101637 IP 10.0.0.1.52228 > 10.0.0.2.5001: UDP, length 1470

23:34:36.113808 IP 10.0.0.1.52228 > 10.0.0.2.5001: UDP, length 1470

23:34:36.125971 IP 10.0.0.1.52228 > 10.0.0.2.5001: UDP, length 1470

23:34:36.138034 IP 10.0.0.1.52228 > 10.0.0.2.5001: UDP, length 1470

23:34:36.150263 IP 10.0.0.1.52228 > 10.0.0.2.5001: UDP, length 1470

23:34:36.162041 IP 10.0.0.1.52228 > 10.0.0.2.5001: UDP, length 1470

23:34:36.174272 IP 10.0.0.1.52228 > 10.0.0.2.5001: UDP, length 1470

23:34:36.186388 IP 10.0.0.1.52228 > 10.0.0.2.5001: UDP, length 1470

23:34:36.198449 IP 10.0.0.1.52228 > 10.0.0.2.5001: UDP, length 1470

23:34:36.210607 IP 10.0.0.1.52228 > 10.0.0.2.5001: UDP, length 1470

23:34:36.222647 IP 10.0.0.1.52228 > 10.0.0.2.5001: UDP, length 1470

23:34:36.234673 IP 10.0.0.1.52228 > 10.0.0.2.5001: UDP, length 1470

23:34:36.246799 IP 10.0.0.1.52228 > 10.0.0.2.5001: UDP, length 1470

23:34:36.258949 IP 10.0.0.1.52228 > 10.0.0.2.5001: UDP, length 1470

23:34:36.270892 IP 10.0.0.1.52228 > 10.0.0.2.5001: UDP, length 1470

23:34:36.283040 IP 10.0.0.1.52228 > 10.0.0.2.5001: UDP, length 1470

23:34:36.295272 IP 10.0.0.1.52228 > 10.0.0.2.5001: UDP, length 1470

23:34:36.307347 IP 10.0.0.1.52228 > 10.0.0.2.5001: UDP, length 1470

23:34:36.319473 IP 10.0.0.1.52228 > 10.0.0.2.5001: UDP, length 1470

23:34:36.331593 IP 10.0.0.1.52228 > 10.0.0.2.5001: UDP, length 1470

23:34:36.343696 IP 10.0.0.1.52228 > 10.0.0.2.5001: UDP, length 1470

23:34:36.367650 IP 10.0.0.1.52228 > 10.0.0.2.5001: UDP, length 1470

23:34:36.379938 IP 10.0.0.1.52228 > 10.0.0.2.5001: UDP, length 1470

23:34:36.391914 IP 10.0.0.1.52228 > 10.0.0.2.5001: UDP, length 1470

23:34:36.404079 IP 10.0.0.1.52228 > 10.0.0.2.5001: UDP, length 1470

23:34:36.416164 IP 10.0.0.1.52228 > 10.0.0.2.5001: UDP, length 1470

23:34:36.428195 IP 10.0.0.1.52228 > 10.0.0.2.5001: UDP, length 1470

23:34:36.440369 IP 10.0.0.1.52228 > 10.0.0.2.5001: UDP, length 1470

23:34:36.452548 IP 10.0.0.1.52228 > 10.0.0.2.5001: UDP, length 1470

23:34:36.464662 IP 10.0.0.1.52228 > 10.0.0.2.5001: UDP, length 1470

23:34:36.476609 IP 10.0.0.1.52228 > 10.0.0.2.5001: UDP, length 1470

23:34:36.488883 IP 10.0.0.1.52228 > 10.0.0.2.5001: UDP, length 1470

23:34:36.500745 IP 10.0.0.1.52228 > 10.0.0.2.5001: UDP, length 1470

23:34:36.512931 IP 10.0.0.1.52228 > 10.0.0.2.5001: UDP, length 1470

23:34:36.525049 IP 10.0.0.1.52228 > 10.0.0.2.5001: UDP, length 1470

23:34:36.537167 IP 10.0.0.1.52228 > 10.0.0.2.5001: UDP, length 1470

23:34:36.549263 IP 10.0.0.1.52228 > 10.0.0.2.5001: UDP, length 1470

23:34:36.561266 IP 10.0.0.1.52228 > 10.0.0.2.5001: UDP, length 1470

23:34:36.573432 IP 10.0.0.1.52228 > 10.0.0.2.5001: UDP, length 1470

23:34:36.585469 IP 10.0.0.1.52228 > 10.0.0.2.5001: UDP, length 1470

23:34:36.597570 IP 10.0.0.1.52228 > 10.0.0.2.5001: UDP, length 1470

23:34:36.609584 IP 10.0.0.1.52228 > 10.0.0.2.5001: UDP, length 1470

23:34:36.621791 IP 10.0.0.1.52228 > 10.0.0.2.5001: UDP, length 1470

23:34:36.633817 IP 10.0.0.1.52228 > 10.0.0.2.5001: UDP, length 1470

23:34:36.645989 IP 10.0.0.1.52228 > 10.0.0.2.5001: UDP, length 1470

23:34:36.658121 IP 10.0.0.1.52228 > 10.0.0.2.5001: UDP, length 1470

23:34:36.670324 IP 10.0.0.1.52228 > 10.0.0.2.5001: UDP, length 1470

23:34:36.682560 IP 10.0.0.1.52228 > 10.0.0.2.5001: UDP, length 1470

23:34:36.694622 IP 10.0.0.1.52228 > 10.0.0.2.5001: UDP, length 1470

23:34:36.706351 IP 10.0.0.1.52228 > 10.0.0.2.5001: UDP, length 1470

23:34:36.718771 IP 10.0.0.1.52228 > 10.0.0.2.5001: UDP, length 1470

23:34:36.730696 IP 10.0.0.1.52228 > 10.0.0.2.5001: UDP, length 1470

23:34:36.742905 IP 10.0.0.1.52228 > 10.0.0.2.5001: UDP, length 1470

23:34:36.754922 IP 10.0.0.1.52228 > 10.0.0.2.5001: UDP, length 1470

23:34:36.767105 IP 10.0.0.1.52228 > 10.0.0.2.5001: UDP, length 1470

23:34:36.791169 IP 10.0.0.1.52228 > 10.0.0.2.5001: UDP, length 1470

23:34:36.803558 IP 10.0.0.1.52228 > 10.0.0.2.5001: UDP, length 1470

23:34:36.815549 IP 10.0.0.1.52228 > 10.0.0.2.5001: UDP, length 1470

23:34:36.827779 IP 10.0.0.1.52228 > 10.0.0.2.5001: UDP, length 1470

23:34:36.839545 IP 10.0.0.1.52228 > 10.0.0.2.5001: UDP, length 1470

23:34:36.851895 IP 10.0.0.1.52228 > 10.0.0.2.5001: UDP, length 1470

23:34:36.863954 IP 10.0.0.1.52228 > 10.0.0.2.5001: UDP, length 1470

23:34:36.875845 IP 10.0.0.1.52228 > 10.0.0.2.5001: UDP, length 1470

23:34:36.887983 IP 10.0.0.1.52228 > 10.0.0.2.5001: UDP, length 1470

23:34:36.900053 IP 10.0.0.1.52228 > 10.0.0.2.5001: UDP, length 1470

23:34:36.912132 IP 10.0.0.1.52228 > 10.0.0.2.5001: UDP, length 1470

23:34:36.924224 IP 10.0.0.1.52228 > 10.0.0.2.5001: UDP, length 1470

23:34:36.936369 IP 10.0.0.1.52228 > 10.0.0.2.5001: UDP, length 1470

23:34:36.948419 IP 10.0.0.1.52228 > 10.0.0.2.5001: UDP, length 1470

23:34:36.961443 IP 10.0.0.1.52228 > 10.0.0.2.5001: UDP, length 1470

23:34:36.972489 IP 10.0.0.1.52228 > 10.0.0.2.5001: UDP, length 1470

23:34:36.984658 IP 10.0.0.1.52228 > 10.0.0.2.5001: UDP, length 1470

23:34:36.996808 IP 10.0.0.1.52228 > 10.0.0.2.5001: UDP, length 1470

23:34:37.008806 IP 10.0.0.1.52228 > 10.0.0.2.5001: UDP, length 1470

23:34:37.033094 IP 10.0.0.1.52228 > 10.0.0.2.5001: UDP, length 1470

23:34:37.045068 IP 10.0.0.1.52228 > 10.0.0.2.5001: UDP, length 1470

23:34:37.057275 IP 10.0.0.1.52228 > 10.0.0.2.5001: UDP, length 1470

23:34:37.069283 IP 10.0.0.1.52228 > 10.0.0.2.5001: UDP, length 1470

23:34:37.081508 IP 10.0.0.1.52228 > 10.0.0.2.5001: UDP, length 1470

23:34:37.093629 IP 10.0.0.1.52228 > 10.0.0.2.5001: UDP, length 1470

23:34:37.105865 IP 10.0.0.1.52228 > 10.0.0.2.5001: UDP, length 1470

23:34:37.118133 IP 10.0.0.1.52228 > 10.0.0.2.5001: UDP, length 1470

23:34:37.129923 IP 10.0.0.1.52228 > 10.0.0.2.5001: UDP, length 1470

23:34:37.142097 IP 10.0.0.1.52228 > 10.0.0.2.5001: UDP, length 1470

23:34:37.154276 IP 10.0.0.1.52228 > 10.0.0.2.5001: UDP, length 1470

23:34:37.166363 IP 10.0.0.1.52228 > 10.0.0.2.5001: UDP, length 1470

23:34:37.178105 IP 10.0.0.1.52228 > 10.0.0.2.5001: UDP, length 1470

23:34:37.190360 IP 10.0.0.1.52228 > 10.0.0.2.5001: UDP, length 1470

23:34:37.202428 IP 10.0.0.1.52228 > 10.0.0.2.5001: UDP, length 1470

23:34:37.214699 IP 10.0.0.1.52228 > 10.0.0.2.5001: UDP, length 1470

23:34:37.226703 IP 10.0.0.1.52228 > 10.0.0.2.5001: UDP, length 1470

23:34:37.238772 IP 10.0.0.1.52228 > 10.0.0.2.5001: UDP, length 1470

23:34:37.250807 IP 10.0.0.1.52228 > 10.0.0.2.5001: UDP, length 1470

23:34:37.262954 IP 10.0.0.1.52228 > 10.0.0.2.5001: UDP, length 1470

23:34:37.274905 IP 10.0.0.1.52228 > 10.0.0.2.5001: UDP, length 1470

23:34:37.287181 IP 10.0.0.1.52228 > 10.0.0.2.5001: UDP, length 1470

23:34:37.299445 IP 10.0.0.1.52228 > 10.0.0.2.5001: UDP, length 1470

23:34:37.311318 IP 10.0.0.1.52228 > 10.0.0.2.5001: UDP, length 1470

23:34:37.323414 IP 10.0.0.1.52228 > 10.0.0.2.5001: UDP, length 1470

23:34:37.335491 IP 10.0.0.1.52228 > 10.0.0.2.5001: UDP, length 1470

23:34:37.347528 IP 10.0.0.1.52228 > 10.0.0.2.5001: UDP, length 1470

23:34:37.359797 IP 10.0.0.1.52228 > 10.0.0.2.5001: UDP, length 1470

23:34:37.372076 IP 10.0.0.1.52228 > 10.0.0.2.5001: UDP, length 1470

23:34:37.384056 IP 10.0.0.1.52228 > 10.0.0.2.5001: UDP, length 1470

23:34:37.395893 IP 10.0.0.1.52228 > 10.0.0.2.5001: UDP, length 1470

23:34:37.408128 IP 10.0.0.1.52228 > 10.0.0.2.5001: UDP, length 1470

23:34:37.420274 IP 10.0.0.1.52228 > 10.0.0.2.5001: UDP, length 1470

23:34:37.432441 IP 10.0.0.1.52228 > 10.0.0.2.5001: UDP, length 1470

23:34:37.444592 IP 10.0.0.1.52228 > 10.0.0.2.5001: UDP, length 1470

23:34:37.456790 IP 10.0.0.1.52228 > 10.0.0.2.5001: UDP, length 1470

23:34:37.468553 IP 10.0.0.1.52228 > 10.0.0.2.5001: UDP, length 1470

23:34:37.480682 IP 10.0.0.1.52228 > 10.0.0.2.5001: UDP, length 1470

23:34:37.504868 IP 10.0.0.1.52228 > 10.0.0.2.5001: UDP, length 1470

23:34:37.517193 IP 10.0.0.1.52228 > 10.0.0.2.5001: UDP, length 1470

23:34:37.529166 IP 10.0.0.1.52228 > 10.0.0.2.5001: UDP, length 1470

23:34:37.541116 IP 10.0.0.1.52228 > 10.0.0.2.5001: UDP, length 1470

23:34:37.553271 IP 10.0.0.1.52228 > 10.0.0.2.5001: UDP, length 1470

23:34:37.565529 IP 10.0.0.1.52228 > 10.0.0.2.5001: UDP, length 1470

23:34:37.577570 IP 10.0.0.1.52228 > 10.0.0.2.5001: UDP, length 1470

23:34:37.589675 IP 10.0.0.1.52228 > 10.0.0.2.5001: UDP, length 1470

23:34:37.601551 IP 10.0.0.1.52228 > 10.0.0.2.5001: UDP, length 1470

23:34:37.613745 IP 10.0.0.1.52228 > 10.0.0.2.5001: UDP, length 1470

23:34:37.625881 IP 10.0.0.1.52228 > 10.0.0.2.5001: UDP, length 1470

23:34:37.638036 IP 10.0.0.1.52228 > 10.0.0.2.5001: UDP, length 1470

23:34:37.650047 IP 10.0.0.1.52228 > 10.0.0.2.5001: UDP, length 1470

23:34:37.662049 IP 10.0.0.1.52228 > 10.0.0.2.5001: UDP, length 1470

23:34:37.674136 IP 10.0.0.1.52228 > 10.0.0.2.5001: UDP, length 1470

23:34:37.686336 IP 10.0.0.1.52228 > 10.0.0.2.5001: UDP, length 1470

23:34:37.698377 IP 10.0.0.1.52228 > 10.0.0.2.5001: UDP, length 1470

23:34:37.710451 IP 10.0.0.1.52228 > 10.0.0.2.5001: UDP, length 1470

23:34:37.722493 IP 10.0.0.1.52228 > 10.0.0.2.5001: UDP, length 1470

23:34:37.734640 IP 10.0.0.1.52228 > 10.0.0.2.5001: UDP, length 1470

23:34:37.746737 IP 10.0.0.1.52228 > 10.0.0.2.5001: UDP, length 1470

23:34:37.770942 IP 10.0.0.1.52228 > 10.0.0.2.5001: UDP, length 1470

23:34:37.783173 IP 10.0.0.1.52228 > 10.0.0.2.5001: UDP, length 1470

23:34:37.795262 IP 10.0.0.1.52228 > 10.0.0.2.5001: UDP, length 1470

23:34:37.807477 IP 10.0.0.1.52228 > 10.0.0.2.5001: UDP, length 1470

23:34:37.819310 IP 10.0.0.1.52228 > 10.0.0.2.5001: UDP, length 1470

23:34:37.831403 IP 10.0.0.1.52228 > 10.0.0.2.5001: UDP, length 1470

23:34:37.843639 IP 10.0.0.1.52228 > 10.0.0.2.5001: UDP, length 1470

23:34:37.855747 IP 10.0.0.1.52228 > 10.0.0.2.5001: UDP, length 1470

23:34:37.867950 IP 10.0.0.1.52228 > 10.0.0.2.5001: UDP, length 1470

23:34:37.880019 IP 10.0.0.1.52228 > 10.0.0.2.5001: UDP, length 1470

23:34:37.891881 IP 10.0.0.1.52228 > 10.0.0.2.5001: UDP, length 1470

23:34:37.904163 IP 10.0.0.1.52228 > 10.0.0.2.5001: UDP, length 1470

23:34:37.916147 IP 10.0.0.1.52228 > 10.0.0.2.5001: UDP, length 1470

23:34:37.928395 IP 10.0.0.1.52228 > 10.0.0.2.5001: UDP, length 1470

23:34:37.944062 IP 10.0.0.1.52228 > 10.0.0.2.5001: UDP, length 1470

23:34:37.952526 IP 10.0.0.1.52228 > 10.0.0.2.5001: UDP, length 1470

23:34:37.964652 IP 10.0.0.1.52228 > 10.0.0.2.5001: UDP, length 1470

23:34:37.976594 IP 10.0.0.1.52228 > 10.0.0.2.5001: UDP, length 1470

23:34:37.988757 IP 10.0.0.1.52228 > 10.0.0.2.5001: UDP, length 1470

23:34:38.000771 IP 10.0.0.1.52228 > 10.0.0.2.5001: UDP, length 1470

23:34:38.012959 IP 10.0.0.1.52228 > 10.0.0.2.5001: UDP, length 1470

23:34:38.025014 IP 10.0.0.1.52228 > 10.0.0.2.5001: UDP, length 1470

23:34:38.036980 IP 10.0.0.1.52228 > 10.0.0.2.5001: UDP, length 1470

23:34:38.049147 IP 10.0.0.1.52228 > 10.0.0.2.5001: UDP, length 1470

23:34:38.061308 IP 10.0.0.1.52228 > 10.0.0.2.5001: UDP, length 1470

23:34:38.073301 IP 10.0.0.1.52228 > 10.0.0.2.5001: UDP, length 1470

23:34:38.085481 IP 10.0.0.1.52228 > 10.0.0.2.5001: UDP, length 1470

23:34:38.097489 IP 10.0.0.1.52228 > 10.0.0.2.5001: UDP, length 1470

23:34:38.109570 IP 10.0.0.1.52228 > 10.0.0.2.5001: UDP, length 1470

23:34:38.121720 IP 10.0.0.1.52228 > 10.0.0.2.5001: UDP, length 1470

23:34:38.133784 IP 10.0.0.1.52228 > 10.0.0.2.5001: UDP, length 1470

23:34:38.145938 IP 10.0.0.1.52228 > 10.0.0.2.5001: UDP, length 1470

23:34:38.158179 IP 10.0.0.1.52228 > 10.0.0.2.5001: UDP, length 1470

23:34:38.170370 IP 10.0.0.1.52228 > 10.0.0.2.5001: UDP, length 1470

23:34:38.182209 IP 10.0.0.1.52228 > 10.0.0.2.5001: UDP, length 1470

23:34:38.194299 IP 10.0.0.1.52228 > 10.0.0.2.5001: UDP, length 1470

23:34:38.206438 IP 10.0.0.1.52228 > 10.0.0.2.5001: UDP, length 1470

23:34:38.218605 IP 10.0.0.1.52228 > 10.0.0.2.5001: UDP, length 1470

23:34:38.230790 IP 10.0.0.1.52228 > 10.0.0.2.5001: UDP, length 1470

23:34:38.242964 IP 10.0.0.1.52228 > 10.0.0.2.5001: UDP, length 1470

23:34:38.254781 IP 10.0.0.1.52228 > 10.0.0.2.5001: UDP, length 1470

23:34:38.266936 IP 10.0.0.1.52228 > 10.0.0.2.5001: UDP, length 1470

23:34:38.279239 IP 10.0.0.1.52228 > 10.0.0.2.5001: UDP, length 1470

23:34:38.291446 IP 10.0.0.1.52228 > 10.0.0.2.5001: UDP, length 1470

23:34:38.303502 IP 10.0.0.1.52228 > 10.0.0.2.5001: UDP, length 1470

23:34:38.315406 IP 10.0.0.1.52228 > 10.0.0.2.5001: UDP, length 1470

23:34:38.339711 IP 10.0.0.1.52228 > 10.0.0.2.5001: UDP, length 1470

23:34:38.351857 IP 10.0.0.1.52228 > 10.0.0.2.5001: UDP, length 1470

23:34:38.363982 IP 10.0.0.1.52228 > 10.0.0.2.5001: UDP, length 1470

23:34:38.375954 IP 10.0.0.1.52228 > 10.0.0.2.5001: UDP, length 1470

23:34:38.388092 IP 10.0.0.1.52228 > 10.0.0.2.5001: UDP, length 1470

23:34:38.400123 IP 10.0.0.1.52228 > 10.0.0.2.5001: UDP, length 1470

23:34:38.412258 IP 10.0.0.1.52228 > 10.0.0.2.5001: UDP, length 1470

23:34:38.424347 IP 10.0.0.1.52228 > 10.0.0.2.5001: UDP, length 1470

23:34:38.436445 IP 10.0.0.1.52228 > 10.0.0.2.5001: UDP, length 1470

23:34:38.448339 IP 10.0.0.1.52228 > 10.0.0.2.5001: UDP, length 1470

23:34:38.460379 IP 10.0.0.1.52228 > 10.0.0.2.5001: UDP, length 1470

23:34:38.472420 IP 10.0.0.1.52228 > 10.0.0.2.5001: UDP, length 1470

23:34:38.484744 IP 10.0.0.1.52228 > 10.0.0.2.5001: UDP, length 1470

23:34:38.496894 IP 10.0.0.1.52228 > 10.0.0.2.5001: UDP, length 1470

23:34:38.508854 IP 10.0.0.1.52228 > 10.0.0.2.5001: UDP, length 1470

23:34:38.521000 IP 10.0.0.1.52228 > 10.0.0.2.5001: UDP, length 1470

23:34:38.533311 IP 10.0.0.1.52228 > 10.0.0.2.5001: UDP, length 1470

23:34:38.545090 IP 10.0.0.1.52228 > 10.0.0.2.5001: UDP, length 1470

23:34:38.557258 IP 10.0.0.1.52228 > 10.0.0.2.5001: UDP, length 1470

23:34:38.569445 IP 10.0.0.1.52228 > 10.0.0.2.5001: UDP, length 1470

23:34:38.581560 IP 10.0.0.1.52228 > 10.0.0.2.5001: UDP, length 1470

23:34:38.593745 IP 10.0.0.1.52228 > 10.0.0.2.5001: UDP, length 1470

23:34:38.605867 IP 10.0.0.1.52228 > 10.0.0.2.5001: UDP, length 1470

23:34:38.617725 IP 10.0.0.1.52228 > 10.0.0.2.5001: UDP, length 1470

23:34:38.629826 IP 10.0.0.1.52228 > 10.0.0.2.5001: UDP, length 1470

23:34:38.641993 IP 10.0.0.1.52228 > 10.0.0.2.5001: UDP, length 1470

23:34:38.654192 IP 10.0.0.1.52228 > 10.0.0.2.5001: UDP, length 1470

23:34:38.666545 IP 10.0.0.1.52228 > 10.0.0.2.5001: UDP, length 1470

23:34:38.678240 IP 10.0.0.1.52228 > 10.0.0.2.5001: UDP, length 1470

23:34:38.690264 IP 10.0.0.1.52228 > 10.0.0.2.5001: UDP, length 1470

23:34:38.702545 IP 10.0.0.1.52228 > 10.0.0.2.5001: UDP, length 1470

23:34:38.714482 IP 10.0.0.1.52228 > 10.0.0.2.5001: UDP, length 1470

23:34:38.726562 IP 10.0.0.1.52228 > 10.0.0.2.5001: UDP, length 1470

23:34:38.738754 IP 10.0.0.1.52228 > 10.0.0.2.5001: UDP, length 1470

23:34:38.750671 IP 10.0.0.1.52228 > 10.0.0.2.5001: UDP, length 1470

23:34:38.762849 IP 10.0.0.1.52228 > 10.0.0.2.5001: UDP, length 1470

23:34:38.774952 IP 10.0.0.1.52228 > 10.0.0.2.5001: UDP, length 1470

23:34:38.787070 IP 10.0.0.1.52228 > 10.0.0.2.5001: UDP, length 1470

23:34:38.799133 IP 10.0.0.1.52228 > 10.0.0.2.5001: UDP, length 1470

23:34:38.811156 IP 10.0.0.1.52228 > 10.0.0.2.5001: UDP, length 1470

23:34:38.823264 IP 10.0.0.1.52228 > 10.0.0.2.5001: UDP, length 1470

23:34:38.835393 IP 10.0.0.1.52228 > 10.0.0.2.5001: UDP, length 1470

23:34:38.847433 IP 10.0.0.1.52228 > 10.0.0.2.5001: UDP, length 1470

23:34:38.859696 IP 10.0.0.1.52228 > 10.0.0.2.5001: UDP, length 1470

23:34:38.871924 IP 10.0.0.1.52228 > 10.0.0.2.5001: UDP, length 1470

23:34:38.884147 IP 10.0.0.1.52228 > 10.0.0.2.5001: UDP, length 1470

23:34:38.895813 IP 10.0.0.1.52228 > 10.0.0.2.5001: UDP, length 1470

23:34:38.908070 IP 10.0.0.1.52228 > 10.0.0.2.5001: UDP, length 1470

23:34:38.920178 IP 10.0.0.1.52228 > 10.0.0.2.5001: UDP, length 1470

23:34:38.932317 IP 10.0.0.1.52228 > 10.0.0.2.5001: UDP, length 1470

23:34:38.944536 IP 10.0.0.1.52228 > 10.0.0.2.5001: UDP, length 1470

23:34:38.956708 IP 10.0.0.1.52228 > 10.0.0.2.5001: UDP, length 1470

23:34:38.968446 IP 10.0.0.1.52228 > 10.0.0.2.5001: UDP, length 1470

23:34:38.980597 IP 10.0.0.1.52228 > 10.0.0.2.5001: UDP, length 1470

23:34:38.992758 IP 10.0.0.1.52228 > 10.0.0.2.5001: UDP, length 1470

23:34:39.004937 IP 10.0.0.1.52228 > 10.0.0.2.5001: UDP, length 1470

23:34:39.017085 IP 10.0.0.1.52228 > 10.0.0.2.5001: UDP, length 1470

23:34:39.029083 IP 10.0.0.1.52228 > 10.0.0.2.5001: UDP, length 1470

23:34:39.041034 IP 10.0.0.1.52228 > 10.0.0.2.5001: UDP, length 1470

23:34:39.053669 IP 10.0.0.1.52228 > 10.0.0.2.5001: UDP, length 1470

23:34:39.065517 IP 10.0.0.1.52228 > 10.0.0.2.5001: UDP, length 1470

23:34:39.089578 IP 10.0.0.1.52228 > 10.0.0.2.5001: UDP, length 1470

23:34:39.101506 IP 10.0.0.1.52228 > 10.0.0.2.5001: UDP, length 1470

23:34:39.113640 IP 10.0.0.1.52228 > 10.0.0.2.5001: UDP, length 1470

23:34:39.125762 IP 10.0.0.1.52228 > 10.0.0.2.5001: UDP, length 1470

23:34:39.137909 IP 10.0.0.1.52228 > 10.0.0.2.5001: UDP, length 1470

23:34:39.149955 IP 10.0.0.1.52228 > 10.0.0.2.5001: UDP, length 1470

23:34:39.161993 IP 10.0.0.1.52228 > 10.0.0.2.5001: UDP, length 1470

23:34:39.174081 IP 10.0.0.1.52228 > 10.0.0.2.5001: UDP, length 1470

23:34:39.186238 IP 10.0.0.1.52228 > 10.0.0.2.5001: UDP, length 1470

23:34:39.198347 IP 10.0.0.1.52228 > 10.0.0.2.5001: UDP, length 1470

23:34:39.210344 IP 10.0.0.1.52228 > 10.0.0.2.5001: UDP, length 1470

23:34:39.222372 IP 10.0.0.1.52228 > 10.0.0.2.5001: UDP, length 1470

23:34:39.234448 IP 10.0.0.1.52228 > 10.0.0.2.5001: UDP, length 1470

23:34:39.246627 IP 10.0.0.1.52228 > 10.0.0.2.5001: UDP, length 1470

23:34:39.258720 IP 10.0.0.1.52228 > 10.0.0.2.5001: UDP, length 1470

23:34:39.270896 IP 10.0.0.1.52228 > 10.0.0.2.5001: UDP, length 1470

23:34:39.283064 IP 10.0.0.1.52228 > 10.0.0.2.5001: UDP, length 1470

23:34:39.295307 IP 10.0.0.1.52228 > 10.0.0.2.5001: UDP, length 1470

23:34:39.307588 IP 10.0.0.1.52228 > 10.0.0.2.5001: UDP, length 1470

23:34:39.319211 IP 10.0.0.1.52228 > 10.0.0.2.5001: UDP, length 1470

23:34:39.331364 IP 10.0.0.1.52228 > 10.0.0.2.5001: UDP, length 1470

23:34:39.343519 IP 10.0.0.1.52228 > 10.0.0.2.5001: UDP, length 1470

23:34:39.355712 IP 10.0.0.1.52228 > 10.0.0.2.5001: UDP, length 1470

23:34:39.367875 IP 10.0.0.1.52228 > 10.0.0.2.5001: UDP, length 1470

23:34:39.379953 IP 10.0.0.1.52228 > 10.0.0.2.5001: UDP, length 1470

23:34:39.391925 IP 10.0.0.1.52228 > 10.0.0.2.5001: UDP, length 1470

23:34:39.414332 IP 10.0.0.1.52228 > 10.0.0.2.5001: UDP, length 1470

23:34:39.420170 IP 10.0.0.1.52228 > 10.0.0.2.5001: UDP, length 1470

23:34:39.430773 IP 10.0.0.1.52228 > 10.0.0.2.5001: UDP, length 1470

23:34:39.440259 IP 10.0.0.1.52228 > 10.0.0.2.5001: UDP, length 1470

23:34:39.452432 IP 10.0.0.1.52228 > 10.0.0.2.5001: UDP, length 1470

23:34:39.464506 IP 10.0.0.1.52228 > 10.0.0.2.5001: UDP, length 1470

23:34:39.476400 IP 10.0.0.1.52228 > 10.0.0.2.5001: UDP, length 1470

23:34:39.488730 IP 10.0.0.1.52228 > 10.0.0.2.5001: UDP, length 1470

23:34:39.500706 IP 10.0.0.1.52228 > 10.0.0.2.5001: UDP, length 1470

23:34:39.512874 IP 10.0.0.1.52228 > 10.0.0.2.5001: UDP, length 1470

23:34:39.524940 IP 10.0.0.1.52228 > 10.0.0.2.5001: UDP, length 1470

23:34:39.537023 IP 10.0.0.1.52228 > 10.0.0.2.5001: UDP, length 1470

23:34:39.549067 IP 10.0.0.1.52228 > 10.0.0.2.5001: UDP, length 1470

23:34:39.561163 IP 10.0.0.1.52228 > 10.0.0.2.5001: UDP, length 1470

23:34:39.573239 IP 10.0.0.1.52228 > 10.0.0.2.5001: UDP, length 1470

23:34:39.585383 IP 10.0.0.1.52228 > 10.0.0.2.5001: UDP, length 1470

23:34:39.597365 IP 10.0.0.1.52228 > 10.0.0.2.5001: UDP, length 1470

23:34:39.609523 IP 10.0.0.1.52228 > 10.0.0.2.5001: UDP, length 1470

23:34:39.621569 IP 10.0.0.1.52228 > 10.0.0.2.5001: UDP, length 1470

23:34:39.633667 IP 10.0.0.1.52228 > 10.0.0.2.5001: UDP, length 1470

23:34:39.645755 IP 10.0.0.1.52228 > 10.0.0.2.5001: UDP, length 1470

23:34:39.657989 IP 10.0.0.1.52228 > 10.0.0.2.5001: UDP, length 1470

23:34:39.670207 IP 10.0.0.1.52228 > 10.0.0.2.5001: UDP, length 1470

23:34:39.682284 IP 10.0.0.1.52228 > 10.0.0.2.5001: UDP, length 1470

23:34:39.694101 IP 10.0.0.1.52228 > 10.0.0.2.5001: UDP, length 1470

23:34:39.718454 IP 10.0.0.1.52228 > 10.0.0.2.5001: UDP, length 1470

23:34:39.730631 IP 10.0.0.1.52228 > 10.0.0.2.5001: UDP, length 1470

23:34:39.742788 IP 10.0.0.1.52228 > 10.0.0.2.5001: UDP, length 1470

23:34:39.754792 IP 10.0.0.1.52228 > 10.0.0.2.5001: UDP, length 1470

23:34:39.766699 IP 10.0.0.1.52228 > 10.0.0.2.5001: UDP, length 1470

23:34:39.778856 IP 10.0.0.1.52228 > 10.0.0.2.5001: UDP, length 1470

23:34:39.791105 IP 10.0.0.1.52228 > 10.0.0.2.5001: UDP, length 1470

23:34:39.815375 IP 10.0.0.1.52228 > 10.0.0.2.5001: UDP, length 1470

23:34:39.839347 IP 10.0.0.1.52228 > 10.0.0.2.5001: UDP, length 1470

23:34:39.851464 IP 10.0.0.1.52228 > 10.0.0.2.5001: UDP, length 1470

23:34:39.863622 IP 10.0.0.1.52228 > 10.0.0.2.5001: UDP, length 1470

23:34:39.875508 IP 10.0.0.1.52228 > 10.0.0.2.5001: UDP, length 1470

23:34:39.888093 IP 10.0.0.1.52228 > 10.0.0.2.5001: UDP, length 1470

23:34:39.899986 IP 10.0.0.1.52228 > 10.0.0.2.5001: UDP, length 1470

23:34:39.911866 IP 10.0.0.1.52228 > 10.0.0.2.5001: UDP, length 1470

23:34:39.923983 IP 10.0.0.1.52228 > 10.0.0.2.5001: UDP, length 1470

23:34:39.936083 IP 10.0.0.1.52228 > 10.0.0.2.5001: UDP, length 1470

23:34:39.948152 IP 10.0.0.1.52228 > 10.0.0.2.5001: UDP, length 1470

23:34:39.960268 IP 10.0.0.1.52228 > 10.0.0.2.5001: UDP, length 1470

23:34:39.972311 IP 10.0.0.1.52228 > 10.0.0.2.5001: UDP, length 1470

23:34:39.984476 IP 10.0.0.1.52228 > 10.0.0.2.5001: UDP, length 1470

23:34:39.996603 IP 10.0.0.1.52228 > 10.0.0.2.5001: UDP, length 1470

23:34:40.008804 IP 10.0.0.1.52228 > 10.0.0.2.5001: UDP, length 1470

23:34:40.020886 IP 10.0.0.1.52228 > 10.0.0.2.5001: UDP, length 1470

23:34:40.033041 IP 10.0.0.1.52228 > 10.0.0.2.5001: UDP, length 1470

23:34:40.044853 IP 10.0.0.1.52228 > 10.0.0.2.5001: UDP, length 1470

23:34:40.057144 IP 10.0.0.1.52228 > 10.0.0.2.5001: UDP, length 1470

23:34:40.069224 IP 10.0.0.1.52228 > 10.0.0.2.5001: UDP, length 1470

23:34:40.081378 IP 10.0.0.1.52228 > 10.0.0.2.5001: UDP, length 1470

23:34:40.093575 IP 10.0.0.1.52228 > 10.0.0.2.5001: UDP, length 1470

23:34:40.105524 IP 10.0.0.1.52228 > 10.0.0.2.5001: UDP, length 1470

23:34:40.117507 IP 10.0.0.1.52228 > 10.0.0.2.5001: UDP, length 1470

23:34:40.129633 IP 10.0.0.1.52228 > 10.0.0.2.5001: UDP, length 1470

23:34:40.141860 IP 10.0.0.1.52228 > 10.0.0.2.5001: UDP, length 1470

23:34:40.153982 IP 10.0.0.1.52228 > 10.0.0.2.5001: UDP, length 1470

23:34:40.166140 IP 10.0.0.1.52228 > 10.0.0.2.5001: UDP, length 1470

23:34:40.178145 IP 10.0.0.1.52228 > 10.0.0.2.5001: UDP, length 1470

23:34:40.190140 IP 10.0.0.1.52228 > 10.0.0.2.5001: UDP, length 1470

23:34:40.202279 IP 10.0.0.1.52228 > 10.0.0.2.5001: UDP, length 1470

23:34:40.214471 IP 10.0.0.1.52228 > 10.0.0.2.5001: UDP, length 1470

23:34:40.226486 IP 10.0.0.1.52228 > 10.0.0.2.5001: UDP, length 1470

23:34:40.238632 IP 10.0.0.1.52228 > 10.0.0.2.5001: UDP, length 1470

23:34:40.250499 IP 10.0.0.1.52228 > 10.0.0.2.5001: UDP, length 1470

23:34:40.262745 IP 10.0.0.1.52228 > 10.0.0.2.5001: UDP, length 1470

23:34:40.274768 IP 10.0.0.1.52228 > 10.0.0.2.5001: UDP, length 1470

23:34:40.287007 IP 10.0.0.1.52228 > 10.0.0.2.5001: UDP, length 1470

23:34:40.299006 IP 10.0.0.1.52228 > 10.0.0.2.5001: UDP, length 1470

23:34:40.310988 IP 10.0.0.1.52228 > 10.0.0.2.5001: UDP, length 1470

23:34:40.323157 IP 10.0.0.1.52228 > 10.0.0.2.5001: UDP, length 1470

23:34:40.335242 IP 10.0.0.1.52228 > 10.0.0.2.5001: UDP, length 1470

23:34:40.347302 IP 10.0.0.1.52228 > 10.0.0.2.5001: UDP, length 1470

23:34:40.359433 IP 10.0.0.1.52228 > 10.0.0.2.5001: UDP, length 1470

23:34:40.371795 IP 10.0.0.1.52228 > 10.0.0.2.5001: UDP, length 1470

23:34:40.384050 IP 10.0.0.1.52228 > 10.0.0.2.5001: UDP, length 1470

23:34:40.395708 IP 10.0.0.1.52228 > 10.0.0.2.5001: UDP, length 1470

23:34:40.407872 IP 10.0.0.1.52228 > 10.0.0.2.5001: UDP, length 1470

23:34:40.420076 IP 10.0.0.1.52228 > 10.0.0.2.5001: UDP, length 1470

23:34:40.432252 IP 10.0.0.1.52228 > 10.0.0.2.5001: UDP, length 1470

23:34:40.444360 IP 10.0.0.1.52228 > 10.0.0.2.5001: UDP, length 1470

23:34:40.456565 IP 10.0.0.1.52228 > 10.0.0.2.5001: UDP, length 1470

23:34:40.468372 IP 10.0.0.1.52228 > 10.0.0.2.5001: UDP, length 1470

23:34:40.480516 IP 10.0.0.1.52228 > 10.0.0.2.5001: UDP, length 1470

23:34:40.492704 IP 10.0.0.1.52228 > 10.0.0.2.5001: UDP, length 1470

23:34:40.504665 IP 10.0.0.1.52228 > 10.0.0.2.5001: UDP, length 1470

23:34:40.516960 IP 10.0.0.1.52228 > 10.0.0.2.5001: UDP, length 1470

23:34:40.528691 IP 10.0.0.1.52228 > 10.0.0.2.5001: UDP, length 1470

23:34:40.540947 IP 10.0.0.1.52228 > 10.0.0.2.5001: UDP, length 1470

23:34:40.553099 IP 10.0.0.1.52228 > 10.0.0.2.5001: UDP, length 1470

23:34:40.565283 IP 10.0.0.1.52228 > 10.0.0.2.5001: UDP, length 1470

23:34:40.577348 IP 10.0.0.1.52228 > 10.0.0.2.5001: UDP, length 1470

23:34:40.589335 IP 10.0.0.1.52228 > 10.0.0.2.5001: UDP, length 1470

23:34:40.601397 IP 10.0.0.1.52228 > 10.0.0.2.5001: UDP, length 1470

23:34:40.613557 IP 10.0.0.1.52228 > 10.0.0.2.5001: UDP, length 1470

23:34:40.625725 IP 10.0.0.1.52228 > 10.0.0.2.5001: UDP, length 1470

23:34:40.637827 IP 10.0.0.1.52228 > 10.0.0.2.5001: UDP, length 1470

23:34:40.649865 IP 10.0.0.1.52228 > 10.0.0.2.5001: UDP, length 1470

23:34:40.661922 IP 10.0.0.1.52228 > 10.0.0.2.5001: UDP, length 1470

23:34:40.673940 IP 10.0.0.1.52228 > 10.0.0.2.5001: UDP, length 1470

23:34:40.686310 IP 10.0.0.1.52228 > 10.0.0.2.5001: UDP, length 1470

23:34:40.698195 IP 10.0.0.1.52228 > 10.0.0.2.5001: UDP, length 1470

23:34:40.710291 IP 10.0.0.1.52228 > 10.0.0.2.5001: UDP, length 1470

23:34:40.722278 IP 10.0.0.1.52228 > 10.0.0.2.5001: UDP, length 1470

23:34:40.734398 IP 10.0.0.1.52228 > 10.0.0.2.5001: UDP, length 1470

23:34:40.746742 IP 10.0.0.1.52228 > 10.0.0.2.5001: UDP, length 1470

23:34:40.759062 IP 10.0.0.1.52228 > 10.0.0.2.5001: UDP, length 1470

23:34:40.770877 IP 10.0.0.1.52228 > 10.0.0.2.5001: UDP, length 1470

23:34:40.783153 IP 10.0.0.1.52228 > 10.0.0.2.5001: UDP, length 1470

23:34:40.795024 IP 10.0.0.1.52228 > 10.0.0.2.5001: UDP, length 1470

23:34:40.807543 IP 10.0.0.1.52228 > 10.0.0.2.5001: UDP, length 1470

23:34:40.819247 IP 10.0.0.1.52228 > 10.0.0.2.5001: UDP, length 1470

23:34:40.831432 IP 10.0.0.1.52228 > 10.0.0.2.5001: UDP, length 1470

23:34:40.843626 IP 10.0.0.1.52228 > 10.0.0.2.5001: UDP, length 1470

23:34:40.855744 IP 10.0.0.1.52228 > 10.0.0.2.5001: UDP, length 1470

23:34:40.867923 IP 10.0.0.1.52228 > 10.0.0.2.5001: UDP, length 1470

23:34:40.879843 IP 10.0.0.1.52228 > 10.0.0.2.5001: UDP, length 1470

23:34:40.891714 IP 10.0.0.1.52228 > 10.0.0.2.5001: UDP, length 1470

23:34:40.916034 IP 10.0.0.1.52228 > 10.0.0.2.5001: UDP, length 1470

23:34:40.928185 IP 10.0.0.1.52228 > 10.0.0.2.5001: UDP, length 1470

23:34:40.940263 IP 10.0.0.1.52228 > 10.0.0.2.5001: UDP, length 1470

23:34:40.952291 IP 10.0.0.1.52228 > 10.0.0.2.5001: UDP, length 1470

23:34:40.964313 IP 10.0.0.1.52228 > 10.0.0.2.5001: UDP, length 1470

23:34:40.976463 IP 10.0.0.1.52228 > 10.0.0.2.5001: UDP, length 1470

23:34:40.992345 IP 10.0.0.1.52228 > 10.0.0.2.5001: UDP, length 1470

23:34:41.000663 IP 10.0.0.1.52228 > 10.0.0.2.5001: UDP, length 1470

23:34:41.012761 IP 10.0.0.1.52228 > 10.0.0.2.5001: UDP, length 1470

23:34:41.024885 IP 10.0.0.1.52228 > 10.0.0.2.5001: UDP, length 1470

23:34:41.036903 IP 10.0.0.1.52228 > 10.0.0.2.5001: UDP, length 1470

23:34:41.048966 IP 10.0.0.1.52228 > 10.0.0.2.5001: UDP, length 1470

23:34:41.061092 IP 10.0.0.1.52228 > 10.0.0.2.5001: UDP, length 1470

23:34:41.073198 IP 10.0.0.1.52228 > 10.0.0.2.5001: UDP, length 1470

23:34:41.085317 IP 10.0.0.1.52228 > 10.0.0.2.5001: UDP, length 1470

23:34:41.097268 IP 10.0.0.1.52228 > 10.0.0.2.5001: UDP, length 1470

23:34:41.109487 IP 10.0.0.1.52228 > 10.0.0.2.5001: UDP, length 1470

23:34:41.121614 IP 10.0.0.1.52228 > 10.0.0.2.5001: UDP, length 1470

23:34:41.133834 IP 10.0.0.1.52228 > 10.0.0.2.5001: UDP, length 1470

23:34:41.145852 IP 10.0.0.1.52228 > 10.0.0.2.5001: UDP, length 1470

23:34:41.158087 IP 10.0.0.1.52228 > 10.0.0.2.5001: UDP, length 1470

23:34:41.169922 IP 10.0.0.1.52228 > 10.0.0.2.5001: UDP, length 1470

23:34:41.182075 IP 10.0.0.1.52228 > 10.0.0.2.5001: UDP, length 1470

23:34:41.194251 IP 10.0.0.1.52228 > 10.0.0.2.5001: UDP, length 1470

23:34:41.206369 IP 10.0.0.1.52228 > 10.0.0.2.5001: UDP, length 1470

23:34:41.218533 IP 10.0.0.1.52228 > 10.0.0.2.5001: UDP, length 1470

23:34:41.230674 IP 10.0.0.1.52228 > 10.0.0.2.5001: UDP, length 1470

23:34:41.242426 IP 10.0.0.1.52228 > 10.0.0.2.5001: UDP, length 1470

23:34:41.266798 IP 10.0.0.1.52228 > 10.0.0.2.5001: UDP, length 1470

23:34:41.278867 IP 10.0.0.1.52228 > 10.0.0.2.5001: UDP, length 1470

23:34:41.291163 IP 10.0.0.1.52228 > 10.0.0.2.5001: UDP, length 1470

23:34:41.302875 IP 10.0.0.1.52228 > 10.0.0.2.5001: UDP, length 1470

23:34:41.315096 IP 10.0.0.1.52228 > 10.0.0.2.5001: UDP, length 1470

23:34:41.327253 IP 10.0.0.1.52228 > 10.0.0.2.5001: UDP, length 1470

23:34:41.339366 IP 10.0.0.1.52228 > 10.0.0.2.5001: UDP, length 1470

23:34:41.351459 IP 10.0.0.1.52228 > 10.0.0.2.5001: UDP, length 1470

23:34:41.363479 IP 10.0.0.1.52228 > 10.0.0.2.5001: UDP, length 1470

23:34:41.375525 IP 10.0.0.1.52228 > 10.0.0.2.5001: UDP, length 1470

23:34:41.387711 IP 10.0.0.1.52228 > 10.0.0.2.5001: UDP, length 1470

23:34:41.411912 IP 10.0.0.1.52228 > 10.0.0.2.5001: UDP, length 1470

23:34:41.423962 IP 10.0.0.1.52228 > 10.0.0.2.5001: UDP, length 1470

23:34:41.436045 IP 10.0.0.1.52228 > 10.0.0.2.5001: UDP, length 1470

23:34:41.448164 IP 10.0.0.1.52228 > 10.0.0.2.5001: UDP, length 1470

23:34:41.460272 IP 10.0.0.1.52228 > 10.0.0.2.5001: UDP, length 1470

23:34:41.472196 IP 10.0.0.1.52228 > 10.0.0.2.5001: UDP, length 1470

23:34:41.484468 IP 10.0.0.1.52228 > 10.0.0.2.5001: UDP, length 1470

23:34:41.496980 IP 10.0.0.1.52228 > 10.0.0.2.5001: UDP, length 1470

23:34:41.508989 IP 10.0.0.1.52228 > 10.0.0.2.5001: UDP, length 1470

23:34:41.520793 IP 10.0.0.1.52228 > 10.0.0.2.5001: UDP, length 1470

23:34:41.532915 IP 10.0.0.1.52228 > 10.0.0.2.5001: UDP, length 1470

23:34:41.545175 IP 10.0.0.1.52228 > 10.0.0.2.5001: UDP, length 1470

23:34:41.557543 IP 10.0.0.1.52228 > 10.0.0.2.5001: UDP, length 1470

23:34:41.569535 IP 10.0.0.1.52228 > 10.0.0.2.5001: UDP, length 1470

23:34:41.581633 IP 10.0.0.1.52228 > 10.0.0.2.5001: UDP, length 1470

23:34:41.593502 IP 10.0.0.1.52228 > 10.0.0.2.5001: UDP, length 1470

23:34:41.605710 IP 10.0.0.1.52228 > 10.0.0.2.5001: UDP, length 1470

23:34:41.617755 IP 10.0.0.1.52228 > 10.0.0.2.5001: UDP, length 1470

23:34:41.629938 IP 10.0.0.1.52228 > 10.0.0.2.5001: UDP, length 1470

23:34:41.642105 IP 10.0.0.1.52228 > 10.0.0.2.5001: UDP, length 1470

23:34:41.654074 IP 10.0.0.1.52228 > 10.0.0.2.5001: UDP, length 1470

23:34:41.665947 IP 10.0.0.1.52228 > 10.0.0.2.5001: UDP, length 1470

23:34:41.677989 IP 10.0.0.1.52228 > 10.0.0.2.5001: UDP, length 1470

23:34:41.690212 IP 10.0.0.1.52228 > 10.0.0.2.5001: UDP, length 1470

23:34:41.702379 IP 10.0.0.1.52228 > 10.0.0.2.5001: UDP, length 1470

23:34:41.714226 IP 10.0.0.1.52228 > 10.0.0.2.5001: UDP, length 1470

23:34:41.726338 IP 10.0.0.1.52228 > 10.0.0.2.5001: UDP, length 1470

23:34:41.738392 IP 10.0.0.1.52228 > 10.0.0.2.5001: UDP, length 1470

23:34:41.750602 IP 10.0.0.1.52228 > 10.0.0.2.5001: UDP, length 1470

23:34:41.762829 IP 10.0.0.1.52228 > 10.0.0.2.5001: UDP, length 1470

23:34:41.774769 IP 10.0.0.1.52228 > 10.0.0.2.5001: UDP, length 1470

23:34:41.786862 IP 10.0.0.1.52228 > 10.0.0.2.5001: UDP, length 1470

23:34:41.798913 IP 10.0.0.1.52228 > 10.0.0.2.5001: UDP, length 1470

23:34:41.811020 IP 10.0.0.1.52228 > 10.0.0.2.5001: UDP, length 1470

23:34:41.823101 IP 10.0.0.1.52228 > 10.0.0.2.5001: UDP, length 1470

23:34:41.835141 IP 10.0.0.1.52228 > 10.0.0.2.5001: UDP, length 1470

23:34:41.847278 IP 10.0.0.1.52228 > 10.0.0.2.5001: UDP, length 1470

23:34:41.859528 IP 10.0.0.1.52228 > 10.0.0.2.5001: UDP, length 1470

23:34:41.871748 IP 10.0.0.1.52228 > 10.0.0.2.5001: UDP, length 1470

23:34:41.883741 IP 10.0.0.1.52228 > 10.0.0.2.5001: UDP, length 1470

23:34:41.895730 IP 10.0.0.1.52228 > 10.0.0.2.5001: UDP, length 1470

23:34:41.907699 IP 10.0.0.1.52228 > 10.0.0.2.5001: UDP, length 1470

23:34:41.919953 IP 10.0.0.1.52228 > 10.0.0.2.5001: UDP, length 1470

23:34:41.932164 IP 10.0.0.1.52228 > 10.0.0.2.5001: UDP, length 1470

23:34:41.944114 IP 10.0.0.1.52228 > 10.0.0.2.5001: UDP, length 1470

23:34:41.956431 IP 10.0.0.1.52228 > 10.0.0.2.5001: UDP, length 1470

23:34:41.968228 IP 10.0.0.1.52228 > 10.0.0.2.5001: UDP, length 1470

23:34:41.980395 IP 10.0.0.1.52228 > 10.0.0.2.5001: UDP, length 1470

23:34:41.992553 IP 10.0.0.1.52228 > 10.0.0.2.5001: UDP, length 1470

23:34:42.004491 IP 10.0.0.1.52228 > 10.0.0.2.5001: UDP, length 1470

23:34:42.016842 IP 10.0.0.1.52228 > 10.0.0.2.5001: UDP, length 1470

23:34:42.040857 IP 10.0.0.1.52228 > 10.0.0.2.5001: UDP, length 1470

23:34:42.053010 IP 10.0.0.1.52228 > 10.0.0.2.5001: UDP, length 1470

23:34:42.065296 IP 10.0.0.1.52228 > 10.0.0.2.5001: UDP, length 1470

23:34:42.077178 IP 10.0.0.1.52228 > 10.0.0.2.5001: UDP, length 1470

23:34:42.089387 IP 10.0.0.1.52228 > 10.0.0.2.5001: UDP, length 1470

23:34:42.101252 IP 10.0.0.1.52228 > 10.0.0.2.5001: UDP, length 1470

23:34:42.113498 IP 10.0.0.1.52228 > 10.0.0.2.5001: UDP, length 1470

23:34:42.125554 IP 10.0.0.1.52228 > 10.0.0.2.5001: UDP, length 1470

23:34:42.137702 IP 10.0.0.1.52228 > 10.0.0.2.5001: UDP, length 1470

23:34:42.149772 IP 10.0.0.1.52228 > 10.0.0.2.5001: UDP, length 1470

23:34:42.161862 IP 10.0.0.1.52228 > 10.0.0.2.5001: UDP, length 1470

23:34:42.173963 IP 10.0.0.1.52228 > 10.0.0.2.5001: UDP, length 1470

23:34:42.186029 IP 10.0.0.1.52228 > 10.0.0.2.5001: UDP, length 1470

23:34:42.198081 IP 10.0.0.1.52228 > 10.0.0.2.5001: UDP, length 1470

23:34:42.210201 IP 10.0.0.1.52228 > 10.0.0.2.5001: UDP, length 1470

23:34:42.222176 IP 10.0.0.1.52228 > 10.0.0.2.5001: UDP, length 1470

23:34:42.234281 IP 10.0.0.1.52228 > 10.0.0.2.5001: UDP, length 1470

23:34:42.246468 IP 10.0.0.1.52228 > 10.0.0.2.5001: UDP, length 1470

23:34:42.258738 IP 10.0.0.1.52228 > 10.0.0.2.5001: UDP, length 1470

23:34:42.270675 IP 10.0.0.1.52228 > 10.0.0.2.5001: UDP, length 1470

23:34:42.282897 IP 10.0.0.1.52228 > 10.0.0.2.5001: UDP, length 1470

23:34:42.295081 IP 10.0.0.1.52228 > 10.0.0.2.5001: UDP, length 1470

23:34:42.306865 IP 10.0.0.1.52228 > 10.0.0.2.5001: UDP, length 1470

23:34:42.319034 IP 10.0.0.1.52228 > 10.0.0.2.5001: UDP, length 1470

23:34:42.331183 IP 10.0.0.1.52228 > 10.0.0.2.5001: UDP, length 1470

23:34:42.343364 IP 10.0.0.1.52228 > 10.0.0.2.5001: UDP, length 1470

23:34:42.355504 IP 10.0.0.1.52228 > 10.0.0.2.5001: UDP, length 1470

23:34:42.367699 IP 10.0.0.1.52228 > 10.0.0.2.5001: UDP, length 1470

23:34:42.379445 IP 10.0.0.1.52228 > 10.0.0.2.5001: UDP, length 1470

23:34:42.391653 IP 10.0.0.1.52228 > 10.0.0.2.5001: UDP, length 1470

23:34:42.403820 IP 10.0.0.1.52228 > 10.0.0.2.5001: UDP, length 1470

23:34:42.415971 IP 10.0.0.1.52228 > 10.0.0.2.5001: UDP, length 1470

23:34:42.428063 IP 10.0.0.1.52228 > 10.0.0.2.5001: UDP, length 1470

23:34:42.440145 IP 10.0.0.1.52228 > 10.0.0.2.5001: UDP, length 1470

23:34:42.452076 IP 10.0.0.1.52228 > 10.0.0.2.5001: UDP, length 1470

23:34:42.464285 IP 10.0.0.1.52228 > 10.0.0.2.5001: UDP, length 1470

23:34:42.476271 IP 10.0.0.1.52228 > 10.0.0.2.5001: UDP, length 1470

23:34:42.488851 IP 10.0.0.1.52228 > 10.0.0.2.5001: UDP, length 1470

23:34:42.500531 IP 10.0.0.1.52228 > 10.0.0.2.5001: UDP, length 1470

23:34:42.512489 IP 10.0.0.1.52228 > 10.0.0.2.5001: UDP, length 1470

23:34:42.524705 IP 10.0.0.1.52228 > 10.0.0.2.5001: UDP, length 1470

23:34:42.533324 IP 10.0.0.2.5001 > 10.0.0.1.52228: UDP, length 1470

23:34:42.536657 IP 10.0.0.1.52228 > 10.0.0.2.5001: UDP, length 1470

23:34:42.537796 IP 10.0.0.2.5001 > 10.0.0.1.52228: UDP, length 1470

23:34:42.548855 IP 10.0.0.1.52228 > 10.0.0.2.5001: UDP, length 1470

23:34:42.550049 IP 10.0.0.2.5001 > 10.0.0.1.52228: UDP, length 1470

23:34:42.560918 IP 10.0.0.1.52228 > 10.0.0.2.5001: UDP, length 1470

23:34:42.562075 IP 10.0.0.2.5001 > 10.0.0.1.52228: UDP, length 1470

23:34:42.572968 IP 10.0.0.1.52228 > 10.0.0.2.5001: UDP, length 1470

23:34:42.574186 IP 10.0.0.2.5001 > 10.0.0.1.52228: UDP, length 1470

23:34:42.585459 IP 10.0.0.1.52228 > 10.0.0.2.5001: UDP, length 1470

23:34:42.586685 IP 10.0.0.2.5001 > 10.0.0.1.52228: UDP, length 1470

23:34:42.597522 IP 10.0.0.1.52228 > 10.0.0.2.5001: UDP, length 1470

23:34:42.598714 IP 10.0.0.2.5001 > 10.0.0.1.52228: UDP, length 1470

23:34:42.609613 IP 10.0.0.1.52228 > 10.0.0.2.5001: UDP, length 1470

23:34:42.610808 IP 10.0.0.2.5001 > 10.0.0.1.52228: UDP, length 1470

23:34:42.621918 IP 10.0.0.1.52228 > 10.0.0.2.5001: UDP, length 1470

23:34:42.623093 IP 10.0.0.2.5001 > 10.0.0.1.52228: UDP, length 1470

23:34:42.633979 IP 10.0.0.1.52228 > 10.0.0.2.5001: UDP, length 1470

23:34:42.635371 IP 10.0.0.2.5001 > 10.0.0.1.52228: UDP, length 1470

23:34:42.649153 IP 10.0.0.1 > 10.0.0.2: ICMP 10.0.0.1 udp port 52228 unreachable, length 556

23:34:42.652309 IP 10.0.0.1 > 10.0.0.2: ICMP 10.0.0.1 udp port 52228 unreachable, length 556

23:34:42.657154 IP 10.0.0.1 > 10.0.0.2: ICMP 10.0.0.1 udp port 52228 unreachable, length 556

23:34:42.661922 IP 10.0.0.1 > 10.0.0.2: ICMP 10.0.0.1 udp port 52228 unreachable, length 556

23:34:42.667143 IP 10.0.0.1 > 10.0.0.2: ICMP 10.0.0.1 udp port 52228 unreachable, length 556

23:34:42.671237 IP 10.0.0.1 > 10.0.0.2: ICMP 10.0.0.1 udp port 52228 unreachable, length 556



cnt=
871
