23:29:57.421687 IP 10.0.0.1.58036 > 10.0.0.2.5001: UDP, length 1470

23:29:57.444265 IP 10.0.0.1.58036 > 10.0.0.2.5001: UDP, length 1470

23:29:57.467323 IP 10.0.0.1.58036 > 10.0.0.2.5001: UDP, length 1470

23:29:57.490256 IP 10.0.0.1.58036 > 10.0.0.2.5001: UDP, length 1470

23:29:57.513108 IP 10.0.0.1.58036 > 10.0.0.2.5001: UDP, length 1470

23:29:57.536011 IP 10.0.0.1.58036 > 10.0.0.2.5001: UDP, length 1470

23:29:57.559211 IP 10.0.0.1.58036 > 10.0.0.2.5001: UDP, length 1470

23:29:57.582066 IP 10.0.0.1.58036 > 10.0.0.2.5001: UDP, length 1470

23:29:57.605060 IP 10.0.0.1.58036 > 10.0.0.2.5001: UDP, length 1470

23:29:57.627835 IP 10.0.0.1.58036 > 10.0.0.2.5001: UDP, length 1470

23:29:57.650853 IP 10.0.0.1.58036 > 10.0.0.2.5001: UDP, length 1470

23:29:57.673719 IP 10.0.0.1.58036 > 10.0.0.2.5001: UDP, length 1470

23:29:57.696859 IP 10.0.0.1.58036 > 10.0.0.2.5001: UDP, length 1470

23:29:57.720070 IP 10.0.0.1.58036 > 10.0.0.2.5001: UDP, length 1470

23:29:57.742763 IP 10.0.0.1.58036 > 10.0.0.2.5001: UDP, length 1470

23:29:57.765796 IP 10.0.0.1.58036 > 10.0.0.2.5001: UDP, length 1470

23:29:57.788744 IP 10.0.0.1.58036 > 10.0.0.2.5001: UDP, length 1470

23:29:57.811636 IP 10.0.0.1.58036 > 10.0.0.2.5001: UDP, length 1470

23:29:57.834495 IP 10.0.0.1.58036 > 10.0.0.2.5001: UDP, length 1470

23:29:57.857503 IP 10.0.0.1.58036 > 10.0.0.2.5001: UDP, length 1470

23:29:57.880791 IP 10.0.0.1.58036 > 10.0.0.2.5001: UDP, length 1470

23:29:57.903772 IP 10.0.0.1.58036 > 10.0.0.2.5001: UDP, length 1470

23:29:57.926555 IP 10.0.0.1.58036 > 10.0.0.2.5001: UDP, length 1470

23:29:57.949453 IP 10.0.0.1.58036 > 10.0.0.2.5001: UDP, length 1470

23:29:57.972389 IP 10.0.0.1.58036 > 10.0.0.2.5001: UDP, length 1470

23:29:57.995481 IP 10.0.0.1.58036 > 10.0.0.2.5001: UDP, length 1470

23:29:58.018458 IP 10.0.0.1.58036 > 10.0.0.2.5001: UDP, length 1470

23:29:58.041367 IP 10.0.0.1.58036 > 10.0.0.2.5001: UDP, length 1470

23:29:58.064249 IP 10.0.0.1.58036 > 10.0.0.2.5001: UDP, length 1470

23:29:58.087308 IP 10.0.0.1.58036 > 10.0.0.2.5001: UDP, length 1470

23:29:58.110071 IP 10.0.0.1.58036 > 10.0.0.2.5001: UDP, length 1470

23:29:58.133415 IP 10.0.0.1.58036 > 10.0.0.2.5001: UDP, length 1470

23:29:58.156035 IP 10.0.0.1.58036 > 10.0.0.2.5001: UDP, length 1470

23:29:58.179186 IP 10.0.0.1.58036 > 10.0.0.2.5001: UDP, length 1470

23:29:58.202163 IP 10.0.0.1.58036 > 10.0.0.2.5001: UDP, length 1470

23:29:58.224972 IP 10.0.0.1.58036 > 10.0.0.2.5001: UDP, length 1470

23:29:58.270913 IP 10.0.0.1.58036 > 10.0.0.2.5001: UDP, length 1470

23:29:58.317356 IP 10.0.0.1.58036 > 10.0.0.2.5001: UDP, length 1470

23:29:58.340297 IP 10.0.0.1.58036 > 10.0.0.2.5001: UDP, length 1470

23:29:58.363164 IP 10.0.0.1.58036 > 10.0.0.2.5001: UDP, length 1470

23:29:58.386051 IP 10.0.0.1.58036 > 10.0.0.2.5001: UDP, length 1470

23:29:58.408993 IP 10.0.0.1.58036 > 10.0.0.2.5001: UDP, length 1470

23:29:58.432172 IP 10.0.0.1.58036 > 10.0.0.2.5001: UDP, length 1470

23:29:58.455156 IP 10.0.0.1.58036 > 10.0.0.2.5001: UDP, length 1470

23:29:58.477907 IP 10.0.0.1.58036 > 10.0.0.2.5001: UDP, length 1470

23:29:58.500973 IP 10.0.0.1.58036 > 10.0.0.2.5001: UDP, length 1470

23:29:58.523777 IP 10.0.0.1.58036 > 10.0.0.2.5001: UDP, length 1470

23:29:58.546853 IP 10.0.0.1.58036 > 10.0.0.2.5001: UDP, length 1470

23:29:58.569614 IP 10.0.0.1.58036 > 10.0.0.2.5001: UDP, length 1470

23:29:58.592510 IP 10.0.0.1.58036 > 10.0.0.2.5001: UDP, length 1470

23:29:58.615536 IP 10.0.0.1.58036 > 10.0.0.2.5001: UDP, length 1470

23:29:58.638625 IP 10.0.0.1.58036 > 10.0.0.2.5001: UDP, length 1470

23:29:58.661374 IP 10.0.0.1.58036 > 10.0.0.2.5001: UDP, length 1470

23:29:58.684240 IP 10.0.0.1.58036 > 10.0.0.2.5001: UDP, length 1470

23:29:58.707497 IP 10.0.0.1.58036 > 10.0.0.2.5001: UDP, length 1470

23:29:58.730486 IP 10.0.0.1.58036 > 10.0.0.2.5001: UDP, length 1470

23:29:58.753507 IP 10.0.0.1.58036 > 10.0.0.2.5001: UDP, length 1470

23:29:58.776270 IP 10.0.0.1.58036 > 10.0.0.2.5001: UDP, length 1470

23:29:58.799208 IP 10.0.0.1.58036 > 10.0.0.2.5001: UDP, length 1470

23:29:58.822245 IP 10.0.0.1.58036 > 10.0.0.2.5001: UDP, length 1470

23:29:58.845193 IP 10.0.0.1.58036 > 10.0.0.2.5001: UDP, length 1470

23:29:58.868272 IP 10.0.0.1.58036 > 10.0.0.2.5001: UDP, length 1470

23:29:58.891350 IP 10.0.0.1.58036 > 10.0.0.2.5001: UDP, length 1470

23:29:58.914315 IP 10.0.0.1.58036 > 10.0.0.2.5001: UDP, length 1470

23:29:58.937109 IP 10.0.0.1.58036 > 10.0.0.2.5001: UDP, length 1470

23:29:58.960041 IP 10.0.0.1.58036 > 10.0.0.2.5001: UDP, length 1470

23:29:58.983085 IP 10.0.0.1.58036 > 10.0.0.2.5001: UDP, length 1470

23:29:59.005917 IP 10.0.0.1.58036 > 10.0.0.2.5001: UDP, length 1470

23:29:59.052318 IP 10.0.0.1.58036 > 10.0.0.2.5001: UDP, length 1470

23:29:59.074864 IP 10.0.0.1.58036 > 10.0.0.2.5001: UDP, length 1470

23:29:59.098185 IP 10.0.0.1.58036 > 10.0.0.2.5001: UDP, length 1470

23:29:59.120716 IP 10.0.0.1.58036 > 10.0.0.2.5001: UDP, length 1470

23:29:59.143767 IP 10.0.0.1.58036 > 10.0.0.2.5001: UDP, length 1470

23:29:59.166903 IP 10.0.0.1.58036 > 10.0.0.2.5001: UDP, length 1470

23:29:59.189680 IP 10.0.0.1.58036 > 10.0.0.2.5001: UDP, length 1470

23:29:59.216608 IP 10.0.0.1.58036 > 10.0.0.2.5001: UDP, length 1470

23:29:59.235345 IP 10.0.0.1.58036 > 10.0.0.2.5001: UDP, length 1470

23:29:59.258803 IP 10.0.0.1.58036 > 10.0.0.2.5001: UDP, length 1470

23:29:59.281584 IP 10.0.0.1.58036 > 10.0.0.2.5001: UDP, length 1470

23:29:59.304706 IP 10.0.0.1.58036 > 10.0.0.2.5001: UDP, length 1470

23:29:59.327792 IP 10.0.0.1.58036 > 10.0.0.2.5001: UDP, length 1470

23:29:59.350596 IP 10.0.0.1.58036 > 10.0.0.2.5001: UDP, length 1470

23:29:59.373438 IP 10.0.0.1.58036 > 10.0.0.2.5001: UDP, length 1470

23:29:59.396266 IP 10.0.0.1.58036 > 10.0.0.2.5001: UDP, length 1470

23:29:59.420014 IP 10.0.0.1.58036 > 10.0.0.2.5001: UDP, length 1470

23:29:59.442629 IP 10.0.0.1.58036 > 10.0.0.2.5001: UDP, length 1470

23:29:59.465522 IP 10.0.0.1.58036 > 10.0.0.2.5001: UDP, length 1470

23:29:59.511290 IP 10.0.0.1.58036 > 10.0.0.2.5001: UDP, length 1470

23:29:59.534317 IP 10.0.0.1.58036 > 10.0.0.2.5001: UDP, length 1470

23:29:59.557485 IP 10.0.0.1.58036 > 10.0.0.2.5001: UDP, length 1470

23:29:59.580126 IP 10.0.0.1.58036 > 10.0.0.2.5001: UDP, length 1470

23:29:59.603204 IP 10.0.0.1.58036 > 10.0.0.2.5001: UDP, length 1470

23:29:59.626142 IP 10.0.0.1.58036 > 10.0.0.2.5001: UDP, length 1470

23:29:59.649018 IP 10.0.0.1.58036 > 10.0.0.2.5001: UDP, length 1470

23:29:59.672212 IP 10.0.0.1.58036 > 10.0.0.2.5001: UDP, length 1470

23:29:59.695039 IP 10.0.0.1.58036 > 10.0.0.2.5001: UDP, length 1470

23:29:59.718071 IP 10.0.0.1.58036 > 10.0.0.2.5001: UDP, length 1470

23:29:59.741143 IP 10.0.0.1.58036 > 10.0.0.2.5001: UDP, length 1470

23:29:59.763987 IP 10.0.0.1.58036 > 10.0.0.2.5001: UDP, length 1470

23:29:59.786867 IP 10.0.0.1.58036 > 10.0.0.2.5001: UDP, length 1470

23:29:59.810041 IP 10.0.0.1.58036 > 10.0.0.2.5001: UDP, length 1470

23:29:59.832968 IP 10.0.0.1.58036 > 10.0.0.2.5001: UDP, length 1470

23:29:59.855996 IP 10.0.0.1.58036 > 10.0.0.2.5001: UDP, length 1470

23:29:59.879017 IP 10.0.0.1.58036 > 10.0.0.2.5001: UDP, length 1470

23:29:59.901751 IP 10.0.0.1.58036 > 10.0.0.2.5001: UDP, length 1470

23:29:59.947858 IP 10.0.0.1.58036 > 10.0.0.2.5001: UDP, length 1470

23:29:59.970713 IP 10.0.0.1.58036 > 10.0.0.2.5001: UDP, length 1470

23:29:59.993587 IP 10.0.0.1.58036 > 10.0.0.2.5001: UDP, length 1470

23:30:00.016663 IP 10.0.0.1.58036 > 10.0.0.2.5001: UDP, length 1470

23:30:00.039680 IP 10.0.0.1.58036 > 10.0.0.2.5001: UDP, length 1470

23:30:00.062634 IP 10.0.0.1.58036 > 10.0.0.2.5001: UDP, length 1470

23:30:00.085436 IP 10.0.0.1.58036 > 10.0.0.2.5001: UDP, length 1470

23:30:00.108401 IP 10.0.0.1.58036 > 10.0.0.2.5001: UDP, length 1470

23:30:00.131463 IP 10.0.0.1.58036 > 10.0.0.2.5001: UDP, length 1470

23:30:00.154469 IP 10.0.0.1.58036 > 10.0.0.2.5001: UDP, length 1470

23:30:00.177291 IP 10.0.0.1.58036 > 10.0.0.2.5001: UDP, length 1470

23:30:00.200220 IP 10.0.0.1.58036 > 10.0.0.2.5001: UDP, length 1470

23:30:00.223125 IP 10.0.0.1.58036 > 10.0.0.2.5001: UDP, length 1470

23:30:00.246324 IP 10.0.0.1.58036 > 10.0.0.2.5001: UDP, length 1470

23:30:00.269359 IP 10.0.0.1.58036 > 10.0.0.2.5001: UDP, length 1470

23:30:00.292132 IP 10.0.0.1.58036 > 10.0.0.2.5001: UDP, length 1470

23:30:00.315172 IP 10.0.0.1.58036 > 10.0.0.2.5001: UDP, length 1470

23:30:00.337972 IP 10.0.0.1.58036 > 10.0.0.2.5001: UDP, length 1470

23:30:00.361013 IP 10.0.0.1.58036 > 10.0.0.2.5001: UDP, length 1470

23:30:00.384104 IP 10.0.0.1.58036 > 10.0.0.2.5001: UDP, length 1470

23:30:00.407004 IP 10.0.0.1.58036 > 10.0.0.2.5001: UDP, length 1470

23:30:00.430110 IP 10.0.0.1.58036 > 10.0.0.2.5001: UDP, length 1470

23:30:00.453059 IP 10.0.0.1.58036 > 10.0.0.2.5001: UDP, length 1470

23:30:00.475985 IP 10.0.0.1.58036 > 10.0.0.2.5001: UDP, length 1470

23:30:00.499148 IP 10.0.0.1.58036 > 10.0.0.2.5001: UDP, length 1470

23:30:00.521920 IP 10.0.0.1.58036 > 10.0.0.2.5001: UDP, length 1470

23:30:00.544976 IP 10.0.0.1.58036 > 10.0.0.2.5001: UDP, length 1470

23:30:00.568572 IP 10.0.0.1.58036 > 10.0.0.2.5001: UDP, length 1470

23:30:00.590921 IP 10.0.0.1.58036 > 10.0.0.2.5001: UDP, length 1470

23:30:00.613773 IP 10.0.0.1.58036 > 10.0.0.2.5001: UDP, length 1470

23:30:00.636683 IP 10.0.0.1.58036 > 10.0.0.2.5001: UDP, length 1470

23:30:00.659825 IP 10.0.0.1.58036 > 10.0.0.2.5001: UDP, length 1470

23:30:00.682738 IP 10.0.0.1.58036 > 10.0.0.2.5001: UDP, length 1470

23:30:00.705540 IP 10.0.0.1.58036 > 10.0.0.2.5001: UDP, length 1470

23:30:00.728912 IP 10.0.0.1.58036 > 10.0.0.2.5001: UDP, length 1470

23:30:00.751973 IP 10.0.0.1.58036 > 10.0.0.2.5001: UDP, length 1470

23:30:00.774601 IP 10.0.0.1.58036 > 10.0.0.2.5001: UDP, length 1470

23:30:00.797707 IP 10.0.0.1.58036 > 10.0.0.2.5001: UDP, length 1470

23:30:00.820320 IP 10.0.0.1.58036 > 10.0.0.2.5001: UDP, length 1470

23:30:00.843533 IP 10.0.0.1.58036 > 10.0.0.2.5001: UDP, length 1470

23:30:00.866568 IP 10.0.0.1.58036 > 10.0.0.2.5001: UDP, length 1470

23:30:00.889373 IP 10.0.0.1.58036 > 10.0.0.2.5001: UDP, length 1470

23:30:00.912267 IP 10.0.0.1.58036 > 10.0.0.2.5001: UDP, length 1470

23:30:00.935190 IP 10.0.0.1.58036 > 10.0.0.2.5001: UDP, length 1470

23:30:00.958249 IP 10.0.0.1.58036 > 10.0.0.2.5001: UDP, length 1470

23:30:00.981332 IP 10.0.0.1.58036 > 10.0.0.2.5001: UDP, length 1470

23:30:01.004371 IP 10.0.0.1.58036 > 10.0.0.2.5001: UDP, length 1470

23:30:01.027167 IP 10.0.0.1.58036 > 10.0.0.2.5001: UDP, length 1470

23:30:01.050117 IP 10.0.0.1.58036 > 10.0.0.2.5001: UDP, length 1470

23:30:01.073281 IP 10.0.0.1.58036 > 10.0.0.2.5001: UDP, length 1470

23:30:01.096210 IP 10.0.0.1.58036 > 10.0.0.2.5001: UDP, length 1470

23:30:01.118955 IP 10.0.0.1.58036 > 10.0.0.2.5001: UDP, length 1470

23:30:01.142000 IP 10.0.0.1.58036 > 10.0.0.2.5001: UDP, length 1470

23:30:01.164969 IP 10.0.0.1.58036 > 10.0.0.2.5001: UDP, length 1470

23:30:01.187881 IP 10.0.0.1.58036 > 10.0.0.2.5001: UDP, length 1470

23:30:01.210800 IP 10.0.0.1.58036 > 10.0.0.2.5001: UDP, length 1470

23:30:01.233729 IP 10.0.0.1.58036 > 10.0.0.2.5001: UDP, length 1470

23:30:01.256861 IP 10.0.0.1.58036 > 10.0.0.2.5001: UDP, length 1470

23:30:01.279883 IP 10.0.0.1.58036 > 10.0.0.2.5001: UDP, length 1470

23:30:01.302903 IP 10.0.0.1.58036 > 10.0.0.2.5001: UDP, length 1470

23:30:01.325759 IP 10.0.0.1.58036 > 10.0.0.2.5001: UDP, length 1470

23:30:01.348834 IP 10.0.0.1.58036 > 10.0.0.2.5001: UDP, length 1470

23:30:01.371898 IP 10.0.0.1.58036 > 10.0.0.2.5001: UDP, length 1470

23:30:01.394781 IP 10.0.0.1.58036 > 10.0.0.2.5001: UDP, length 1470

23:30:01.417618 IP 10.0.0.1.58036 > 10.0.0.2.5001: UDP, length 1470

23:30:01.440646 IP 10.0.0.1.58036 > 10.0.0.2.5001: UDP, length 1470

23:30:01.463614 IP 10.0.0.1.58036 > 10.0.0.2.5001: UDP, length 1470

23:30:01.486612 IP 10.0.0.1.58036 > 10.0.0.2.5001: UDP, length 1470

23:30:01.532566 IP 10.0.0.1.58036 > 10.0.0.2.5001: UDP, length 1470

23:30:01.555755 IP 10.0.0.1.58036 > 10.0.0.2.5001: UDP, length 1470

23:30:01.578611 IP 10.0.0.1.58036 > 10.0.0.2.5001: UDP, length 1470

23:30:01.601357 IP 10.0.0.1.58036 > 10.0.0.2.5001: UDP, length 1470

23:30:01.624410 IP 10.0.0.1.58036 > 10.0.0.2.5001: UDP, length 1470

23:30:01.647443 IP 10.0.0.1.58036 > 10.0.0.2.5001: UDP, length 1470

23:30:01.670623 IP 10.0.0.1.58036 > 10.0.0.2.5001: UDP, length 1470

23:30:01.693815 IP 10.0.0.1.58036 > 10.0.0.2.5001: UDP, length 1470

23:30:01.716327 IP 10.0.0.1.58036 > 10.0.0.2.5001: UDP, length 1470

23:30:01.739081 IP 10.0.0.1.58036 > 10.0.0.2.5001: UDP, length 1470

23:30:01.762162 IP 10.0.0.1.58036 > 10.0.0.2.5001: UDP, length 1470

23:30:01.784999 IP 10.0.0.1.58036 > 10.0.0.2.5001: UDP, length 1470

23:30:01.808252 IP 10.0.0.1.58036 > 10.0.0.2.5001: UDP, length 1470

23:30:01.831187 IP 10.0.0.1.58036 > 10.0.0.2.5001: UDP, length 1470

23:30:01.854028 IP 10.0.0.1.58036 > 10.0.0.2.5001: UDP, length 1470

23:30:01.877090 IP 10.0.0.1.58036 > 10.0.0.2.5001: UDP, length 1470

23:30:01.899965 IP 10.0.0.1.58036 > 10.0.0.2.5001: UDP, length 1470

23:30:01.924871 IP 10.0.0.1.58036 > 10.0.0.2.5001: UDP, length 1470

23:30:01.945674 IP 10.0.0.1.58036 > 10.0.0.2.5001: UDP, length 1470

23:30:01.968824 IP 10.0.0.1.58036 > 10.0.0.2.5001: UDP, length 1470

23:30:01.991862 IP 10.0.0.1.58036 > 10.0.0.2.5001: UDP, length 1470

23:30:02.014817 IP 10.0.0.1.58036 > 10.0.0.2.5001: UDP, length 1470

23:30:02.037640 IP 10.0.0.1.58036 > 10.0.0.2.5001: UDP, length 1470

23:30:02.060661 IP 10.0.0.1.58036 > 10.0.0.2.5001: UDP, length 1470

23:30:02.083720 IP 10.0.0.1.58036 > 10.0.0.2.5001: UDP, length 1470

23:30:02.106700 IP 10.0.0.1.58036 > 10.0.0.2.5001: UDP, length 1470

23:30:02.129660 IP 10.0.0.1.58036 > 10.0.0.2.5001: UDP, length 1470

23:30:02.152637 IP 10.0.0.1.58036 > 10.0.0.2.5001: UDP, length 1470

23:30:02.175471 IP 10.0.0.1.58036 > 10.0.0.2.5001: UDP, length 1470

23:30:02.198421 IP 10.0.0.1.58036 > 10.0.0.2.5001: UDP, length 1470

23:30:02.221636 IP 10.0.0.1.58036 > 10.0.0.2.5001: UDP, length 1470

23:30:02.244722 IP 10.0.0.1.58036 > 10.0.0.2.5001: UDP, length 1470

23:30:02.267401 IP 10.0.0.1.58036 > 10.0.0.2.5001: UDP, length 1470

23:30:02.290504 IP 10.0.0.1.58036 > 10.0.0.2.5001: UDP, length 1470

23:30:02.313487 IP 10.0.0.1.58036 > 10.0.0.2.5001: UDP, length 1470

23:30:02.336075 IP 10.0.0.1.58036 > 10.0.0.2.5001: UDP, length 1470

23:30:02.359255 IP 10.0.0.1.58036 > 10.0.0.2.5001: UDP, length 1470

23:30:02.382278 IP 10.0.0.1.58036 > 10.0.0.2.5001: UDP, length 1470

23:30:02.405453 IP 10.0.0.1.58036 > 10.0.0.2.5001: UDP, length 1470

23:30:02.428326 IP 10.0.0.1.58036 > 10.0.0.2.5001: UDP, length 1470

23:30:02.451226 IP 10.0.0.1.58036 > 10.0.0.2.5001: UDP, length 1470

23:30:02.465460 IP 10.0.0.2.5001 > 10.0.0.1.58036: UDP, length 1470



cnt=
216
