23:35:23.471834 IP 10.0.0.1.44064 > 10.0.0.2.5001: UDP, length 1470
23:35:23.474853 IP 10.0.0.1.44064 > 10.0.0.2.5001: UDP, length 1470
23:35:23.483320 IP 10.0.0.1.44064 > 10.0.0.2.5001: UDP, length 1470
23:35:23.495447 IP 10.0.0.1.44064 > 10.0.0.2.5001: UDP, length 1470
23:35:23.507512 IP 10.0.0.1.44064 > 10.0.0.2.5001: UDP, length 1470
23:35:23.519623 IP 10.0.0.1.44064 > 10.0.0.2.5001: UDP, length 1470
23:35:23.531676 IP 10.0.0.1.44064 > 10.0.0.2.5001: UDP, length 1470
23:35:23.543820 IP 10.0.0.1.44064 > 10.0.0.2.5001: UDP, length 1470
23:35:23.555954 IP 10.0.0.1.44064 > 10.0.0.2.5001: UDP, length 1470
23:35:23.568056 IP 10.0.0.1.44064 > 10.0.0.2.5001: UDP, length 1470
23:35:23.580031 IP 10.0.0.1.44064 > 10.0.0.2.5001: UDP, length 1470
23:35:23.592193 IP 10.0.0.1.44064 > 10.0.0.2.5001: UDP, length 1470
23:35:23.604275 IP 10.0.0.1.44064 > 10.0.0.2.5001: UDP, length 1470
23:35:23.616425 IP 10.0.0.1.44064 > 10.0.0.2.5001: UDP, length 1470
23:35:23.628545 IP 10.0.0.1.44064 > 10.0.0.2.5001: UDP, length 1470
23:35:23.640486 IP 10.0.0.1.44064 > 10.0.0.2.5001: UDP, length 1470
23:35:23.652621 IP 10.0.0.1.44064 > 10.0.0.2.5001: UDP, length 1470
23:35:23.664802 IP 10.0.0.1.44064 > 10.0.0.2.5001: UDP, length 1470
23:35:23.676948 IP 10.0.0.1.44064 > 10.0.0.2.5001: UDP, length 1470
23:35:23.689045 IP 10.0.0.1.44064 > 10.0.0.2.5001: UDP, length 1470
23:35:23.701024 IP 10.0.0.1.44064 > 10.0.0.2.5001: UDP, length 1470
23:35:23.713159 IP 10.0.0.1.44064 > 10.0.0.2.5001: UDP, length 1470
23:35:23.725315 IP 10.0.0.1.44064 > 10.0.0.2.5001: UDP, length 1470
23:35:23.737441 IP 10.0.0.1.44064 > 10.0.0.2.5001: UDP, length 1470
23:35:23.749444 IP 10.0.0.1.44064 > 10.0.0.2.5001: UDP, length 1470
23:35:23.761529 IP 10.0.0.1.44064 > 10.0.0.2.5001: UDP, length 1470
23:35:23.773516 IP 10.0.0.1.44064 > 10.0.0.2.5001: UDP, length 1470
23:35:23.785733 IP 10.0.0.1.44064 > 10.0.0.2.5001: UDP, length 1470
23:35:23.797879 IP 10.0.0.1.44064 > 10.0.0.2.5001: UDP, length 1470
23:35:23.809822 IP 10.0.0.1.44064 > 10.0.0.2.5001: UDP, length 1470
23:35:23.822029 IP 10.0.0.1.44064 > 10.0.0.2.5001: UDP, length 1470
23:35:23.834123 IP 10.0.0.1.44064 > 10.0.0.2.5001: UDP, length 1470
23:35:23.846176 IP 10.0.0.1.44064 > 10.0.0.2.5001: UDP, length 1470
23:35:23.858319 IP 10.0.0.1.44064 > 10.0.0.2.5001: UDP, length 1470
23:35:23.870369 IP 10.0.0.1.44064 > 10.0.0.2.5001: UDP, length 1470
23:35:23.882426 IP 10.0.0.1.44064 > 10.0.0.2.5001: UDP, length 1470
23:35:23.894567 IP 10.0.0.1.44064 > 10.0.0.2.5001: UDP, length 1470
23:35:23.906636 IP 10.0.0.1.44064 > 10.0.0.2.5001: UDP, length 1470
23:35:23.918719 IP 10.0.0.1.44064 > 10.0.0.2.5001: UDP, length 1470
23:35:23.930826 IP 10.0.0.1.44064 > 10.0.0.2.5001: UDP, length 1470
23:35:23.942955 IP 10.0.0.1.44064 > 10.0.0.2.5001: UDP, length 1470
23:35:23.955063 IP 10.0.0.1.44064 > 10.0.0.2.5001: UDP, length 1470
23:35:23.967064 IP 10.0.0.1.44064 > 10.0.0.2.5001: UDP, length 1470
23:35:23.979183 IP 10.0.0.1.44064 > 10.0.0.2.5001: UDP, length 1470
23:35:23.991354 IP 10.0.0.1.44064 > 10.0.0.2.5001: UDP, length 1470
23:35:24.003469 IP 10.0.0.1.44064 > 10.0.0.2.5001: UDP, length 1470
23:35:24.015585 IP 10.0.0.1.44064 > 10.0.0.2.5001: UDP, length 1470
23:35:24.027714 IP 10.0.0.1.44064 > 10.0.0.2.5001: UDP, length 1470
23:35:24.039703 IP 10.0.0.1.44064 > 10.0.0.2.5001: UDP, length 1470
23:35:24.051832 IP 10.0.0.1.44064 > 10.0.0.2.5001: UDP, length 1470
23:35:24.063956 IP 10.0.0.1.44064 > 10.0.0.2.5001: UDP, length 1470
23:35:24.076078 IP 10.0.0.1.44064 > 10.0.0.2.5001: UDP, length 1470
23:35:24.088160 IP 10.0.0.1.44064 > 10.0.0.2.5001: UDP, length 1470
23:35:24.100214 IP 10.0.0.1.44064 > 10.0.0.2.5001: UDP, length 1470
23:35:24.112335 IP 10.0.0.1.44064 > 10.0.0.2.5001: UDP, length 1470
23:35:24.124439 IP 10.0.0.1.44064 > 10.0.0.2.5001: UDP, length 1470
23:35:24.136574 IP 10.0.0.1.44064 > 10.0.0.2.5001: UDP, length 1470
23:35:24.148581 IP 10.0.0.1.44064 > 10.0.0.2.5001: UDP, length 1470
23:35:24.160624 IP 10.0.0.1.44064 > 10.0.0.2.5001: UDP, length 1470
23:35:24.172824 IP 10.0.0.1.44064 > 10.0.0.2.5001: UDP, length 1470
23:35:24.184947 IP 10.0.0.1.44064 > 10.0.0.2.5001: UDP, length 1470
23:35:24.197014 IP 10.0.0.1.44064 > 10.0.0.2.5001: UDP, length 1470
23:35:24.209033 IP 10.0.0.1.44064 > 10.0.0.2.5001: UDP, length 1470
23:35:24.221141 IP 10.0.0.1.44064 > 10.0.0.2.5001: UDP, length 1470
23:35:24.233277 IP 10.0.0.1.44064 > 10.0.0.2.5001: UDP, length 1470
23:35:24.245442 IP 10.0.0.1.44064 > 10.0.0.2.5001: UDP, length 1470
23:35:24.257546 IP 10.0.0.1.44064 > 10.0.0.2.5001: UDP, length 1470
23:35:24.269523 IP 10.0.0.1.44064 > 10.0.0.2.5001: UDP, length 1470
23:35:24.281681 IP 10.0.0.1.44064 > 10.0.0.2.5001: UDP, length 1470
23:35:24.293743 IP 10.0.0.1.44064 > 10.0.0.2.5001: UDP, length 1470
23:35:24.305921 IP 10.0.0.1.44064 > 10.0.0.2.5001: UDP, length 1470
23:35:24.317953 IP 10.0.0.1.44064 > 10.0.0.2.5001: UDP, length 1470
23:35:24.329997 IP 10.0.0.1.44064 > 10.0.0.2.5001: UDP, length 1470
23:35:24.342166 IP 10.0.0.1.44064 > 10.0.0.2.5001: UDP, length 1470
23:35:24.354328 IP 10.0.0.1.44064 > 10.0.0.2.5001: UDP, length 1470
23:35:24.366397 IP 10.0.0.1.44064 > 10.0.0.2.5001: UDP, length 1470
23:35:24.378333 IP 10.0.0.1.44064 > 10.0.0.2.5001: UDP, length 1470
23:35:24.390533 IP 10.0.0.1.44064 > 10.0.0.2.5001: UDP, length 1470
23:35:24.402592 IP 10.0.0.1.44064 > 10.0.0.2.5001: UDP, length 1470
23:35:24.414729 IP 10.0.0.1.44064 > 10.0.0.2.5001: UDP, length 1470
23:35:24.426833 IP 10.0.0.1.44064 > 10.0.0.2.5001: UDP, length 1470
23:35:24.438884 IP 10.0.0.1.44064 > 10.0.0.2.5001: UDP, length 1470
23:35:24.451027 IP 10.0.0.1.44064 > 10.0.0.2.5001: UDP, length 1470
23:35:24.463278 IP 10.0.0.1.44064 > 10.0.0.2.5001: UDP, length 1470
23:35:24.475254 IP 10.0.0.1.44064 > 10.0.0.2.5001: UDP, length 1470
23:35:24.487372 IP 10.0.0.1.44064 > 10.0.0.2.5001: UDP, length 1470
23:35:24.499402 IP 10.0.0.1.44064 > 10.0.0.2.5001: UDP, length 1470
23:35:24.511581 IP 10.0.0.1.44064 > 10.0.0.2.5001: UDP, length 1470
23:35:24.523700 IP 10.0.0.1.44064 > 10.0.0.2.5001: UDP, length 1470
23:35:24.535784 IP 10.0.0.1.44064 > 10.0.0.2.5001: UDP, length 1470
23:35:24.547819 IP 10.0.0.1.44064 > 10.0.0.2.5001: UDP, length 1470
23:35:24.559890 IP 10.0.0.1.44064 > 10.0.0.2.5001: UDP, length 1470
23:35:24.572065 IP 10.0.0.1.44064 > 10.0.0.2.5001: UDP, length 1470
23:35:24.584185 IP 10.0.0.1.44064 > 10.0.0.2.5001: UDP, length 1470
23:35:24.596140 IP 10.0.0.1.44064 > 10.0.0.2.5001: UDP, length 1470
23:35:24.608249 IP 10.0.0.1.44064 > 10.0.0.2.5001: UDP, length 1470
23:35:24.620426 IP 10.0.0.1.44064 > 10.0.0.2.5001: UDP, length 1470
23:35:24.632553 IP 10.0.0.1.44064 > 10.0.0.2.5001: UDP, length 1470
23:35:24.644688 IP 10.0.0.1.44064 > 10.0.0.2.5001: UDP, length 1470
23:35:24.656811 IP 10.0.0.1.44064 > 10.0.0.2.5001: UDP, length 1470
23:35:24.668733 IP 10.0.0.1.44064 > 10.0.0.2.5001: UDP, length 1470
23:35:24.680850 IP 10.0.0.1.44064 > 10.0.0.2.5001: UDP, length 1470
23:35:24.692898 IP 10.0.0.1.44064 > 10.0.0.2.5001: UDP, length 1470
23:35:24.705086 IP 10.0.0.1.44064 > 10.0.0.2.5001: UDP, length 1470
23:35:24.717063 IP 10.0.0.1.44064 > 10.0.0.2.5001: UDP, length 1470
23:35:24.729220 IP 10.0.0.1.44064 > 10.0.0.2.5001: UDP, length 1470
23:35:24.741339 IP 10.0.0.1.44064 > 10.0.0.2.5001: UDP, length 1470
23:35:24.753476 IP 10.0.0.1.44064 > 10.0.0.2.5001: UDP, length 1470
23:35:24.765548 IP 10.0.0.1.44064 > 10.0.0.2.5001: UDP, length 1470
23:35:24.777555 IP 10.0.0.1.44064 > 10.0.0.2.5001: UDP, length 1470
23:35:24.789709 IP 10.0.0.1.44064 > 10.0.0.2.5001: UDP, length 1470
23:35:24.801829 IP 10.0.0.1.44064 > 10.0.0.2.5001: UDP, length 1470
23:35:24.813963 IP 10.0.0.1.44064 > 10.0.0.2.5001: UDP, length 1470
23:35:24.825981 IP 10.0.0.1.44064 > 10.0.0.2.5001: UDP, length 1470
23:35:24.838076 IP 10.0.0.1.44064 > 10.0.0.2.5001: UDP, length 1470
23:35:24.850202 IP 10.0.0.1.44064 > 10.0.0.2.5001: UDP, length 1470
23:35:24.862315 IP 10.0.0.1.44064 > 10.0.0.2.5001: UDP, length 1470
23:35:24.874374 IP 10.0.0.1.44064 > 10.0.0.2.5001: UDP, length 1470
23:35:24.886398 IP 10.0.0.1.44064 > 10.0.0.2.5001: UDP, length 1470
23:35:24.898563 IP 10.0.0.1.44064 > 10.0.0.2.5001: UDP, length 1470
23:35:24.910659 IP 10.0.0.1.44064 > 10.0.0.2.5001: UDP, length 1470
23:35:24.922786 IP 10.0.0.1.44064 > 10.0.0.2.5001: UDP, length 1470
23:35:24.934944 IP 10.0.0.1.44064 > 10.0.0.2.5001: UDP, length 1470
23:35:24.946905 IP 10.0.0.1.44064 > 10.0.0.2.5001: UDP, length 1470
23:35:24.959036 IP 10.0.0.1.44064 > 10.0.0.2.5001: UDP, length 1470
23:35:24.971093 IP 10.0.0.1.44064 > 10.0.0.2.5001: UDP, length 1470
23:35:24.983120 IP 10.0.0.1.44064 > 10.0.0.2.5001: UDP, length 1470
23:35:24.995395 IP 10.0.0.1.44064 > 10.0.0.2.5001: UDP, length 1470
23:35:25.007403 IP 10.0.0.1.44064 > 10.0.0.2.5001: UDP, length 1470
23:35:25.019524 IP 10.0.0.1.44064 > 10.0.0.2.5001: UDP, length 1470
23:35:25.031635 IP 10.0.0.1.44064 > 10.0.0.2.5001: UDP, length 1470
23:35:25.043723 IP 10.0.0.1.44064 > 10.0.0.2.5001: UDP, length 1470
23:35:25.055774 IP 10.0.0.1.44064 > 10.0.0.2.5001: UDP, length 1470
23:35:25.067865 IP 10.0.0.1.44064 > 10.0.0.2.5001: UDP, length 1470
23:35:25.080019 IP 10.0.0.1.44064 > 10.0.0.2.5001: UDP, length 1470
23:35:25.092135 IP 10.0.0.1.44064 > 10.0.0.2.5001: UDP, length 1470
23:35:25.104225 IP 10.0.0.1.44064 > 10.0.0.2.5001: UDP, length 1470
23:35:25.126709 IP 10.0.0.1.44064 > 10.0.0.2.5001: UDP, length 1470
23:35:25.138823 IP 10.0.0.1.44064 > 10.0.0.2.5001: UDP, length 1470
23:35:25.150899 IP 10.0.0.1.44064 > 10.0.0.2.5001: UDP, length 1470
23:35:25.163066 IP 10.0.0.1.44064 > 10.0.0.2.5001: UDP, length 1470
23:35:25.175007 IP 10.0.0.1.44064 > 10.0.0.2.5001: UDP, length 1470
23:35:25.187030 IP 10.0.0.1.44064 > 10.0.0.2.5001: UDP, length 1470
23:35:25.199213 IP 10.0.0.1.44064 > 10.0.0.2.5001: UDP, length 1470
23:35:25.211417 IP 10.0.0.1.44064 > 10.0.0.2.5001: UDP, length 1470
23:35:25.223339 IP 10.0.0.1.44064 > 10.0.0.2.5001: UDP, length 1470
23:35:25.235469 IP 10.0.0.1.44064 > 10.0.0.2.5001: UDP, length 1470
23:35:25.247581 IP 10.0.0.1.44064 > 10.0.0.2.5001: UDP, length 1470
23:35:25.259645 IP 10.0.0.1.44064 > 10.0.0.2.5001: UDP, length 1470
23:35:25.271932 IP 10.0.0.1.44064 > 10.0.0.2.5001: UDP, length 1470
23:35:25.283824 IP 10.0.0.1.44064 > 10.0.0.2.5001: UDP, length 1470
23:35:25.295943 IP 10.0.0.1.44064 > 10.0.0.2.5001: UDP, length 1470
23:35:25.308051 IP 10.0.0.1.44064 > 10.0.0.2.5001: UDP, length 1470
23:35:25.320145 IP 10.0.0.1.44064 > 10.0.0.2.5001: UDP, length 1470
23:35:25.332387 IP 10.0.0.1.44064 > 10.0.0.2.5001: UDP, length 1470
23:35:25.344405 IP 10.0.0.1.44064 > 10.0.0.2.5001: UDP, length 1470
23:35:25.356505 IP 10.0.0.1.44064 > 10.0.0.2.5001: UDP, length 1470
23:35:25.368622 IP 10.0.0.1.44064 > 10.0.0.2.5001: UDP, length 1470
23:35:25.380629 IP 10.0.0.1.44064 > 10.0.0.2.5001: UDP, length 1470
23:35:25.392795 IP 10.0.0.1.44064 > 10.0.0.2.5001: UDP, length 1470
23:35:25.404901 IP 10.0.0.1.44064 > 10.0.0.2.5001: UDP, length 1470
23:35:25.417044 IP 10.0.0.1.44064 > 10.0.0.2.5001: UDP, length 1470
23:35:25.429029 IP 10.0.0.1.44064 > 10.0.0.2.5001: UDP, length 1470
23:35:25.441190 IP 10.0.0.1.44064 > 10.0.0.2.5001: UDP, length 1470
23:35:25.453188 IP 10.0.0.1.44064 > 10.0.0.2.5001: UDP, length 1470
23:35:25.465392 IP 10.0.0.1.44064 > 10.0.0.2.5001: UDP, length 1470
23:35:25.477620 IP 10.0.0.1.44064 > 10.0.0.2.5001: UDP, length 1470
23:35:25.489521 IP 10.0.0.1.44064 > 10.0.0.2.5001: UDP, length 1470
23:35:25.501599 IP 10.0.0.1.44064 > 10.0.0.2.5001: UDP, length 1470
23:35:25.513746 IP 10.0.0.1.44064 > 10.0.0.2.5001: UDP, length 1470
23:35:25.525879 IP 10.0.0.1.44064 > 10.0.0.2.5001: UDP, length 1470
23:35:25.537990 IP 10.0.0.1.44064 > 10.0.0.2.5001: UDP, length 1470
23:35:25.550084 IP 10.0.0.1.44064 > 10.0.0.2.5001: UDP, length 1470
23:35:25.562206 IP 10.0.0.1.44064 > 10.0.0.2.5001: UDP, length 1470
23:35:25.574254 IP 10.0.0.1.44064 > 10.0.0.2.5001: UDP, length 1470
23:35:25.586365 IP 10.0.0.1.44064 > 10.0.0.2.5001: UDP, length 1470
23:35:25.598365 IP 10.0.0.1.44064 > 10.0.0.2.5001: UDP, length 1470
23:35:25.610593 IP 10.0.0.1.44064 > 10.0.0.2.5001: UDP, length 1470
23:35:25.622554 IP 10.0.0.1.44064 > 10.0.0.2.5001: UDP, length 1470
23:35:25.634671 IP 10.0.0.1.44064 > 10.0.0.2.5001: UDP, length 1470
23:35:25.646896 IP 10.0.0.1.44064 > 10.0.0.2.5001: UDP, length 1470
23:35:25.658752 IP 10.0.0.1.44064 > 10.0.0.2.5001: UDP, length 1470
23:35:25.671020 IP 10.0.0.1.44064 > 10.0.0.2.5001: UDP, length 1470
23:35:25.683056 IP 10.0.0.1.44064 > 10.0.0.2.5001: UDP, length 1470
23:35:25.695229 IP 10.0.0.1.44064 > 10.0.0.2.5001: UDP, length 1470
23:35:25.707225 IP 10.0.0.1.44064 > 10.0.0.2.5001: UDP, length 1470
23:35:25.719367 IP 10.0.0.1.44064 > 10.0.0.2.5001: UDP, length 1470
23:35:25.731540 IP 10.0.0.1.44064 > 10.0.0.2.5001: UDP, length 1470
23:35:25.755655 IP 10.0.0.1.44064 > 10.0.0.2.5001: UDP, length 1470
23:35:25.767738 IP 10.0.0.1.44064 > 10.0.0.2.5001: UDP, length 1470
23:35:25.779872 IP 10.0.0.1.44064 > 10.0.0.2.5001: UDP, length 1470
23:35:25.791875 IP 10.0.0.1.44064 > 10.0.0.2.5001: UDP, length 1470
23:35:25.804075 IP 10.0.0.1.44064 > 10.0.0.2.5001: UDP, length 1470
23:35:25.816188 IP 10.0.0.1.44064 > 10.0.0.2.5001: UDP, length 1470
23:35:25.828251 IP 10.0.0.1.44064 > 10.0.0.2.5001: UDP, length 1470
23:35:25.840388 IP 10.0.0.1.44064 > 10.0.0.2.5001: UDP, length 1470
23:35:25.852498 IP 10.0.0.1.44064 > 10.0.0.2.5001: UDP, length 1470
23:35:25.864453 IP 10.0.0.1.44064 > 10.0.0.2.5001: UDP, length 1470
23:35:25.876657 IP 10.0.0.1.44064 > 10.0.0.2.5001: UDP, length 1470
23:35:25.888655 IP 10.0.0.1.44064 > 10.0.0.2.5001: UDP, length 1470
23:35:25.900744 IP 10.0.0.1.44064 > 10.0.0.2.5001: UDP, length 1470
23:35:25.912841 IP 10.0.0.1.44064 > 10.0.0.2.5001: UDP, length 1470
23:35:25.924969 IP 10.0.0.1.44064 > 10.0.0.2.5001: UDP, length 1470
23:35:25.937083 IP 10.0.0.1.44064 > 10.0.0.2.5001: UDP, length 1470
23:35:25.949268 IP 10.0.0.1.44064 > 10.0.0.2.5001: UDP, length 1470
23:35:25.961528 IP 10.0.0.1.44064 > 10.0.0.2.5001: UDP, length 1470
23:35:25.973567 IP 10.0.0.1.44064 > 10.0.0.2.5001: UDP, length 1470
23:35:25.985540 IP 10.0.0.1.44064 > 10.0.0.2.5001: UDP, length 1470
23:35:25.997493 IP 10.0.0.1.44064 > 10.0.0.2.5001: UDP, length 1470
23:35:26.009702 IP 10.0.0.1.44064 > 10.0.0.2.5001: UDP, length 1470
23:35:26.021647 IP 10.0.0.1.44064 > 10.0.0.2.5001: UDP, length 1470
23:35:26.033873 IP 10.0.0.1.44064 > 10.0.0.2.5001: UDP, length 1470
23:35:26.045937 IP 10.0.0.1.44064 > 10.0.0.2.5001: UDP, length 1470
23:35:26.058099 IP 10.0.0.1.44064 > 10.0.0.2.5001: UDP, length 1470
23:35:26.070263 IP 10.0.0.1.44064 > 10.0.0.2.5001: UDP, length 1470
23:35:26.082239 IP 10.0.0.1.44064 > 10.0.0.2.5001: UDP, length 1470
23:35:26.094351 IP 10.0.0.1.44064 > 10.0.0.2.5001: UDP, length 1470
23:35:26.106725 IP 10.0.0.1.44064 > 10.0.0.2.5001: UDP, length 1470
23:35:26.118933 IP 10.0.0.1.44064 > 10.0.0.2.5001: UDP, length 1470
23:35:26.130874 IP 10.0.0.1.44064 > 10.0.0.2.5001: UDP, length 1470
23:35:26.142824 IP 10.0.0.1.44064 > 10.0.0.2.5001: UDP, length 1470
23:35:26.154880 IP 10.0.0.1.44064 > 10.0.0.2.5001: UDP, length 1470
23:35:26.166969 IP 10.0.0.1.44064 > 10.0.0.2.5001: UDP, length 1470
23:35:26.179212 IP 10.0.0.1.44064 > 10.0.0.2.5001: UDP, length 1470
23:35:26.191275 IP 10.0.0.1.44064 > 10.0.0.2.5001: UDP, length 1470
23:35:26.203407 IP 10.0.0.1.44064 > 10.0.0.2.5001: UDP, length 1470
23:35:26.215456 IP 10.0.0.1.44064 > 10.0.0.2.5001: UDP, length 1470
23:35:26.227478 IP 10.0.0.1.44064 > 10.0.0.2.5001: UDP, length 1470
23:35:26.239491 IP 10.0.0.1.44064 > 10.0.0.2.5001: UDP, length 1470
23:35:26.251583 IP 10.0.0.1.44064 > 10.0.0.2.5001: UDP, length 1470
23:35:26.263640 IP 10.0.0.1.44064 > 10.0.0.2.5001: UDP, length 1470
23:35:26.275906 IP 10.0.0.1.44064 > 10.0.0.2.5001: UDP, length 1470
23:35:26.287917 IP 10.0.0.1.44064 > 10.0.0.2.5001: UDP, length 1470
23:35:26.312079 IP 10.0.0.1.44064 > 10.0.0.2.5001: UDP, length 1470
23:35:26.324200 IP 10.0.0.1.44064 > 10.0.0.2.5001: UDP, length 1470
23:35:26.336194 IP 10.0.0.1.44064 > 10.0.0.2.5001: UDP, length 1470
23:35:26.348392 IP 10.0.0.1.44064 > 10.0.0.2.5001: UDP, length 1470
23:35:26.360440 IP 10.0.0.1.44064 > 10.0.0.2.5001: UDP, length 1470
23:35:26.372599 IP 10.0.0.1.44064 > 10.0.0.2.5001: UDP, length 1470
23:35:26.384740 IP 10.0.0.1.44064 > 10.0.0.2.5001: UDP, length 1470
23:35:26.396791 IP 10.0.0.1.44064 > 10.0.0.2.5001: UDP, length 1470
23:35:26.408823 IP 10.0.0.1.44064 > 10.0.0.2.5001: UDP, length 1470
23:35:26.420836 IP 10.0.0.1.44064 > 10.0.0.2.5001: UDP, length 1470
23:35:26.433058 IP 10.0.0.1.44064 > 10.0.0.2.5001: UDP, length 1470
23:35:26.445205 IP 10.0.0.1.44064 > 10.0.0.2.5001: UDP, length 1470
23:35:26.457268 IP 10.0.0.1.44064 > 10.0.0.2.5001: UDP, length 1470
23:35:26.469490 IP 10.0.0.1.44064 > 10.0.0.2.5001: UDP, length 1470
23:35:26.481377 IP 10.0.0.1.44064 > 10.0.0.2.5001: UDP, length 1470
23:35:26.493570 IP 10.0.0.1.44064 > 10.0.0.2.5001: UDP, length 1470
23:35:26.505669 IP 10.0.0.1.44064 > 10.0.0.2.5001: UDP, length 1470
23:35:26.517794 IP 10.0.0.1.44064 > 10.0.0.2.5001: UDP, length 1470
23:35:26.541940 IP 10.0.0.1.44064 > 10.0.0.2.5001: UDP, length 1470
23:35:26.554075 IP 10.0.0.1.44064 > 10.0.0.2.5001: UDP, length 1470
23:35:26.566102 IP 10.0.0.1.44064 > 10.0.0.2.5001: UDP, length 1470
23:35:26.578278 IP 10.0.0.1.44064 > 10.0.0.2.5001: UDP, length 1470
23:35:26.590297 IP 10.0.0.1.44064 > 10.0.0.2.5001: UDP, length 1470
23:35:26.602432 IP 10.0.0.1.44064 > 10.0.0.2.5001: UDP, length 1470
23:35:26.614526 IP 10.0.0.1.44064 > 10.0.0.2.5001: UDP, length 1470
23:35:26.626592 IP 10.0.0.1.44064 > 10.0.0.2.5001: UDP, length 1470
23:35:26.638795 IP 10.0.0.1.44064 > 10.0.0.2.5001: UDP, length 1470
23:35:26.650804 IP 10.0.0.1.44064 > 10.0.0.2.5001: UDP, length 1470
23:35:26.662900 IP 10.0.0.1.44064 > 10.0.0.2.5001: UDP, length 1470
23:35:26.674917 IP 10.0.0.1.44064 > 10.0.0.2.5001: UDP, length 1470
23:35:26.699241 IP 10.0.0.1.44064 > 10.0.0.2.5001: UDP, length 1470
23:35:26.711264 IP 10.0.0.1.44064 > 10.0.0.2.5001: UDP, length 1470
23:35:26.723444 IP 10.0.0.1.44064 > 10.0.0.2.5001: UDP, length 1470
23:35:26.735399 IP 10.0.0.1.44064 > 10.0.0.2.5001: UDP, length 1470
23:35:26.747467 IP 10.0.0.1.44064 > 10.0.0.2.5001: UDP, length 1470
23:35:26.759655 IP 10.0.0.1.44064 > 10.0.0.2.5001: UDP, length 1470
23:35:26.771767 IP 10.0.0.1.44064 > 10.0.0.2.5001: UDP, length 1470
23:35:26.783728 IP 10.0.0.1.44064 > 10.0.0.2.5001: UDP, length 1470
23:35:26.795909 IP 10.0.0.1.44064 > 10.0.0.2.5001: UDP, length 1470
23:35:26.808093 IP 10.0.0.1.44064 > 10.0.0.2.5001: UDP, length 1470
23:35:26.820105 IP 10.0.0.1.44064 > 10.0.0.2.5001: UDP, length 1470
23:35:26.832273 IP 10.0.0.1.44064 > 10.0.0.2.5001: UDP, length 1470
23:35:26.844331 IP 10.0.0.1.44064 > 10.0.0.2.5001: UDP, length 1470
23:35:26.856474 IP 10.0.0.1.44064 > 10.0.0.2.5001: UDP, length 1470
23:35:26.868730 IP 10.0.0.1.44064 > 10.0.0.2.5001: UDP, length 1470
23:35:26.880541 IP 10.0.0.1.44064 > 10.0.0.2.5001: UDP, length 1470
23:35:26.892884 IP 10.0.0.1.44064 > 10.0.0.2.5001: UDP, length 1470
23:35:26.905599 IP 10.0.0.1.44064 > 10.0.0.2.5001: UDP, length 1470
23:35:26.916954 IP 10.0.0.1.44064 > 10.0.0.2.5001: UDP, length 1470
23:35:26.928969 IP 10.0.0.1.44064 > 10.0.0.2.5001: UDP, length 1470
23:35:26.941025 IP 10.0.0.1.44064 > 10.0.0.2.5001: UDP, length 1470
23:35:26.953205 IP 10.0.0.1.44064 > 10.0.0.2.5001: UDP, length 1470
23:35:26.965463 IP 10.0.0.1.44064 > 10.0.0.2.5001: UDP, length 1470
23:35:26.977561 IP 10.0.0.1.44064 > 10.0.0.2.5001: UDP, length 1470
23:35:26.989393 IP 10.0.0.1.44064 > 10.0.0.2.5001: UDP, length 1470
23:35:27.001676 IP 10.0.0.1.44064 > 10.0.0.2.5001: UDP, length 1470
23:35:27.013808 IP 10.0.0.1.44064 > 10.0.0.2.5001: UDP, length 1470
23:35:27.025883 IP 10.0.0.1.44064 > 10.0.0.2.5001: UDP, length 1470
23:35:27.038046 IP 10.0.0.1.44064 > 10.0.0.2.5001: UDP, length 1470
23:35:27.050046 IP 10.0.0.1.44064 > 10.0.0.2.5001: UDP, length 1470
23:35:27.061998 IP 10.0.0.1.44064 > 10.0.0.2.5001: UDP, length 1470
23:35:27.074059 IP 10.0.0.1.44064 > 10.0.0.2.5001: UDP, length 1470
23:35:27.086196 IP 10.0.0.1.44064 > 10.0.0.2.5001: UDP, length 1470
23:35:27.098240 IP 10.0.0.1.44064 > 10.0.0.2.5001: UDP, length 1470
23:35:27.110419 IP 10.0.0.1.44064 > 10.0.0.2.5001: UDP, length 1470
23:35:27.122510 IP 10.0.0.1.44064 > 10.0.0.2.5001: UDP, length 1470
23:35:27.134555 IP 10.0.0.1.44064 > 10.0.0.2.5001: UDP, length 1470
23:35:27.146700 IP 10.0.0.1.44064 > 10.0.0.2.5001: UDP, length 1470
23:35:27.158711 IP 10.0.0.1.44064 > 10.0.0.2.5001: UDP, length 1470
23:35:27.170869 IP 10.0.0.1.44064 > 10.0.0.2.5001: UDP, length 1470
23:35:27.183027 IP 10.0.0.1.44064 > 10.0.0.2.5001: UDP, length 1470
23:35:27.195155 IP 10.0.0.1.44064 > 10.0.0.2.5001: UDP, length 1470
23:35:27.207291 IP 10.0.0.1.44064 > 10.0.0.2.5001: UDP, length 1470
23:35:27.219226 IP 10.0.0.1.44064 > 10.0.0.2.5001: UDP, length 1470
23:35:27.231437 IP 10.0.0.1.44064 > 10.0.0.2.5001: UDP, length 1470
23:35:27.243477 IP 10.0.0.1.44064 > 10.0.0.2.5001: UDP, length 1470
23:35:27.255636 IP 10.0.0.1.44064 > 10.0.0.2.5001: UDP, length 1470
23:35:27.267614 IP 10.0.0.1.44064 > 10.0.0.2.5001: UDP, length 1470
23:35:27.279799 IP 10.0.0.1.44064 > 10.0.0.2.5001: UDP, length 1470
23:35:27.291894 IP 10.0.0.1.44064 > 10.0.0.2.5001: UDP, length 1470
23:35:27.303974 IP 10.0.0.1.44064 > 10.0.0.2.5001: UDP, length 1470
23:35:27.316153 IP 10.0.0.1.44064 > 10.0.0.2.5001: UDP, length 1470
23:35:27.328107 IP 10.0.0.1.44064 > 10.0.0.2.5001: UDP, length 1470
23:35:27.340166 IP 10.0.0.1.44064 > 10.0.0.2.5001: UDP, length 1470
23:35:27.352362 IP 10.0.0.1.44064 > 10.0.0.2.5001: UDP, length 1470
23:35:27.364478 IP 10.0.0.1.44064 > 10.0.0.2.5001: UDP, length 1470
23:35:27.376637 IP 10.0.0.1.44064 > 10.0.0.2.5001: UDP, length 1470
23:35:27.388609 IP 10.0.0.1.44064 > 10.0.0.2.5001: UDP, length 1470
23:35:27.400710 IP 10.0.0.1.44064 > 10.0.0.2.5001: UDP, length 1470
23:35:27.412763 IP 10.0.0.1.44064 > 10.0.0.2.5001: UDP, length 1470
23:35:27.425001 IP 10.0.0.1.44064 > 10.0.0.2.5001: UDP, length 1470
23:35:27.436991 IP 10.0.0.1.44064 > 10.0.0.2.5001: UDP, length 1470
23:35:27.449152 IP 10.0.0.1.44064 > 10.0.0.2.5001: UDP, length 1470
23:35:27.461254 IP 10.0.0.1.44064 > 10.0.0.2.5001: UDP, length 1470
23:35:27.473134 IP 10.0.0.1.44064 > 10.0.0.2.5001: UDP, length 1470
23:35:27.485462 IP 10.0.0.1.44064 > 10.0.0.2.5001: UDP, length 1470
23:35:27.497500 IP 10.0.0.1.44064 > 10.0.0.2.5001: UDP, length 1470
23:35:27.509611 IP 10.0.0.1.44064 > 10.0.0.2.5001: UDP, length 1470
23:35:27.521707 IP 10.0.0.1.44064 > 10.0.0.2.5001: UDP, length 1470
23:35:27.533693 IP 10.0.0.1.44064 > 10.0.0.2.5001: UDP, length 1470
23:35:27.545872 IP 10.0.0.1.44064 > 10.0.0.2.5001: UDP, length 1470
23:35:27.557956 IP 10.0.0.1.44064 > 10.0.0.2.5001: UDP, length 1470
23:35:27.570137 IP 10.0.0.1.44064 > 10.0.0.2.5001: UDP, length 1470
23:35:27.582176 IP 10.0.0.1.44064 > 10.0.0.2.5001: UDP, length 1470
23:35:27.594246 IP 10.0.0.1.44064 > 10.0.0.2.5001: UDP, length 1470
23:35:27.606304 IP 10.0.0.1.44064 > 10.0.0.2.5001: UDP, length 1470
23:35:27.618452 IP 10.0.0.1.44064 > 10.0.0.2.5001: UDP, length 1470
23:35:27.630638 IP 10.0.0.1.44064 > 10.0.0.2.5001: UDP, length 1470
23:35:27.642655 IP 10.0.0.1.44064 > 10.0.0.2.5001: UDP, length 1470
23:35:27.654854 IP 10.0.0.1.44064 > 10.0.0.2.5001: UDP, length 1470
23:35:27.666820 IP 10.0.0.1.44064 > 10.0.0.2.5001: UDP, length 1470
23:35:27.678979 IP 10.0.0.1.44064 > 10.0.0.2.5001: UDP, length 1470
23:35:27.691101 IP 10.0.0.1.44064 > 10.0.0.2.5001: UDP, length 1470
23:35:27.703168 IP 10.0.0.1.44064 > 10.0.0.2.5001: UDP, length 1470
23:35:27.715364 IP 10.0.0.1.44064 > 10.0.0.2.5001: UDP, length 1470
23:35:27.727196 IP 10.0.0.1.44064 > 10.0.0.2.5001: UDP, length 1470
23:35:27.739349 IP 10.0.0.1.44064 > 10.0.0.2.5001: UDP, length 1470
23:35:27.751542 IP 10.0.0.1.44064 > 10.0.0.2.5001: UDP, length 1470
23:35:27.763669 IP 10.0.0.1.44064 > 10.0.0.2.5001: UDP, length 1470
23:35:27.775703 IP 10.0.0.1.44064 > 10.0.0.2.5001: UDP, length 1470
23:35:27.787805 IP 10.0.0.1.44064 > 10.0.0.2.5001: UDP, length 1470
23:35:27.799882 IP 10.0.0.1.44064 > 10.0.0.2.5001: UDP, length 1470
23:35:27.811972 IP 10.0.0.1.44064 > 10.0.0.2.5001: UDP, length 1470
23:35:27.824159 IP 10.0.0.1.44064 > 10.0.0.2.5001: UDP, length 1470
23:35:27.836147 IP 10.0.0.1.44064 > 10.0.0.2.5001: UDP, length 1470
23:35:27.848306 IP 10.0.0.1.44064 > 10.0.0.2.5001: UDP, length 1470
23:35:27.860417 IP 10.0.0.1.44064 > 10.0.0.2.5001: UDP, length 1470
23:35:27.872402 IP 10.0.0.1.44064 > 10.0.0.2.5001: UDP, length 1470
23:35:27.884483 IP 10.0.0.1.44064 > 10.0.0.2.5001: UDP, length 1470
23:35:27.896530 IP 10.0.0.1.44064 > 10.0.0.2.5001: UDP, length 1470
23:35:27.908600 IP 10.0.0.1.44064 > 10.0.0.2.5001: UDP, length 1470
23:35:27.920733 IP 10.0.0.1.44064 > 10.0.0.2.5001: UDP, length 1470
23:35:27.932887 IP 10.0.0.1.44064 > 10.0.0.2.5001: UDP, length 1470
23:35:27.945013 IP 10.0.0.1.44064 > 10.0.0.2.5001: UDP, length 1470
23:35:27.957143 IP 10.0.0.1.44064 > 10.0.0.2.5001: UDP, length 1470
23:35:27.969285 IP 10.0.0.1.44064 > 10.0.0.2.5001: UDP, length 1470
23:35:27.981279 IP 10.0.0.1.44064 > 10.0.0.2.5001: UDP, length 1470
23:35:27.993478 IP 10.0.0.1.44064 > 10.0.0.2.5001: UDP, length 1470
23:35:28.005465 IP 10.0.0.1.44064 > 10.0.0.2.5001: UDP, length 1470
23:35:28.017620 IP 10.0.0.1.44064 > 10.0.0.2.5001: UDP, length 1470
23:35:28.029746 IP 10.0.0.1.44064 > 10.0.0.2.5001: UDP, length 1470
23:35:28.041803 IP 10.0.0.1.44064 > 10.0.0.2.5001: UDP, length 1470
23:35:28.053948 IP 10.0.0.1.44064 > 10.0.0.2.5001: UDP, length 1470
23:35:28.065963 IP 10.0.0.1.44064 > 10.0.0.2.5001: UDP, length 1470
23:35:28.078112 IP 10.0.0.1.44064 > 10.0.0.2.5001: UDP, length 1470
23:35:28.090258 IP 10.0.0.1.44064 > 10.0.0.2.5001: UDP, length 1470
23:35:28.102537 IP 10.0.0.1.44064 > 10.0.0.2.5001: UDP, length 1470
23:35:28.114435 IP 10.0.0.1.44064 > 10.0.0.2.5001: UDP, length 1470
23:35:28.126488 IP 10.0.0.1.44064 > 10.0.0.2.5001: UDP, length 1470
23:35:28.138643 IP 10.0.0.1.44064 > 10.0.0.2.5001: UDP, length 1470
23:35:28.150716 IP 10.0.0.1.44064 > 10.0.0.2.5001: UDP, length 1470
23:35:28.162864 IP 10.0.0.1.44064 > 10.0.0.2.5001: UDP, length 1470
23:35:28.174833 IP 10.0.0.1.44064 > 10.0.0.2.5001: UDP, length 1470
23:35:28.187000 IP 10.0.0.1.44064 > 10.0.0.2.5001: UDP, length 1470
23:35:28.199136 IP 10.0.0.1.44064 > 10.0.0.2.5001: UDP, length 1470
23:35:28.211177 IP 10.0.0.1.44064 > 10.0.0.2.5001: UDP, length 1470
23:35:28.223332 IP 10.0.0.1.44064 > 10.0.0.2.5001: UDP, length 1470
23:35:28.235322 IP 10.0.0.1.44064 > 10.0.0.2.5001: UDP, length 1470
23:35:28.247422 IP 10.0.0.1.44064 > 10.0.0.2.5001: UDP, length 1470
23:35:28.259594 IP 10.0.0.1.44064 > 10.0.0.2.5001: UDP, length 1470
23:35:28.271712 IP 10.0.0.1.44064 > 10.0.0.2.5001: UDP, length 1470
23:35:28.283761 IP 10.0.0.1.44064 > 10.0.0.2.5001: UDP, length 1470
23:35:28.295714 IP 10.0.0.1.44064 > 10.0.0.2.5001: UDP, length 1470
23:35:28.307928 IP 10.0.0.1.44064 > 10.0.0.2.5001: UDP, length 1470
23:35:28.320009 IP 10.0.0.1.44064 > 10.0.0.2.5001: UDP, length 1470
23:35:28.332198 IP 10.0.0.1.44064 > 10.0.0.2.5001: UDP, length 1470
23:35:28.344258 IP 10.0.0.1.44064 > 10.0.0.2.5001: UDP, length 1470
23:35:28.356331 IP 10.0.0.1.44064 > 10.0.0.2.5001: UDP, length 1470
23:35:28.368480 IP 10.0.0.1.44064 > 10.0.0.2.5001: UDP, length 1470
23:35:28.380375 IP 10.0.0.1.44064 > 10.0.0.2.5001: UDP, length 1470
23:35:28.392676 IP 10.0.0.1.44064 > 10.0.0.2.5001: UDP, length 1470
23:35:28.404602 IP 10.0.0.1.44064 > 10.0.0.2.5001: UDP, length 1470
23:35:28.416825 IP 10.0.0.1.44064 > 10.0.0.2.5001: UDP, length 1470
23:35:28.428941 IP 10.0.0.1.44064 > 10.0.0.2.5001: UDP, length 1470
23:35:28.440999 IP 10.0.0.1.44064 > 10.0.0.2.5001: UDP, length 1470
23:35:28.453140 IP 10.0.0.1.44064 > 10.0.0.2.5001: UDP, length 1470
23:35:28.465149 IP 10.0.0.1.44064 > 10.0.0.2.5001: UDP, length 1470
23:35:28.477498 IP 10.0.0.1.44064 > 10.0.0.2.5001: UDP, length 1470
23:35:28.501602 IP 10.0.0.1.44064 > 10.0.0.2.5001: UDP, length 1470
23:35:28.513706 IP 10.0.0.1.44064 > 10.0.0.2.5001: UDP, length 1470
23:35:28.525922 IP 10.0.0.1.44064 > 10.0.0.2.5001: UDP, length 1470
23:35:28.538095 IP 10.0.0.1.44064 > 10.0.0.2.5001: UDP, length 1470
23:35:28.550168 IP 10.0.0.1.44064 > 10.0.0.2.5001: UDP, length 1470
23:35:28.562258 IP 10.0.0.1.44064 > 10.0.0.2.5001: UDP, length 1470
23:35:28.574379 IP 10.0.0.1.44064 > 10.0.0.2.5001: UDP, length 1470
23:35:28.586291 IP 10.0.0.1.44064 > 10.0.0.2.5001: UDP, length 1470
23:35:28.598478 IP 10.0.0.1.44064 > 10.0.0.2.5001: UDP, length 1470
23:35:28.610647 IP 10.0.0.1.44064 > 10.0.0.2.5001: UDP, length 1470
23:35:28.622559 IP 10.0.0.1.44064 > 10.0.0.2.5001: UDP, length 1470
23:35:28.634721 IP 10.0.0.1.44064 > 10.0.0.2.5001: UDP, length 1470
23:35:28.647281 IP 10.0.0.1.44064 > 10.0.0.2.5001: UDP, length 1470
23:35:28.659179 IP 10.0.0.1.44064 > 10.0.0.2.5001: UDP, length 1470
23:35:28.670995 IP 10.0.0.1.44064 > 10.0.0.2.5001: UDP, length 1470
23:35:28.683138 IP 10.0.0.1.44064 > 10.0.0.2.5001: UDP, length 1470
23:35:28.695431 IP 10.0.0.1.44064 > 10.0.0.2.5001: UDP, length 1470
23:35:28.707317 IP 10.0.0.1.44064 > 10.0.0.2.5001: UDP, length 1470
23:35:28.719482 IP 10.0.0.1.44064 > 10.0.0.2.5001: UDP, length 1470
23:35:28.731615 IP 10.0.0.1.44064 > 10.0.0.2.5001: UDP, length 1470
23:35:28.743389 IP 10.0.0.1.44064 > 10.0.0.2.5001: UDP, length 1470
23:35:28.755534 IP 10.0.0.1.44064 > 10.0.0.2.5001: UDP, length 1470
23:35:28.767717 IP 10.0.0.1.44064 > 10.0.0.2.5001: UDP, length 1470
23:35:28.779909 IP 10.0.0.1.44064 > 10.0.0.2.5001: UDP, length 1470
23:35:28.792049 IP 10.0.0.1.44064 > 10.0.0.2.5001: UDP, length 1470
23:35:28.803904 IP 10.0.0.1.44064 > 10.0.0.2.5001: UDP, length 1470
23:35:28.816012 IP 10.0.0.1.44064 > 10.0.0.2.5001: UDP, length 1470
23:35:28.828158 IP 10.0.0.1.44064 > 10.0.0.2.5001: UDP, length 1470
23:35:28.840377 IP 10.0.0.1.44064 > 10.0.0.2.5001: UDP, length 1470
23:35:28.852442 IP 10.0.0.1.44064 > 10.0.0.2.5001: UDP, length 1470
23:35:28.864562 IP 10.0.0.1.44064 > 10.0.0.2.5001: UDP, length 1470
23:35:28.876477 IP 10.0.0.1.44064 > 10.0.0.2.5001: UDP, length 1470
23:35:28.888658 IP 10.0.0.1.44064 > 10.0.0.2.5001: UDP, length 1470
23:35:28.900756 IP 10.0.0.1.44064 > 10.0.0.2.5001: UDP, length 1470
23:35:28.912893 IP 10.0.0.1.44064 > 10.0.0.2.5001: UDP, length 1470
23:35:28.924955 IP 10.0.0.1.44064 > 10.0.0.2.5001: UDP, length 1470
23:35:28.937019 IP 10.0.0.1.44064 > 10.0.0.2.5001: UDP, length 1470
23:35:28.949077 IP 10.0.0.1.44064 > 10.0.0.2.5001: UDP, length 1470
23:35:28.961194 IP 10.0.0.1.44064 > 10.0.0.2.5001: UDP, length 1470
23:35:28.973282 IP 10.0.0.1.44064 > 10.0.0.2.5001: UDP, length 1470
23:35:28.985377 IP 10.0.0.1.44064 > 10.0.0.2.5001: UDP, length 1470
23:35:28.997330 IP 10.0.0.1.44064 > 10.0.0.2.5001: UDP, length 1470
23:35:29.009435 IP 10.0.0.1.44064 > 10.0.0.2.5001: UDP, length 1470
23:35:29.021622 IP 10.0.0.1.44064 > 10.0.0.2.5001: UDP, length 1470
23:35:29.033766 IP 10.0.0.1.44064 > 10.0.0.2.5001: UDP, length 1470
23:35:29.045860 IP 10.0.0.1.44064 > 10.0.0.2.5001: UDP, length 1470
23:35:29.058142 IP 10.0.0.1.44064 > 10.0.0.2.5001: UDP, length 1470
23:35:29.070287 IP 10.0.0.1.44064 > 10.0.0.2.5001: UDP, length 1470
23:35:29.082062 IP 10.0.0.1.44064 > 10.0.0.2.5001: UDP, length 1470
23:35:29.106425 IP 10.0.0.1.44064 > 10.0.0.2.5001: UDP, length 1470
23:35:29.118611 IP 10.0.0.1.44064 > 10.0.0.2.5001: UDP, length 1470
23:35:29.130736 IP 10.0.0.1.44064 > 10.0.0.2.5001: UDP, length 1470
23:35:29.142866 IP 10.0.0.1.44064 > 10.0.0.2.5001: UDP, length 1470
23:35:29.154759 IP 10.0.0.1.44064 > 10.0.0.2.5001: UDP, length 1470
23:35:29.166828 IP 10.0.0.1.44064 > 10.0.0.2.5001: UDP, length 1470
23:35:29.179531 IP 10.0.0.1.44064 > 10.0.0.2.5001: UDP, length 1470
23:35:29.191151 IP 10.0.0.1.44064 > 10.0.0.2.5001: UDP, length 1470
23:35:29.203248 IP 10.0.0.1.44064 > 10.0.0.2.5001: UDP, length 1470
23:35:29.215388 IP 10.0.0.1.44064 > 10.0.0.2.5001: UDP, length 1470
23:35:29.227364 IP 10.0.0.1.44064 > 10.0.0.2.5001: UDP, length 1470
23:35:29.239504 IP 10.0.0.1.44064 > 10.0.0.2.5001: UDP, length 1470
23:35:29.251590 IP 10.0.0.1.44064 > 10.0.0.2.5001: UDP, length 1470
23:35:29.263706 IP 10.0.0.1.44064 > 10.0.0.2.5001: UDP, length 1470
23:35:29.275786 IP 10.0.0.1.44064 > 10.0.0.2.5001: UDP, length 1470
23:35:29.287931 IP 10.0.0.1.44064 > 10.0.0.2.5001: UDP, length 1470
23:35:29.300114 IP 10.0.0.1.44064 > 10.0.0.2.5001: UDP, length 1470
23:35:29.312214 IP 10.0.0.1.44064 > 10.0.0.2.5001: UDP, length 1470
23:35:29.324292 IP 10.0.0.1.44064 > 10.0.0.2.5001: UDP, length 1470
23:35:29.336448 IP 10.0.0.1.44064 > 10.0.0.2.5001: UDP, length 1470
23:35:29.348403 IP 10.0.0.1.44064 > 10.0.0.2.5001: UDP, length 1470
23:35:29.360498 IP 10.0.0.1.44064 > 10.0.0.2.5001: UDP, length 1470
23:35:29.372471 IP 10.0.0.1.44064 > 10.0.0.2.5001: UDP, length 1470
23:35:29.384683 IP 10.0.0.1.44064 > 10.0.0.2.5001: UDP, length 1470
23:35:29.396837 IP 10.0.0.1.44064 > 10.0.0.2.5001: UDP, length 1470
23:35:29.409158 IP 10.0.0.1.44064 > 10.0.0.2.5001: UDP, length 1470
23:35:29.421118 IP 10.0.0.1.44064 > 10.0.0.2.5001: UDP, length 1470
23:35:29.433388 IP 10.0.0.1.44064 > 10.0.0.2.5001: UDP, length 1470
23:35:29.454335 IP 10.0.0.1.44064 > 10.0.0.2.5001: UDP, length 1470
23:35:29.462271 IP 10.0.0.1.44064 > 10.0.0.2.5001: UDP, length 1470
23:35:29.469202 IP 10.0.0.1.44064 > 10.0.0.2.5001: UDP, length 1470
23:35:29.481321 IP 10.0.0.1.44064 > 10.0.0.2.5001: UDP, length 1470
23:35:29.493336 IP 10.0.0.1.44064 > 10.0.0.2.5001: UDP, length 1470
23:35:29.505496 IP 10.0.0.1.44064 > 10.0.0.2.5001: UDP, length 1470
23:35:29.517658 IP 10.0.0.1.44064 > 10.0.0.2.5001: UDP, length 1470
23:35:29.529808 IP 10.0.0.1.44064 > 10.0.0.2.5001: UDP, length 1470
23:35:29.541977 IP 10.0.0.1.44064 > 10.0.0.2.5001: UDP, length 1470
23:35:29.554042 IP 10.0.0.1.44064 > 10.0.0.2.5001: UDP, length 1470
23:35:29.565946 IP 10.0.0.1.44064 > 10.0.0.2.5001: UDP, length 1470
23:35:29.578092 IP 10.0.0.1.44064 > 10.0.0.2.5001: UDP, length 1470
23:35:29.590269 IP 10.0.0.1.44064 > 10.0.0.2.5001: UDP, length 1470
23:35:29.602382 IP 10.0.0.1.44064 > 10.0.0.2.5001: UDP, length 1470
23:35:29.614487 IP 10.0.0.1.44064 > 10.0.0.2.5001: UDP, length 1470
23:35:29.626505 IP 10.0.0.1.44064 > 10.0.0.2.5001: UDP, length 1470
23:35:29.638574 IP 10.0.0.1.44064 > 10.0.0.2.5001: UDP, length 1470
23:35:29.650713 IP 10.0.0.1.44064 > 10.0.0.2.5001: UDP, length 1470
23:35:29.662897 IP 10.0.0.1.44064 > 10.0.0.2.5001: UDP, length 1470
23:35:29.674858 IP 10.0.0.1.44064 > 10.0.0.2.5001: UDP, length 1470
23:35:29.687044 IP 10.0.0.1.44064 > 10.0.0.2.5001: UDP, length 1470
23:35:29.698979 IP 10.0.0.1.44064 > 10.0.0.2.5001: UDP, length 1470
23:35:29.711148 IP 10.0.0.1.44064 > 10.0.0.2.5001: UDP, length 1470
23:35:29.723196 IP 10.0.0.1.44064 > 10.0.0.2.5001: UDP, length 1470
23:35:29.735314 IP 10.0.0.1.44064 > 10.0.0.2.5001: UDP, length 1470
23:35:29.747320 IP 10.0.0.1.44064 > 10.0.0.2.5001: UDP, length 1470
23:35:29.759328 IP 10.0.0.1.44064 > 10.0.0.2.5001: UDP, length 1470
23:35:29.771549 IP 10.0.0.1.44064 > 10.0.0.2.5001: UDP, length 1470
23:35:29.783748 IP 10.0.0.1.44064 > 10.0.0.2.5001: UDP, length 1470
23:35:29.795789 IP 10.0.0.1.44064 > 10.0.0.2.5001: UDP, length 1470
23:35:29.807993 IP 10.0.0.1.44064 > 10.0.0.2.5001: UDP, length 1470
23:35:29.820191 IP 10.0.0.1.44064 > 10.0.0.2.5001: UDP, length 1470
23:35:29.832346 IP 10.0.0.1.44064 > 10.0.0.2.5001: UDP, length 1470
23:35:29.844216 IP 10.0.0.1.44064 > 10.0.0.2.5001: UDP, length 1470
23:35:29.856233 IP 10.0.0.1.44064 > 10.0.0.2.5001: UDP, length 1470
23:35:29.868488 IP 10.0.0.1.44064 > 10.0.0.2.5001: UDP, length 1470
23:35:29.880625 IP 10.0.0.1.44064 > 10.0.0.2.5001: UDP, length 1470
23:35:29.892734 IP 10.0.0.1.44064 > 10.0.0.2.5001: UDP, length 1470
23:35:29.904862 IP 10.0.0.1.44064 > 10.0.0.2.5001: UDP, length 1470
23:35:29.916638 IP 10.0.0.1.44064 > 10.0.0.2.5001: UDP, length 1470
23:35:29.928818 IP 10.0.0.1.44064 > 10.0.0.2.5001: UDP, length 1470
23:35:29.940981 IP 10.0.0.1.44064 > 10.0.0.2.5001: UDP, length 1470
23:35:29.953105 IP 10.0.0.1.44064 > 10.0.0.2.5001: UDP, length 1470
23:35:29.965149 IP 10.0.0.1.44064 > 10.0.0.2.5001: UDP, length 1470
23:35:29.977161 IP 10.0.0.1.44064 > 10.0.0.2.5001: UDP, length 1470
23:35:29.989244 IP 10.0.0.1.44064 > 10.0.0.2.5001: UDP, length 1470
23:35:30.001527 IP 10.0.0.1.44064 > 10.0.0.2.5001: UDP, length 1470
23:35:30.013653 IP 10.0.0.1.44064 > 10.0.0.2.5001: UDP, length 1470
23:35:30.025681 IP 10.0.0.1.44064 > 10.0.0.2.5001: UDP, length 1470
23:35:30.037740 IP 10.0.0.1.44064 > 10.0.0.2.5001: UDP, length 1470
23:35:30.049812 IP 10.0.0.1.44064 > 10.0.0.2.5001: UDP, length 1470
23:35:30.062013 IP 10.0.0.1.44064 > 10.0.0.2.5001: UDP, length 1470
23:35:30.073950 IP 10.0.0.1.44064 > 10.0.0.2.5001: UDP, length 1470
23:35:30.086068 IP 10.0.0.1.44064 > 10.0.0.2.5001: UDP, length 1470
23:35:30.098157 IP 10.0.0.1.44064 > 10.0.0.2.5001: UDP, length 1470
23:35:30.110242 IP 10.0.0.1.44064 > 10.0.0.2.5001: UDP, length 1470
23:35:30.122279 IP 10.0.0.1.44064 > 10.0.0.2.5001: UDP, length 1470
23:35:30.134395 IP 10.0.0.1.44064 > 10.0.0.2.5001: UDP, length 1470
23:35:30.146711 IP 10.0.0.1.44064 > 10.0.0.2.5001: UDP, length 1470
23:35:30.158873 IP 10.0.0.1.44064 > 10.0.0.2.5001: UDP, length 1470
23:35:30.170870 IP 10.0.0.1.44064 > 10.0.0.2.5001: UDP, length 1470
23:35:30.182886 IP 10.0.0.1.44064 > 10.0.0.2.5001: UDP, length 1470
23:35:30.194936 IP 10.0.0.1.44064 > 10.0.0.2.5001: UDP, length 1470
23:35:30.207112 IP 10.0.0.1.44064 > 10.0.0.2.5001: UDP, length 1470
23:35:30.219261 IP 10.0.0.1.44064 > 10.0.0.2.5001: UDP, length 1470
23:35:30.231469 IP 10.0.0.1.44064 > 10.0.0.2.5001: UDP, length 1470
23:35:30.243629 IP 10.0.0.1.44064 > 10.0.0.2.5001: UDP, length 1470
23:35:30.255378 IP 10.0.0.1.44064 > 10.0.0.2.5001: UDP, length 1470
23:35:30.267547 IP 10.0.0.1.44064 > 10.0.0.2.5001: UDP, length 1470
23:35:30.279752 IP 10.0.0.1.44064 > 10.0.0.2.5001: UDP, length 1470
23:35:30.291937 IP 10.0.0.1.44064 > 10.0.0.2.5001: UDP, length 1470
23:35:30.304071 IP 10.0.0.1.44064 > 10.0.0.2.5001: UDP, length 1470
23:35:30.315991 IP 10.0.0.1.44064 > 10.0.0.2.5001: UDP, length 1470
23:35:30.327937 IP 10.0.0.1.44064 > 10.0.0.2.5001: UDP, length 1470
23:35:30.340160 IP 10.0.0.1.44064 > 10.0.0.2.5001: UDP, length 1470
23:35:30.352306 IP 10.0.0.1.44064 > 10.0.0.2.5001: UDP, length 1470
23:35:30.364452 IP 10.0.0.1.44064 > 10.0.0.2.5001: UDP, length 1470
23:35:30.376513 IP 10.0.0.1.44064 > 10.0.0.2.5001: UDP, length 1470
23:35:30.388643 IP 10.0.0.1.44064 > 10.0.0.2.5001: UDP, length 1470
23:35:30.400576 IP 10.0.0.1.44064 > 10.0.0.2.5001: UDP, length 1470
23:35:30.412737 IP 10.0.0.1.44064 > 10.0.0.2.5001: UDP, length 1470
23:35:30.424858 IP 10.0.0.1.44064 > 10.0.0.2.5001: UDP, length 1470
23:35:30.436937 IP 10.0.0.1.44064 > 10.0.0.2.5001: UDP, length 1470
23:35:30.448951 IP 10.0.0.1.44064 > 10.0.0.2.5001: UDP, length 1470
23:35:30.461053 IP 10.0.0.1.44064 > 10.0.0.2.5001: UDP, length 1470
23:35:30.474904 IP 10.0.0.1.44064 > 10.0.0.2.5001: UDP, length 1470
23:35:30.485341 IP 10.0.0.1.44064 > 10.0.0.2.5001: UDP, length 1470
23:35:30.497221 IP 10.0.0.1.44064 > 10.0.0.2.5001: UDP, length 1470
23:35:30.509382 IP 10.0.0.1.44064 > 10.0.0.2.5001: UDP, length 1470
23:35:30.521672 IP 10.0.0.1.44064 > 10.0.0.2.5001: UDP, length 1470
23:35:30.533556 IP 10.0.0.1.44064 > 10.0.0.2.5001: UDP, length 1470
23:35:30.545696 IP 10.0.0.1.44064 > 10.0.0.2.5001: UDP, length 1470
23:35:30.557824 IP 10.0.0.1.44064 > 10.0.0.2.5001: UDP, length 1470
23:35:30.570080 IP 10.0.0.1.44064 > 10.0.0.2.5001: UDP, length 1470
23:35:30.582241 IP 10.0.0.1.44064 > 10.0.0.2.5001: UDP, length 1470
23:35:30.594333 IP 10.0.0.1.44064 > 10.0.0.2.5001: UDP, length 1470
23:35:30.606156 IP 10.0.0.1.44064 > 10.0.0.2.5001: UDP, length 1470
23:35:30.618348 IP 10.0.0.1.44064 > 10.0.0.2.5001: UDP, length 1470
23:35:30.630459 IP 10.0.0.1.44064 > 10.0.0.2.5001: UDP, length 1470
23:35:30.642712 IP 10.0.0.1.44064 > 10.0.0.2.5001: UDP, length 1470
23:35:30.654833 IP 10.0.0.1.44064 > 10.0.0.2.5001: UDP, length 1470
23:35:30.666965 IP 10.0.0.1.44064 > 10.0.0.2.5001: UDP, length 1470
23:35:30.678770 IP 10.0.0.1.44064 > 10.0.0.2.5001: UDP, length 1470
23:35:30.690979 IP 10.0.0.1.44064 > 10.0.0.2.5001: UDP, length 1470
23:35:30.703101 IP 10.0.0.1.44064 > 10.0.0.2.5001: UDP, length 1470
23:35:30.715274 IP 10.0.0.1.44064 > 10.0.0.2.5001: UDP, length 1470
23:35:30.727267 IP 10.0.0.1.44064 > 10.0.0.2.5001: UDP, length 1470
23:35:30.739484 IP 10.0.0.1.44064 > 10.0.0.2.5001: UDP, length 1470
23:35:30.751302 IP 10.0.0.1.44064 > 10.0.0.2.5001: UDP, length 1470
23:35:30.763449 IP 10.0.0.1.44064 > 10.0.0.2.5001: UDP, length 1470
23:35:30.775648 IP 10.0.0.1.44064 > 10.0.0.2.5001: UDP, length 1470
23:35:30.787771 IP 10.0.0.1.44064 > 10.0.0.2.5001: UDP, length 1470
23:35:30.799795 IP 10.0.0.1.44064 > 10.0.0.2.5001: UDP, length 1470
23:35:30.811782 IP 10.0.0.1.44064 > 10.0.0.2.5001: UDP, length 1470
23:35:30.823988 IP 10.0.0.1.44064 > 10.0.0.2.5001: UDP, length 1470
23:35:30.836085 IP 10.0.0.1.44064 > 10.0.0.2.5001: UDP, length 1470
23:35:30.848129 IP 10.0.0.1.44064 > 10.0.0.2.5001: UDP, length 1470
23:35:30.860241 IP 10.0.0.1.44064 > 10.0.0.2.5001: UDP, length 1470
23:35:30.872269 IP 10.0.0.1.44064 > 10.0.0.2.5001: UDP, length 1470
23:35:30.884454 IP 10.0.0.1.44064 > 10.0.0.2.5001: UDP, length 1470
23:35:30.896698 IP 10.0.0.1.44064 > 10.0.0.2.5001: UDP, length 1470
23:35:30.908964 IP 10.0.0.1.44064 > 10.0.0.2.5001: UDP, length 1470
23:35:30.920938 IP 10.0.0.1.44064 > 10.0.0.2.5001: UDP, length 1470
23:35:30.933176 IP 10.0.0.1.44064 > 10.0.0.2.5001: UDP, length 1470
23:35:30.945496 IP 10.0.0.1.44064 > 10.0.0.2.5001: UDP, length 1470
23:35:30.957602 IP 10.0.0.1.44064 > 10.0.0.2.5001: UDP, length 1470
23:35:30.969307 IP 10.0.0.1.44064 > 10.0.0.2.5001: UDP, length 1470
23:35:30.981252 IP 10.0.0.1.44064 > 10.0.0.2.5001: UDP, length 1470
23:35:30.993265 IP 10.0.0.1.44064 > 10.0.0.2.5001: UDP, length 1470
23:35:31.005466 IP 10.0.0.1.44064 > 10.0.0.2.5001: UDP, length 1470
23:35:31.017863 IP 10.0.0.1.44064 > 10.0.0.2.5001: UDP, length 1470
23:35:31.029896 IP 10.0.0.1.44064 > 10.0.0.2.5001: UDP, length 1470
23:35:31.041759 IP 10.0.0.1.44064 > 10.0.0.2.5001: UDP, length 1470
23:35:31.053758 IP 10.0.0.1.44064 > 10.0.0.2.5001: UDP, length 1470
23:35:31.066130 IP 10.0.0.1.44064 > 10.0.0.2.5001: UDP, length 1470
23:35:31.078034 IP 10.0.0.1.44064 > 10.0.0.2.5001: UDP, length 1470
23:35:31.090326 IP 10.0.0.1.44064 > 10.0.0.2.5001: UDP, length 1470
23:35:31.102283 IP 10.0.0.1.44064 > 10.0.0.2.5001: UDP, length 1470
23:35:31.114255 IP 10.0.0.1.44064 > 10.0.0.2.5001: UDP, length 1470
23:35:31.126421 IP 10.0.0.1.44064 > 10.0.0.2.5001: UDP, length 1470
23:35:31.138616 IP 10.0.0.1.44064 > 10.0.0.2.5001: UDP, length 1470
23:35:31.150668 IP 10.0.0.1.44064 > 10.0.0.2.5001: UDP, length 1470
23:35:31.162716 IP 10.0.0.1.44064 > 10.0.0.2.5001: UDP, length 1470
23:35:31.174719 IP 10.0.0.1.44064 > 10.0.0.2.5001: UDP, length 1470
23:35:31.186846 IP 10.0.0.1.44064 > 10.0.0.2.5001: UDP, length 1470
23:35:31.198947 IP 10.0.0.1.44064 > 10.0.0.2.5001: UDP, length 1470
23:35:31.211060 IP 10.0.0.1.44064 > 10.0.0.2.5001: UDP, length 1470
23:35:31.223097 IP 10.0.0.1.44064 > 10.0.0.2.5001: UDP, length 1470
23:35:31.235287 IP 10.0.0.1.44064 > 10.0.0.2.5001: UDP, length 1470
23:35:31.247270 IP 10.0.0.1.44064 > 10.0.0.2.5001: UDP, length 1470
23:35:31.271558 IP 10.0.0.1.44064 > 10.0.0.2.5001: UDP, length 1470
23:35:31.283838 IP 10.0.0.1.44064 > 10.0.0.2.5001: UDP, length 1470
23:35:31.295800 IP 10.0.0.1.44064 > 10.0.0.2.5001: UDP, length 1470
23:35:31.307997 IP 10.0.0.1.44064 > 10.0.0.2.5001: UDP, length 1470
23:35:31.319822 IP 10.0.0.1.44064 > 10.0.0.2.5001: UDP, length 1470
23:35:31.331983 IP 10.0.0.1.44064 > 10.0.0.2.5001: UDP, length 1470
23:35:31.344170 IP 10.0.0.1.44064 > 10.0.0.2.5001: UDP, length 1470
23:35:31.356303 IP 10.0.0.1.44064 > 10.0.0.2.5001: UDP, length 1470
23:35:31.368448 IP 10.0.0.1.44064 > 10.0.0.2.5001: UDP, length 1470
23:35:31.380596 IP 10.0.0.1.44064 > 10.0.0.2.5001: UDP, length 1470
23:35:31.392341 IP 10.0.0.1.44064 > 10.0.0.2.5001: UDP, length 1470
23:35:31.404556 IP 10.0.0.1.44064 > 10.0.0.2.5001: UDP, length 1470
23:35:31.416725 IP 10.0.0.1.44064 > 10.0.0.2.5001: UDP, length 1470
23:35:31.428912 IP 10.0.0.1.44064 > 10.0.0.2.5001: UDP, length 1470
23:35:31.441057 IP 10.0.0.1.44064 > 10.0.0.2.5001: UDP, length 1470
23:35:31.452978 IP 10.0.0.1.44064 > 10.0.0.2.5001: UDP, length 1470
23:35:31.464965 IP 10.0.0.1.44064 > 10.0.0.2.5001: UDP, length 1470
23:35:31.477158 IP 10.0.0.1.44064 > 10.0.0.2.5001: UDP, length 1470
23:35:31.489866 IP 10.0.0.1.44064 > 10.0.0.2.5001: UDP, length 1470
23:35:31.501506 IP 10.0.0.1.44064 > 10.0.0.2.5001: UDP, length 1470
23:35:31.513518 IP 10.0.0.1.44064 > 10.0.0.2.5001: UDP, length 1470
23:35:31.525533 IP 10.0.0.1.44064 > 10.0.0.2.5001: UDP, length 1470
23:35:31.537586 IP 10.0.0.1.44064 > 10.0.0.2.5001: UDP, length 1470
23:35:31.549760 IP 10.0.0.1.44064 > 10.0.0.2.5001: UDP, length 1470
23:35:31.561876 IP 10.0.0.1.44064 > 10.0.0.2.5001: UDP, length 1470
23:35:31.573921 IP 10.0.0.1.44064 > 10.0.0.2.5001: UDP, length 1470
23:35:31.586076 IP 10.0.0.1.44064 > 10.0.0.2.5001: UDP, length 1470
23:35:31.598076 IP 10.0.0.1.44064 > 10.0.0.2.5001: UDP, length 1470
23:35:31.610197 IP 10.0.0.1.44064 > 10.0.0.2.5001: UDP, length 1470
23:35:31.622175 IP 10.0.0.1.44064 > 10.0.0.2.5001: UDP, length 1470
23:35:31.634362 IP 10.0.0.1.44064 > 10.0.0.2.5001: UDP, length 1470
23:35:31.646698 IP 10.0.0.1.44064 > 10.0.0.2.5001: UDP, length 1470
23:35:31.658856 IP 10.0.0.1.44064 > 10.0.0.2.5001: UDP, length 1470
23:35:31.670707 IP 10.0.0.1.44064 > 10.0.0.2.5001: UDP, length 1470
23:35:31.695103 IP 10.0.0.1.44064 > 10.0.0.2.5001: UDP, length 1470
23:35:31.707306 IP 10.0.0.1.44064 > 10.0.0.2.5001: UDP, length 1470
23:35:31.719407 IP 10.0.0.1.44064 > 10.0.0.2.5001: UDP, length 1470
23:35:31.731578 IP 10.0.0.1.44064 > 10.0.0.2.5001: UDP, length 1470
23:35:31.743591 IP 10.0.0.1.44064 > 10.0.0.2.5001: UDP, length 1470
23:35:31.755258 IP 10.0.0.1.44064 > 10.0.0.2.5001: UDP, length 1470
23:35:31.767765 IP 10.0.0.1.44064 > 10.0.0.2.5001: UDP, length 1470
23:35:31.779863 IP 10.0.0.1.44064 > 10.0.0.2.5001: UDP, length 1470
23:35:31.792032 IP 10.0.0.1.44064 > 10.0.0.2.5001: UDP, length 1470
23:35:31.804090 IP 10.0.0.1.44064 > 10.0.0.2.5001: UDP, length 1470
23:35:31.816405 IP 10.0.0.1.44064 > 10.0.0.2.5001: UDP, length 1470
23:35:31.828096 IP 10.0.0.1.44064 > 10.0.0.2.5001: UDP, length 1470
23:35:31.840256 IP 10.0.0.1.44064 > 10.0.0.2.5001: UDP, length 1470
23:35:31.852438 IP 10.0.0.1.44064 > 10.0.0.2.5001: UDP, length 1470
23:35:31.864428 IP 10.0.0.1.44064 > 10.0.0.2.5001: UDP, length 1470
23:35:31.876203 IP 10.0.0.1.44064 > 10.0.0.2.5001: UDP, length 1470
23:35:31.888587 IP 10.0.0.1.44064 > 10.0.0.2.5001: UDP, length 1470
23:35:31.900396 IP 10.0.0.1.44064 > 10.0.0.2.5001: UDP, length 1470
23:35:31.912542 IP 10.0.0.1.44064 > 10.0.0.2.5001: UDP, length 1470
23:35:31.924680 IP 10.0.0.1.44064 > 10.0.0.2.5001: UDP, length 1470
23:35:31.936880 IP 10.0.0.1.44064 > 10.0.0.2.5001: UDP, length 1470
23:35:31.948763 IP 10.0.0.1.44064 > 10.0.0.2.5001: UDP, length 1470
23:35:31.961042 IP 10.0.0.1.44064 > 10.0.0.2.5001: UDP, length 1470
23:35:31.973026 IP 10.0.0.1.44064 > 10.0.0.2.5001: UDP, length 1470
23:35:31.985089 IP 10.0.0.1.44064 > 10.0.0.2.5001: UDP, length 1470
23:35:31.997071 IP 10.0.0.1.44064 > 10.0.0.2.5001: UDP, length 1470
23:35:32.009277 IP 10.0.0.1.44064 > 10.0.0.2.5001: UDP, length 1470
23:35:32.021737 IP 10.0.0.1.44064 > 10.0.0.2.5001: UDP, length 1470
23:35:32.033505 IP 10.0.0.1.44064 > 10.0.0.2.5001: UDP, length 1470
23:35:32.045665 IP 10.0.0.1.44064 > 10.0.0.2.5001: UDP, length 1470
23:35:32.057791 IP 10.0.0.1.44064 > 10.0.0.2.5001: UDP, length 1470
23:35:32.069963 IP 10.0.0.1.44064 > 10.0.0.2.5001: UDP, length 1470
23:35:32.082097 IP 10.0.0.1.44064 > 10.0.0.2.5001: UDP, length 1470
23:35:32.094184 IP 10.0.0.1.44064 > 10.0.0.2.5001: UDP, length 1470
23:35:32.106092 IP 10.0.0.1.44064 > 10.0.0.2.5001: UDP, length 1470
23:35:32.118246 IP 10.0.0.1.44064 > 10.0.0.2.5001: UDP, length 1470
23:35:32.130408 IP 10.0.0.1.44064 > 10.0.0.2.5001: UDP, length 1470
23:35:32.142636 IP 10.0.0.1.44064 > 10.0.0.2.5001: UDP, length 1470
23:35:32.154746 IP 10.0.0.1.44064 > 10.0.0.2.5001: UDP, length 1470
23:35:32.166835 IP 10.0.0.1.44064 > 10.0.0.2.5001: UDP, length 1470
23:35:32.178715 IP 10.0.0.1.44064 > 10.0.0.2.5001: UDP, length 1470
23:35:32.190858 IP 10.0.0.1.44064 > 10.0.0.2.5001: UDP, length 1470
23:35:32.203020 IP 10.0.0.1.44064 > 10.0.0.2.5001: UDP, length 1470
23:35:32.215144 IP 10.0.0.1.44064 > 10.0.0.2.5001: UDP, length 1470
23:35:32.227145 IP 10.0.0.1.44064 > 10.0.0.2.5001: UDP, length 1470
23:35:32.239013 IP 10.0.0.1.44064 > 10.0.0.2.5001: UDP, length 1470
23:35:32.251318 IP 10.0.0.1.44064 > 10.0.0.2.5001: UDP, length 1470
23:35:32.263498 IP 10.0.0.1.44064 > 10.0.0.2.5001: UDP, length 1470
23:35:32.275439 IP 10.0.0.1.44064 > 10.0.0.2.5001: UDP, length 1470
23:35:32.287877 IP 10.0.0.1.44064 > 10.0.0.2.5001: UDP, length 1470
23:35:32.299696 IP 10.0.0.1.44064 > 10.0.0.2.5001: UDP, length 1470
23:35:32.311768 IP 10.0.0.1.44064 > 10.0.0.2.5001: UDP, length 1470
23:35:32.323887 IP 10.0.0.1.44064 > 10.0.0.2.5001: UDP, length 1470
23:35:32.335945 IP 10.0.0.1.44064 > 10.0.0.2.5001: UDP, length 1470
23:35:32.348038 IP 10.0.0.1.44064 > 10.0.0.2.5001: UDP, length 1470
23:35:32.360137 IP 10.0.0.1.44064 > 10.0.0.2.5001: UDP, length 1470
23:35:32.372281 IP 10.0.0.1.44064 > 10.0.0.2.5001: UDP, length 1470
23:35:32.384309 IP 10.0.0.1.44064 > 10.0.0.2.5001: UDP, length 1470
23:35:32.396428 IP 10.0.0.1.44064 > 10.0.0.2.5001: UDP, length 1470
23:35:32.408682 IP 10.0.0.1.44064 > 10.0.0.2.5001: UDP, length 1470
23:35:32.420708 IP 10.0.0.1.44064 > 10.0.0.2.5001: UDP, length 1470
23:35:32.432925 IP 10.0.0.1.44064 > 10.0.0.2.5001: UDP, length 1470
23:35:32.445008 IP 10.0.0.1.44064 > 10.0.0.2.5001: UDP, length 1470
23:35:32.456906 IP 10.0.0.1.44064 > 10.0.0.2.5001: UDP, length 1470
23:35:32.469341 IP 10.0.0.1.44064 > 10.0.0.2.5001: UDP, length 1470
23:35:32.481261 IP 10.0.0.1.44064 > 10.0.0.2.5001: UDP, length 1470
23:35:32.493563 IP 10.0.0.1.44064 > 10.0.0.2.5001: UDP, length 1470
23:35:32.505353 IP 10.0.0.1.44064 > 10.0.0.2.5001: UDP, length 1470
23:35:32.517252 IP 10.0.0.1.44064 > 10.0.0.2.5001: UDP, length 1470
23:35:32.529501 IP 10.0.0.1.44064 > 10.0.0.2.5001: UDP, length 1470
23:35:32.541661 IP 10.0.0.1.44064 > 10.0.0.2.5001: UDP, length 1470
23:35:32.553834 IP 10.0.0.1.44064 > 10.0.0.2.5001: UDP, length 1470
23:35:32.565989 IP 10.0.0.1.44064 > 10.0.0.2.5001: UDP, length 1470
23:35:32.577939 IP 10.0.0.1.44064 > 10.0.0.2.5001: UDP, length 1470
23:35:32.589953 IP 10.0.0.1.44064 > 10.0.0.2.5001: UDP, length 1470
23:35:32.602147 IP 10.0.0.1.44064 > 10.0.0.2.5001: UDP, length 1470
23:35:32.614287 IP 10.0.0.1.44064 > 10.0.0.2.5001: UDP, length 1470
23:35:32.626360 IP 10.0.0.1.44064 > 10.0.0.2.5001: UDP, length 1470
23:35:32.638441 IP 10.0.0.1.44064 > 10.0.0.2.5001: UDP, length 1470
23:35:32.650516 IP 10.0.0.1.44064 > 10.0.0.2.5001: UDP, length 1470
23:35:32.662593 IP 10.0.0.1.44064 > 10.0.0.2.5001: UDP, length 1470
23:35:32.674843 IP 10.0.0.1.44064 > 10.0.0.2.5001: UDP, length 1470
23:35:32.699237 IP 10.0.0.1.44064 > 10.0.0.2.5001: UDP, length 1470
23:35:32.710949 IP 10.0.0.1.44064 > 10.0.0.2.5001: UDP, length 1470
23:35:32.722940 IP 10.0.0.1.44064 > 10.0.0.2.5001: UDP, length 1470
23:35:32.735331 IP 10.0.0.1.44064 > 10.0.0.2.5001: UDP, length 1470
23:35:32.747112 IP 10.0.0.1.44064 > 10.0.0.2.5001: UDP, length 1470
23:35:32.759438 IP 10.0.0.1.44064 > 10.0.0.2.5001: UDP, length 1470
23:35:32.771591 IP 10.0.0.1.44064 > 10.0.0.2.5001: UDP, length 1470
23:35:32.783698 IP 10.0.0.1.44064 > 10.0.0.2.5001: UDP, length 1470
23:35:32.795464 IP 10.0.0.1.44064 > 10.0.0.2.5001: UDP, length 1470
23:35:32.807617 IP 10.0.0.1.44064 > 10.0.0.2.5001: UDP, length 1470
23:35:32.819861 IP 10.0.0.1.44064 > 10.0.0.2.5001: UDP, length 1470
23:35:32.831967 IP 10.0.0.1.44064 > 10.0.0.2.5001: UDP, length 1470
23:35:32.844205 IP 10.0.0.1.44064 > 10.0.0.2.5001: UDP, length 1470
23:35:32.856292 IP 10.0.0.1.44064 > 10.0.0.2.5001: UDP, length 1470
23:35:32.868163 IP 10.0.0.1.44064 > 10.0.0.2.5001: UDP, length 1470
23:35:32.880375 IP 10.0.0.1.44064 > 10.0.0.2.5001: UDP, length 1470
23:35:32.892442 IP 10.0.0.1.44064 > 10.0.0.2.5001: UDP, length 1470
23:35:32.904824 IP 10.0.0.1.44064 > 10.0.0.2.5001: UDP, length 1470
23:35:32.916747 IP 10.0.0.1.44064 > 10.0.0.2.5001: UDP, length 1470
23:35:32.928768 IP 10.0.0.1.44064 > 10.0.0.2.5001: UDP, length 1470
23:35:32.940743 IP 10.0.0.1.44064 > 10.0.0.2.5001: UDP, length 1470
23:35:32.952907 IP 10.0.0.1.44064 > 10.0.0.2.5001: UDP, length 1470
23:35:32.964974 IP 10.0.0.1.44064 > 10.0.0.2.5001: UDP, length 1470
23:35:32.977191 IP 10.0.0.1.44064 > 10.0.0.2.5001: UDP, length 1470
23:35:32.989293 IP 10.0.0.1.44064 > 10.0.0.2.5001: UDP, length 1470
23:35:33.001154 IP 10.0.0.1.44064 > 10.0.0.2.5001: UDP, length 1470
23:35:33.013359 IP 10.0.0.1.44064 > 10.0.0.2.5001: UDP, length 1470
23:35:33.025508 IP 10.0.0.1.44064 > 10.0.0.2.5001: UDP, length 1470
23:35:33.037637 IP 10.0.0.1.44064 > 10.0.0.2.5001: UDP, length 1470
23:35:33.049694 IP 10.0.0.1.44064 > 10.0.0.2.5001: UDP, length 1470
23:35:33.061801 IP 10.0.0.1.44064 > 10.0.0.2.5001: UDP, length 1470
23:35:33.073758 IP 10.0.0.1.44064 > 10.0.0.2.5001: UDP, length 1470
23:35:33.085956 IP 10.0.0.1.44064 > 10.0.0.2.5001: UDP, length 1470
23:35:33.097974 IP 10.0.0.1.44064 > 10.0.0.2.5001: UDP, length 1470
23:35:33.110081 IP 10.0.0.1.44064 > 10.0.0.2.5001: UDP, length 1470
23:35:33.122139 IP 10.0.0.1.44064 > 10.0.0.2.5001: UDP, length 1470
23:35:33.134235 IP 10.0.0.1.44064 > 10.0.0.2.5001: UDP, length 1470
23:35:33.146253 IP 10.0.0.1.44064 > 10.0.0.2.5001: UDP, length 1470
23:35:33.158490 IP 10.0.0.1.44064 > 10.0.0.2.5001: UDP, length 1470
23:35:33.170658 IP 10.0.0.1.44064 > 10.0.0.2.5001: UDP, length 1470
23:35:33.182733 IP 10.0.0.1.44064 > 10.0.0.2.5001: UDP, length 1470
23:35:33.194950 IP 10.0.0.1.44064 > 10.0.0.2.5001: UDP, length 1470
23:35:33.207065 IP 10.0.0.1.44064 > 10.0.0.2.5001: UDP, length 1470
23:35:33.218886 IP 10.0.0.1.44064 > 10.0.0.2.5001: UDP, length 1470
23:35:33.231595 IP 10.0.0.1.44064 > 10.0.0.2.5001: UDP, length 1470
23:35:33.243189 IP 10.0.0.1.44064 > 10.0.0.2.5001: UDP, length 1470
23:35:33.255376 IP 10.0.0.1.44064 > 10.0.0.2.5001: UDP, length 1470
23:35:33.267480 IP 10.0.0.1.44064 > 10.0.0.2.5001: UDP, length 1470
23:35:33.279652 IP 10.0.0.1.44064 > 10.0.0.2.5001: UDP, length 1470
23:35:33.291721 IP 10.0.0.1.44064 > 10.0.0.2.5001: UDP, length 1470
23:35:33.303771 IP 10.0.0.1.44064 > 10.0.0.2.5001: UDP, length 1470
23:35:33.315986 IP 10.0.0.1.44064 > 10.0.0.2.5001: UDP, length 1470
23:35:33.328120 IP 10.0.0.1.44064 > 10.0.0.2.5001: UDP, length 1470
23:35:33.340164 IP 10.0.0.1.44064 > 10.0.0.2.5001: UDP, length 1470
23:35:33.352262 IP 10.0.0.1.44064 > 10.0.0.2.5001: UDP, length 1470
23:35:33.376484 IP 10.0.0.1.44064 > 10.0.0.2.5001: UDP, length 1470
23:35:33.388627 IP 10.0.0.1.44064 > 10.0.0.2.5001: UDP, length 1470
23:35:33.400644 IP 10.0.0.1.44064 > 10.0.0.2.5001: UDP, length 1470
23:35:33.412728 IP 10.0.0.1.44064 > 10.0.0.2.5001: UDP, length 1470
23:35:33.424858 IP 10.0.0.1.44064 > 10.0.0.2.5001: UDP, length 1470
23:35:33.436869 IP 10.0.0.1.44064 > 10.0.0.2.5001: UDP, length 1470
23:35:33.449179 IP 10.0.0.1.44064 > 10.0.0.2.5001: UDP, length 1470
23:35:33.461101 IP 10.0.0.1.44064 > 10.0.0.2.5001: UDP, length 1470
23:35:33.473096 IP 10.0.0.1.44064 > 10.0.0.2.5001: UDP, length 1470
23:35:33.485056 IP 10.0.0.1.44064 > 10.0.0.2.5001: UDP, length 1470
23:35:33.497293 IP 10.0.0.1.44064 > 10.0.0.2.5001: UDP, length 1470
23:35:33.509226 IP 10.0.0.1.44064 > 10.0.0.2.5001: UDP, length 1470
23:35:33.521388 IP 10.0.0.1.44064 > 10.0.0.2.5001: UDP, length 1470
23:35:33.533566 IP 10.0.0.1.44064 > 10.0.0.2.5001: UDP, length 1470
23:35:33.545706 IP 10.0.0.1.44064 > 10.0.0.2.5001: UDP, length 1470
23:35:33.557860 IP 10.0.0.1.44064 > 10.0.0.2.5001: UDP, length 1470
23:35:33.569684 IP 10.0.0.1.44064 > 10.0.0.2.5001: UDP, length 1470
23:35:33.581847 IP 10.0.0.1.44064 > 10.0.0.2.5001: UDP, length 1470
23:35:33.594015 IP 10.0.0.1.44064 > 10.0.0.2.5001: UDP, length 1470
23:35:33.606266 IP 10.0.0.1.44064 > 10.0.0.2.5001: UDP, length 1470
23:35:33.618343 IP 10.0.0.1.44064 > 10.0.0.2.5001: UDP, length 1470
23:35:33.630397 IP 10.0.0.1.44064 > 10.0.0.2.5001: UDP, length 1470
23:35:33.642282 IP 10.0.0.1.44064 > 10.0.0.2.5001: UDP, length 1470
23:35:33.654326 IP 10.0.0.1.44064 > 10.0.0.2.5001: UDP, length 1470
23:35:33.666703 IP 10.0.0.1.44064 > 10.0.0.2.5001: UDP, length 1470
23:35:33.678699 IP 10.0.0.1.44064 > 10.0.0.2.5001: UDP, length 1470
23:35:33.690895 IP 10.0.0.1.44064 > 10.0.0.2.5001: UDP, length 1470
23:35:33.703030 IP 10.0.0.1.44064 > 10.0.0.2.5001: UDP, length 1470
23:35:33.714924 IP 10.0.0.1.44064 > 10.0.0.2.5001: UDP, length 1470
23:35:33.727070 IP 10.0.0.1.44064 > 10.0.0.2.5001: UDP, length 1470
23:35:33.739232 IP 10.0.0.1.44064 > 10.0.0.2.5001: UDP, length 1470
23:35:33.751281 IP 10.0.0.1.44064 > 10.0.0.2.5001: UDP, length 1470
23:35:33.775327 IP 10.0.0.1.44064 > 10.0.0.2.5001: UDP, length 1470
23:35:33.787499 IP 10.0.0.1.44064 > 10.0.0.2.5001: UDP, length 1470
23:35:33.799603 IP 10.0.0.1.44064 > 10.0.0.2.5001: UDP, length 1470
23:35:33.811719 IP 10.0.0.1.44064 > 10.0.0.2.5001: UDP, length 1470
23:35:33.823787 IP 10.0.0.1.44064 > 10.0.0.2.5001: UDP, length 1470
23:35:33.835777 IP 10.0.0.1.44064 > 10.0.0.2.5001: UDP, length 1470
23:35:33.847933 IP 10.0.0.1.44064 > 10.0.0.2.5001: UDP, length 1470
23:35:33.860076 IP 10.0.0.1.44064 > 10.0.0.2.5001: UDP, length 1470
23:35:33.872122 IP 10.0.0.1.44064 > 10.0.0.2.5001: UDP, length 1470
23:35:33.884201 IP 10.0.0.1.44064 > 10.0.0.2.5001: UDP, length 1470
23:35:33.896490 IP 10.0.0.1.44064 > 10.0.0.2.5001: UDP, length 1470
23:35:33.908809 IP 10.0.0.1.44064 > 10.0.0.2.5001: UDP, length 1470
23:35:33.920437 IP 10.0.0.1.44064 > 10.0.0.2.5001: UDP, length 1470
23:35:33.932572 IP 10.0.0.1.44064 > 10.0.0.2.5001: UDP, length 1470
23:35:33.944817 IP 10.0.0.1.44064 > 10.0.0.2.5001: UDP, length 1470
23:35:33.956988 IP 10.0.0.1.44064 > 10.0.0.2.5001: UDP, length 1470
23:35:33.969142 IP 10.0.0.1.44064 > 10.0.0.2.5001: UDP, length 1470
23:35:33.981337 IP 10.0.0.1.44064 > 10.0.0.2.5001: UDP, length 1470
23:35:33.993053 IP 10.0.0.1.44064 > 10.0.0.2.5001: UDP, length 1470
23:35:34.005237 IP 10.0.0.1.44064 > 10.0.0.2.5001: UDP, length 1470
23:35:34.017353 IP 10.0.0.1.44064 > 10.0.0.2.5001: UDP, length 1470
23:35:34.029569 IP 10.0.0.1.44064 > 10.0.0.2.5001: UDP, length 1470
23:35:34.041731 IP 10.0.0.1.44064 > 10.0.0.2.5001: UDP, length 1470
23:35:34.053820 IP 10.0.0.1.44064 > 10.0.0.2.5001: UDP, length 1470
23:35:34.065699 IP 10.0.0.1.44064 > 10.0.0.2.5001: UDP, length 1470
23:35:34.077855 IP 10.0.0.1.44064 > 10.0.0.2.5001: UDP, length 1470
23:35:34.089995 IP 10.0.0.1.44064 > 10.0.0.2.5001: UDP, length 1470
23:35:34.102169 IP 10.0.0.1.44064 > 10.0.0.2.5001: UDP, length 1470
23:35:34.114335 IP 10.0.0.1.44064 > 10.0.0.2.5001: UDP, length 1470
23:35:34.126298 IP 10.0.0.1.44064 > 10.0.0.2.5001: UDP, length 1470
23:35:34.138275 IP 10.0.0.1.44064 > 10.0.0.2.5001: UDP, length 1470
23:35:34.150420 IP 10.0.0.1.44064 > 10.0.0.2.5001: UDP, length 1470
23:35:34.162533 IP 10.0.0.1.44064 > 10.0.0.2.5001: UDP, length 1470
23:35:34.174635 IP 10.0.0.1.44064 > 10.0.0.2.5001: UDP, length 1470
23:35:34.186698 IP 10.0.0.1.44064 > 10.0.0.2.5001: UDP, length 1470
23:35:34.198666 IP 10.0.0.1.44064 > 10.0.0.2.5001: UDP, length 1470
23:35:34.210857 IP 10.0.0.1.44064 > 10.0.0.2.5001: UDP, length 1470
23:35:34.222922 IP 10.0.0.1.44064 > 10.0.0.2.5001: UDP, length 1470
23:35:34.235112 IP 10.0.0.1.44064 > 10.0.0.2.5001: UDP, length 1470
23:35:34.247201 IP 10.0.0.1.44064 > 10.0.0.2.5001: UDP, length 1470
23:35:34.259149 IP 10.0.0.1.44064 > 10.0.0.2.5001: UDP, length 1470
23:35:34.271188 IP 10.0.0.1.44064 > 10.0.0.2.5001: UDP, length 1470
23:35:34.283432 IP 10.0.0.1.44064 > 10.0.0.2.5001: UDP, length 1470
23:35:34.295609 IP 10.0.0.1.44064 > 10.0.0.2.5001: UDP, length 1470
23:35:34.307674 IP 10.0.0.1.44064 > 10.0.0.2.5001: UDP, length 1470
23:35:34.319850 IP 10.0.0.1.44064 > 10.0.0.2.5001: UDP, length 1470
23:35:34.331970 IP 10.0.0.1.44064 > 10.0.0.2.5001: UDP, length 1470
23:35:34.343824 IP 10.0.0.1.44064 > 10.0.0.2.5001: UDP, length 1470
23:35:34.356020 IP 10.0.0.1.44064 > 10.0.0.2.5001: UDP, length 1470
23:35:34.368180 IP 10.0.0.1.44064 > 10.0.0.2.5001: UDP, length 1470
23:35:34.380298 IP 10.0.0.1.44064 > 10.0.0.2.5001: UDP, length 1470
23:35:34.392551 IP 10.0.0.1.44064 > 10.0.0.2.5001: UDP, length 1470
23:35:34.404554 IP 10.0.0.1.44064 > 10.0.0.2.5001: UDP, length 1470
23:35:34.416456 IP 10.0.0.1.44064 > 10.0.0.2.5001: UDP, length 1470
23:35:34.428618 IP 10.0.0.1.44064 > 10.0.0.2.5001: UDP, length 1470
23:35:34.440777 IP 10.0.0.1.44064 > 10.0.0.2.5001: UDP, length 1470
23:35:34.452909 IP 10.0.0.1.44064 > 10.0.0.2.5001: UDP, length 1470
23:35:34.465002 IP 10.0.0.1.44064 > 10.0.0.2.5001: UDP, length 1470
23:35:34.476865 IP 10.0.0.1.44064 > 10.0.0.2.5001: UDP, length 1470
23:35:34.489011 IP 10.0.0.1.44064 > 10.0.0.2.5001: UDP, length 1470
23:35:34.501308 IP 10.0.0.1.44064 > 10.0.0.2.5001: UDP, length 1470
23:35:34.513333 IP 10.0.0.1.44064 > 10.0.0.2.5001: UDP, length 1470
23:35:34.525391 IP 10.0.0.1.44064 > 10.0.0.2.5001: UDP, length 1470
23:35:34.537383 IP 10.0.0.1.44064 > 10.0.0.2.5001: UDP, length 1470
23:35:34.549530 IP 10.0.0.1.44064 > 10.0.0.2.5001: UDP, length 1470
23:35:34.561733 IP 10.0.0.1.44064 > 10.0.0.2.5001: UDP, length 1470
23:35:34.573745 IP 10.0.0.1.44064 > 10.0.0.2.5001: UDP, length 1470
23:35:34.585830 IP 10.0.0.1.44064 > 10.0.0.2.5001: UDP, length 1470
23:35:34.597888 IP 10.0.0.1.44064 > 10.0.0.2.5001: UDP, length 1470
23:35:34.609965 IP 10.0.0.1.44064 > 10.0.0.2.5001: UDP, length 1470
23:35:34.621984 IP 10.0.0.1.44064 > 10.0.0.2.5001: UDP, length 1470
23:35:34.634175 IP 10.0.0.1.44064 > 10.0.0.2.5001: UDP, length 1470
23:35:34.646377 IP 10.0.0.1.44064 > 10.0.0.2.5001: UDP, length 1470
23:35:34.658731 IP 10.0.0.1.44064 > 10.0.0.2.5001: UDP, length 1470
23:35:34.670714 IP 10.0.0.1.44064 > 10.0.0.2.5001: UDP, length 1470
23:35:34.682717 IP 10.0.0.1.44064 > 10.0.0.2.5001: UDP, length 1470
23:35:34.694679 IP 10.0.0.1.44064 > 10.0.0.2.5001: UDP, length 1470
23:35:34.706817 IP 10.0.0.1.44064 > 10.0.0.2.5001: UDP, length 1470
23:35:34.718977 IP 10.0.0.1.44064 > 10.0.0.2.5001: UDP, length 1470
23:35:34.731166 IP 10.0.0.1.44064 > 10.0.0.2.5001: UDP, length 1470
23:35:34.743297 IP 10.0.0.1.44064 > 10.0.0.2.5001: UDP, length 1470
23:35:34.755341 IP 10.0.0.1.44064 > 10.0.0.2.5001: UDP, length 1470
23:35:34.779416 IP 10.0.0.1.44064 > 10.0.0.2.5001: UDP, length 1470
23:35:34.791554 IP 10.0.0.1.44064 > 10.0.0.2.5001: UDP, length 1470
23:35:34.803721 IP 10.0.0.1.44064 > 10.0.0.2.5001: UDP, length 1470
23:35:34.815865 IP 10.0.0.1.44064 > 10.0.0.2.5001: UDP, length 1470
23:35:34.827605 IP 10.0.0.1.44064 > 10.0.0.2.5001: UDP, length 1470
23:35:34.839851 IP 10.0.0.1.44064 > 10.0.0.2.5001: UDP, length 1470
23:35:34.852020 IP 10.0.0.1.44064 > 10.0.0.2.5001: UDP, length 1470
23:35:34.864011 IP 10.0.0.1.44064 > 10.0.0.2.5001: UDP, length 1470
23:35:34.876124 IP 10.0.0.1.44064 > 10.0.0.2.5001: UDP, length 1470
23:35:34.888164 IP 10.0.0.1.44064 > 10.0.0.2.5001: UDP, length 1470
23:35:34.900166 IP 10.0.0.1.44064 > 10.0.0.2.5001: UDP, length 1470
23:35:34.912311 IP 10.0.0.1.44064 > 10.0.0.2.5001: UDP, length 1470
23:35:34.924418 IP 10.0.0.1.44064 > 10.0.0.2.5001: UDP, length 1470
23:35:34.936545 IP 10.0.0.1.44064 > 10.0.0.2.5001: UDP, length 1470
23:35:34.948684 IP 10.0.0.1.44064 > 10.0.0.2.5001: UDP, length 1470
23:35:34.960683 IP 10.0.0.1.44064 > 10.0.0.2.5001: UDP, length 1470
23:35:34.972858 IP 10.0.0.1.44064 > 10.0.0.2.5001: UDP, length 1470
23:35:34.985134 IP 10.0.0.1.44064 > 10.0.0.2.5001: UDP, length 1470
23:35:34.997034 IP 10.0.0.1.44064 > 10.0.0.2.5001: UDP, length 1470
23:35:35.009074 IP 10.0.0.1.44064 > 10.0.0.2.5001: UDP, length 1470
23:35:35.021492 IP 10.0.0.1.44064 > 10.0.0.2.5001: UDP, length 1470
23:35:35.033261 IP 10.0.0.1.44064 > 10.0.0.2.5001: UDP, length 1470
23:35:35.045637 IP 10.0.0.1.44064 > 10.0.0.2.5001: UDP, length 1470
23:35:35.057465 IP 10.0.0.1.44064 > 10.0.0.2.5001: UDP, length 1470
23:35:35.069869 IP 10.0.0.1.44064 > 10.0.0.2.5001: UDP, length 1470
23:35:35.082235 IP 10.0.0.1.44064 > 10.0.0.2.5001: UDP, length 1470
23:35:35.094394 IP 10.0.0.1.44064 > 10.0.0.2.5001: UDP, length 1470
23:35:35.106378 IP 10.0.0.1.44064 > 10.0.0.2.5001: UDP, length 1470
23:35:35.118270 IP 10.0.0.1.44064 > 10.0.0.2.5001: UDP, length 1470
23:35:35.130380 IP 10.0.0.1.44064 > 10.0.0.2.5001: UDP, length 1470
23:35:35.142543 IP 10.0.0.1.44064 > 10.0.0.2.5001: UDP, length 1470
23:35:35.154733 IP 10.0.0.1.44064 > 10.0.0.2.5001: UDP, length 1470
23:35:35.166867 IP 10.0.0.1.44064 > 10.0.0.2.5001: UDP, length 1470
23:35:35.178972 IP 10.0.0.1.44064 > 10.0.0.2.5001: UDP, length 1470
23:35:35.190829 IP 10.0.0.1.44064 > 10.0.0.2.5001: UDP, length 1470
23:35:35.202890 IP 10.0.0.1.44064 > 10.0.0.2.5001: UDP, length 1470
23:35:35.215097 IP 10.0.0.1.44064 > 10.0.0.2.5001: UDP, length 1470
23:35:35.227194 IP 10.0.0.1.44064 > 10.0.0.2.5001: UDP, length 1470
23:35:35.239037 IP 10.0.0.1.44064 > 10.0.0.2.5001: UDP, length 1470
23:35:35.251296 IP 10.0.0.1.44064 > 10.0.0.2.5001: UDP, length 1470
23:35:35.263332 IP 10.0.0.1.44064 > 10.0.0.2.5001: UDP, length 1470
23:35:35.275345 IP 10.0.0.1.44064 > 10.0.0.2.5001: UDP, length 1470
23:35:35.287608 IP 10.0.0.1.44064 > 10.0.0.2.5001: UDP, length 1470
23:35:35.299788 IP 10.0.0.1.44064 > 10.0.0.2.5001: UDP, length 1470
23:35:35.311596 IP 10.0.0.1.44064 > 10.0.0.2.5001: UDP, length 1470
23:35:35.323653 IP 10.0.0.1.44064 > 10.0.0.2.5001: UDP, length 1470
23:35:35.335732 IP 10.0.0.1.44064 > 10.0.0.2.5001: UDP, length 1470
23:35:35.347835 IP 10.0.0.1.44064 > 10.0.0.2.5001: UDP, length 1470
23:35:35.359906 IP 10.0.0.1.44064 > 10.0.0.2.5001: UDP, length 1470
23:35:35.372132 IP 10.0.0.1.44064 > 10.0.0.2.5001: UDP, length 1470
23:35:35.384035 IP 10.0.0.1.44064 > 10.0.0.2.5001: UDP, length 1470
23:35:35.396102 IP 10.0.0.1.44064 > 10.0.0.2.5001: UDP, length 1470
23:35:35.408346 IP 10.0.0.1.44064 > 10.0.0.2.5001: UDP, length 1470
23:35:35.420510 IP 10.0.0.1.44064 > 10.0.0.2.5001: UDP, length 1470
23:35:35.432572 IP 10.0.0.1.44064 > 10.0.0.2.5001: UDP, length 1470
23:35:35.444833 IP 10.0.0.1.44064 > 10.0.0.2.5001: UDP, length 1470
23:35:35.456926 IP 10.0.0.1.44064 > 10.0.0.2.5001: UDP, length 1470
23:35:35.468761 IP 10.0.0.1.44064 > 10.0.0.2.5001: UDP, length 1470
23:35:35.480966 IP 10.0.0.1.44064 > 10.0.0.2.5001: UDP, length 1470
23:35:35.493176 IP 10.0.0.1.44064 > 10.0.0.2.5001: UDP, length 1470
23:35:35.505134 IP 10.0.0.1.44064 > 10.0.0.2.5001: UDP, length 1470
23:35:35.517387 IP 10.0.0.1.44064 > 10.0.0.2.5001: UDP, length 1470
23:35:35.529235 IP 10.0.0.1.44064 > 10.0.0.2.5001: UDP, length 1470
23:35:35.541359 IP 10.0.0.1.44064 > 10.0.0.2.5001: UDP, length 1470
23:35:35.553620 IP 10.0.0.1.44064 > 10.0.0.2.5001: UDP, length 1470
23:35:35.565680 IP 10.0.0.1.44064 > 10.0.0.2.5001: UDP, length 1470
23:35:35.577788 IP 10.0.0.1.44064 > 10.0.0.2.5001: UDP, length 1470
23:35:35.589927 IP 10.0.0.1.44064 > 10.0.0.2.5001: UDP, length 1470
23:35:35.601982 IP 10.0.0.1.44064 > 10.0.0.2.5001: UDP, length 1470
23:35:35.613984 IP 10.0.0.1.44064 > 10.0.0.2.5001: UDP, length 1470
23:35:35.626129 IP 10.0.0.1.44064 > 10.0.0.2.5001: UDP, length 1470
23:35:35.638248 IP 10.0.0.1.44064 > 10.0.0.2.5001: UDP, length 1470
23:35:35.650309 IP 10.0.0.1.44064 > 10.0.0.2.5001: UDP, length 1470
23:35:35.662432 IP 10.0.0.1.44064 > 10.0.0.2.5001: UDP, length 1470
23:35:35.674378 IP 10.0.0.1.44064 > 10.0.0.2.5001: UDP, length 1470
23:35:35.686684 IP 10.0.0.1.44064 > 10.0.0.2.5001: UDP, length 1470
23:35:35.698690 IP 10.0.0.1.44064 > 10.0.0.2.5001: UDP, length 1470
23:35:35.710741 IP 10.0.0.1.44064 > 10.0.0.2.5001: UDP, length 1470
23:35:35.722811 IP 10.0.0.1.44064 > 10.0.0.2.5001: UDP, length 1470
23:35:35.734984 IP 10.0.0.1.44064 > 10.0.0.2.5001: UDP, length 1470
23:35:35.746927 IP 10.0.0.1.44064 > 10.0.0.2.5001: UDP, length 1470
23:35:35.759069 IP 10.0.0.1.44064 > 10.0.0.2.5001: UDP, length 1470
23:35:35.771255 IP 10.0.0.1.44064 > 10.0.0.2.5001: UDP, length 1470
23:35:35.783457 IP 10.0.0.1.44064 > 10.0.0.2.5001: UDP, length 1470
23:35:35.795496 IP 10.0.0.1.44064 > 10.0.0.2.5001: UDP, length 1470
23:35:35.807716 IP 10.0.0.1.44064 > 10.0.0.2.5001: UDP, length 1470
23:35:35.819595 IP 10.0.0.1.44064 > 10.0.0.2.5001: UDP, length 1470
23:35:35.831726 IP 10.0.0.1.44064 > 10.0.0.2.5001: UDP, length 1470
23:35:35.843902 IP 10.0.0.1.44064 > 10.0.0.2.5001: UDP, length 1470
23:35:35.856103 IP 10.0.0.1.44064 > 10.0.0.2.5001: UDP, length 1470
23:35:35.868105 IP 10.0.0.1.44064 > 10.0.0.2.5001: UDP, length 1470
23:35:35.880184 IP 10.0.0.1.44064 > 10.0.0.2.5001: UDP, length 1470
23:35:35.892184 IP 10.0.0.1.44064 > 10.0.0.2.5001: UDP, length 1470
23:35:35.904392 IP 10.0.0.1.44064 > 10.0.0.2.5001: UDP, length 1470
23:35:35.916518 IP 10.0.0.1.44064 > 10.0.0.2.5001: UDP, length 1470
23:35:35.928594 IP 10.0.0.1.44064 > 10.0.0.2.5001: UDP, length 1470
23:35:35.940710 IP 10.0.0.1.44064 > 10.0.0.2.5001: UDP, length 1470
23:35:35.952566 IP 10.0.0.1.44064 > 10.0.0.2.5001: UDP, length 1470
23:35:35.964773 IP 10.0.0.1.44064 > 10.0.0.2.5001: UDP, length 1470
23:35:35.976947 IP 10.0.0.1.44064 > 10.0.0.2.5001: UDP, length 1470
23:35:35.989245 IP 10.0.0.1.44064 > 10.0.0.2.5001: UDP, length 1470
23:35:36.001058 IP 10.0.0.1.44064 > 10.0.0.2.5001: UDP, length 1470
23:35:36.013195 IP 10.0.0.1.44064 > 10.0.0.2.5001: UDP, length 1470
23:35:36.025212 IP 10.0.0.1.44064 > 10.0.0.2.5001: UDP, length 1470
23:35:36.037380 IP 10.0.0.1.44064 > 10.0.0.2.5001: UDP, length 1470
23:35:36.049518 IP 10.0.0.1.44064 > 10.0.0.2.5001: UDP, length 1470
23:35:36.061612 IP 10.0.0.1.44064 > 10.0.0.2.5001: UDP, length 1470
23:35:36.073503 IP 10.0.0.1.44064 > 10.0.0.2.5001: UDP, length 1470
23:35:36.086066 IP 10.0.0.1.44064 > 10.0.0.2.5001: UDP, length 1470
23:35:36.097790 IP 10.0.0.1.44064 > 10.0.0.2.5001: UDP, length 1470
23:35:36.109905 IP 10.0.0.1.44064 > 10.0.0.2.5001: UDP, length 1470
23:35:36.122045 IP 10.0.0.1.44064 > 10.0.0.2.5001: UDP, length 1470
23:35:36.133963 IP 10.0.0.1.44064 > 10.0.0.2.5001: UDP, length 1470
23:35:36.146433 IP 10.0.0.1.44064 > 10.0.0.2.5001: UDP, length 1470
23:35:36.158608 IP 10.0.0.1.44064 > 10.0.0.2.5001: UDP, length 1470
23:35:36.182490 IP 10.0.0.1.44064 > 10.0.0.2.5001: UDP, length 1470
23:35:36.194704 IP 10.0.0.1.44064 > 10.0.0.2.5001: UDP, length 1470
23:35:36.206884 IP 10.0.0.1.44064 > 10.0.0.2.5001: UDP, length 1470
23:35:36.219007 IP 10.0.0.1.44064 > 10.0.0.2.5001: UDP, length 1470
23:35:36.231114 IP 10.0.0.1.44064 > 10.0.0.2.5001: UDP, length 1470
23:35:36.242963 IP 10.0.0.1.44064 > 10.0.0.2.5001: UDP, length 1470
23:35:36.255133 IP 10.0.0.1.44064 > 10.0.0.2.5001: UDP, length 1470
23:35:36.267285 IP 10.0.0.1.44064 > 10.0.0.2.5001: UDP, length 1470
23:35:36.279352 IP 10.0.0.1.44064 > 10.0.0.2.5001: UDP, length 1470
23:35:36.291564 IP 10.0.0.1.44064 > 10.0.0.2.5001: UDP, length 1470
23:35:36.303384 IP 10.0.0.1.44064 > 10.0.0.2.5001: UDP, length 1470
23:35:36.315520 IP 10.0.0.1.44064 > 10.0.0.2.5001: UDP, length 1470
23:35:36.327715 IP 10.0.0.1.44064 > 10.0.0.2.5001: UDP, length 1470
23:35:36.339883 IP 10.0.0.1.44064 > 10.0.0.2.5001: UDP, length 1470
23:35:36.351930 IP 10.0.0.1.44064 > 10.0.0.2.5001: UDP, length 1470
23:35:36.364034 IP 10.0.0.1.44064 > 10.0.0.2.5001: UDP, length 1470
23:35:36.376009 IP 10.0.0.1.44064 > 10.0.0.2.5001: UDP, length 1470
23:35:36.388227 IP 10.0.0.1.44064 > 10.0.0.2.5001: UDP, length 1470
23:35:36.400270 IP 10.0.0.1.44064 > 10.0.0.2.5001: UDP, length 1470
23:35:36.412384 IP 10.0.0.1.44064 > 10.0.0.2.5001: UDP, length 1470
23:35:36.424431 IP 10.0.0.1.44064 > 10.0.0.2.5001: UDP, length 1470
23:35:36.436413 IP 10.0.0.1.44064 > 10.0.0.2.5001: UDP, length 1470
23:35:36.448597 IP 10.0.0.1.44064 > 10.0.0.2.5001: UDP, length 1470
23:35:36.460726 IP 10.0.0.1.44064 > 10.0.0.2.5001: UDP, length 1470
23:35:36.472764 IP 10.0.0.1.44064 > 10.0.0.2.5001: UDP, length 1470
23:35:36.485104 IP 10.0.0.1.44064 > 10.0.0.2.5001: UDP, length 1470
23:35:36.497213 IP 10.0.0.1.44064 > 10.0.0.2.5001: UDP, length 1470
23:35:36.509017 IP 10.0.0.1.44064 > 10.0.0.2.5001: UDP, length 1470
23:35:36.521172 IP 10.0.0.1.44064 > 10.0.0.2.5001: UDP, length 1470
23:35:36.533613 IP 10.0.0.1.44064 > 10.0.0.2.5001: UDP, length 1470
23:35:36.545690 IP 10.0.0.1.44064 > 10.0.0.2.5001: UDP, length 1470
23:35:36.557748 IP 10.0.0.1.44064 > 10.0.0.2.5001: UDP, length 1470
23:35:36.569952 IP 10.0.0.1.44064 > 10.0.0.2.5001: UDP, length 1470
23:35:36.581988 IP 10.0.0.1.44064 > 10.0.0.2.5001: UDP, length 1470
23:35:36.593956 IP 10.0.0.1.44064 > 10.0.0.2.5001: UDP, length 1470
23:35:36.606069 IP 10.0.0.1.44064 > 10.0.0.2.5001: UDP, length 1470
23:35:36.618234 IP 10.0.0.1.44064 > 10.0.0.2.5001: UDP, length 1470
23:35:36.630413 IP 10.0.0.1.44064 > 10.0.0.2.5001: UDP, length 1470
23:35:36.642664 IP 10.0.0.1.44064 > 10.0.0.2.5001: UDP, length 1470
23:35:36.654763 IP 10.0.0.1.44064 > 10.0.0.2.5001: UDP, length 1470
23:35:36.666500 IP 10.0.0.1.44064 > 10.0.0.2.5001: UDP, length 1470
23:35:36.678743 IP 10.0.0.1.44064 > 10.0.0.2.5001: UDP, length 1470
23:35:36.690869 IP 10.0.0.1.44064 > 10.0.0.2.5001: UDP, length 1470
23:35:36.702814 IP 10.0.0.1.44064 > 10.0.0.2.5001: UDP, length 1470
23:35:36.714862 IP 10.0.0.1.44064 > 10.0.0.2.5001: UDP, length 1470
23:35:36.726921 IP 10.0.0.1.44064 > 10.0.0.2.5001: UDP, length 1470
23:35:36.738978 IP 10.0.0.1.44064 > 10.0.0.2.5001: UDP, length 1470
23:35:36.750999 IP 10.0.0.1.44064 > 10.0.0.2.5001: UDP, length 1470
23:35:36.763215 IP 10.0.0.1.44064 > 10.0.0.2.5001: UDP, length 1470
23:35:36.775285 IP 10.0.0.1.44064 > 10.0.0.2.5001: UDP, length 1470
23:35:36.787349 IP 10.0.0.1.44064 > 10.0.0.2.5001: UDP, length 1470
23:35:36.799326 IP 10.0.0.1.44064 > 10.0.0.2.5001: UDP, length 1470
23:35:36.811515 IP 10.0.0.1.44064 > 10.0.0.2.5001: UDP, length 1470
23:35:36.823603 IP 10.0.0.1.44064 > 10.0.0.2.5001: UDP, length 1470
23:35:36.835643 IP 10.0.0.1.44064 > 10.0.0.2.5001: UDP, length 1470
23:35:36.847724 IP 10.0.0.1.44064 > 10.0.0.2.5001: UDP, length 1470
23:35:36.859810 IP 10.0.0.1.44064 > 10.0.0.2.5001: UDP, length 1470
23:35:36.883983 IP 10.0.0.1.44064 > 10.0.0.2.5001: UDP, length 1470
23:35:36.896154 IP 10.0.0.1.44064 > 10.0.0.2.5001: UDP, length 1470
23:35:36.908493 IP 10.0.0.1.44064 > 10.0.0.2.5001: UDP, length 1470
23:35:36.920579 IP 10.0.0.1.44064 > 10.0.0.2.5001: UDP, length 1470
23:35:36.932664 IP 10.0.0.1.44064 > 10.0.0.2.5001: UDP, length 1470
23:35:36.944456 IP 10.0.0.1.44064 > 10.0.0.2.5001: UDP, length 1470
23:35:36.956652 IP 10.0.0.1.44064 > 10.0.0.2.5001: UDP, length 1470
23:35:36.968734 IP 10.0.0.1.44064 > 10.0.0.2.5001: UDP, length 1470
23:35:36.981031 IP 10.0.0.1.44064 > 10.0.0.2.5001: UDP, length 1470
23:35:36.993190 IP 10.0.0.1.44064 > 10.0.0.2.5001: UDP, length 1470
23:35:37.004926 IP 10.0.0.1.44064 > 10.0.0.2.5001: UDP, length 1470
23:35:37.017114 IP 10.0.0.1.44064 > 10.0.0.2.5001: UDP, length 1470
23:35:37.029259 IP 10.0.0.1.44064 > 10.0.0.2.5001: UDP, length 1470
23:35:37.041465 IP 10.0.0.1.44064 > 10.0.0.2.5001: UDP, length 1470
23:35:37.053712 IP 10.0.0.1.44064 > 10.0.0.2.5001: UDP, length 1470
23:35:37.066115 IP 10.0.0.1.44064 > 10.0.0.2.5001: UDP, length 1470
23:35:37.077528 IP 10.0.0.1.44064 > 10.0.0.2.5001: UDP, length 1470
23:35:37.089718 IP 10.0.0.1.44064 > 10.0.0.2.5001: UDP, length 1470
23:35:37.101988 IP 10.0.0.1.44064 > 10.0.0.2.5001: UDP, length 1470
23:35:37.114033 IP 10.0.0.1.44064 > 10.0.0.2.5001: UDP, length 1470
23:35:37.138112 IP 10.0.0.1.44064 > 10.0.0.2.5001: UDP, length 1470
23:35:37.150213 IP 10.0.0.1.44064 > 10.0.0.2.5001: UDP, length 1470
23:35:37.162329 IP 10.0.0.1.44064 > 10.0.0.2.5001: UDP, length 1470
23:35:37.174327 IP 10.0.0.1.44064 > 10.0.0.2.5001: UDP, length 1470
23:35:37.186502 IP 10.0.0.1.44064 > 10.0.0.2.5001: UDP, length 1470
23:35:37.198544 IP 10.0.0.1.44064 > 10.0.0.2.5001: UDP, length 1470
23:35:37.210596 IP 10.0.0.1.44064 > 10.0.0.2.5001: UDP, length 1470
23:35:37.222719 IP 10.0.0.1.44064 > 10.0.0.2.5001: UDP, length 1470
23:35:37.234932 IP 10.0.0.1.44064 > 10.0.0.2.5001: UDP, length 1470
23:35:37.258935 IP 10.0.0.1.44064 > 10.0.0.2.5001: UDP, length 1470
23:35:37.271339 IP 10.0.0.1.44064 > 10.0.0.2.5001: UDP, length 1470
23:35:37.283128 IP 10.0.0.1.44064 > 10.0.0.2.5001: UDP, length 1470
23:35:37.295726 IP 10.0.0.1.44064 > 10.0.0.2.5001: UDP, length 1470
23:35:37.307572 IP 10.0.0.1.44064 > 10.0.0.2.5001: UDP, length 1470
23:35:37.319792 IP 10.0.0.1.44064 > 10.0.0.2.5001: UDP, length 1470
23:35:37.331761 IP 10.0.0.1.44064 > 10.0.0.2.5001: UDP, length 1470
23:35:37.344060 IP 10.0.0.1.44064 > 10.0.0.2.5001: UDP, length 1470
23:35:37.355849 IP 10.0.0.1.44064 > 10.0.0.2.5001: UDP, length 1470
23:35:37.368107 IP 10.0.0.1.44064 > 10.0.0.2.5001: UDP, length 1470
23:35:37.392355 IP 10.0.0.1.44064 > 10.0.0.2.5001: UDP, length 1470
23:35:37.404472 IP 10.0.0.1.44064 > 10.0.0.2.5001: UDP, length 1470
23:35:37.428405 IP 10.0.0.1.44064 > 10.0.0.2.5001: UDP, length 1470
23:35:37.440672 IP 10.0.0.1.44064 > 10.0.0.2.5001: UDP, length 1470
23:35:37.452851 IP 10.0.0.1.44064 > 10.0.0.2.5001: UDP, length 1470
23:35:37.465051 IP 10.0.0.1.44064 > 10.0.0.2.5001: UDP, length 1470
23:35:37.476949 IP 10.0.0.1.44064 > 10.0.0.2.5001: UDP, length 1470
23:35:37.489004 IP 10.0.0.1.44064 > 10.0.0.2.5001: UDP, length 1470
23:35:37.500892 IP 10.0.0.1.44064 > 10.0.0.2.5001: UDP, length 1470
23:35:37.513080 IP 10.0.0.1.44064 > 10.0.0.2.5001: UDP, length 1470
23:35:37.525209 IP 10.0.0.1.44064 > 10.0.0.2.5001: UDP, length 1470
23:35:37.537312 IP 10.0.0.1.44064 > 10.0.0.2.5001: UDP, length 1470
23:35:37.549362 IP 10.0.0.1.44064 > 10.0.0.2.5001: UDP, length 1470
23:35:37.561469 IP 10.0.0.1.44064 > 10.0.0.2.5001: UDP, length 1470
23:35:37.573549 IP 10.0.0.1.44064 > 10.0.0.2.5001: UDP, length 1470
23:35:37.585651 IP 10.0.0.1.44064 > 10.0.0.2.5001: UDP, length 1470
23:35:37.597697 IP 10.0.0.1.44064 > 10.0.0.2.5001: UDP, length 1470
23:35:37.609805 IP 10.0.0.1.44064 > 10.0.0.2.5001: UDP, length 1470
23:35:37.622152 IP 10.0.0.1.44064 > 10.0.0.2.5001: UDP, length 1470
23:35:37.646049 IP 10.0.0.1.44064 > 10.0.0.2.5001: UDP, length 1470
23:35:37.658247 IP 10.0.0.1.44064 > 10.0.0.2.5001: UDP, length 1470
23:35:37.670419 IP 10.0.0.1.44064 > 10.0.0.2.5001: UDP, length 1470
23:35:37.682489 IP 10.0.0.1.44064 > 10.0.0.2.5001: UDP, length 1470
23:35:37.694786 IP 10.0.0.1.44064 > 10.0.0.2.5001: UDP, length 1470
23:35:37.706683 IP 10.0.0.1.44064 > 10.0.0.2.5001: UDP, length 1470
23:35:37.718691 IP 10.0.0.1.44064 > 10.0.0.2.5001: UDP, length 1470
23:35:37.730843 IP 10.0.0.1.44064 > 10.0.0.2.5001: UDP, length 1470
23:35:37.743118 IP 10.0.0.1.44064 > 10.0.0.2.5001: UDP, length 1470
23:35:37.755167 IP 10.0.0.1.44064 > 10.0.0.2.5001: UDP, length 1470
23:35:37.767225 IP 10.0.0.1.44064 > 10.0.0.2.5001: UDP, length 1470
23:35:37.779068 IP 10.0.0.1.44064 > 10.0.0.2.5001: UDP, length 1470
23:35:37.791276 IP 10.0.0.1.44064 > 10.0.0.2.5001: UDP, length 1470
23:35:37.803471 IP 10.0.0.1.44064 > 10.0.0.2.5001: UDP, length 1470
23:35:37.815527 IP 10.0.0.1.44064 > 10.0.0.2.5001: UDP, length 1470
23:35:37.827679 IP 10.0.0.1.44064 > 10.0.0.2.5001: UDP, length 1470
23:35:37.839739 IP 10.0.0.1.44064 > 10.0.0.2.5001: UDP, length 1470
23:35:37.851726 IP 10.0.0.1.44064 > 10.0.0.2.5001: UDP, length 1470
23:35:37.863902 IP 10.0.0.1.44064 > 10.0.0.2.5001: UDP, length 1470
23:35:37.875932 IP 10.0.0.1.44064 > 10.0.0.2.5001: UDP, length 1470
23:35:37.888147 IP 10.0.0.1.44064 > 10.0.0.2.5001: UDP, length 1470
23:35:37.900170 IP 10.0.0.1.44064 > 10.0.0.2.5001: UDP, length 1470
23:35:37.912204 IP 10.0.0.1.44064 > 10.0.0.2.5001: UDP, length 1470
23:35:37.924294 IP 10.0.0.1.44064 > 10.0.0.2.5001: UDP, length 1470
23:35:37.948510 IP 10.0.0.1.44064 > 10.0.0.2.5001: UDP, length 1470
23:35:37.960741 IP 10.0.0.1.44064 > 10.0.0.2.5001: UDP, length 1470
23:35:37.972649 IP 10.0.0.1.44064 > 10.0.0.2.5001: UDP, length 1470
23:35:37.984808 IP 10.0.0.1.44064 > 10.0.0.2.5001: UDP, length 1470
23:35:37.996843 IP 10.0.0.1.44064 > 10.0.0.2.5001: UDP, length 1470
23:35:38.008809 IP 10.0.0.1.44064 > 10.0.0.2.5001: UDP, length 1470
23:35:38.021173 IP 10.0.0.1.44064 > 10.0.0.2.5001: UDP, length 1470
23:35:38.033365 IP 10.0.0.1.44064 > 10.0.0.2.5001: UDP, length 1470
23:35:38.045597 IP 10.0.0.1.44064 > 10.0.0.2.5001: UDP, length 1470
23:35:38.057335 IP 10.0.0.1.44064 > 10.0.0.2.5001: UDP, length 1470
23:35:38.069559 IP 10.0.0.1.44064 > 10.0.0.2.5001: UDP, length 1470
23:35:38.081700 IP 10.0.0.1.44064 > 10.0.0.2.5001: UDP, length 1470
23:35:38.093878 IP 10.0.0.1.44064 > 10.0.0.2.5001: UDP, length 1470
23:35:38.106040 IP 10.0.0.1.44064 > 10.0.0.2.5001: UDP, length 1470
23:35:38.118140 IP 10.0.0.1.44064 > 10.0.0.2.5001: UDP, length 1470
23:35:38.129937 IP 10.0.0.1.44064 > 10.0.0.2.5001: UDP, length 1470
23:35:38.142107 IP 10.0.0.1.44064 > 10.0.0.2.5001: UDP, length 1470
23:35:38.154269 IP 10.0.0.1.44064 > 10.0.0.2.5001: UDP, length 1470
23:35:38.166413 IP 10.0.0.1.44064 > 10.0.0.2.5001: UDP, length 1470
23:35:38.178435 IP 10.0.0.1.44064 > 10.0.0.2.5001: UDP, length 1470
23:35:38.190343 IP 10.0.0.1.44064 > 10.0.0.2.5001: UDP, length 1470
23:35:38.202469 IP 10.0.0.1.44064 > 10.0.0.2.5001: UDP, length 1470
23:35:38.214710 IP 10.0.0.1.44064 > 10.0.0.2.5001: UDP, length 1470
23:35:38.226820 IP 10.0.0.1.44064 > 10.0.0.2.5001: UDP, length 1470
23:35:38.238940 IP 10.0.0.1.44064 > 10.0.0.2.5001: UDP, length 1470
23:35:38.250826 IP 10.0.0.1.44064 > 10.0.0.2.5001: UDP, length 1470
23:35:38.262965 IP 10.0.0.1.44064 > 10.0.0.2.5001: UDP, length 1470
23:35:38.275044 IP 10.0.0.1.44064 > 10.0.0.2.5001: UDP, length 1470
23:35:38.287263 IP 10.0.0.1.44064 > 10.0.0.2.5001: UDP, length 1470
23:35:38.299546 IP 10.0.0.1.44064 > 10.0.0.2.5001: UDP, length 1470
23:35:38.311419 IP 10.0.0.1.44064 > 10.0.0.2.5001: UDP, length 1470
23:35:38.323447 IP 10.0.0.1.44064 > 10.0.0.2.5001: UDP, length 1470
23:35:38.335546 IP 10.0.0.1.44064 > 10.0.0.2.5001: UDP, length 1470
23:35:38.347604 IP 10.0.0.1.44064 > 10.0.0.2.5001: UDP, length 1470
23:35:38.359745 IP 10.0.0.1.44064 > 10.0.0.2.5001: UDP, length 1470
23:35:38.372078 IP 10.0.0.1.44064 > 10.0.0.2.5001: UDP, length 1470
23:35:38.383947 IP 10.0.0.1.44064 > 10.0.0.2.5001: UDP, length 1470
23:35:38.395875 IP 10.0.0.1.44064 > 10.0.0.2.5001: UDP, length 1470
23:35:38.420294 IP 10.0.0.1.44064 > 10.0.0.2.5001: UDP, length 1470
23:35:38.432466 IP 10.0.0.1.44064 > 10.0.0.2.5001: UDP, length 1470
23:35:38.444619 IP 10.0.0.1.44064 > 10.0.0.2.5001: UDP, length 1470
23:35:38.456753 IP 10.0.0.1.44064 > 10.0.0.2.5001: UDP, length 1470
23:35:38.468579 IP 10.0.0.1.44064 > 10.0.0.2.5001: UDP, length 1470
23:35:38.480745 IP 10.0.0.1.44064 > 10.0.0.2.5001: UDP, length 1470
23:35:38.492886 IP 10.0.0.1.44064 > 10.0.0.2.5001: UDP, length 1470
23:35:38.504950 IP 10.0.0.1.44064 > 10.0.0.2.5001: UDP, length 1470
23:35:38.517184 IP 10.0.0.1.44064 > 10.0.0.2.5001: UDP, length 1470
23:35:38.529258 IP 10.0.0.1.44064 > 10.0.0.2.5001: UDP, length 1470
23:35:38.541138 IP 10.0.0.1.44064 > 10.0.0.2.5001: UDP, length 1470
23:35:38.553323 IP 10.0.0.1.44064 > 10.0.0.2.5001: UDP, length 1470
23:35:38.565531 IP 10.0.0.1.44064 > 10.0.0.2.5001: UDP, length 1470
23:35:38.577674 IP 10.0.0.1.44064 > 10.0.0.2.5001: UDP, length 1470
23:35:38.589818 IP 10.0.0.1.44064 > 10.0.0.2.5001: UDP, length 1470
23:35:38.601787 IP 10.0.0.1.44064 > 10.0.0.2.5001: UDP, length 1470
23:35:38.613770 IP 10.0.0.1.44064 > 10.0.0.2.5001: UDP, length 1470
23:35:38.625898 IP 10.0.0.1.44064 > 10.0.0.2.5001: UDP, length 1470
23:35:38.638040 IP 10.0.0.1.44064 > 10.0.0.2.5001: UDP, length 1470
23:35:38.650100 IP 10.0.0.1.44064 > 10.0.0.2.5001: UDP, length 1470
23:35:38.662259 IP 10.0.0.1.44064 > 10.0.0.2.5001: UDP, length 1470
23:35:38.674277 IP 10.0.0.1.44064 > 10.0.0.2.5001: UDP, length 1470
23:35:38.686345 IP 10.0.0.1.44064 > 10.0.0.2.5001: UDP, length 1470
23:35:38.710593 IP 10.0.0.1.44064 > 10.0.0.2.5001: UDP, length 1470
23:35:38.722621 IP 10.0.0.1.44064 > 10.0.0.2.5001: UDP, length 1470
23:35:38.734675 IP 10.0.0.1.44064 > 10.0.0.2.5001: UDP, length 1470
23:35:38.746644 IP 10.0.0.1.44064 > 10.0.0.2.5001: UDP, length 1470
23:35:38.758779 IP 10.0.0.1.44064 > 10.0.0.2.5001: UDP, length 1470
23:35:38.770986 IP 10.0.0.1.44064 > 10.0.0.2.5001: UDP, length 1470
23:35:38.783211 IP 10.0.0.1.44064 > 10.0.0.2.5001: UDP, length 1470
23:35:38.795411 IP 10.0.0.1.44064 > 10.0.0.2.5001: UDP, length 1470
23:35:38.807476 IP 10.0.0.1.44064 > 10.0.0.2.5001: UDP, length 1470
23:35:38.819244 IP 10.0.0.1.44064 > 10.0.0.2.5001: UDP, length 1470
23:35:38.831472 IP 10.0.0.1.44064 > 10.0.0.2.5001: UDP, length 1470
23:35:38.843589 IP 10.0.0.1.44064 > 10.0.0.2.5001: UDP, length 1470
23:35:38.855787 IP 10.0.0.1.44064 > 10.0.0.2.5001: UDP, length 1470
23:35:38.867790 IP 10.0.0.1.44064 > 10.0.0.2.5001: UDP, length 1470
23:35:38.879895 IP 10.0.0.1.44064 > 10.0.0.2.5001: UDP, length 1470
23:35:38.891842 IP 10.0.0.1.44064 > 10.0.0.2.5001: UDP, length 1470
23:35:38.904082 IP 10.0.0.1.44064 > 10.0.0.2.5001: UDP, length 1470
23:35:38.916184 IP 10.0.0.1.44064 > 10.0.0.2.5001: UDP, length 1470
23:35:38.928335 IP 10.0.0.1.44064 > 10.0.0.2.5001: UDP, length 1470
23:35:38.940405 IP 10.0.0.1.44064 > 10.0.0.2.5001: UDP, length 1470
23:35:38.952542 IP 10.0.0.1.44064 > 10.0.0.2.5001: UDP, length 1470
23:35:38.964563 IP 10.0.0.1.44064 > 10.0.0.2.5001: UDP, length 1470
23:35:38.976743 IP 10.0.0.1.44064 > 10.0.0.2.5001: UDP, length 1470
23:35:38.988984 IP 10.0.0.1.44064 > 10.0.0.2.5001: UDP, length 1470
23:35:39.000937 IP 10.0.0.1.44064 > 10.0.0.2.5001: UDP, length 1470
23:35:39.013039 IP 10.0.0.1.44064 > 10.0.0.2.5001: UDP, length 1470
23:35:39.024994 IP 10.0.0.1.44064 > 10.0.0.2.5001: UDP, length 1470
23:35:39.037169 IP 10.0.0.1.44064 > 10.0.0.2.5001: UDP, length 1470
23:35:39.049261 IP 10.0.0.1.44064 > 10.0.0.2.5001: UDP, length 1470
23:35:39.073461 IP 10.0.0.1.44064 > 10.0.0.2.5001: UDP, length 1470
23:35:39.085680 IP 10.0.0.1.44064 > 10.0.0.2.5001: UDP, length 1470
23:35:39.097705 IP 10.0.0.1.44064 > 10.0.0.2.5001: UDP, length 1470
23:35:39.109904 IP 10.0.0.1.44064 > 10.0.0.2.5001: UDP, length 1470
23:35:39.122347 IP 10.0.0.1.44064 > 10.0.0.2.5001: UDP, length 1470
23:35:39.134070 IP 10.0.0.1.44064 > 10.0.0.2.5001: UDP, length 1470
23:35:39.146279 IP 10.0.0.1.44064 > 10.0.0.2.5001: UDP, length 1470
23:35:39.158461 IP 10.0.0.1.44064 > 10.0.0.2.5001: UDP, length 1470
23:35:39.170503 IP 10.0.0.1.44064 > 10.0.0.2.5001: UDP, length 1470
23:35:39.182489 IP 10.0.0.1.44064 > 10.0.0.2.5001: UDP, length 1470
23:35:39.194661 IP 10.0.0.1.44064 > 10.0.0.2.5001: UDP, length 1470
23:35:39.206807 IP 10.0.0.1.44064 > 10.0.0.2.5001: UDP, length 1470
23:35:39.219132 IP 10.0.0.1.44064 > 10.0.0.2.5001: UDP, length 1470
23:35:39.243534 IP 10.0.0.1.44064 > 10.0.0.2.5001: UDP, length 1470
23:35:39.254822 IP 10.0.0.1.44064 > 10.0.0.2.5001: UDP, length 1470
23:35:39.266876 IP 10.0.0.1.44064 > 10.0.0.2.5001: UDP, length 1470
23:35:39.279193 IP 10.0.0.1.44064 > 10.0.0.2.5001: UDP, length 1470
23:35:39.291342 IP 10.0.0.1.44064 > 10.0.0.2.5001: UDP, length 1470
23:35:39.303447 IP 10.0.0.1.44064 > 10.0.0.2.5001: UDP, length 1470
23:35:39.315508 IP 10.0.0.1.44064 > 10.0.0.2.5001: UDP, length 1470
23:35:39.327362 IP 10.0.0.1.44064 > 10.0.0.2.5001: UDP, length 1470
23:35:39.339583 IP 10.0.0.1.44064 > 10.0.0.2.5001: UDP, length 1470
23:35:39.351761 IP 10.0.0.1.44064 > 10.0.0.2.5001: UDP, length 1470
23:35:39.363891 IP 10.0.0.1.44064 > 10.0.0.2.5001: UDP, length 1470
23:35:39.375866 IP 10.0.0.1.44064 > 10.0.0.2.5001: UDP, length 1470
23:35:39.387831 IP 10.0.0.1.44064 > 10.0.0.2.5001: UDP, length 1470
23:35:39.400090 IP 10.0.0.1.44064 > 10.0.0.2.5001: UDP, length 1470
23:35:39.412163 IP 10.0.0.1.44064 > 10.0.0.2.5001: UDP, length 1470
23:35:39.424240 IP 10.0.0.1.44064 > 10.0.0.2.5001: UDP, length 1470
23:35:39.436329 IP 10.0.0.1.44064 > 10.0.0.2.5001: UDP, length 1470
23:35:39.448308 IP 10.0.0.1.44064 > 10.0.0.2.5001: UDP, length 1470
23:35:39.465458 IP 10.0.0.1.44064 > 10.0.0.2.5001: UDP, length 1470
23:35:39.472493 IP 10.0.0.1.44064 > 10.0.0.2.5001: UDP, length 1470
23:35:39.484579 IP 10.0.0.1.44064 > 10.0.0.2.5001: UDP, length 1470
23:35:39.496626 IP 10.0.0.1.44064 > 10.0.0.2.5001: UDP, length 1470
23:35:39.508695 IP 10.0.0.1.44064 > 10.0.0.2.5001: UDP, length 1470
23:35:39.520913 IP 10.0.0.1.44064 > 10.0.0.2.5001: UDP, length 1470
23:35:39.533163 IP 10.0.0.1.44064 > 10.0.0.2.5001: UDP, length 1470
23:35:39.545224 IP 10.0.0.1.44064 > 10.0.0.2.5001: UDP, length 1470
23:35:39.557493 IP 10.0.0.1.44064 > 10.0.0.2.5001: UDP, length 1470
23:35:39.569313 IP 10.0.0.1.44064 > 10.0.0.2.5001: UDP, length 1470
23:35:39.581525 IP 10.0.0.1.44064 > 10.0.0.2.5001: UDP, length 1470
23:35:39.593644 IP 10.0.0.1.44064 > 10.0.0.2.5001: UDP, length 1470
23:35:39.605789 IP 10.0.0.1.44064 > 10.0.0.2.5001: UDP, length 1470
23:35:39.618005 IP 10.0.0.1.44064 > 10.0.0.2.5001: UDP, length 1470
23:35:39.630057 IP 10.0.0.1.44064 > 10.0.0.2.5001: UDP, length 1470
23:35:39.641952 IP 10.0.0.1.44064 > 10.0.0.2.5001: UDP, length 1470
23:35:39.654173 IP 10.0.0.1.44064 > 10.0.0.2.5001: UDP, length 1470
23:35:39.666279 IP 10.0.0.1.44064 > 10.0.0.2.5001: UDP, length 1470
23:35:39.678363 IP 10.0.0.1.44064 > 10.0.0.2.5001: UDP, length 1470
23:35:39.690444 IP 10.0.0.1.44064 > 10.0.0.2.5001: UDP, length 1470
23:35:39.702380 IP 10.0.0.1.44064 > 10.0.0.2.5001: UDP, length 1470
23:35:39.714809 IP 10.0.0.1.44064 > 10.0.0.2.5001: UDP, length 1470
23:35:39.726677 IP 10.0.0.1.44064 > 10.0.0.2.5001: UDP, length 1470
23:35:39.738847 IP 10.0.0.1.44064 > 10.0.0.2.5001: UDP, length 1470
23:35:39.750895 IP 10.0.0.1.44064 > 10.0.0.2.5001: UDP, length 1470
23:35:39.762916 IP 10.0.0.1.44064 > 10.0.0.2.5001: UDP, length 1470
23:35:39.774943 IP 10.0.0.1.44064 > 10.0.0.2.5001: UDP, length 1470
23:35:39.787218 IP 10.0.0.1.44064 > 10.0.0.2.5001: UDP, length 1470
23:35:39.799360 IP 10.0.0.1.44064 > 10.0.0.2.5001: UDP, length 1470
23:35:39.811446 IP 10.0.0.1.44064 > 10.0.0.2.5001: UDP, length 1470
23:35:39.823493 IP 10.0.0.1.44064 > 10.0.0.2.5001: UDP, length 1470
23:35:39.838808 IP 10.0.0.1.44064 > 10.0.0.2.5001: UDP, length 1470
23:35:39.847573 IP 10.0.0.1.44064 > 10.0.0.2.5001: UDP, length 1470
23:35:39.859681 IP 10.0.0.1.44064 > 10.0.0.2.5001: UDP, length 1470
23:35:39.871872 IP 10.0.0.1.44064 > 10.0.0.2.5001: UDP, length 1470
23:35:39.883802 IP 10.0.0.1.44064 > 10.0.0.2.5001: UDP, length 1470
23:35:39.896002 IP 10.0.0.1.44064 > 10.0.0.2.5001: UDP, length 1470
23:35:39.908334 IP 10.0.0.1.44064 > 10.0.0.2.5001: UDP, length 1470
23:35:39.920432 IP 10.0.0.1.44064 > 10.0.0.2.5001: UDP, length 1470
23:35:39.932187 IP 10.0.0.1.44064 > 10.0.0.2.5001: UDP, length 1470
23:35:39.944379 IP 10.0.0.1.44064 > 10.0.0.2.5001: UDP, length 1470
23:35:39.956408 IP 10.0.0.1.44064 > 10.0.0.2.5001: UDP, length 1470
23:35:39.968685 IP 10.0.0.1.44064 > 10.0.0.2.5001: UDP, length 1470
23:35:39.980874 IP 10.0.0.1.44064 > 10.0.0.2.5001: UDP, length 1470
23:35:39.992954 IP 10.0.0.1.44064 > 10.0.0.2.5001: UDP, length 1470
23:35:40.004814 IP 10.0.0.1.44064 > 10.0.0.2.5001: UDP, length 1470
23:35:40.016923 IP 10.0.0.1.44064 > 10.0.0.2.5001: UDP, length 1470
23:35:40.029136 IP 10.0.0.1.44064 > 10.0.0.2.5001: UDP, length 1470
23:35:40.041318 IP 10.0.0.1.44064 > 10.0.0.2.5001: UDP, length 1470
23:35:40.053325 IP 10.0.0.1.44064 > 10.0.0.2.5001: UDP, length 1470
23:35:40.065553 IP 10.0.0.1.44064 > 10.0.0.2.5001: UDP, length 1470
23:35:40.077385 IP 10.0.0.1.44064 > 10.0.0.2.5001: UDP, length 1470
23:35:40.089552 IP 10.0.0.1.44064 > 10.0.0.2.5001: UDP, length 1470
23:35:40.101731 IP 10.0.0.1.44064 > 10.0.0.2.5001: UDP, length 1470
23:35:40.113799 IP 10.0.0.1.44064 > 10.0.0.2.5001: UDP, length 1470
23:35:40.125803 IP 10.0.0.1.44064 > 10.0.0.2.5001: UDP, length 1470
23:35:40.137806 IP 10.0.0.1.44064 > 10.0.0.2.5001: UDP, length 1470
23:35:40.150010 IP 10.0.0.1.44064 > 10.0.0.2.5001: UDP, length 1470
23:35:40.162133 IP 10.0.0.1.44064 > 10.0.0.2.5001: UDP, length 1470
23:35:40.174221 IP 10.0.0.1.44064 > 10.0.0.2.5001: UDP, length 1470
23:35:40.186357 IP 10.0.0.1.44064 > 10.0.0.2.5001: UDP, length 1470
23:35:40.198328 IP 10.0.0.1.44064 > 10.0.0.2.5001: UDP, length 1470
23:35:40.210457 IP 10.0.0.1.44064 > 10.0.0.2.5001: UDP, length 1470
23:35:40.222542 IP 10.0.0.1.44064 > 10.0.0.2.5001: UDP, length 1470
23:35:40.234700 IP 10.0.0.1.44064 > 10.0.0.2.5001: UDP, length 1470
23:35:40.247091 IP 10.0.0.1.44064 > 10.0.0.2.5001: UDP, length 1470
23:35:40.258913 IP 10.0.0.1.44064 > 10.0.0.2.5001: UDP, length 1470
23:35:40.271195 IP 10.0.0.1.44064 > 10.0.0.2.5001: UDP, length 1470
23:35:40.282999 IP 10.0.0.1.44064 > 10.0.0.2.5001: UDP, length 1470
23:35:40.295245 IP 10.0.0.1.44064 > 10.0.0.2.5001: UDP, length 1470
23:35:40.307374 IP 10.0.0.1.44064 > 10.0.0.2.5001: UDP, length 1470
23:35:40.319450 IP 10.0.0.1.44064 > 10.0.0.2.5001: UDP, length 1470
23:35:40.331669 IP 10.0.0.1.44064 > 10.0.0.2.5001: UDP, length 1470
23:35:40.343774 IP 10.0.0.1.44064 > 10.0.0.2.5001: UDP, length 1470
23:35:40.355540 IP 10.0.0.1.44064 > 10.0.0.2.5001: UDP, length 1470
23:35:40.367767 IP 10.0.0.1.44064 > 10.0.0.2.5001: UDP, length 1470
23:35:40.379911 IP 10.0.0.1.44064 > 10.0.0.2.5001: UDP, length 1470
23:35:40.392271 IP 10.0.0.1.44064 > 10.0.0.2.5001: UDP, length 1470
23:35:40.404289 IP 10.0.0.1.44064 > 10.0.0.2.5001: UDP, length 1470
23:35:40.416206 IP 10.0.0.1.44064 > 10.0.0.2.5001: UDP, length 1470
23:35:40.428211 IP 10.0.0.1.44064 > 10.0.0.2.5001: UDP, length 1470
23:35:40.440335 IP 10.0.0.1.44064 > 10.0.0.2.5001: UDP, length 1470
23:35:40.452504 IP 10.0.0.1.44064 > 10.0.0.2.5001: UDP, length 1470
23:35:40.464812 IP 10.0.0.1.44064 > 10.0.0.2.5001: UDP, length 1470
23:35:40.476568 IP 10.0.0.1.44064 > 10.0.0.2.5001: UDP, length 1470
23:35:40.488574 IP 10.0.0.1.44064 > 10.0.0.2.5001: UDP, length 1470
23:35:40.500768 IP 10.0.0.1.44064 > 10.0.0.2.5001: UDP, length 1470
23:35:40.512946 IP 10.0.0.1.44064 > 10.0.0.2.5001: UDP, length 1470
23:35:40.525018 IP 10.0.0.1.44064 > 10.0.0.2.5001: UDP, length 1470
23:35:40.537104 IP 10.0.0.1.44064 > 10.0.0.2.5001: UDP, length 1470
23:35:40.549075 IP 10.0.0.1.44064 > 10.0.0.2.5001: UDP, length 1470
23:35:40.561215 IP 10.0.0.1.44064 > 10.0.0.2.5001: UDP, length 1470
23:35:40.573455 ARP, Request who-has 10.0.0.2 tell 10.0.0.1, length 28
23:35:40.573960 IP 10.0.0.1.44064 > 10.0.0.2.5001: UDP, length 1470
23:35:40.581873 ARP, Reply 10.0.0.2 is-at e6:14:f1:bd:ca:16, length 28
23:35:40.583902 IP 10.0.0.2.5001 > 10.0.0.1.44064: UDP, length 1470
23:35:40.586810 IP 10.0.0.1.44064 > 10.0.0.2.5001: UDP, length 1470
23:35:40.588032 IP 10.0.0.2.5001 > 10.0.0.1.44064: UDP, length 1470
23:35:40.597836 IP 10.0.0.1.44064 > 10.0.0.2.5001: UDP, length 1470
23:35:40.598996 IP 10.0.0.2.5001 > 10.0.0.1.44064: UDP, length 1470
23:35:40.609942 ARP, Request who-has 10.0.0.2 tell 10.0.0.1, length 28
23:35:40.610100 IP 10.0.0.1.44064 > 10.0.0.2.5001: UDP, length 1470
23:35:40.611110 ARP, Reply 10.0.0.2 is-at e6:14:f1:bd:ca:16, length 28
23:35:40.611228 IP 10.0.0.2.5001 > 10.0.0.1.44064: UDP, length 1470
23:35:40.622200 IP 10.0.0.1.44064 > 10.0.0.2.5001: UDP, length 1470
23:35:40.623426 IP 10.0.0.2.5001 > 10.0.0.1.44064: UDP, length 1470
23:35:40.634356 IP 10.0.0.1.44064 > 10.0.0.2.5001: UDP, length 1470
23:35:40.635560 IP 10.0.0.2.5001 > 10.0.0.1.44064: UDP, length 1470
23:35:40.646596 IP 10.0.0.1.44064 > 10.0.0.2.5001: UDP, length 1470
23:35:40.647831 IP 10.0.0.2.5001 > 10.0.0.1.44064: UDP, length 1470
23:35:40.658743 ARP, Request who-has 10.0.0.2 tell 10.0.0.1, length 28
23:35:40.658745 IP 10.0.0.1.44064 > 10.0.0.2.5001: UDP, length 1470
23:35:40.659919 ARP, Reply 10.0.0.2 is-at e6:14:f1:bd:ca:16, length 28
23:35:40.659949 IP 10.0.0.2.5001 > 10.0.0.1.44064: UDP, length 1470
23:35:40.672273 IP 10.0.0.1 > 10.0.0.2: ICMP 10.0.0.1 udp port 44064 unreachable, length 556
23:35:40.676603 IP 10.0.0.1 > 10.0.0.2: ICMP 10.0.0.1 udp port 44064 unreachable, length 556
23:35:40.681539 IP 10.0.0.1 > 10.0.0.2: ICMP 10.0.0.1 udp port 44064 unreachable, length 556
23:35:40.686028 IP 10.0.0.1 > 10.0.0.2: ICMP 10.0.0.1 udp port 44064 unreachable, length 556
23:35:40.691096 IP 10.0.0.1 > 10.0.0.2: ICMP 10.0.0.1 udp port 44064 unreachable, length 556
23:35:45.662952 ARP, Request who-has 10.0.0.1 tell 10.0.0.2, length 28
23:35:45.669606 ARP, Reply 10.0.0.1 is-at 5e:e6:fd:ce:0d:ff, length 28

